날짜,제목,내용
2024.03.09.,테슬라에 죽쓴 이차전지...K배터리가 살릴까,‘차세대 배터리’ 공개에 주요 이차전지 주 상승 ‘파우치형 셀투팩’(CTP) 배터리를 최초 공개한 LG에너지솔루션(373220)도 이틀 연속 주가가 상승세다. LG에너지솔루션 주가는 이날 전 거래일 대비 0.75% 오른 40만2500원에 거래를 마쳤다. 파우치형 배터리 공개된 지난 7일에는 3.22% 상승 마감했다. ‘배터리...
2024.03.09.,대기업 공채 시즌…수시 채용도 주목해야,"채용 LG의 경우 LG에너지솔루션을 시작으로 LG생활건강, LG마그나, LG전자, LG화학, LG디스플레이 등 신입사원을 모집한다. 각 계열사별로 일정과 채용절차는 다르다. 가장 먼저 시작한 LG에너지솔루션과 LG생활건강 경우 10일까지, LG화학은 25일 오후 2시까지 지원 가능하다. 자세한 내용은 LG그룹 채용 사이트..."
2024.03.09.,"인텔·마이크론, 대놓고 K인재 싹쓸이…자동차·2차전지도 피해 속출","LG에너지솔루션은 임원급 직원이 자문 중개서비스 업체를 통해 2차전지 연구개발 동향, 생산설비 현황 등 영업비밀을 누설한 피해가 제기됐다. 그는 LG에너지솔루션 재직 중 중개업체로부터 총 9억8000만원을 수취한 혐의가 있는 것으로 알려졌다. 삼성SDI와 SK온은 양사의 핵심 기술 연구 개발을 맡은 임직원..."
2024.03.09.,"""전기차 시대 곧 온다""…12만명 몰린 이곳","LG에너지솔루션, 삼성SDI는 따로 집계를 하지 않았다. 하지만 SK온과 부스가 나란히 놓였다는 점에서 비슷한 수준으로 추정했다. 전기차 시장의 '캐즘'(대중화 전 일시적 수요 정체기) 현상 탓에 국내 배터리 업체들이 어려움을 겪고 있는 상황이 무색할 정도로 배터리 산업에 대한 뜨거운 관심을 느낄 수..."
2024.03.09.,"[배터리완전정복](27)타이어·신발밑창 재료, 배터리서도 쓴다…도전재가 뭐길...",LG에너지솔루션에 CNT도전재를 공급하고 있다. LG화학은 2017년에 500톤 규모의 CNT 1공장을 처음 가동했으며 3공장까지 합쳐 2023년 현재 총 2900톤의 생산 능력을 보유하고 있다. 2025년 충남 대산의 CNT 4공장까지 완공되면 생산능력은 6100톤으로 늘어난다. 제이오는 2006년 국내 최초로 MWCNT 대량 생산에...
2024.03.09.,"""대기업인데 육아휴직 간 아빠 없다""…'남초'기업서 터진 원성",LG에너지솔루션 역시 ‘으쓱ESG엔솔키즈어린이집’(서울 여의도 본사)와 ‘키즈&SOL어린이집’(충북 오창 에너지플랜트) 두 곳의 직장 어린이집을 운영 중이다. 교사 대 영유아 비율을 최소화해 보육의 질을 높이고 3명의 원어민 교사가 상주해 자체 외국어 교육을 진행한다. 최모 LG에너지솔루션 책임은 “영어...
2024.03.10.,"LG엔솔, 배터리 관리에 퀄컴 AI 활용한다","LG에너지솔루션은 퀄컴과 협력해 차세대 전기차에 탑재될 첨단 배터리관리시스템(BMS) 진단 솔루션 개발을 추진한다고 10일 밝혔다. BMS는 전류와 전압, 온도 등 배터리 데이터를 활용해 제품이 최적의 성능을 발휘할 수 있도록 하고, 문제 상황을 사전에 감지 및 조치하도록 지원한다. 특히 차에서 영화와..."
2024.03.10.,"LG엔솔-퀄컴, 첨단 배터리관리시스템 솔루션 개발 나선다",LG엔솔 소프트웨어에 퀄컴 플랫폼 SoC 활용…연산능력 80배 향상 LG에너지솔루션과 퀄컴이 첨단 배터리관리시스템(BMS) 진단 솔루션 개발에 손을 잡았다. LG에너지솔루션은 퀄컴과 협력해 차세대 전기차에 탑재될 첨단 BMS 진단 솔루션 개발을 추진한다고 10일 밝혔다. 두 회사는 LG에너지솔루션의 BMS 진단...
2024.03.10.,"LG에너지솔루션-퀄컴, 차세대 배터리 진단 솔루션 개발 협력","LG에너지솔루션 사업개발총괄 정혁성 상무(왼쪽), 퀄컴 CDMA 테크날러지 코리아 마케팅 부문 박지성 부사장(오른쪽) [사진: LG에너지솔루션, 퀄컴] LG에너지솔루션과 퀄컴 테크날러지스가 첨단 BMS(배터리 관리 시스템, Battery Management System) 진단 솔루션 개발을 위해 협력한다. LG에너지솔루션은 퀄컴과..."
2024.03.10.,"LG에너지솔루션, 퀄컴과 BMS 진단 솔루션 협력…글로벌 완성차 업체에 공급 목...",스마트에프엔 박재훈 기자 LG에너지솔루션이 퀄컴 테크날러지스와 첨단 BMS(Battery Management System) 진단 솔루션 개발을 위해 협력한다고 10일 밝혔다. 양사는 협력을 통해 LG에너지솔루션의 BMS 진단 소프트웨어와 퀄컴 스냅드래곤 디지털 섀시의 특정 기능 결합을 통해 한층 고도화된 첨단 BMS 솔루션을...
2024.03.10.,"퀄컴, 첨단 BMS 솔루션 개척 나선다",퀄컴이 LG에너지솔루션과 첨단 BMS(Battery Management System) 진단 솔루션 개발을 위해 손 잡았다. 10일 차세대 전기차에 탑재될 첨단 BMS 진단 솔루션 개발을 추진한다고 밝혔다. 양사는 이번 협력 관계를 통해 LG에너지솔루션의 BMS 진단 소프트웨어와 퀄컴 스냅드래곤 디지털 섀시(Snapdragon® Digital ChassisTM)의 특정...
2024.03.10.,"LG엔솔, 퀄컴과 첨단 BMS 솔루션 개발한다...""컴퓨팅 성능 80배↑, 인공지능 ...",LG에너지솔루션(대표이사 김동명)이 퀄컴 테크날러지스 Inc.와 첨단 BMS 진단 솔루션 개발에 협력한다. LG에너지솔루션은 퀄컴과 협력해 차세대 전기차에 탑재될 첨단 BMS 진단 솔루션 개발을 추진한다고 10일 밝혔다. 정혁성(왼쪽) LG에너지솔루션 사업개발총괄 상무는 지난 8일 박지성 퀄컴 CDMA 테크날러지...
2024.03.10.,“드디어 올 것이 왔다”...‘초거대 AI’ 투입한다는 LG 공장 확 달라진다는...,"이를 위해 현재 LG전자, LG생활건강, LG화학, LG에너지솔루션, LG이노텍 등에선 LG그룹 차원의 고도화된 산업용 자율 AI 에이전트를 구축하기 위한 파일럿 테스트가 한창 이뤄지고 있는 것으로 파악된다. 임우형 LG AI연구원 연구 그룹장(상무)은 최근 서울 여의도 LG 본사에서 매일경제신문과 인터뷰를 갖고..."
2024.03.10.,"LG엔솔, 퀄컴과 전기차 첨단 BMS 솔루션 개발 추진… ""차별화된 고객경험 기대...",LG에너지솔루션이 퀄컴과 협력해 자세대 전기차에 탑재될 첨단 배터리관리시스템(BMS: Battery Management System) 진단 솔루션 개발을 추진한다고 10일 밝혔다. 양사는 이번 협력 관계를 통해 LG에너지솔루션의 BMS 진단 소프트웨어와 클라우드 커넥티드 플랫폼인 퀄컴 스냅드래곤 디지털 섀시의 특정 기능 결합을...
2024.03.10.,"LG에너지솔루션-퀄컴, 첨단 BMS 솔루션 개발 나선다",LG에너지솔루션(LG엔솔)과 퀄컴 테크날러지스 Inc. (Qualcomm Technologies Inc.)가 손을 잡고 첨단 BMS(Battery Management System) 진단 솔루션 개발에 나섭니다. LG엔솔은 퀄컴과 협력해 차세대 전기차에 탑재될 첨단 BMS 진단 솔루션 개발을 추진한다고 오늘(10일) 밝혔습니다. BMS 진단 솔루션은 고객사 및 소비자의...
2024.03.11.,"LG전자, 유럽서 에너지 최적화 냉난방 솔루션 공개","고효율 히트펌프 냉난방시스템과 에너지저장시스템(ESS), 에너지 소비량을 모니터링하는 LG 씽큐 앱 등을 결합해 에너지 활용을 최적화하는 홈 에너지 솔루션을 구성할 수 있다. 특히 LG전자는 이번 전시를 통해 유럽 가정용 냉난방 시장을 공략하는 벽걸이 에어컨 신제품 '듀얼쿨'을 최초 공개한다...."
2024.03.11.,ESS용 리튬이온전지 출하량 53% 증가…삼성SDI·LG엔솔 점유율은 '뚝',"국내 업체 중에는 삼성SDI와 LG에너지솔루션이 각각 6위와 7위에 올랐으나 삼성SDI는 전년 대비 성장률이 0%로 정체를 보였고, LG에너지솔루션은 -11%로 지난해보다 출하량이 감소했습니다. 양사의 시장 점유율은 2022년 14%에서 지난해 9%로 하락했습니다. ESS는 미국 인플레이션 감축법(IRA)상..."
2024.03.11.,"LG전자, '고효율 히트펌프' 기술로 유럽 냉난방 공조 사업 드라이브",고객은 ▲고효율 히트펌프 냉난방시스템과 ▲에너지 저장 시스템(ESS) ▲에너지 소비량을 모니터링하는 LG 씽큐(LG ThinQ) 앱 등을 결합해 에너지 활용을 최적화하는 홈 에너지 솔루션을 구성할 수 있다. LG전자는 이번 전시를 통해 유럽 가정용 냉난방 시장을 공략하는 벽걸이 에어컨 신제품...
2024.03.11.,"K-배터리 기업 올해 '9조' 투자…정부, 1172억 개발 지원","대응 ▲국내 투자를 통한 공급망 자립화 ▲배터리 전주기 순환 체계 구축 등 5대 과제를 제안했다. 이날 행사에는 LG에너지솔루션, 삼성SDI, SK온 등 배터리셀 기업을 비롯해 현대차, 에코프로, 엘앤에프, 포스코퓨처엠, 엔켐, 고려아연, LS MnM, 피엠그로우, 광해광업공단, 배터리산업협회 등이 참석했다."
2024.03.11.,"LG‧삼성‧SK, 올해 국내투자 '9조'…2028년 차세대 배터리 개발","LG에너지솔루션, 삼성SDI, SK온 등 배터리 기업들이 올해 국내에서 총 9조원 이상을 투자한다. 정부와 함께 꿈의 배터리로 불리는 전고체 배터리 포함 차세대 배터리 사업도 본격 시작한다. 안덕근 산업통상자원부 장관은 11일 민관합동 배터리 얼라이언스에 참석해 올해 민‧관이 함께 대응할 핵심 과제들을..."
2024.03.11.,민테크 “상장 통해 글로벌 배터리 진단·검사 솔루션 기업 도약”,"이 같은 장점 덕분에 민테크가 개발한 배터리 검사·진단 솔루션은 SK온·삼성SDI·LG에너지솔루션 등 전기차 배터리 제조사부터 현대차 같은 전기차 제조사, 한국교통안전공단·환경공단 같은 기관에서 폭넓게 사용되고 있다. 특히 LG에너지솔루션(6.1%)과 GS에너지(5.3%)는 전략적 투자를 통해 주요 주주로..."
2024.03.11.,"LG전자, 유럽 공조 전시회 ‘MCE 2024’서 고효율 공조 솔루션 선보여",고객은 ▲고효율 히트펌프 냉난방시스템과 ▲에너지 저장 시스템(ESS) ▲에너지 소비량을 모니터링하는 LG 씽큐(LG ThinQ) 앱 등을 결합해 에너지 활용을 최적화하는 홈 에너지 솔루션을 구성할 수 있다. 특히 LG전자는 이번 전시를 통해 유럽 가정용 냉난방 시장을 공략하는 벽걸이 에어컨...
2024.03.11.,"놀라운 기술 가득, LG전자 'MCE 2024'서 고효율 공조 솔루션 선보인다","고객은 고효율 히트펌프 냉난방시스템과 에너지 저장 시스템(ESS), 에너지 소비량을 모니터링하는 LG 씽큐(LG ThinQ) 앱 등을 결합해 에너지 활용을 최적화하는 홈 에너지 솔루션을 구성할 수 있다. 특히 LG전자는 이번 전시를 통해 유럽 가정용 냉난방 시장을 공략하는 벽걸이 에어컨 신제품..."
2024.03.12.,LG에너지솔루션-퀄컴 첨단 BMS 솔루션 개발 나선다,LG에너지솔루션과 퀄컴 테크날러지스가 첨단 BMS(배터리 관리 시스템) 진단 솔루션 개발에 나선다. LG에너지솔루션은 최근 퀄컴과 협력해 차세대 전기차에 탑재될 첨단 BMS 진단 솔루션 개발을 추진한다고 밝혔다. 양사는 이번 협력 관계를 통해 LG에너지솔루션의 BMS 진단 소프트웨어와 퀄컴 스냅드래곤...
2024.03.12.,"LG에너지솔루션, 지역 내 환경 정화 활동 '앞장'",［중부매일 이성현 기자］ LG에너지솔루션이 환경 정화 활동을 시작으로 올해 봉사단의 첫발을 내디뎠다. LG에너지솔루션 임직원 20여 명은 12일 오후 오창 에너지플랜트 사업장 인근 각리천을 찾아 일대의 쓰레기를 수거하고 유해식물 제거하는 환경 정화 활동을 진행했다고 밝혔다. 지난 5일 청주시와 '1사...
2024.03.12.,"하나증권 ""차세대 배터리 개발 탄력, 삼성SDI LG에너지솔루션 에코프로 주목""","<산업통상자원부> 관련종목으로는 삼성SDI와 LG에너지솔루션, SK온, 에코프로, 엘앤에프, 포스코퓨처엠, 엔켐, 고려아연 등을 제시했다. 정부와 2차전지 업계는 전날 서울 강남 한국기술센터에서 열린 '민관 합동 배터리 얼라이언스' 회의에서 전고체 배터리 등 차세대 배터리 개발을 위해 협력하기로 결정했다...."
2024.03.12.,"코스피, 0.8% 올라 2,680대 복귀…기관 삼성전자·삼성SDI·LG에너지솔루션·...","◆ 외인 매수/매도 종목 투자자별 매매 동향을 살펴 보면 외국인 순매수 상위 종목은 에코프로비엠(497억원), KB금융(455억원), 에코프로(424억원), 알테오젠(250억원), LG에너지솔루션(238억원), 현대차(205억원), 셀트리온(182억원), 포스코퓨처엠(181억원), 한화에어로스페이스(181억원), 금양..."
2024.03.12.,LG엔솔 오창 각리천서 환경정화 활동,LG에너지솔루션 임직원 20여명은 12일 청주 오창 에너지플랜트사업장 인근 각리천을 찾아 쓰레기를 수거하고 유해식물 제거하는 환경정화 활동을 진행했다. /LG에너지솔루션 제공
2024.03.12.,"CATL, 중국 시장 점유율 55.2%…LG엔솔 외국업체 유일 10위권",LG에너지솔루션 점유율은 2%로 외국업체 중 유일하게 10위권에 진입했다. 11일 중국 자동차동력배터리산업 혁신연맹은 2월 중국 전기차용 배터리 시장에서 CATL이 점유율 55.2%로 1위를 차지했다고 발표했다. CATL의 전기차 배터리 탑재량은 9.82기가와트시(GWh)로 대당 50킬로와트시(KWh)로 계산하면...
2024.03.12.,"코스피, 개인 매수에 상승 마감...LG에너지솔루션, LG화학 상승 VS 현대차, S...","시가총액 상위 10개 종목은 현대차(-0.82%), SK하이닉스(-0.54%), 기아(-0.08%)를 제외하고 상승 마감했다. LG에너지솔루션(4.74%), LG화학(3.33%), POSCO홀딩스(2.97%), 삼성전자(1.24%), 셀트리온(1.23%), 삼성바이오로직스(1.2%), 삼성전자우(0.64%)는 상승 마감했다."
2024.03.12.,"1위 LG에너지솔루션 주가·2위 LG화학 주가·3위 포스코인터내셔널 주가, 3월...",LG에너지솔루션 주가는 2024년 3월 2주차 공개된 랭키파이의 테마별 주식 니켈 부문 트렌드지수 분석 결과 1위에 올랐다. 랭키파이 테마별 주식 니켈 부문 트렌드 지수는 3월 1주차 키워드 검색량과 구글트렌드 점수를 지수화한 분석 결과이다. 1위 LG에너지솔루션 주가는 트렌드지수 18...
2024.03.12.,잦아들 기미 안보이는 LG엔솔 직원들 성과급 트럭시위,성과급 논란으로 촉발된 LG에너지솔루션 직원들의 트럭시위가 잦아들 기미가 보이지 않는다. 서울 여의도 LG에너지솔루션 본사에 이어 지난주 인터배터리2024 행사가 열린 코엑스 앞에서도 시위를 벌였다. LG엔솔 노조 등 시위를 주도하는 측에서는 회장 자택에도 시위트럭을 보내야 한다는 논의가 이뤄지고...
2024.03.12.,"1위 LG에너지솔루션·2위 씨아이에스·3위 엘앤에프, 3월 2주차 테마별 주식 ...",테마별 주식 2차전지(LFP/리튬인산철) 부문 트렌드지수 LG에너지솔루션의 랭키파이 2024년 3월 2주차 트렌드지수 분석 결과 1위를 차지했다. 조사기간 2024년 3월 1주차의 테마별 주식 2차전지(LFP/리튬인산철) 부문 빅데이터를 수집하여 분석한 지표이다. 1위...
2024.03.13.,R&D 투자 14.5% 늘린 LG엔솔…더 빨리 도망가는 CATL,LG에너지솔루션(이하 LG엔솔)의 연구개발(R&D) 투자가 지난해 1조원에 육박했다. 역대급 규모지만 글로벌 시장에서 배터리 1위 경쟁을 벌이는 중국 CATL과 비교하면 갈길이 멀다. 그동안 양적 투자에 집중한 LG엔솔은 엔지니어출신 새 수장을 필두로 기술력 중심의 '질적 성장'을 예고한 상태다....
2024.03.13.,'배터리 관리' 기술 고도화 나선 LG에너지솔루션…배경은?,지난 10일 LG에너지솔루션과 퀄컴 관계자가 첨단 BMS 솔루션 개발 협력을 약속하고 기념사진을 찍고 있다. ⓒLG에너지솔루션 LG에너지솔루션이 배터리 관리 시스템(이하 BMS) 소프트웨어 기술 고도화에 속도를 내는 모습이다. BMS가 전기차 안전성 및 효율성 제고에 미치는 영향이 커지면서 고객사가...
2024.03.13.,"""LG에너지솔루션, 하반기 AMPC 효과 확대 기대""","키움증권은 13일 LG에너지솔루션에 대해 올해 기대치는 낮아졌으나, 실적은 상저하고를 기록할 것이라고 전했다. 권준수 키움증권 연구원은 ""LG에너지솔루션의 1분기 매출액은 전분기 대비 20% 줄어든 6조4000억원, 영업이익은 50% 감소한 1682억원을 기록할 전망""이라며 ""AMPC 효과 예상치 2958억원, 약 6...."
2024.03.13.,"LG전자, 유럽 냉난방 공조 사업 속도",LG전자는 주거용 솔루션존에서 ‘지속가능한 집’을 위한 토털 에너지 솔루션을 제시한다. 화석연료를 사용하지 않고 탄소배출을 줄이는 고효율 히트펌프 냉난방시스템 ‘써마브이 R290 모노블럭’은 차세대 친환경 냉매와 블랙 컬러 실외기 디자인을 적용했다. 이 제품은 유럽 ErP(Energy-related...
2024.03.13.,"아바코, 2차전지 실적 반영될까...LG엔솔 수주 이어져-하나증권","한편 아바코의 전극, 조립 공정용 물류자동화 장비는 고객사 LG에너지솔루션 밸류체인 내 꾸준한 점유율을 유지하고 있다. 얼티엄셀즈 1, 2공장에 이어 3공장까지 누적 2000억원 이상의 2차전지 물류장비 수주 레퍼런스를 가진다. 또한 지난 2~3월에는 LG에너지솔루션 미시간 자체공장용 2차전지 물류장비 총..."
2024.03.13.,"3/12 외국인 순매수 상위 종목 기술력, '고평가' 에코프로비엠·알테오젠·LG...","LG에너지솔루션의 기술투자지수는 152.3, 기술력점수(TSS)는 6,445.7, 기업가치추정은 고평가로 나타났다. 지난 11일 코스피 시장에서 외국인 순매수 상위 종목 TOP10은 두산에너빌리티, 두산로보틱스, 삼성중공업, LIG넥스원, 한미반도체, 삼성물산, LG이노텍, 삼성엔지니어링, 현대모비스, 엘앤에프 등 순으로..."
2024.03.13.,[LG그룹] LG에너지솔루션 4.74% 올라 계열사 중 상승률 선두,"LG그룹 계열사 중 LG에너지솔루션 종목은 전거래일 대비 4.74% 상승해 계열사 중 주가상승률 1위를 기록했다. LG에너지솔루션 뒤를 이어 LG화학, LG전자 종목도 각각 3.33%, 2.41%씩 상승해 상승률 상위권에 이름을 올렸다. 한편, LG 종목은 -2.06%를 기록해 LG그룹 계열사 중 가장..."
2024.03.13.,"1위 LG에너지솔루션 주가·2위 LG화학 주가·3위 포스코인터내셔널 주가, 3월...","랭키파이가 발표한 2024년 3월 2주차 트렌드지수 분석 결과 테마별 주식 니켈 부문 트렌드지수에서 LG에너지솔루션 주가가 1위를 차지했다. 이는 랭키파이 빅데이터를 분석한 테마별 주식 니켈 부문 트렌드지수 2024년 3월 1주차 지표이다. 1위 LG에너지솔루션 주가는 트렌드지수 16,638점으로..."
2024.03.13.,[더벨][IB 풍향계]LG화학 딜 '한국증권 셀프참여'에 IB들 '불만',"특히나 LG화학이나 LG에너지솔루션 같은 계열사들은 1년에 한 번 대규모 회사채 조달을 단행하는 만큼 수요예측 흥행여부를 중요하게 여기는 이슈어들이다. 증권사들 마다 캡티브영업을 약속하며 주관경쟁에 나서는 이유다. 딜 수임 과정에서 보험사와 자산운용사, 종금사, 캐피탈사 등 계열사들의 참여를..."
2024.03.14.,LG그룹 최고경영진 獨 총출동…벤츠와 車 협력 논의,"사진을 보면 권봉석 ㈜LG 부회장과 조주완 LG전자 사장을 비롯해 정철동 LG디스플레이 사장, 김동명 LG에너지솔루션 사장, 문혁수 LG이노텍 부사장, 은석현 LG전자 VS사업본부장(부사장) 등 LG 전장(자동차 전기 장비·장치) 관련 주요 계열사 최고경영진이 함께 했다. 양사는 그동안 자동차는 물론 다양한..."
2024.03.14.,"전고체 배터리에 느긋?…LG엔솔, 신중함에 완성도 더한다",점차 양산 속도 경쟁으로 번지고 있는 가운데 LG에너지솔루션은 신중하게 접근하겠다는 구상이다. 전고체 배터리는 액체 전해질 대신 고체 전해질을 사용해 화재의 위험성이 적고 주행거리가 길어 배터리 업계에서 주목하는 차세대 배터리다. 전고체 배터리를 얼마나 완벽하고 빠르게 양산할 수 있느냐가...
2024.03.14.,"LG엔솔, 작년 R&D 비용 첫 1조원 돌파…전년대비 18.4%↑",시설투자도 10조원대로 큰폭 증가…전기차 수요 성장 둔화에 가동률은 소폭 하락 퇴임한 권영수 전 부회장 작년 연봉 44억4천700만원…상여 크게 증가 전기차 수요 성장세 둔화로 배터리 업계가 숨 고르기에 들어간 가운데서도 LG에너지솔루션의 지난해 연구개발(R&D) 투자가 큰 폭으로 증가해 처음...
2024.03.14.,"권영수 전 LG엔솔 부회장, 작년 보수 44억원…""퇴직금 별도""","권영수 전 LG에너지솔루션(373220) 부회장이 지난해 보수로 44억4700만 원을 받았다. 권 전 부회장은 지난해 11월 용퇴했지만 임기 만료일은 오는 25일이어서 퇴직금은 포함되지 않았다. 14일 LG에너지솔루션 사업보고서에 따르면 권 전 부회장은 지난해 급여 18억4000만 원, 상여 26억700만 원을 합쳐..."
2024.03.14.,"“LG화학, LG에너지솔루션 지분 일부 매각할 수도”",LG화학이 신규투자를 위한 재원이 필요한 가운데 자금조달 수단 중 하나로 자회사인 LG에너지솔루션 지분 일부를 매각할 수 있다는 분석이 나왔다. 14일 하이투자증권은 보고서를 통해 LG화학의 주가 상승을 위한 트리거(trigger)로 석유화학 포트폴리오 구조조정과 LG에너지솔루션 지분 일부 매각을 통한...
2024.03.14.,"韓 재생에너지 사용률 9% 불과...""RE100 달성 가장 힘든 나라""",기업별 재생에너지 사용률을 살펴보면 LG에너지솔루션과 SK아이이테크놀로지가 각각 56%의 재생에너지 사용률을 인정 받았다. 국내 기업들 내 가장 높은 비율이었다. LG에너지솔루션의 자체 기록에서는 57%로 확인됐다. RE100 선언 이후에도 재생에너지 사용률이 현저히 낮은 기업들이 많았다....
2024.03.14.,LG엔솔 직원 작년 평균연봉 1.2억…삼성SDI 제쳤다,LG에너지솔루션(373220)의 직원 평균 연봉이 1억 원을 돌파했다. 14일 사업보고서에 따르면 LG에너지솔루션은 지난해 전체 직원 1만2166명에게 총 1조4970억8900만 원의 보수를 지급했다. 1인 평균 급여는 1억2300만 원으로 전년(9900만원)보다 24.24% 증가했다. 이는 지난해 지급한 역대급...
2024.03.14.,"LG엔솔, 삼성SDI 출신 신정순 부사장 신규 선임",LG에너지솔루션(373220)이 삼성SDI(006400) 출신 신정순 부사장을 신규 영입했다. 14일 사업보고서에 따르면 LG에너지솔루션은 올해 신 부사장을 Cell선행제품개발총괄로 선임했다. 신 부사장은 1969년생으로 서울대를 졸업했다. 삼성SDI에서 소형전지와 중대형전지 개발 담당 임원을 지냈다. 지난...
2024.03.14.,LG엔솔 작년 R&D 투자 첫 1조 돌파…직원 평균연봉도 1억 넘겨(종합),최동현 김종윤 기자 = LG에너지솔루션(373220)의 지난해 연구개발(R&D) 투자가 1조 원을 돌파했다. 글로벌 전기차 수요 둔화로 배터리 업계가 허리띠를 졸라맨 가운데 공격적인 투자를 이어간 셈이다. 14일 사업보고서에 따르면 LG에너지솔루션의 지난해 R&D 비용읏 1조374억1500만 원으로 전년...
2024.03.14.,2차전지株 부활하나...삼성SDI·LG엔솔 반등 준비,"이외 엘앤에프(10.66%) LG에너지솔루션(8.00%), 포스코퓨처엠(5.52%) 등 2차전지 관련 종목들이 전반적인 오름세를 보였다. 이 기간 코스피지수가 1.67% 오른 점과 비교하면 시장 수익률을 훨씬 웃도는 상승률이다. 지난해 상반기 국내 증시 상승세를 이끌었던 2차전지 종목들은 하반기 들어서 방전되는 모습을..."
2024.03.15.,"LG에너지솔루션, 지난해 R&D 1조·설비투자 10조 역대 최대",LG에너지솔루션(대표 김동명)이 투자와 개발에 거침없는 행보를 이어가고 있다. 15일 LG에너지솔루션 사업보고서에 따르면 지난해 연구개발(R&D) 투자 비용은 1조373억 원이다. 전년(8760억 원) 대비 18.4% 늘어난 수치다. LG에너지솔루션의 R&D 투자비가 1조 원을 넘은 것은 지난해가 처음이다....
