날짜,제목,내용
2023.08.18.,"'후발주자' SK온, LG엔솔 특허·삼성SDI 연구비 추격 위해 담금질 박차","/ 사진=SK SK이노베이션의 배터리 자회사 SK온은 LG에너지솔루션 및 삼성SDI보다 뒤늦게 관련 사업에 뛰어든 '후발주자'다. 최근 예년보다 많은 연구개발비를 투입하는 등 경쟁사를 따라잡기 위한 담금질에 속도를 내는 모습이다. 단, 시장진출이 늦었던 만큼 LG·삼성을 추격하는 데에는 상당한 시간이..."
2023.08.19.,LG에너지솔루션 주가 '시큰둥'…유럽서도 리튬 생산 가속도 주목,LG에너지솔루션 주가가 약세를 보였다. 이 회사는 리튬 생산을 위해 유럽으로도 눈길을 돌렸다. 이에따라 남미와 호주 등에서 주로 채굴해왔던 리튬이 가장 큰 배터리 수요처 한복판에서도 생산되는 것이다. 이에따라 이 회사에 전기차 배터리용 수산화리튬을 공급하기로 한 독일 '벌칸에너지'가...
2023.08.19.,"권영수 LG엔솔 부회장, 中 배터리 공세에 ""우리도 열심히 준비 중"" 자신감 드...",배터리협회 첫 방문한 권영수 한국배터리산업협회장 18일 배터리산업협회를 찾은 권영수 LG에너지솔루션 부회장 겸 한국배터리산업협회장(왼쪽)이 박태성 한국배터리산업협회 상근부회장(오른쪽)과 악수하고 있다./공동취재단 권영수 LG에너지솔루션 대표이사 부회장(한국배터리산업협회장)이 중국...
2023.08.19.,"LG화학, 비주력 정리해 배터리 소재 키운다","교환대상은 LG화학이 보유한 LG에너지솔루션 주식 369만5000주(발행 주식 총수의 1.57%)로 약 2조6000억원 규모로 책정됐다. LG화학은 조단위 투자금을 손에 쥐었지만 자산유동화를 계속 이어갈 방침이다. 5년 뒤, 양극재 사업 4배로 키운다 이처럼 LG화학이 자산유동화에 집중하는 이유는 신사업 투자 때문이다...."
2023.08.19.,"LG엔솔, 인도 올라와 전기스쿠터 S1 에어에 배터리 팩 공급 계약","LG에너지솔루션(이하 LG엔솔)은 인도 전기차 제조업체 올라일렉트릭(이하 올라)과 S1 에어 전기 스쿠터 배터리 팩 공급 계약을 체결했다. S1 에어는 인도 내 저렴한 전기 스쿠터 중 하나로, 151km 주행 거리, 음성 인식, 네비게이션, 블루투스 등을 지원한다. S1 에어는 허브 타입 전기 모터와 3kWh 배터리 팩을..."
2023.08.19.,[LG그룹] LG헬로비전 1.41% 올라 계열사 중 일일 상승률 1위,1위 LG헬로비전 3960원(1.41%)▲2위 HS애드 5920원(-0.17%)▲3위 LG유플러스 1만210원(-0.29%)▲4위 LG생활건강 44만7500원(-0.56%)▲5위 LG 7만9700원(-1.36%)▲6위 LG전자 9만8300원(-1.6%)▲7위 LG이노텍 25만6000원(-1.73%)▲8위 LG에너지솔루션 52만9000원(-2.04%)▲9위 LG화학 56만9000원(-2.07%)▲10위...
2023.08.19.,"앨 고어 ""윤석열 정부 신재생 전환 속도 높여야""","앨 고어 전 부통령은 ""한국에는 LG 에너지솔루션과 삼성SDI, SK에코플랜트 등 세계 6대 배터리 제조업체 중 3곳이 있다. 아울러 2050년까지 100% 청정 전기 전환을 약속한 RE100 기업도 27곳이 있다""면서 다른 기업들도 탄소 중립 목표를 위한 구체적 계획을 세울 것을 당부했다. 이날 행사에는 반기문 전 유엔(UN)..."
2023.08.19.,'그냥 배터리가 아니다' 신형 싼타페 탑재된 배터리의 의미,"이미 글로벌 시장에서 경쟁력을 인정받고 있는 LG에너지솔루션, SK온과도 합작법인 설립에 나섰습니다. 배터리 직접 생산에 나서기는 했지만 아직은 배터리 전문 업체들에 비해 부족한 것이 사실입니다. 따라서 이들 업체들과 합작을 통해 기술과 생산 노하우 등을 습득하고 이를 자체 배터리에 적용하기 위한..."
2023.08.19.,"자동차·부품 대기업 영업익 1년 새 3.4조원↑…현대차, 증가액 1위","한국전력공사와 현대차·기아 다음으로 삼성중공업(3147억원), LG에너지솔루션(2650억원), 현대모비스(2604억원), 현대삼호중공업(2238억원), 삼성물산(2164억원), SK온(1945억원), 삼성엔지니어링(1910억원) 등 순으로 영업이익 증가액이 컸다. 특히 현대차·기아는 올해 1분기에 이어 2분기에도 삼성전자와..."
2023.08.19.,[기관 매도 종목] '얼마나팔길래' POSCO홀딩스·아모센스·덕성 맥신'上' 리튬...,"반면 영화테크, POSCO홀딩스, 이지트로닉스, 새빗켐, 에코프로비엠, LG에너지솔루션, 디에이테크놀로지, 영풍, SK이노베이션, 코스모화학, 성일하이텍, 엘앤에프 주가가 하락, 초전도체 관련주로 알려진 파워로직스가 29.95% 하락했다. POSCO홀딩스가 속한 리튬 관련주는 총 23개 종목으로 업종 평균 2.60..."
2023.08.19.,캐나다 전기차 배터리 공급망 세계 2위 부상 전망…경제가치 '47.5조',"코트라 관계자는 ""북미 전기차 배터리 시장에 진출한 LG에너지솔루션, 포스코, SK이노베이션 등이 있으며 삼성 또한 스텔란티스와 함께 미국 내 공장 건설을 계획하고 있다""며 ""대기업의 진출과 함께 우리나라의 관련 중소, 중견기업의 동반 진출과 향후 배터리 재활용 산업에서의 우리 기업의 활약이..."
2023.08.20.,"스노우레이크 경영진 교체해도 ""LG엔솔은 포기 못해""","새로운 수장을 맞이한 가운데 LG에너지솔루션과의 지속적인 동맹을 강조했다. 20일 캐나다 지역지 '위니펙 프리 프레스'에 따르면 프랭크 휘틀리 신임 최고경영자(CEO)는 이 매체와의 인터뷰에서 ""LG에너지솔루션과의 양해각서(MOU)는 여전히 유요하다""며 ""LG에너지솔루션과의 대화를 기대한다""고 밝혔다...."
2023.08.20.,"배터리, 전기차 다음으로 ‘ESS’ 뜬다","20일 업계에 따르면 LG에너지솔루션, 삼성SDI, SK온 등 국내 배터리 업체들은 전력용, 폐배터리 재사용 등으로 고성장이 기대되는 ESS 사업에 적극 투자하고 있다. ESS는 전력을 저장했다가 필요한 시점에 전력을 공급하는 시스템으로 전력 활용 효율을 높이기 위한 전력저장장치다. ESS의 용도는 부하이동..."
2023.08.20.,"상위 30대 기업 40%, 임금 제자리거나 깎였다","조선·이차전지 나홀로 호황···하반기에도 임금 격차 뚜렷 반면, HMM과 LG에너지솔루션 등은 임금이 큰 폭으로 올랐다. 지난해 10조원이 넘는 역대급 영업이익을 낸 HMM은 올 초 성과급으로 월 기본급의 600%를 지급해 상반기 임금이 3700만원에서 7900만원으로 껑충 뛰었다. 지난해 창사 이래 최대 실적을..."
2023.08.20.,"[데이터로 보는 증시]호텔신라· POSCO홀딩스, 기관·외국인 주간 코스피 순매...","기관은 호텔신라(008770)(370억원)를 가장 많이 순매수한 가운데 삼성전자우(005935)(311억원), LG에너지솔루션(373220)(288억원), 신세계(004170)(186억원), SK텔레콤(017670)(179억원), 포스코퓨처엠(003670)(177억원), 이수페타시스(007660)(151억원), 삼성에스디에스(018260)(135억원), 오리온(271560)..."
2023.08.20.,'에코형제' 2조원 던진 개미들…이달 들어 사들인 종목 톱10,"LG화학(5038억원)과 LG에너지솔루션(3718억원), 포스코인터내셔널(3425억원) 등도 7월 개인투자자 순매수 상위권에 이름을 올렸다. 개인, 7월부터 '에코' 형제 2조원 넘게 순매도 심지어 개인투자자는 지난달 2차전지 주도주인 에코프로와 에코프로비엠을 대거 팔아치웠다. 7월 한 달간 개인투자자의 순매도..."
2023.08.20.,"배터리+완성차 ‘멀티 파트너십’…전기차 가격 더 낮아질까 [전기차, 아직 충...","오는 2030년 ‘전기차 1위 기업’을 목표로 하고 있는 현대자동차그룹은 LG에너지솔루션과 오는 2025년까지 미국에 전기차 배터리셀 합작공장을 세우고, 연간 약 30만대 물량의 배터리셀을 생산한다. 양측은 인도네시아에서 전기차 배터리 합작사를 세우는 프로젝트를 함께하면서 협업 관계를 유지해 왔다...."
2023.08.21.,계열사 실적 감소한 LG그룹…하반기 경영 방향은?,화학 계열사는 LG에너지솔루션 주요 OEM향 판매 확대와 소형 파우치형 매출 증가로 매출은 증가했다. 하지만 석유화학사업 경쟁 심화에 따른 판가 하락과 LG에너지솔루션 제너럴모터스(GM) 리콜 충당금 등이 수익에 악영향을 미쳤다. 배당금과 상표권 사용료율 비중이 높은 주력 계열사가 주춤하면서...
2023.08.21.,"[데이터로 보는 증시]한화솔루션·금양, 기관·외국인 코스피 순매수 1위(8월...","기관이 한화솔루션(009830)(195억원)을 가장 많이 순매수한 가운데 SK렌터카(068400)(195억원), LG에너지솔루션(373220)(171억원), 포스코퓨처엠(003670)(130억원), 금양(001570)(82억원), NAVER(035420)(73억원), 삼성바이오로직스(207940)(62억원), 오리온(271560)(61억원), SK텔레콤(017670)(59억원)..."
2023.08.21.,[영상] LG엔솔 후방 생태계 재편 움직임...신규 장비사 준비중,"""안녕하세요 이수환입니다."" -""LG에너지솔루션 후방 생태계 재편 움직임이 있다.""라고 하셨는데 장비 업체들 말씀하시는겁니까? ""그렇죠, 장비 업체 중심으로 말씀을 드릴 겁니다."" -어떤 움직임이 있습니까? ""이게 모든 협력사를 다 막론하기에는 너무 방대하니까, 제가 하나의 기준을 하나 세울게요. 그냥 가장..."
2023.08.21.,"'430조' 금맥 캔다…LG그룹, 전기차 충전 생태계 구축 '속도'","LG전자 관계자는 ""M&A(인수합병), 외부 파트너십 확대와 더불어 LG에너지솔루션, LG이노텍 등 계열사 역량을 활용해 빠르게 (전기차 충전) 시장 장악이 가능할 전망""이라며 ""LG만의 차별화된 영역으로 충전사업을 빠르게 조단위 사업으로 육성할 것""이라고 말했다. 통신사업자인 LG유플러스의 행보도 이목을..."
2023.08.21.,"LG전자, 독일 베를린에서 모듈러 하우스 전시로 스마트 홈 시장 공략","스마트 코티지는 LG전자의 주택 솔루션의 일환으로, 최첨단 HVAC(난방, 환기, 공조) 기술과 에너지, 가전, 홈 IoT 서비스 등을 통합한 모듈러 주택이다. 이 제품은 지속 가능한 삶을 추구하는 소비자들에게 새로운 선택지를 제공할 것으로 기대된다. 스마트 코티지는 유럽 시장 고객들의 선호에 맞게 내부..."
2023.08.21.,'배터리 재수' 시동 건 범LG家 GS·LS그룹,미트라켐은 GM과 LG에너지솔루션의 배터리 합작사인 '얼티엄셀즈'에 양극재 공급을 추진하고 있다. GS그룹은 이번 미트라켐 투자로 배터리 소재 사업 재진출을 본격화할 것으로 보인다. 앞서 GS그룹은 양극재 사업에 뛰어들었다가 손실을 보고 매각했다. 2013년 GS에너지는 양극재 회사 대정이엠 지분을...
2023.08.21.,"‘소재 달인’ 신학철, 폐플라스틱 80조 시장 정조준 [LG화학 3대 신사업 해부...","반면 미래 동력으로 육성한 배터리(현 LG에너지솔루션)·배터리소재는 엄청난 성과를 내기 시작했다. 문제는 배터리를 제외한 소재 사업 비전과 전략이다. 신 부회장은 취임 직후 사업조직 개편을 통해 본격적으로 소재 사업에 힘을 실어주기 시작했다. 기초소재(석유화학), 전지, 정보전자소재 등..."
2023.08.21.,[LG그룹 월간동향] LG생활건강 8월 중 4.56% 상승 미소...계열사 중 상승률 상...,1위 LG생활건강 44만7500원(4.56%)▲2위 LG유플러스 1만210원(2%)▲3위 HS애드 5920원(0.34%)▲4위 로보스타 2만9450원(-0.51%)▲5위 LG헬로비전 3960원(-0.75%)▲6위 LG디스플레이 1만3150원(-2.52%)▲7위 LG이노텍 25만6000원(-3.03%)▲8위 LG 7만9700원(-4.55%)▲9위 LG에너지솔루션 52만9000원(-5.54%)▲10위...
2023.08.21.,테슬라가 선택한 中 M3P배터리…삼원계 배터리 대체할 수 있나,CATL의 상반기 매출액은 LG에너지솔루션·삼성SDI·SK온 등 국내 3사의 매출액을 모두 합친 수치(35조7천174억원)와 비슷한 규모다. 영업이익은 한국 업체들 합계의 3배를 웃돌았다. 주목할 것은 이익률이다. 13%가 넘는 영업이익률을 실현하며 국내 3사를 압도했다. 국내 3사 가운데서는 삼성SDI가 7.7%로...
2023.08.22.,“印밸류체인 속한 LG엔솔 두산에너빌 주목”,"하나증권은 특히 인도의 성장성을 높게 보고 있다. GDP성장률은 6%대를 상회할 것으로 예상되는 가운데 새로운 주도주가 될 것이라는 평가다. 이 실장은 “두산에너빌리티, LG에너지솔루션 등 국내에서 인도 시총 상위 기업의 밸류체인에 속해 있는 기업들의 수혜가 기대된다”고 말했다."
2023.08.22.,"[특징주] LG에너지솔루션, 장초반 2%대 중반 상승",이투데이=서지희 기자 | LG에너지솔루션이 장초반 2%대 중반에서 상승세를 이어가고 있다. 22일 오전 10시 50분 기준 LG에너지솔루션은 전일보다 2.47% 오른 53만9000원에 거래 중이다. 최근 권영수 LG에너지솔루션 부회장(한국배터리산업협회장)은 중국 CATL이 최근 발표한 리튬인산철(LFP) 배터리와...
2023.08.22.,"""요가에 미러아트까지""...LG엔솔, 문화대학 뺨치는 사내강좌","#아침엔 요가, 오후엔 부동산 생활 법률 상담, 퇴근 후에는 플로리스트 봉사활동까지…LG에너지솔루션 직원 A씨의 평일은 쉴 새 없이 돌아간다. 출근 전부터 퇴근 후까지 회사가 A씨의 취미 생활은 물론 개인적인 법률 상담까지 알아서 챙겨준다. 22일 업계에 따르면 LG에너지솔루션은 최근 직원들을 위해 법률..."
2023.08.22.,"[데이터로 보는 증시]SK하이닉스·LG에너지솔루션, 기관·외국인 코스피 순매...","기관은 SK하이닉스(000660)(201억원)를 가장 많이 순매수한 가운데 포스코퓨처엠(003670)(169억원), NAVER(035420)(160억원), LG에너지솔루션(373220)(126억원), 삼성SDI(006400)(79억원), 현대엘리베이(017800)(52억원), 코스모신소재(005070)(42억원), 삼성전기(009150)(42억원), 신한지주(055550)(41억원)..."
2023.08.22.,코스피·코스닥 동반 상승 흐름‥ LG에너지솔루션 3거래일 만에 상승,시가총액 상위 종목 살펴보면 상승 중인 종목이 우세한 가운데 LG에너지솔루션이 외국인과 기관 매수세에 3거래일 만에 오르고 있고 미국 정부의 중국 규제로 반사이익을 얻을 것이라는 기대감에 코스닥시장에서 에코프로가 6% 넘는 강세를 보이고 있습니다. 반면 금양은 자사주 처분 결정 소식에 2% 넘게...
2023.08.22.,"코스피, 개인 매수에 상승 마감…네이버, LG에너지솔루션 상승 VS 삼성바이오...","시가총액 상위 10개 종목은 삼성바이오로직스(-0.64%), 삼성전자우(-0.37%), 보합 마감한 삼성전자를 제외하고 상승 마감했다. NAVER(3.03%), LG에너지솔루션(2.47%), POSCO홀딩스(1.63%), 삼성SDI(1.36%), 현대차(0.97%), LG화학(0.88%), SK하이닉스(0.09%)는 상승 마감했다."
2023.08.22.,"[무탄소경영] LG엔솔, CF100 추진에 '탄소 네거티브' 속도…온실가스 확 줄인...",지난해 재생에너지 전력 전환율 56% 기록 CF100 통해 대체 가능한 친환경 에너지원 발굴 삼성전자·현대차와 CF100 사단법인 참여 LG에너지솔루션이 정부가 새롭게 추진하는 CF100(무탄소전원 100% 사용)에 힘입어 온실가스 배출을 대폭 감소시킬 것으로 보인다. 특히 탄소를 배출하지 않는 원자력과 청정수소 등...
2023.08.22.,"[배터리3사 자금 전략-③] LG엔솔, 차입에서 채권까지 '종횡무진'","권영수 LG에너지솔루션 대표이사 부회장[출처: 연합뉴스 자료 사진] '영업이익 증가율 2분기 연속 140%대.' LG에너지솔루션이 올해 써낸 성적표다. 2021년, LG에너지솔루션은 흑자 전환에 성공했다. 이후 실적은 꾸준히 개선돼 올해 들어는 전년 동기 대비 세 자릿수 증가율을 보이고 있다. 현금흐름..."
2023.08.22.,코스피 기관 순매수도 상위 10 종목(21일)...한화솔루션-SK렌터카-LG에너지솔...,"▲ 21일 코스피 시장에서 기관은 한화솔루션, SK렌터카, LG에너지솔루션을 집중 매수했다. 반면, 넥스틸, 셀트리온, 삼성전자를 집중 매도했다.© 연합뉴스. 21일 코스피 시장에서 기관은 한화솔루션, SK렌터카, LG에너지솔루션을 집중 매수했다. 반면, 넥스틸, 셀트리온, 삼성전자를 집중 매도했다."
2023.08.23.,"LG엔솔, 태양광 에너지 수익 3000만원 장학금 기탁",LG에너지솔루션은 태양광 발전시설에서 나온 에너지 수익 3000만원을 충북 청소년 장학금으로 환원했다고 23일 밝혔다. 이 업체는 에너지의 날(20회)을 맞아 전날 열린 희망그린장학금 전달식에서 지역 청소년 57명에게 장학금을 전달했다. 장학금은 태양광 발전시설 '청주희망그린발전소'에서 나왔다....
2023.08.23.,"MZ 취업 선호, 男 ""하이닉스·LG엔솔""…女 ""네이버·카카오""",여성 구직자들은 ▲카카오(17.2%) ▲네이버(17.1%) ▲SK하이닉스(10.7%) ▲LG에너지솔루션(6.5%) ▲CJ제일제당(6.2%) ▲아모레퍼시픽(4.9%) ▲현대자동차(4.6%) ▲삼성SDI(4.3%) 순으로 선호했다. 매년 여성 구직자 사이에서 취업하고 싶은 기업 상위권에 들던 '대한항공'은 이번 조사에서는 10위권 안에 들지...
2023.08.23.,[생생경제] LG카드 사태 이후로 금융업과 인연없는 LG,"지금 LG의 역사를 보면 동동그리무 크림을 시작으로 화학 공업까지 넓혀갔고 계속 발전해서 지금은 LG화학, LG생활건강, LG에너지솔루션까지 오게 됐다는 이야기를 해주셨는데. 어떻습니까? 1990년대에 접어들면서 LG는 책임경영제를 도입한다라고 하던데 이건 어떤 이야기예요? ◆ 박주근> 당시 구본무 회장이..."
2023.08.23.,SK온 공장만 풀가동…LG엔솔·삼성SDI 무슨 일?,"하지만, 삼성SDI와 LG에너지솔루션의 경우 사정이 조금 다르다. 전기차용 배터리 공장 가동률은 꾸준히 늘고 있지만, 소형전지 시장 침체 여파로 가동률이 다소 주춤하는 모습이다. 22일 금융감독원 전자공시시스템에 공시된 K배터리 3사의 반기보고서를 분석해 보면, 올해 상반기 가장 높은 공장 가동률을..."
2023.08.23.,'LG엔솔-GM 합작' 얼티엄셀즈 공장서 화학물질 유출로 가동중단,LG에너지솔루션과 제너럴모터스(GM) 합작사인 얼티엄셀즈 미국 공장에서 위험한 화학물질 유출 사고가 나 가동중단에 들어갔다. 23일 월스트리트저널(WSJ) 등 주요 외신에 따르면 미국 오하이오주 워렌에 있는 얼티엄셀즈 배터리 공장에서 발생한 화학물질 유출 사고가 미 연방규제 당국에 의해 조사를 받고...
2023.08.23.,"LG엔솔·위플레이 ""문화체험으로 새로운 가치를 전합니다""",충북 혜능보육원서 케이크팝·레고키링 만들기 ［충북일보］ 충북 청주소재 취미공유 플랫폼 위플레이가 LG에너지솔루션과 지역 내 문화체험 취약계층을 위한 사회공헌활동을 실시했다. 위플레이는 최근 LG엔솔 임직원 30여 명과 충북 혜능보육원을 방문해 30명의 아동에게 원데이클래스를 제공했다고 23일...
2023.08.23.,"LG화학, 첨단소재부문 가동률 2년새 30% '뚝'…왜?",자회사인 LG에너지솔루션을 고객사로 두며 수익을 얻어왔다. 첨단소재사업부문의 가동률이 지속적으로 줄고 있는 것은 최근 전기차 시장이 둔화하면서 배터리 수요가 감소하고 있어서다. 특히 전기차 침투율이 높았던 유럽의 경우 기저 효과로 인해 수요 둔화가 빠르게 이뤄지고 있다. 유럽 최대 자동차...
2023.08.23.,실적부진에 반토막 난 'LG화학'... 연중 최저치 갈아치웠다,"석유화학부문의 적자와 양극재부문 부진, LG에너지솔루션의 일회성 비용 등이 반영된 결과다. 3·4분기 예상 영업이익은 7807억원으로, 전분기에 비해서는 소폭 증가하겠지만 여전히 부진할 것이라는 분석이다. 한승재 DB금융투자증권 연구원은 “단기 실적 악화가 주가를 끌어내리는 가장 큰 요인”..."
2023.08.23.,"코스피, 기관과 외인 매도에 하락 마감…삼성전자, 삼성전자우 상승 VS LG에너...","시총상위 10개 종목은 삼성전자(0.75%), 삼성전자우(0.74%)를 제외하고 하락 마감했다. LG에너지솔루션(-2.60%), NAVER(-2.49%), 삼성SDI(-2.01%), LG화학(-1.92%), POSCO홀딩스(-1.61%), 삼성바이오로직스(-1.29%), SK하이닉스(-0.43%), 현대차(-0.21%)는 하락 마감했다."
2023.08.24.,"엔켐, LG엔솔-GM 합작사 ‘얼티엄셀즈’에 차세대 전해액 공급 확정","국내 최대 전해액 생산기업 엔켐이 LG에너지솔루션과 미국 제너럴모터스(GM)의 배터리 합작 법인인 ‘얼티엄셀즈’의 오하이오 제1공장향 차세대 전해액 공급을 확정했다. 현재 해당 제품들은 출하 예정 상태다. 앞서 엔켐은 지난해 12월 미국 조지아주에 제1공장을 성공적으로 완공한 이후, 올해 초 SK온의..."
2023.08.24.,"“발등에 불?”…‘실적 쇼크’ LG화학, 체질 개선 속도 빨라졌다","그중에서도 LG화학이 경쟁사들 대비 LG에너지솔루션 등과 같은 든든한 신사업을 이미 확보해 사업 재편에 속도가 더 빨리 붙은 모습이다. 돈 안되는 사업 정리를 통해 얻은 재원은 '돈' 되는 사업에 투입될 예정이다. 3대 신성장동력으로 배터리 소재, 친환경 소재, 혁신 신약을 꼽고, 매출 비중을 현재 21%에서..."
2023.08.24.,"""LG엔솔-GM 합작 공장, 임금 30% 인상 합의 근접""",LG에너지솔루션과 제너럴모터스(GM)의 배터리 합작 공장 내 노동자 임금이 30% 가까이 오를 수 있다는 외신 보도가 나왔다. 블룸버그통신 등 주요 외신은 24일 LG에너지솔루션과 GM의 합작법인인 얼티엄셀즈의 오하이오 공장 임금 인상 협상이 진행 중이라고 보도했다. 노사 양측은 오하이오 공장...
2023.08.24.,LG에너지솔루션' 충북 배터리 특화단지 추진단' 참여,"추진단장에는 경제부지사이며 LG에너지솔루션, 충북테크노파크, 한국전자기술연구원 등이 참여한다. 추진단 내에 총괄추진반과 기업지원반을 운영, 특화단지 관련 행정 지원을 위해 사무국을 둔다. 9월 추진단 출범식 이후에는 지자체와 특화단지추진단, 기업, 협력기관, 대학 간 간담회로 특화단지 육성 방안을..."
2023.08.24.,"[이넷뉴스 브랜드평판] LG에너지솔루션, ESS 브랜드평판 1위···SK이노베이...","발표에 따르면, 1위 LG에너지솔루션 2위 SK이노베이션 3위 LG전자 순으로 나타났다.​​ ​ 이넷뉴스와 한국기업평판연구소는 전력저장장치 ESS 관련 상장기업 32개 브랜드에 대해서 빅데이터 분석을 활용한 브랜드 평판조사를 실시했다. 2023년 7월 24일부터 2023년 8월 24일까지의..."
2023.08.24.,"[더벨][CFO 성과 보수]이창실 LG엔솔 부사장, LG그룹 CFO 중 상반기 보수 '최...","이창실 LG에너지솔루션 부사장이 LG그룹 최고재무책임자(CFO, 사진) 중 2023년 상반기 가장 많은 보수를 받은 것으로 나타났다. 21일 금융감독원 전자공시시스템에 따르면 이 부사장은 올해 상반기 보수로 총 8억8900만원을 받아 LG그룹 CFO들 중 가장 많은 보수를 받았다. 이 부사장에 이어 지주사 LG..."
2023.08.24.,"LG엔솔, 청주 청소년 57명 장학금 3000만원 전달","LG에너지솔루션은 지난 22일 20회 에너지의 날을 맞아 열린 희망그린장학금 전달식에서 지역 청소년 57명에게 장학금 3000만원을 전달했다고 밝혔다. 전달식에는 김병국 청주시의회 의장, 박재환 청주시교육지원청 교육장, 노영수 충북사회복지 공동모금회 회장 등이 참석했다. 이번 장학금은 태양광 발전시설..."
2023.08.24.,"구광모 LG 회장, 선택과 집중으로 '배터리 전장 등' 신사업에 총력전","특히 그룹 내 주력 사업체인 LG전자와 LG에너지솔루션이 경기 부진 속에서도 전장, 배터리를 앞세우고 가전이 선방하는 등 등 주력 사업에서 실적 방어에 성공했다는 점이 돋보인다. 신성장사업을 주력 사업군으로, 4.7조 자금 조달 구광모 회장은 전문 경영인들을 주요 사업 전면에 배치하고 있다. 구..."
2023.08.25.,"LG엔솔·GM 합작 美얼티엄셀즈, 임금 25% 인상 잠정합의(종합)","김난영 특파원 = LG에너지솔루션(LG엔솔)과 제너럴모터스(GM)의 미국 합작법인인 얼티엄셀즈(Ultium Cells)가 노조 측과 직원 임금 25% 인상에 합의했다고 AP가 보도했다. AP는 25일(현지시간) 전미자동차노조(UAW)를 인용, 오하이오 소재 얼티엄셀즈 공장 사측과 노조가 임금 25% 인상안에 잠정 합의했다고..."
