날짜,제목,내용
2023.12.01.,"삼성, 이웃사랑 성금 500억원…사회복지공동모금회 감사패 수여","올해 연말 이웃사랑성금은 삼성전자, 삼성디스플레이, 삼성SDI, 삼성전기, 삼성SDS, 삼성생명, 삼성화재, 삼성카드, 삼성증권, 삼성물산, 삼성엔지니어링, 제일기획, 에스원 등 23개 관계사가 참여했다. 기부에 참여한 삼성 관계사들은 대외 기부금 출연을 위한 각 사별 승인 절차를 거쳤다. 삼성이 전달한..."
2023.12.01.,"삼성, 이웃사랑성금 500억원 모아 사회복지공동모금회에 기부","올해 연말 이웃사랑성금은 삼성전자, 삼성디스플레이, 삼성SDI, 삼성전기, 삼성SDS, 삼성생명, 삼성화재, 삼성카드, 삼성증권, 삼성물산, 삼성엔지니어링, 제일기획, 에스원 등 23개 관계사가 참여했다. 기부에 참여한 삼성 관계사들은 대외 기부금 출연을 위한 각 사별 승인 절차를 거쳤다. 삼성이 전달한..."
2023.12.01.,힘들어도 500억 쾌척…연말 이웃사랑성금 ‘통 큰 기부’ 한 회장님,"올해 연말 이웃사랑성금은 삼성전자, 삼성디스플레이, 삼성SDI, 삼성전기, 삼성SDS, 삼성생명, 삼성화재, 삼성카드, 삼성증권, 삼성물산, 삼성엔지니어링, 제일기획, 에스원 등 23개 관계사가 참여했다. 기부에 참여한 삼성 관계사들은 대외 기부금 출연을 위한 각 사별 승인 절차를 거쳤다. 삼성이 전달한..."
2023.12.02.,[하나證 주간추천주]삼성전기·팬오션·BGF리테일,"△삼성전기(009150) -2024년 중국 스마트폰 기저효과 및 회복 움직임으로 적층세라믹콘덴서(MLCC) 및 카메라 모듈 매출 증가 전망. -온디바이스 인공지능(AI) 관련 패키지기판, MLCC 부문 수혜 기대. △팬오션(028670) -중국 경기 부양 기대와 파나마 운하 적체로 인해 발틱운임지수(BDI) 지난해 5월..."
2023.12.02.,주간 코스피 기관 순매수도 상위 10종목...삼성전자-삼성전기-한화오션,"© 연합뉴스. 금주(2023-11-27~2023-12-01) 코스피 시장에서 기관은 삼성전자, 삼성전기, 한화오션을 집주 매수했다."
2023.12.02.,"주가 600% 폭등 '넥스트 루닛'은 어디? ""자율주행 '여기'에 주목""","퓨런티어는 주로 삼성전기와 LG이노텍에 공급을 하고 있는데요. 물론 삼성전기나 LG이노텍에서 공식적으로 테슬라에 부품을 공급한다고 얘기는 안 하지만 지난해 각각 5조원, 1조원 규모로 테슬라에 공급한다는 보도가 나온적이 있거든요. 테슬라의 자율주행 기술이 고도화 할수록 삼성전기와 LG이노텍이..."
2023.12.02.,"큰손 '연기금', 삼전 팔고 카카오 담았다","2위는 카카오를 662억원어치 순매수했으며, 삼성SDI(640억원), 한화오션(485억원), 한화에어로스페이스(476억원), 삼성전기(455억원), 크래프톤(450억원) 등을 사들였다. 카카오는 10월 27일 3만7300원의 최저가를 찍고 11월 한 달 동안 주가가 34.32% 올라 5만원대를 회복했다. 주가 반등 기회를 틈타 개인 투자자들이..."
2023.12.02.,연기금 셀트리온 팔고 두산로보틱스·카카오 담았다,"연기금은 이어 삼성SDI(640억원), 한화오션(485억원), 한화에어로스페이스(476억원), 삼성전기(455억원), 크래프톤(450억원) 등을 사들였다. 삼성SDI와 엘앤에프는 전기차 수요 둔화 우려에 최근 주가가 급락하면서 저점 매수세가 유입된 것으로 분석된다."
2023.12.02.,"‘큰손’ 연기금, 11월에 삼성전자 팔고 카카오 샀다","카카오는 10월 27일 3만7300원으로 52주 신저가를 기록한 뒤 11월에만 34.32% 올랐다. 지금은 5만원 안팎에 거래되고 있다. 연기금은 삼성SDI(640억원‧이하 괄호 안은 순매수액), 한화오션(485억원), 한화에어로스페이스(476억원), 삼성전기(455억원), 크래프톤(450억원)도 11월 매수 대상에 포함했다."
2023.12.02.,[삼성그룹] 시가총액 6조1950억원 감소...삼성중공업 1.88% 상승 '주목',"삼성중공업 뒤를 이어 삼성전기, 제일기획 종목도 각각 0.69%, 0.66%씩 상승해 상승률 상위권에 이름을 올렸다. 한편, 삼성SDI 종목은 -5.3%를 기록해 삼성그룹 계열사 중 가장 부진한 흐름을 나타냈다. 지난 1일 삼성그룹 전체 계열사의 주가 등락률은 다음과 같다. 표기순서는..."
2023.12.02.,"미래에셋증권, 11월 마지막주 하이브 등 31종목 매수 추천","삼성전기(009150) 4분기 매출액 2조83억원(+2.0% YoY), 영업이익 1038억원(+2.5% YoY, OPM 5.2%)으로 컨센서스 하회 전망. 투자 포인트 ▲전장용 MLCC 매출 증가로 컴포넌트 사업부 Blended ASP 증가 ▲하이엔드 FC-BGA를 필두로 한 패키지솔루션 사업부의 고부가 가치 제품 위주 믹스 마진 개선. 목표주가..."
2023.12.02.,엑스포 불발…아쉬운 550일 유치전 外[금주의 산업계 이슈],"이번 성금은 삼성전자, 삼성디스플레이, 삼성SDI, 삼성전기, 삼성SDS, 삼성생명, 삼성화재, 삼성카드, 삼성증권, 삼성물산, 삼성엔지니어링, 제일기획, 에스원 등 23개 관계사가 참여했다. 유가·환율 하락, 항공사 실적 더 좋아진다…왜? 고공 행진하던 국제유가와 원·달러 환율이 안정세를 찾으며 항공업계..."
2023.12.03.,숨고르는 증시엔 '실적 성장주' 주목...삼성전기·리노공업 '픽' [株슐랭가이...,"3일 하나증권은 삼성전기, 팬오션, BGF리테일을 추천종목으로 꼽았다. 삼성전기의 경우 2024년 스마트폰 기저효과 및 회복 움직임으로 적층세라콘덴서(MLCC) 및 카메라 모듈 매출이 증가할 것으로 내다봤다. 하나증권은 ""온 디바이스 인공지능(AI) 관련 패키지 기판, MLCC 부문의 수혜를 기대한다""고 전했다...."
2023.12.03.,'숨고르기' 개별 종목 장세…실적 개선주 골라야[주간추천주],"하나증권은 삼성전기(009150)를 주간 추천주로 손꼽았다. 내년 중국 스마트폰 기저효과와 함께 회복 움직임으로 적층세라믹콘덴서(MLCC) 및 카메라 모듈 매출 증가가 전망되기 때문이다. 또한, 하나증권은 “온디바이스(On-device) 인공지능(AI) 관련 패키지기판과 MLCC 부문의 수혜가 기대된다”고 강조했다...."
2023.12.03.,0.003% 확률…삼성 CEO 되려면 꼭 필요한 '이것' [삼성 인사 분석③],이후 2020년 1월 정기 사장단 인사를 통해 계열사 삼성전기의 대표이사(사장)에 올랐다. 지난 2021년 12월에는 DS(디바이스솔루션)부문장으로 다시 삼성전자 사장으로 복귀했다. 노태문 무선사업부장은 삼성전자에서 '최연소' 타이틀을 휩쓴 인물로 잘 알려져 있다. 그는 1968년생으로 2007년 1월 만 38세...
2023.12.03.,"삼성, 사회복지공동모금회에 연말 이웃사랑성금 500억원 전달","올해 연말 이웃사랑성금은 삼성전자, 삼성디스플레이, 삼성SDI, 삼성전기, 삼성SDS 삼성생명, 삼성화재, 삼성카드, 삼성증권, 삼성물산, 삼성엔지니어링, 제일기획, 에스원 등 23개 관계사가 참여했다. 기부에 참여한 삼성 관계사들은 대외 기부금 출연을 위한 각 사별 승인 절차를 거쳤다. 삼성이 전달한..."
2023.12.03.,"연기금, 셀트리온 1177억원 매도… 두산로보틱스는 1410억원 매수","2위는 카카오로 662억원어치 순매수했으며 삼성SDI(640억원), 한화오션(485억원), 한화에어로스페이스(476억원), 삼성전기(455억원), 크래프톤(450억원) 등을 사들였다. 카카오는 지난 10월27일 3만7300원의 최저가를 찍고 11월 한 달 동안 주가가 34.32% 올라 5만원대를 회복했다. 주가 반등 기회를 틈타 개인..."
2023.12.03.,[삼성그룹 주간동향] 한주간 시총 3조630억원 증가...삼성에스디에스 강세,"삼성에스디에스 뒤를 이어 삼성전기, 삼성중공업 종목도 각각 7.08%, 6.55%씩 상승해 상승률 상위권에 이름을 올렸다. 한편, 삼성엔지니어링 종목은 -3.88%를 기록해 삼성그룹 계열사 중 가장 부진한 흐름을 나타냈다. 지난 1일 삼성그룹 전체 계열사의 주간 기준 등락률은 다음과..."
2023.12.03.,"LG엔솔·하이닉스, 12월 치열한 시총 2위 경쟁 예고","당시 SK하이닉스보다 삼성전자, 삼성전기, LG이노텍, IT 중소형주의 주가수익률(PER)이 더 높았다. 현재의 상황도 이와 비슷하다. SK하이닉스의 PER는 1.47배로 LG에너지솔루션의 5.35배보다 낮다. 해당 기업의 순이익이 주식가격보다 크면 클수록 PER가 낮게 나타난다. 따라서 PER가 낮으면 이익에 비해..."
2023.12.03.,"CSR 달력 29만개 임직원들에 지급, 삼성…‘기업의 사회적 역할’ 인식 제고","올해 삼성에서는 삼성전자, 삼성디스플레이, 삼성SDI, 삼성전기, 삼성SDS, 삼성화재, 삼성카드, 삼성증권, 삼성물산, 제일기획, 삼성바이오에피스 등 14개 관계사가 탁상 달력 구매에 참여했다. 삼성은 ‘함께가요 미래로! Enabling People’이라는 CSR 비전 아래 청소년 교육과 상생협력의 사회공헌 활동을..."
2023.12.03.,"LG이노텍, 애플 폴디드줌 액추에이터 시장 점유율 확대 가속화","자화전자는 과거 삼성전자·삼성전기 등과 볼 가이드 방식 액추에이터를 개발했다. 자화전자가 애플 공급망에 들어갈 것이란 전망이 나오던 시점부터 삼성전자 공급망에서 자화전자 부품 물량이 줄어들 것이란 관측이 나오기도 했는데, 자화전자는 여전히 자리를 지키고 있다. 애플 아이폰의 일반 카메라..."
2023.12.04.,"키움증권 ""삼성전기, 스마트폰 시장 회복 수혜""","키움증권은 4일 삼성전기에 대해 스카트폰 시장이 장기 침체에서 벗어나 회복국면에 진입함에 따라 내년 상반기 실적 호전세가 나타날 것이라고 전망했다. 투자의견은 '매수', 목표주가는 18만원을 유지했다. 키움증권은 삼성전기의 4분기 영업이익이 1344억원으로 전년 동기 대비 33% 증가할 것으로 예상했다...."
2023.12.04.,"'3년차' 장덕현 삼성전기 사장…""MLCC·카메라모듈 혁신 시동""","'3년차'에 접어드는 장덕현 삼성전기 사장이 핵심 사업인 MLCC(적층세라믹캐패시터), 카메라모듈을 중심으로 기술혁신을 가속한다. 해당 분야 전문가들의 승진과 곧 있을 조직개편을 통해 MLCC와 카메라 모듈 사업에 더욱 힘을 실을 전망이다. 4일 업계에 따르면 지난 2022년부터 삼성전기(009150)를 이끈..."
2023.12.04.,"삼성전기 주가 상승랠리 뚜렷...""스마트폰 시장 회복국면 진입""",삼성전기 주가의 상승세가 눈에 띈다. 4일 한국거래소에 따르면 전 거래일 0.69% 올라 14만 6000원에 거래를 마감했다. 주가는 깊은 하락추세에 벗어나 상승랠리에 박차를 가하고 있다. 외국인은 적극 러브콜을 하고 있다. 스마트폰 시장이 장기 침체에서 벗어나 회복국면 진입으로 내년 상반기 실적 호전세가...
2023.12.04.,"""내년 코스피 상단 2800선…반도체·2차전지株 반등 시점은""","내년 연간 추천 종목은 삼성전자(005930), SK하이닉스(000660), 삼성전기(009150), NAVER(035420), HD현대중공업(329180), 메리츠금융지주(138040), 삼성바이오로직스(207940), 유한양행(000100), 앨엔에프를 제시했다. 원자재는 경기 둔화로 내구재와 운송향 수요 정체가 예상되나 하반기 중국의 부양 효과는 일부 리스크 상쇄가..."
2023.12.04.,"삼성, 연말 이웃사랑성금 500억원 기탁","올해 연말 이웃사랑성금은 삼성전자, 삼성디스플레이, 삼성SDI, 삼성전기, 삼성SDS, 삼성생명, 삼성화재, 삼성카드, 삼성증권, 삼성물산, 삼성엔지니어링, 제일기획, 에스원 등 23개 관계사가 참여했다. 기부에 참여한 삼성 관계사들은 대외 기부금 출연을 위한 각 사별 승인 절차를 거쳤다. 삼성이 전달한..."
2023.12.04.,"""2024년 '스마트폰 반등'… 애플 아닌 中 주도""","이에 따라 삼성전기 등 중화권 비중이 높은 부품업체의 수혜도 기대되고 있다. 4일 업계에 따르면 올 3분기 전 세계 스마트폰 출하량은 3억400만대로, 전년 동기 대비 0.2% 성장했다. 1~2분기에 각각 2억6900만대, 2억6800만대를 기록한 것과 비교하면 뚜렷한 '상저하고' 흐름을 보이고 있다. 10월 글로벌 스마트폰..."
2023.12.04.,"[더벨][Financial Index/삼성그룹]삼성전자, FCF 순유출 최대",삼성엔지니어링과 삼성전기가 마이너스 전환하면서 1700% 수준의 감소율을 보였다. 액수로는 삼성전자가 순유출 21조원으로 최대치를 기록했다. 잉여현금흐름은 영업활동현금흐름에서 시설투자 등 자본적지출(CAPEX)과 배당 등을 제외하고 남은 현금흐름을 뜻한다. 기업 입장에선 여윳돈이기에...
2023.12.04.,[영상] 삼성·LG 2024 정기인사...핵심 포인트는 '이것',"삼성디스플레이, 삼성SDI, 삼성전기, 삼성SDS 대표가 다 유임됐구요."" -특이사항이라고 할만하면 한종희 부회장이 영상디스플레이(VD)사업부장은 뗐고 경계현 사장이 반도체(DS) 부문장 하면서 SAIT(옛 종합기술원) 원장을 겸임하는 건데. 한종희 부회장 입장에서 보면 3개 사업부잖아요. 3개 사업부 중에 2개를 맡는..."
2023.12.04.,"[오늘의 증시 리포트] “에코프로비엠, 기존 중장기 실적 전망 유지”","이투데이=박상인 기자 | ◇에코프로비엠 기존 중장기 실적 전망 유지 삼성SDI와 5년간 총 43.9조원 양극재 공급 계약 체결 달라질 것은 없다 Hold 투자의견과 목표주가 유지 정원석 하이투자 ◇삼성전기 스마트폰 시장 회복 사이클 수혜 4분기 실적 추정치 유지, 내년 상반기 실적 호전 초점 스마트폰 시장 회복..."
2023.12.04.,"창립 10년 '삼성웰스토리', 국내·베트남 점유율 1위 이면","삼성웰스토리에 따르면 삼성전자, 삼성디스플레이, 삼성전기, 삼성SDI 등 그룹 계열사를 모두 포함한 지난해 내부거래 비율은 33.7%로 나타났다. 지난 2020년 41.4%에 달하던 내부거래 비율은 '일감 개방 선포식'이 있었던 2021년 40.2%, 지난해 33.7%까지 줄며 2년 사이 7.7%포인트 낮아졌다. 앞서 2021년 공정위는 삼성..."
2023.12.05.,"""온디바이스AI 주목, 칩스앤미디어·삼성전기 등 상승""","이미 칩스앤미디어, 퀄리타스반도체, 오픈엣지테크놀로지, 삼성전기 등 관련주들 상승세를 보였습니다. 11월 말엔 차익 매물이 나오면서 주춤하기도 했지만 기존 AI관련주인 고대역폭메모리 HBM의 뒤를 이을 강자가 될지 관심이 큽니다. ◇진행자> 각 기기에 AI가 들어가는 거라고 하면 자동차의 자율주행차..."
2023.12.05.,"삼성전기 내년 전장기업 변신 가속화, 장덕현 북미 시장에서 기틀 닦는다",삼성전기가 전기차 보급이 가장 빠를 것으로 예상되는 북미의 전장(자동차 전자장비) 시장을 정조준하고 있다. 장덕현 삼성전기 대표이사 사장은 기존 IT부품 중심 사업구조에서 전장부품사로 변신을 추진하고 있는데 이를 위해 북미를 중심으로 기반을 다져나갈 것으로 예상된다. 장덕현 삼성전기 대표이사...
2023.12.05.,"""세계 스마트폰 시장 반등""…삼성전기, 내년 상반기 실적 호조 기대",삼성전기 수원사업장 전경. [뉴시스] 삼성전기가 전 세계 스마트폰 판매 회복에 힘입어 내년 호실적이 예상된다. 시장에서는 삼성전기가 올해 4분기 저점을 찍은 뒤 내년 상반기부터는 본격적으로 실적이 호전될 것으로 내다보고 있다. 실제 내년에는 스마트폰 수요가 성장 흐름으로 접어들 것이라는...
2023.12.05.,"""테슬라가 코앞에""…멕시코에 '전장 둥지' 트는 삼성·LG",삼성전기(009150)도 멕시코에 '전장 둥지'를 튼다. 삼성전기는 전장용 카메라 모듈 생산법인을 멕시코에 짓기로 하고 오는 2024년 설립 예정으로 추진 중이다. 차량당 카메라 탑재수가 늘면서 전장용 카메라 모듈의 고성장이 예상됨에 따라 멕시코 공장에서 향후 급증하는 고객 수요에 적극 대응한다는...
2023.12.05.,베스트 애널리스트가 내다본 2024년 산업 지도① [2024 재테크 키워드 금·반...,"(미니박스) PICK 2024 유망종목 2024년 섹터 내 최선호주로 삼성전기, LG이노텍, 비에이치를 추천한다. 이 중 삼성전기는 주력 사업인 MLCC 업황이 바닥을 통과 중이고, 2024년 주요 IT 제품들의 회복으로 인해 전년 대비 50% 증익할 것으로 전망한다. 특히 중화권 스마트폰향 비중이 높은 편이기 때문에 중국..."
2023.12.05.,"K-배터리, 대중국 규제 수혜…북미 진출 탄력","업계 관계자는 ""중국 기업들과 추진 중인 프로젝트의 지분율 향상이 부담으로 작용할 수 있다""며 ""전구체를 비롯한 소재의 중국 의존도를 낮추기 위한 노력도 가속화돼야 할 것""이라고 말했다. 삼성SDI 배터리 삼성SDI 전기차 배터리 미국, FEOC 세부 규정 발표…중국 기업 현지 투자·합작사 설립 난항"
2023.12.05.,"HLB, 2023 한국의 경영대상에서 ‘Report of the Year’ 수상","HLB는 현대글로비스, 삼성전기, 미래에셋증권 등과 함께 국내 제약·바이오기업으로는 유일하게 지속가능성보고서 부문 수상자로 선정됐다. 지난 2021년 그룹ESG 경영팀을 신설했던 HLB는 ESG 경영체제를 도입한 후 지속가능경영을 위해 꾸준히 노력해왔다. 사회공헌 행사, UNGC(유엔글로벌콤팩트)..."
2023.12.05.,"[2023연말결산] 삼성, AI-전장-바이오 집중육성···이재용 회장 국내외 현장...","삼성전자ㆍ하만ㆍ삼성전기ㆍ삼성디스플레이, 900조 규모 전장시장 주목 삼성그룹은 약 900조원 규모로 성장할 것으로 예상되고 있는 '자동차 전자 장비' 시장에 주목하고 있다. 앞서 글로벌 시장 조사기관 리서치앤드마켓은 세계 전장시장 규모가 2024년 4000억달러(한화 약 529조 원)에서 2028년 7000억달러..."
2023.12.06.,"대신증권 ""삼성전기, 내년 영업익 26% 증가 전망…최선호주""","대신증권은 6일 고부가 제품 매출 증가 등으로 내년 삼성전기의 영업이익이 올해보다 26% 증가할 것이라며 업종 내 최선호주로 제시한다고 밝혔다. 박강호 연구원은 ""화웨이의 폴더블폰 시장 확대 등으로 중국 스마트폰 시장 내 교체 수요가 기대되는 가운데 내년 스마트폰, PC, TV 시장은 3년 만에 성장세로..."
2023.12.06.,"대신증권 ""삼성전기, 내년부터 고성장 구간 진입""","대신증권은 6일 삼성전기에 대해 내년 뉴패러다임의 수혜로 고성장 구간에 진입할 것이라고 전망하며 내년 최선호주로 꼽았다. 투자의견은 '매수', 목표주가는 18만원을 유지했다. 대신증권은 삼성전기가 내년 주요 IT기기의 성장 속에서 MLCC(적층세라믹콘덴서), 반도체 기판 등의 매출이 확대돼 수익성..."
2023.12.06.,"애플, 넉달만에 시총3조 회복…관련주 '훈풍' 불까","이는 4분기 실적이 크게 개선될 것이란 소식 때문으로 풀이된다. 월가는 애플의 4분기 매출이 1180억 달러, 순익은 324억 달러로 2021년 이후 최고를 기록했을 것으로 전망하고 있다. 국내 대표적인 애플 관련주로는 LG이노텍, 삼성전기, LG전자 등이 꼽힌다."
2023.12.06.,"재도약 나선 전자부품 빅2…LG이노텍, 먼저 치고 나간다",LG이노텍이 먼저 반등에 나서고 삼성전기가 가세하는 흐름이다. 올 4분기 LG이노텍은 아이폰15 판매가 본격화됨에 따라 역대 최대 실적을 기록할 것으로 기대된다. 전통적 비수기를 맞은 삼성전기는 바닥을 다지며 내년부터 본격 시동을 건다. 안드로이드 수혜주지만… 6일 금융정보업체 에프엔가이드에...
2023.12.06.,인생을 건 기술개발 집념…세상에 없던 소재로 日 독점 깬다 [강경주의 IT카페...,"와이엠티는 삼성전기, 대덕전자, 비에이치, 심텍, 영풍전자 등 국내 유수 PCB 기업들을 고객사로 두고 있다. 폭스콘 등 글로벌 기업에도 화학재료를 수출한다. 와이엠티 재료는 이들 기업의 가공을 거쳐 애플과 삼성전자 스마트폰을 비롯해 글로벌 기업의 전기자동차, 5G 통신칩 등의 분야에 두루 쓰인다...."
2023.12.06.,"코스피, 2,500 안팎 박스권 흐름 지속…외국인 삼성전자·두산로보틱스·하이...","(43억원), 삼성전기(41억원), DB하이텍(40억원), 삼성화재(38억원), JYP엔터(37억원) 등이다.또한 외국인 순매도 상위 종목은 삼성SDI(598억원), SK하이닉스(359억원), 한화에어로스페이스(221억원), 삼성바이오로직스(194억원), LG에너지솔루션(160억원), 네이버(137억원), 와이지엔터테인먼트..."
2023.12.06.,"[더벨][CFO 인사 코드]삼성 전자부문 CFO, 올해는 무풍지대","삼성전기는 부사장 2명과 상무 6명 등 총 8명이, 삼성SDS는 부사장 2명과 상무 7명이 승진했다. 지난해에 이어 올해도 성장 잠재력을 갖춘 30대 상무, 40대 부사장 등 젊은 리더들이 배출됐다. 다만 경영지원실 등 재무라인은 인사 변동의 무풍지대였다. 박학규 DX부문 경영지원실장(사장)과 김홍경 DS부문..."
2023.12.06.,스마트레이더시스템 주가 쑥쑥...배송용 드론 레이다 수주 부각,이날 오후 1시 46분 현재 자율주행차 관련주인 넥스트칩 인포뱅크 현대오토에버 스마트레이더시스템 모바일어플라이언스 에이스테크 라닉스 드림텍 에이테크솔루션 삼보모터스 팅크웨어 하이비젼시스템 HL만도 커머스마이너 모트렉스 MDS테크 세코닉스 라이콤 코리아에프티 삼성전기 LG이노텍...
2023.12.06.,"LG이노텍, 언더패널카메라 선행개발 돌입...애플 대응 추정",최근 플래그십 바형 스마트폰 전면 카메라 모듈은 1000만 화소를 훌쩍 웃돈다. 삼성전자 스마트폰 카메라 모듈 공급망에서 하이엔드 제품 위주로 납품하는 삼성전기도 삼성전자 폴더블폰용 UPC는 만들지 않고 있다. 삼성전자 폴더블폰 갤럭시Z폴드4와 Z폴드5 언더패널카메라 사양 (자료=삼성전자) 디일렉=
2023.12.07.,[삼성그룹] 시가총액 2조6200억원 증가...삼성전기 2.82% 상승 '주목',"이들 계열사 중 삼성전기 종목은 전거래일 대비 2.82% 상승해 삼성그룹 계열사에서 주가상승률 1위를 기록했다. 삼성전기 뒤를 이어 멀티캠퍼스, 삼성화재 종목도 각각 2.31%, 2.11%씩 상승해 상승률 상위권에 이름을 올렸다. 한편, 삼성SDI 종목은 -2.36%를 기록해 삼성그룹 계열사..."
2023.12.07.,"'삼성맨' 등판시킨 LX세미콘…""사업 승부수 띄운다""","이 사장은 삼성전자 시스템LSI사업부 개발실장, 삼성디스플레이 LCD 개발실장, 삼성전기 대표이사 등을 역임했다. 이 사장은 삼성전기의 경영을 맡은 뒤 과감한 투자와 전면적인 체질 개선을 추진해 삼성전기의 사상 최고 실적을 이끌었다는 평가다. 이 사장 영입과 함께 LX세미콘은 전장(자동차 부품)..."
2023.12.07.,대통령과 국제시장 찾은 이재용… “부산 도전에 삼성도 함께 하겠다”,"실제로 삼성전자는 올해 3월 지역 균형 발전을 위해 전국에 위치한 삼성전자, 삼성디스플레이, 삼성SDI, 삼성전기 등 계열사 사업장을 중심으로 10년 간 60조1000억원을 투자하겠다는 계획을 발표한 바 있다. 이 중 부산에는 삼성전기 사업장이 자리하고 있다. 삼성은 해당 사업장을 IT 제품 및 전장에 탑재되는..."
2023.12.07.,재계 임원인사 마무리 수순…‘세대교체’에 방점,"지속된 점을 고려해 그룹 리더십 전반에 대해선 변화보다 안정에 무게를 뒀다. 삼성전자는 한종희 부회장과 경계현 사장 2인 대표이사 체제를 유지했다. 최주선 삼성디스플레이 사장, 장덕현 삼성전기 사장, 최윤호 삼성SDI 사장, 황성우 삼성SDS 사장 등 주요 관계사 수장 대부분도 유임했다. kangju07@"
2023.12.08.,"""진짜 불사조네""…'올드보이 귀환'에 삼성맨들도 깜짝",이 사장은 2014년부터 2020년까지 삼성전기 CEO를 맡아 전장부품과 반도체기판 등을 주력사업으로 키운 성과를 냈다. 이밖에 LG전자 MC사업본부장을 끝으로 2년 전 은퇴했다가 이번 인사에서 LG에너지솔루션으로 복귀한 이연모 부사장도 'OB의 귀환' 사례로 꼽힌다. HBM 키운 이석희 등 기술통 CEO 경력자 '각광...
