날짜,제목,내용
2023.09.01.,[Who Is ?] 임무현 대주전자재료 창업주 겸 회장,임무현은 삼성그룹에 몸담은 적 없었지만 대주전자재료는 삼성전기와 협력관계를 맺고 있었다. 임무현의 보수는 공개된 바 없다. 2023년 6월30일 기준 대주전자재료 주식 78만1700주(5.05%)를 들고 있다. 이는 2023년 8월24일 종가(9만2600원) 기준 723억 원의 가치를 가진다. ◆ 어록 임무현 대주전자재료...
2023.09.01.,[2024전문대수시특집] '첨단분야 혁신융합대학' 영진전문대 2349명(95.6%) '비...,"최근 6년간(2018~2023년, 교육부 발표 정보공시 기준) 대기업 취업 실적을 살펴보면 △삼성전자 삼성전기 삼성SDI 호텔신라 등 삼성계열사에 244명 △LG이노텍 LG디스플레이 LG유플러스 LG화학 등 LG계열사 309명 △SK하이닉스 SK실트론 SK에너지 등 SK계열사 296명 △한화그룹사 119명 △현대그룹사 85명..."
2023.09.01.,[코스피200 주간분석] 세방전지 한주간 20%↑상승률 1위...포스코퓨처엠 꼴찌,45%)▲189위 삼성전기 13만9200원(-4.66%)▲190위 OCI홀딩스 9만900원(-5.11%) 191위 대웅제약 10만1200원(-5.15%)▲192위 한전기술 6만4800원(-5.4%)▲193위 보령 9040원(-6.13%)▲194위 한미약품 28만2500원(-6.15%)▲195위 한미사이언스 3만2600원(-6.19%)▲196위 한올바이오파마...
2023.09.01.,[삼성그룹] 시가총액 2조870억원 감소...삼성중공업 2.44% 상승 '주목',14%)▲11위 삼성증권 3만7350원(-0.27%)▲12위 삼성전자 6만6900원(-0.3%)▲13위 삼성전기 13만5400원(-0.81%)▲14위 제일기획 1만8850원(-0.95%)▲15위 삼성물산 10만4700원(-1.41%)▲16위 삼성바이오로직스 73만7000원(-2.38%)▲17위 삼성엔지니어링 3만4000원(-3.82%)
2023.09.02.,[주간증시전망] 美 추가 금리인상 우려 완화 ‘박스피’ 계속…예상 밴드 249...,"포스코퓨처엠(-1596억 원), POSCO홀딩스(-1482억 원), 삼성전기(-737억 원), 삼성전자우(-607억 원), 고려아연(-484억 원), LG화학(-462억 원) 등은 순매도했다. 기관은 삼성전자(2370억 원), SK하이닉스(778억 원), 고려아연(542억 원), 호텔신라(467억 원), LG생활건강(433억 원) 등을 순매수했고, POSCO홀딩스(-1062억 원)..."
2023.09.02.,[주간 투자주체 동향] 주간 개인순매수 상위 종목은?...포스코 그룹주 집중매...,"3위 삼성전기 -737억원(-53만주), 4위 삼성전자우 -607억원(-111만주), 5위 고려아연 -484억원(-9만주), 6위 LG화학 -462억원(-8만주), 7위 LG에너지솔루션 -450억원(-9만주), 8위 KT&G -411억원(-47만주), 9위 포스코인터내셔널 -409억원(-52만주), 10위 호텔신라 -307억원(-35만주), 11위..."
2023.09.02.,"""'공순이'라 불렸던 나, 이제는 베테랑 공장 노동자""[나, 블루칼라 여자]","황점순 : 여동생이 수원에 있는 삼성전기에서 일하고 있어서 그 쪽에 방을 얻었다. 동생을 따라 그 곳에 입사해서 또 공장에 다녔다. 거기서 일하다가 엄마가 고향 남자를 소개해서 24살에 결혼했다. 경주로 내려와서 아이 둘을 낳았다. 그러면서 삼성생명에서 보험도 팔아봤고, 식당에서 서빙도 해봤고..."
2023.09.02.,[삼성그룹] 시가총액 23조5810억원 껑충...삼성전자 6%대 급등 '눈길',"삼성전자 뒤를 이어 멀티캠퍼스, 삼성전기 종목도 각각 3.07%, 2.81%씩 상승해 상승률 상위권에 이름을 올렸다. 한편, 삼성중공업 종목은 -5.33%를 기록해 삼성그룹 계열사 중 가장 부진한 흐름을 나타냈다. 지난 1일 삼성그룹 전체 계열사의 주가 등락률은 다음과 같다. 표기순서는..."
2023.09.02.,"경남도,'지방건설기술심의위원회' 재구성, 전기전자 12명","(금강시스템스) ▲박보수(삼성전기) 등 12명이다. '지방건설기술심의위원회'는 건설기술진흥법 제5조에 따라 도 및 도 산하기관, 시군에서 추진하는 건설공사 및 건설엔지니어링 등의 건설기술전반에 관한 사항에 대해 심의를 담당하는 법정 위원회다. 위원회에서는 ▲총 공사비 100억원 이상 건설공사에 대한..."
2023.09.02.,"자율주행차 관련주, '덩실덩실' 스마트레이더시스템·넥스트칩·앤씨앤·에이...","이외에 현대오토에버, 칩스앤미디어, 삼성전기, 하이비젼시스템, 유니퀘스트, 유니트론텍, LG전자, 에이테크솔루션, 현대모비스, HL만도, KG모빌리티 등은 상승했다. 하지만 인포뱅크, 퓨런티어, THE MIDONG, 팅크웨어, SK텔레콤, 한국단자, LG이노텍, 파인디지털, 기아, 캠시스, 옵트론텍, 현대차..."
2023.09.02.,[삼성그룹 주간동향] 시가총액 22조3770억원 증가...반도체 강세 이어질까?,"한편, 삼성전기 종목은 -4.66%를 기록해 삼성그룹 계열사 중 가장 부진한 흐름을 나타냈다. 지난 1일 삼성그룹 전체 계열사의 주간 기준 등락률은 다음과 같다. 표기순서는 등락률 순위, 종목명, 1일 종가, 주간 기준 등락률 이다. 1위 삼성전자 7만1000원(5.81%)▲2위 멀티캠퍼스..."
2023.09.02.,[코스피 200] 삼성전자 6.13% 상승…지수 구성종목 중 상승률 1위,84%)▲10위 삼성전기 13만9200원(2.81%) 코스피200 지수 구성종목 중 하락률 상위 종목은 다음과 같다. 1위 한미사이언스 3만2600원(-9.44%)▲2위 한화오션 3만5000원(-8.74%)▲3위 SK아이이테크놀로지 8만3200원(-7.86%)▲4위 한국콜마 5만3600원(-7.27%)▲5위 한올바이오파마 2만2350원(-5.89...
2023.09.03.,POSCO홀딩스·포스코퓨처엠·삼성전기 등 코스피 종목 개인 순매수 상위권,"28일부터 9월 1일까지 한주간 코스피 개인 부문 순매수 종목 중 상위권에 POSCO홀딩스, 포스코퓨처엠, 삼성전기 등으로 나타났다. 3일 한국거래소 정보데이터시스템에 따르면 POSCO홀딩스의 거래대금 순매수는 2084억2281만1000원, 거래량 순매수는 35만9289주다. 이어서 포스코퓨처엠의..."
2023.09.03.,"[데이터로 보는 증시]삼성전자, 기관·외국인 주간 코스피 순매수 1위(8월 28...","주간 순매도 상위 종목은 POSCO홀딩스(1062억원)와 삼성전기(756억원), 포스코퓨처엠(436억원), 씨에스윈드(308억원), LG에너지솔루션(297억원), 한화오션(042660)(280억원), 한전기술(241억원), 유한양행(241억원), LS(200억원), 삼성바이오로직스(194억원), LG전자(181억원) 등이다...."
2023.09.03.,“준법위 거쳤나요?” 삼성서 더는 낯설지 않은 이 말 [방영덕의 디테일],"‘삼성 준법위’, 뭐하는 곳인가요 2020년 1월 30일 삼성전자, 삼성물산, 삼성SDI, 삼성전기, 삼성SDS, 삼성생명보험, 삼성화재해상보험 등 삼성의 7개 관계사들은 삼성 준법위를 신설했습니다. 이름 그대로 삼성 관계사에 대한 준법 감시 역할을 하기 위해섭니다. 당시 이재용 삼성전자 회장의 국정농단 사건..."
2023.09.03.,"영진전문대, 디지털 신기술 분야 인재 양성 '탄력'","최근 6년간(2018~2023년, 교육부 발표 정보공시 기준) 대기업 취업 실적을 살펴보면 △삼성전자, 삼성전기, 삼성SDI, 호텔신라 등 삼성계열사에 244명, △LG이노텍, LG디스플레이, LG유플러스, LG화학 등 LG계열사 309명, △SK하이닉스, SK실트론, SK에너지 등 SK계열사 296명, △한화그룹사 119명, △현대그룹사 85명..."
2023.09.03.,"[기업탐방] 태성, AI와 2차전지 시장 성장 동시 수혜","삼성전기, LG이노텍 등 국내 고객사와 글로벌 PCB 1위 업체인 폭스콘의 자회사 펑딩 등을 해외 고객사를 확보했다.23년 6월 카메라 모듈 사업부를 신설하여 사업영역을 확장했고, 2차전지 동도금 장비 또한 준비 중이다. 주목해볼 투자포인트는 크게 2가지로 보인다. 첫째 AI와 차량용 반도체 성장에 따라 PCB..."
2023.09.03.,[초전도체 관련주 기관 연일 매수] '안끝났나?' 파워로직스·원익피앤이·신성...,"세코닉스, 아이엠, 동운아나텍, 삼성전기, 하이비젼시스템, 팸텍, 바이오로그디바이스, 나무가, 라온피플, 파트론, 액트로, 코아시아씨엠 주가가 상승했고, 해성옵틱스, 엠씨넥스 종목이 보합, 노블엠앤비, 이즈미디어 종목은 거래가 없었다. 업종 상승에도 탑엔지니어링, 퓨런티어, 삼양옵틱스, 자화전자..."
2023.09.03.,[주말에 보는 외국인·기관 쌍끌이 매수 종목] 체시스·스마트레이더시스템·...,"스마트레이더시스템, 넥스트칩, 앤씨앤, 에이스테크, 세코닉스, 현대오토에버, 삼성전자, 칩스앤미디어, 삼성전기, 라닉스, 하이비젼시스템, 유니퀘스트, 유니트론텍, LG전자, 텔레칩스, 에이테크솔루션, 아이에이, 현대모비스, HL만도, KG모빌리티 주가가 상승 마감했고, 엠씨넥스, 커머스마이너, NAVER..."
2023.09.04.,"삼성전기, 중장기 성장성 확보-NH","NH투자증권은 4일 삼성전기에 3분기 실적 기대치는 하회할 가능성이 있으나 고부가가치 기판 물량 증가가 중장기적으로 기대돼 주가 하락시 매수 기회로 삼는 것이 좋다고 조언했다. 목표주가는 19만원, 투자의견 '매수'를 유지했다. 이규하 NH투자증권 연구원은 ""전장용 적층세라믹콘덴서(MLCC)는 과거..."
2023.09.04.,[오늘의 주요공시] HJ중공업ㆍ한국항공우주ㆍ삼성전기 등,"이투데이=김예슬 기자 | △HJ중공업, 보령신복합 1호기 건설공사 낙찰자 선정 △HJ중공업, 부산 구서4구역 재건축정비사업 시공자 선정 △HJ중공업, 대구 아진아파트 가로주택정비사업 시공자 선정 △한국항공우주, 부정당업자 제재 행정처분 해제 △삼성전기, 미국 자동차 업체와 카메라 모듈 공급계약 체결..."
2023.09.04.,"에이테크솔루션 주가 강세, 삼성전기 카메라 모듈 공급계약 영향","삼성전기의 카메라 모듈 공급계약 소식에 영향을 받는 것으로 보인다. 삼성전기는 이날 미국 자동차 업체간에 카메라 모듈 공급계약이 체결됐다고 공시했다. 다만, 공급 수량 및 금액 등은 정해진 바가 없다고 설명했다. 삼성전기는 향후 본 계약 관련 수시공시 의무에 해당되는 사유 발생 시 바로..."
2023.09.04.,"코스피, 기관 순매수도 상위 10종목(4일)....포스코인터네셔널-SK하이닉스-삼...","▲ 4일 코스피 시장에서 기관은 .포스코인터네셔널, SK하이닉스, 삼성전기를 집중 매수했다. 반면, 삼성전자, POSCO홀딩스, NAVER을 집중 매도했다.© 연합뉴스. 4일 코스피 시장에서 기관은 .포스코인터네셔널, SK하이닉스, 삼성전기를 집중 매수했다. 반면, 삼성전자, POSCO홀딩스, NAVER을 집중 매도했다."
2023.09.04.,"이재용 회장, 수행원 없이 서비스센터 현장 점검","국내에서는 삼성전자, 삼성전기, 삼성SDI, 삼성화재, 삼성디스플레이, 삼성증권 등 국내 주요 사업장을 잇달아 방문하면서 임직원 소통에 힘썼고 협력사와 고객센터 등도 자주 찾고 있다. 재계 관계자는 ""이 회장은 적극적인 글로벌 현장 경영 행보와 함께 국내에서도 보폭이 확대됐다""며 ""국내에서는..."
2023.09.04.,"2023 IAA, 미래 도로 달릴 첨단 모빌리티는?","현대모비스는 배터리 시스템, 동력계 등의 전동화 핵심 부품과 차종에 상관없이 다양한 목적에 대응 가능한 새 모빌리티 플랫폼 e-CCPM을 출품했다. 삼성과 LG도 모빌리티 시장을 공략하기 위해 IAA에 처음 등장했다. 삼성은 전기차용 고전압 배터리와 디스플레이 기술을, LG는 전장 사업 강화를 발표했다."
2023.09.04.,"삼성·LG, 반도체·SW·로봇 인재 직접 키운다","삼성전기는 지난해 11월 포항공대와 ‘소재·부품 인재 양성 MOU’를 체결했다. 삼성전기는 소재·부품 관련 미래 기술 테마를 포항공대에 제안하고, 선발된 석·박사 과정 대학원생은 장학금 및 학자금을 지원받고, 졸업 후 삼성전기에 입사하게 된다. 그 밖에 삼성은 국내 대학들의 인재 양성을 위해..."
2023.09.04.,"[시간외Y] 옵트론텍, 캠시스 '상한가'","옵트론텍과 캠시스의 상한가는 삼성전기(009150)가 '글로벌 전기차 1위' 테슬라에 차량용 카메라 모듈을 공급하는 계약을 체결했다는 소식으로 인해 향후 수혜 기대감에 강한 매수세가 몰린 것으로 풀이된다. 삼성전기는 금일 공시에서 ""미국 자동차 업체에 카메라 모듈을 공급하는 계약을 체결했다""며 ""공급..."
2023.09.04.,"산업인력공단, 佛 리옹 국제기능올림픽대회 국가대표선수 입소식 개최","국가대표 선수들은 공단 글로벌숙련기술진흥원(인천), 삼성전자·삼성전기(수원), 삼성중공업(거제), HD현대중공업(울산) 훈련장 등을 오가며 훈련에 전념할 예정이다. 2007년부터 17년간 국제기능올림픽 대회를 후원하고 있는 삼성전자(회장 이재용)는 개소식에 참석한 국가대표 선수들에게 7억2000만원..."
2023.09.05.,"삼성전기, 국내 최대 기판展서 차세대 반도체기판 기술력 공개","삼성전기는 'KPCA Show 2023'에 참가해 차세대 반도체기판 기술력을 공개한다고 5일 밝혔다. 오는 6일부터 8일까지 인천 송도컨벤시아에서 개최되는 KPCA Show(국제PCB 및 반도체패키징산업전)는 국내외 기판, 소재, 설비 업체들이 참가하는 국내 최대 기판 전시회다. 삼성전기는 국내 최대 반도체기판..."
2023.09.05.,"삼성전기, 美 전기차업체와 공급계약에 5%대 상승[핫스탁]","삼성전기가 미국 전기차업체와 카메라 모듈 공급 계약을 체결했다는 소식에 관련주들이 일제히 급등하고 있다. 5일 오전 9시7분 현재 삼성전기는 전 거래일 대비 8100원(5.76%) 오른 14만8700원에 거래되고 있다. 또 옵트론텍(29.95%)과 해성옵틱스(29.9%) 등이 상한가를 기록 중이며 캠시스(25.15%0, 액트로(14.41%0..."
2023.09.05.,"삼성전기, '국제PCB 및 반도체패키징산업전' 참가",삼성전기가 오는 6일부터 8일까지 인천 연수구 송도컨벤시아에서 열리는 '국제PCB 및 반도체패키징산업전'(KPCA Show 2023)에 참가한다고 5일 밝혔다. 사진은 삼성전기 KPCA 부스 조감도. 2023.9.5 [삼성전기 제공. 재판매 및 DB 금지]
2023.09.05.,"삼성전기, 차세대 반도체기판 기술력 선보인다",사진=삼성전기 삼성전기가 반도체 성능 차별화의 핵심인 대면적·고다층·초슬림 반도체기판 기술력을 공개한다. 삼성전기는 오는 6일부터 8일까지 인천 송도컨벤시아에서 열리는 '국제PCB 및 반도체패키징산업전(KPCA Show) 2023'에 참가한다. 이번 전시회에서 삼성전기는 하이엔드급 제품인...
2023.09.05.,"자동차 전장회사 변신하는 삼성전기 ""쌀 때 사볼까?""",삼성전기가 미국 전기차 업체에 납품한다는 사실에 주가가 급반색했다. 지난해부터 시장에서는 자동차용 전장 기업으로 변신할 삼성전기에 큰 관심을 보내왔다. 삼성전기 주가가 체질 변화를 계기로 레벨업할 지 관심이 커진다. 전장 회사로 변신 가속화…시장 확대된다 5일 코스피 시장에서 삼성전기는...
2023.09.05.,"LG이노텍·삼성전기, KPCA쇼서 고부가 반도체 기판 전시",LG이노텍과 삼성전기가 6~8일 인천 송도 컨벤시아에서 열리는 KPCA쇼(국제PCB및반도체패키징산업전)에 참가해 고부가 반도체 기판을 전시한다고 5일 밝혔다. (자료=LG이노텍·삼성전기) LG이노텍과 삼성전기가 6~8일 인천 송도 컨벤시아에서 열리는 KPCA쇼(국제PCB및반도체패키징산업전)에 참가해...
2023.09.05.,"삼성전기 '계약금액' 안적은 계약 공시, 알고 보니…","삼성전기가 미국의 한 자동차 업체와 카메라 모듈 공급 계약을 체결했다고 지난 4일 공시했다. 삼성전기는 이 업체명과 계약 물량, 계약 금액 등은 일절 공개하지 않았다. 나중에 이 업체는 미국 테슬라로 추정됐다. 한국거래소는 지난해 6월 삼성전기가 테슬라에 카메라 모듈을 납품한다는 소식이 나온 이후..."
2023.09.05.,삼성전기·LG이노텍 “고성능‧고부가 반도체 기판 시장 이끈다”,삼성전기와 LG이노텍이 글로벌 전자기판·소재·설비업체가 참가하는 국내 최대 규모의 기판 전시회에서 나란히 차세대 반도체 기판 기술력을 선보인다. 삼성전기는 6~8일 인천 송도컨벤시아에서 열리는 ‘국제 인쇄회로기판(PCB) 및 반도체 패키징 산업전(KPCA 쇼 2023)’에 참가해 고성능 반도체 패키지...
2023.09.05.,"카메라 모듈 관련주 주가 장중 강세, 삼성전기 테슬라 공급 소식에",삼성전기가 미국 전기차업체에 카메라 모듈을 공급하기로 계약을 맺었다는 소식이 전해지면서 삼성전기와 카메라 모듈관련 기업 주가가 장중 강세다. 5일 코스피시장에서 삼성전기 주가는 전날보다 2.06%(2900원) 높은 14만3500원에 거래되고 있다. 5일 장중 삼성전기 주가가 2% 강세를 보이고 있다....
2023.09.06.,"삼성전기, 첨단 패키징 '2.1D' 주목…""미래 HBM 시대 대세될 것""","삼성전기가 최첨단 패키징 기술의 일종인 '2.1D' 시장에 주목하고 있다. 2.1D 패키징은 삼성전기와 같은 기판업체가 주도할 수 있는 기술로, 향후 HBM(고대역폭메모리)를 10개 이상 탑재하는 시장에서 본격 활용될 것으로 전망된다. 6일 김용훈 삼성전기 패키지마케팅 그룹장은 인천 송도 컨벤시아에서..."
2023.09.06.,"삼성전기, 단가 눈높이를 좀 더 낮추자...목표가 20만원 -한투","한국투자증권이 삼성전기의 목표 주가를 20만원, 투자 의견을 '매수'로 제시했다. 6일 조철희 한국투자증권 연구원은 ""삼성전기의 3·4분기 추정 실적은 매출액 2조2000억원, 영업이익 2260억원으로 전분기와 전사 매출액은 유사하다""며 ""카메라모듈 매출액은 성수기 효과가 끝나면서 소폭 줄어들지만 MLCC..."
2023.09.06.,삼성전기 '체질개선'...테슬라 손잡고 전장사업 속도,"삼성전기 수원사업장/사진제공=삼성전기전기차 보급 확대로 차량용 반도체는 물론, 차량용 카메라 등 전장 부품에 대한 수요가 크게 늘어나고 있다. 수익의 대부분이 스마트폰 부품에 초점이 맞춰져 있던 부품업체들은 최근 전장 부문으로 눈을 돌려, 새로운 활로를 찾고 있다. 6일 업계에 따르면 삼성전기는..."
2023.09.06.,"LG이노텍·삼성전기, '고성능 FC-BGA' 선점 경쟁",삼성전기와 LG이노텍이 고부가 반도체 기판 제품인 플립칩 볼그리드 어레이(FC-BGA) 경쟁에 나선다. 챗GPT·인공지능(AI)·전장 등의 시장이 커지며 차세대 반도체 기판의 핵심제품으로 FC-BGA가 주목받고 있어서다. 최근 고성능 반도체칩 수요가 늘어나면서 반도체칩을 메인보드와 연결해주는 반도체 패키지...
2023.09.06.,"팸텍, 주가 강세…삼성전기 美 업체 계약에 들썩","이는 삼성전기가 미국의 한 자동차 업체와 카메라 모듈 공급 계약을 체결했다고 지난 4일 공시했기 때문으로 풀이된다. 삼성전기는 이 업체명과 계약 물량, 계약 금액 등은 일절 공개하지 않았다. 한국거래소는 지난해 6월 삼성전기가 테슬라에 카메라 모듈을 납품한다는 소식이 나온 이후 삼성전기 측에..."
2023.09.06.,"""삼성전기, 2025년 전장향 카메라 매출은 8000억원 이상 전망""","대신증권은 6일 삼성전기에 대해 미국 자동차 업체와 카메라모듈 공급 계약을 체결했다고 전했다. 박강호 대신증권 연구원은 ""삼성전기의 목표주가는 2023년·2024년 평균 주당순이익(EPS)에 목표 주가수익비율(P/E) 22.7배를 적용했다""며 ""전장향 카메라의 신규 공급 계약 체결로 2025년 실적 상향 가능성 부각..."
2023.09.06.,"삼성전기, 4거래일만에 3% 낙폭…공매도 수량 12만3000주대로 늘어나",삼성전기가 하락세다. 삼성전기는 6일 코스피 시장에서 오전 11시56분 현재 전 거래일보다 3.11%(4500원) 하락한 14만300원에 거래되고 있다. 이 회사는 1일부터 5일까지 3거래일 연속 상승세다. 한국거래소에 따르면 삼성전기의 공매도 수량은 4일 4만8732주에서 5일 12만3705주로 늘어났다.
2023.09.06.,[삼성그룹] 시가총액 2조4700억원 감소...삼성전기 2.99% 상승 '눈길',"이들 계열사 중 삼성전기 종목은 전거래일 대비 2.99% 상승해 삼성그룹 계열사에서 주가상승률 1위를 기록했다. 한편, 삼성중공업 종목은 -1.89%를 기록해 삼성그룹 계열사 중 가장 부진한 흐름을 나타냈다. 지난 5일 삼성그룹 전체 계열사의 주가 등락률은 다음과 같다...."
2023.09.06.,"AI시장 성장, 반도체 말고도 기판사업에 훈풍",국내 양대 전자부품업체 삼성전기·LG이노텍이 AI(인공지능) 시장 성장에 힘입어 '반도체 패키지 기판' 사업에 박차를 가한다. 반도체 공정 미세화에 한계를 느끼면서 반도체 기판이 반도체 성능을 차별화할 수 있는 대안이 되고 있기 때문이다. AI가 키우는 기판 산업 삼성전기와 LG이노텍은 6일 인천...
2023.09.07.,"카메라모듈株, 전장부품 수혜 전망 가시화…삼성전기 '신호탄' 될까","7일 업계에 따르면, 최근 삼성전기는 미국 전기차 업체에 카메라 모듈 공급 계약을 체결한 것으로 알려졌다. 구체적인 계약 상대방과 물량, 금액 등은 명시되지 않았지만, 업계에서는 해당 업체를 '테슬라(Tesla)'로 추정하고 있다. 테슬라 신형 전기차에 삼성전기 카메라 모듈이 탑재될 것으로 보인다...."
2023.09.07.,"삼성전기 차량용 카메라 모듈 사업 불붙어, 장덕현 전장 중심회사 변모 ‘탄력...",장덕현 삼성전기 대표이사 사장(사진)이 테슬라로 추정되는 북미고객사와 전장용 카메라 모듈 공급계약을 계기로 전장 중심회사로 변화하는데 고삐를 죌 것으로 예상된다. <그래픽 비즈니스포스트> 삼성전기가 테슬라로 추정되는 북미 고객사와 차량용 카메라 모듈 공급계약을 맺으면서 전장(자동차...
2023.09.07.,"인천본부세관, 삼성전기(주) 협력사 지원사업 실시",AEO·FTA 활용 설명회 및 컨설팅 실시로 기업 수출경쟁력 확보 지원 인천본부세관은 6일 경기도 경제과학진흥원에서 삼성전기㈜의 중소 협력업체 33개社 실무자 등 40여명이 참석한 가운데 ‘AEO (Authorized Economic Operator 수출입 안전관리 우수업체)제도 및 FTA 활용 설명회’를 개최했다. 이번...
2023.09.07.,"태성 주가 파죽지세... PCB자동화 생산과 삼성전기, LG이노텍, 대덕전자는?","식각설비의 핵심기술인 진공장치, 이류체분사장치를 개발하여 특허출원 하였으며 일본, 독일의 기술력을 뛰어 넘어 역수출하고 있다. 삼성전기, LG이노텍, 대덕전자 및 글로벌 PCB업계 1위인 폭스콘의 자회사 펑딩(구. ZDT) 등 세계적인 PCB 제조사에 지속적으로 제품을 납품하고 있다."
2023.09.07.,"삼성·테슬라, 깊어지는 자율주행 동행…반도체부터 카메라모듈까지","파운드리에 이어 카메라 모듈 부문에서 테슬라와 협력하는 기업은 삼성전기다. 지난 4일 삼성전기는 공시를 통해 ""미국 자동차 업체와 카메라 모듈 공급계약이 체결됐지만 공급 수량과 금액 등은 정해진 바가 없다""고 밝혔다. 업체는 테슬라가 유력하고, 공급 규모는 조 단위로 추정된다. 카메라 모듈은..."
2023.09.07.,"스마트공장 선정기업 대표들, 삼성전자 광주캠퍼스 방문","한편, 중기중앙회는 중기부, 삼성(삼성전자·삼성전기·삼성SDI)과 함께 2018년부터 '대중소 상생형 스마트공장 1차 지원사업'을 진행해 2천여개사의 스마트공장 구축을 지원했다. 올해부터 새롭게 시작되는 '대중소 상생형 삼성 스마트공장 구축 2차 지원사업'은 중기부와 삼성이 3년간 매년 200억원을 투입, 연간..."
2023.09.07.,삼성전자 6개월째 임금협상 '미타결'…입장차 뭐길래?,"그룹 내 다른 전자 계열사인 삼성디스플레이와 삼성전기가 지난 5월 임단협을 마무리 짓고, SK하이닉스도 지난달 임금 협상에 합의했다. 하지만 삼성전자는 아직까지 임협 리스크가 발목을 잡는 모습이다. 삼성전자는 지난해에도 임금 협상을 조기에 매듭짓지 못했는데 올해에도 노사 양측은 입장차만..."
