날짜,제목,내용
2023.11.23.,"코스피, 박스권서 등락 거듭하다 외국인 '사자'에 강보합…외국인 삼성전자·...","9억원↓), 삼성바이오로직스(3,726억원, 56.7억원↓), 엘앤에프(3,586억원, 15.5억원↑), HLB(2,605억원, 7.6억원↑), SK하이닉스(2,473억원, 24.9억원↓), 카카오뱅크(2,332억원, 11.5억원↓), 호텔신라(1,901억원, 8.1억원↑), HMM(1,837억원, 32.8억원↑), 두산에너빌리티(1,745억원, 11.3억원↓), 아모레퍼시픽..."
2023.11.24.,"삼성바이오로직스 ""의약품 시장 '바이오로직스'와 'CDMO'가 주인공""","삼성바이오로직스 제임스 최 부사장(영업지원센터장)이 23일 인천 연수구 송도 컨벤시아에서 열린 '2023 바이오 인천 글로벌 콘펙스(BIG C 2023)’에서 삼성바이오로직스 CDMO 사업 전략에 대해 발표하고 있다.©약업신문“전 세계적인 고령화, 치료 영역 확대는 바이오헬스 산업의 큰 성장을..."
2023.11.24.,[데이터 뉴스룸] 제약業 매출 성적에 희비 교차…삼성바이오로직스 미소 VS 씨...,조사 대상 업체 중에서는 삼성바이오로직스는 20% 이상 매출이 상승했다. 반면 씨젠은 매출이 60% 넘게 하락해 희비가 크게 엇갈렸다. 이 같은 결과는 본지가 '국내 주요 제약 업체 50곳의 2022년 3분기(1~9월) 대비 2023년 동기간 매출 변동 현황 결과서 도출됐다. 매출액은 개별(별도) 재무제표...
2023.11.24.,"삼성바이오로직스 '직장 내 갑질' 결국, ""니가 타는 차에 불났으면 좋겠다""?","삼성바이오로직스 인천 송도 본사에 다니는 20대 직원이 직장 내 괴롭힘을 받았다는 의혹에 사망하자 고용노동부가 사실 관계 파악에 나섰다. 최근까지도 부서장과 갈등 노무 상담 받아와 고용노동부, '괴롭힘 의혹' 사실관계 파악 중 [백세경제=김인하 기자] 삼성바이오로직스 인천 송도 본사에 다니는 20대..."
2023.11.24.,"코스피, 외인 매도에 하락 마감...삼성바이오로직스, SK하이닉스, LG에너지솔...","시가총액 상위 10개 종목은 보합 마감한 NAVER를 제외하고 하락 마감했다. 삼성바이오로직스(-1.66%), SK하이닉스(-1.61%), LG에너지솔루션(-1.34%), 삼성전자(-0.97%), LG화학(-0.96%), POSCO홀딩스(-0.53%), 현대차(-0.43%), 기아(-0.36%), 삼성전자우(-0.35%)는 하락 마감했다."
2023.11.24.,삼바로직스·셀트리온의 미래 성장 전략…'CDMO부터 신약 개발까지',"2023 바이오 인천 글로벌 콘펙스(Bio Incheon Global Confex 2023, BIG C 2023)의 세션4 강연에서 제임스 최 삼성바이오로직스 부사장과 이수영 셀트리온 전무가 자사의 미래 전략을 말했다. 23일 송도 컨벤시아에서 인천광역시와 대한무역투자진흥공사(KOTRA)가 주최하고, 인천관광공사, 아시아생물공학연합체..."
2023.11.24.,코스피 2500 이탈...LG엔솔 · 삼성바이오 · 셀트리온 '뚝',"삼성바이오로직스(-1.66%), 셀트리온(-2.83%), SK바이오팜(-3.98%), SK바이오사이언스(-1.61%) 등 바이오 대형주들이 하락했다. 조선주 중 한화오션이 신주 상장을 앞두고 권리매도 첫 거래일을 맞아 16.73% 급락했다. 삼성중공업(-3.30%), HD현대중공업(-1.56%) 등도 내렸다. 해운주 중 HMM(-4.04%), 흥아해운(-6...."
2023.11.24.,"13조 아일리아 전쟁…리제네론, 셀트리온 이어 삼성바이오에피스 소송",김경림 박준형 기자 = 황반변성 치료제 '아일리아' 특허를 보유한 미국 제약기업 리제네론이 삼성바이오로직스의 자회사 삼성바이오에피스를 상대로 미국 사법부에 소송을 제기했다. 기존 특허무효심판(IPR)과 다른 정식 소송으로 사법부 결정에 따라 삼성바이오에피스는 바이오시밀러 연구에 제동이 걸릴...
2023.11.24.,"코스피, 외국인 '팔자'에 하락…외국인 두산로보틱스·포스코DX·삼성에스디에...","(110억원), 삼성바이오로직스(109억원), KB금융(100억원), 셀트리온(95억원), 이오플로우(87억원), 에코프로머티(77억원), 하나금융지주(71억원), LG생활건강(66억원), HMM(55억원) 등이다. ◆ 기관 매수/매도 종목 기관 순매수 상위 종목은 삼성에스디에스(166억원), 삼성전자(115억원), 카카오..."
2023.11.24.,2024년 제약·바이오 트렌드는 키트루다 ADC 병용과 SC,"또 1차 치료제로 확대되는 면역항암제와 ADC 병용요법은 초기 환자를 대상으로 시장을 잠식시킬 것이고 ADC 또한 SC 변경이 필수적일 것으로 예상했다. 그러면서 관련 국내 기업으로 알테오젠, 삼성바이오로직스, 셀트리온, 레고켐바이오 등을 추천했다."
2023.11.25.,‘이번에 또’ 삼성바이오로직스 20대 직원 사망···상사 협박·폭언 의혹 ...,"삼성바이오로직스 직원이 직장 내 괴롭힘으로 사망했다는 청원이 접수돼 고용노동부가 근로감독을 실시했다. 고용부는 삼성바이오로직스 직원인 20대 남성이 지난 16일 사망한 것과 관련해 직장 내 괴롭힘이 있었다는 청원을 접수, 22일 근로감독을 결정했다고 발표했다.청원서에 따르면 부서장이 숨진 직원에게..."
2023.11.25.,"삼성바이오로직스, 올해 1~3분기 누적 기부금 ‘고작’ 1억6400만원",삼성바이오로직스의 올해 1~3분기 누적 기부금이 1억6400만원으로 집계됐다. 같은 기간 90억원을 기부한 유한양행과는 55배 차이가 난다. 또 종근당과 광동제약은 올해 1~3분기 매출과 영업이익은 전년 동기 대비 늘었지만 기부금은 오히려 줄었다. 25일 기업데이터연구소 CEO스코어(대표 김경준)가...
2023.11.25.,[바이오 K-뉴딜] HLB 0.16% 상승 '선방'...구성종목 대부분 하락,1위 HLB 3만1950원(0.16%)▲2위 한미약품 30만3000원(-0.49%)▲3위 유한양행 6만1900원(-0.8%)▲4위 한미사이언스 3만5700원(-1.38%)▲5위 SK바이오사이언스 6만7400원(-1.61%)▲6위 삼성바이오로직스 70만9000원(-1.66%)▲7위 셀트리온 16만8000원(-2.83%)▲8위 셀트리온헬스케어 7만3800원(-3.4%)▲9위...
2023.11.25.,시흥·송도 연계 'K 바이오 S-스퀘어 클러스터' 구축 모색,"우정훈 대표는 ""송도는 앵커 기업으로 삼성바이오로직스와 셀트리온이 입주하여 크게 성장하였으나 현재 포화상태로 확산성에 대한 필요성이 크다""면서 ""반면 시흥은 이용 가능한 부지가 많이 있으니 두 지역을 연계해 훌륭한 기획으로 R&D 매력을 극대화할 필요가 있다""고 강조했다. 최병호 대표는 ""송도와..."
2023.11.25.,"[주간 투자주체 동향] 외국인투자자, 한주간 이차전지 '순매도'","15위 삼성바이오로직스 -95억원(-1만주), 16위 HD현대건설기계 -93억원(-19만주), 17위 한솔케미칼 -91억원(-5만주), 18위 한미반도체 -91억원(-15만주), 19위 LG생활건강 -89억원(-3만주), 20위 삼성중공업 -87억원(-113만주) [기관] 유가증권시장 순매수 상위종목 1위 카카오 647억원(130만주)..."
2023.11.25.,"미래에셋증권, 11월 셋째주 SKC 등 25종목 매수 추천","삼성바이오로직스(207940) 전방 산업(항체의약품) 수요 증가에 주목. 1, 2, 3 공장 완전 가동, 생산/운영 효율화, 기대 보다 빠른 4공장 Ramp-up. 5공장(15,000Lx12) 지난 4월 착공, 2025년 4월 가동 목표. 6공장 2027년까지 건설 계획 추진. 알츠하이머, 자가면역, 비만 등 신규 타겟 항체 의약품, ADC..."
2023.11.25.,[삼성그룹] 시가총액 6조380억원 감소...삼성에스디에스 5.36% 상승 '주목',87%)▲10위 삼성전자 7만1700원(-0.97%)▲11위 삼성엔지니어링 2만5750원(-1.15%)▲12위 호텔신라 6만6500원(-1.19%)▲13위 삼성카드 3만2650원(-1.21%)▲14위 삼성바이오로직스 70만9000원(-1.66%)▲15위 삼성물산 11만6100원(-1.94%)▲16위 삼성SDI 46만3000원(-2.53%)▲17위 삼성중공업 7630원(-3.3%)
2023.11.25.,인천을 품고 세계로 향하는 ‘초연결 직업교육’ [학생성공시대 여는 인천교육...,"특히 삼성바이오로직스, 엠코테크놀로지코리아, 스태츠칩팩코리아 등과의 협업이 대표적이다. 세계 최고의 기업이 지역에 있다는 이점을 활용한 반도체산업 인재양성을 위해 시와 대학, 기업과 연계해 고졸 직업 인재를 양성해 나가겠다는 방침이다. 우선 오는 2025년까지 인천정보과학고를 인천반도체고로..."
2023.11.25.,"차분한 미 증시, 4주 연속 상승..바이든 총체적 난국..비트코인 5천만원 돌파...","현대차와 기아, 삼성바이오로직스, 셀트리온, KB금융, LG전자, JYP Ent, 하이브, 에스엠 등 시총상위주 대부분이 조정을 피하지 못해 크 아쉬움을 남겼다. 다만 최근 급등세를 보이고 있는 두산로보틱스와 신규 상장된 그린리소스, 한선엔지니어링이 큰 폭의 상승을 보여 큰 관심을 끌었는데, 증시의 방향성과 종목..."
2023.11.25.,"증시 우상향 유효,반도체 등 가치주 집중..금리 하방경직 씁쓸,2차전지 주의....","현대차와 기아, 삼성바이오로직스, 셀트리온, KB금융, LG전자, JYP Ent, 하이브, LG생활건강, 에스엠 등 시총상위주 대부분이 조정을 피하지 못해 큰 아쉬움을 남겼다. 그러나 반면에 최근 속등세를 보이고 있는 두산로보틱스와 신규 상장된 그린리소스, 한선엔지니어링이 급등을 보여 큰 관심을 끌었는데, 증시의..."
2023.11.26.,"삼성바이오, ADC '약물' 제조시설 어떻게 확보할까",삼성바이오로직스가 항체약물접합체(ADC) 위탁개발생산(CDMO) 시장 진출을 위해 '페이로드(약물)'인 독성 화학물질 생산시설을 직접 준공하거나 인수 또는 생산시설을 갖춘 기업과 라이선스 계약을 맺는 3개 방안을 검토 중인 것으로 확인됐다. 항체에 붙이는 페이로드 제조 역량을 갖춰 ADC 의약품 개발부터...
2023.11.26.,[바이오 K-뉴딜 주간동향] 셀트리온제약 한주간 4.13% 껑충,"한편, 삼성바이오로직스는 -1.94%를 기록해 KRX 바이오 K-뉴딜지수 구성종목 중 가장 부진한 흐름을 나타냈다. 지난 24일 KRX 바이오 K-뉴딜지수 구성종목 주간 기준 등락률은 다음과 같다. 표기순서는 등락률 순위, 종목명, 24일 종가, 주간 기준 등락률 이다. 1위 셀트리온제약..."
2023.11.26.,[우리대학 이런학과] 11. 안동과학대학교 바이오백신제약과,"한승훈 교수 한승훈 교수는 성균관대 이학박사로 성균관대 및 Albert Einstein College of Medicine에서 박사후연구원, ㈜삼성바이오로직스에서 수석연구원으로 활동했으며, 연구 및 관심분야는 바이오의약품 원천기술개발, 골수성백혈병 관련 줄기세포 및 병기 진행 등이다."
2023.11.26.,"이번주 전망과 추천주..완만한 상승 기대돼..중동 휴전,기대 금물..반도체주 ...","현대차와 기아, 삼성바이오로직스, 셀트리온, KB금융, LG전자, JYP Ent, 하이브, LG생활건강, 에스엠 등 시총상위주 대부분이 조정을 피하지 못해 큰 아쉬움을 남겼다. 그러나 반면에 최근 속등세를 보이고 있는 두산로보틱스와 신규 상장된 그린리소스, 한선엔지니어링이 급등을 보여 큰 관심을 끌었는데, 증시의..."
2023.11.26.,[삼성그룹 주간동향] 한주간 시총 3조1900억원 감소...삼성화재 한주간 강세,17%)▲10위 삼성증권 3만8650원(-0.39%)▲11위 삼성FN리츠 5000원(-0.99%)▲12위 삼성카드 3만2650원(-1.06%)▲13위 삼성전자 7만1700원(-1.1%)▲14위 삼성물산 11만6100원(-1.53%)▲15위 삼성전기 13만7000원(-1.72%)▲16위 삼성바이오로직스 70만9000원(-1.94%)▲17위 제일기획 2만50원(-1.96%)
2023.11.26.,"직장 내 괴롭힘 피해자 10%는 극단적 선택 고민…""보호조치 마련해야""",지난 16일 삼성바이오로직스에서 근무 중 괴롭힘을 당한 것으로 알려진 20대 남성 노동자가 숨진 채 발견됐다. 지난달 4일에는 인천 연수구의 장애인활동지원기관에서 근무하던 50대 여성 노동자가 ‘직장 내 괴롭힘을 당했다’는 내용의 유서를 남기고 숨졌다. 같은 달 28일에도 사내에서 괴롭힘을 겪은...
2023.11.26.,"반도체,고배당주 중심 비중 늘릴 때..점진적 상승 유효..중동 휴전,기대 금물...","현대차와 기아, 삼성바이오로직스, 셀트리온, KB금융, LG전자, JYP Ent, 하이브, LG생활건강, 에스엠 등 시총상위주 대부분이 조정을 피하지 못해 큰 아쉬움을 남겼다. 그러나 반면에 최근 속등세를 보이고 있는 두산로보틱스와 신규 상장된 그린리소스, 한선엔지니어링이 급등을 보여 큰 관심을 끌었는데, 증시의..."
2023.11.27.,"10년만에 부활한 삼성 미래사업기획단, '제2의 반도체' 찾는다","바이오시밀러 분야는 삼성바이오로직스와 삼성바이오에피스라는 자회사 출범으로 이어졌다. 하지만 태양전지 부문은 2011년 삼성전자에서 삼성SDI로 이관됐지만 이렇다 할 성과를 내지 못하고 중단됐다. 의료기기와 LED 사업은 삼성전자 산하에 남아있지만, 반도체나 스마트폰, 가전제품만큼의 주력..."
2023.11.27.,'기후대응' 미룰 수 없다…제약바이오에 필요한 것은,"보고서에 따르면 현재 ESG 또는 지속가능성 보고서를 발간하고 있는 곳은 12곳으로 삼성바이오로직스, 셀트리온, SK바이오팜, SK바이오사이언스, 유한양행, 한미약품, 종근당, 대웅제약, HK이노엔, GC녹십자, 보령, 동아쏘시오홀딩스 등이다. 이들 기업이 가장 많이 제시하고 있는 목표는 '2050년까지 탄소중립..."
2023.11.27.,"1~3분기 제약·바이오, 매출 28조원·영업익 2조원…'부익부 빈익빈 심화'","이어 삼성바이오로직스가 지난 2022년 1~3분기 1조6000억원 규모에서 2023년 동기 2조1000억원 규모로 매출액 24.9%의 증감률을 기록했다. 더불어 8700억의 영업이익을 기록한 삼성바이오로직스는 영업이익률 부분에서도 41.2% 상승하며, 상위 20개사 중 가장 높은 수치를 기록했다. 다음으로..."
2023.11.27.,제약바이오 양극화 해소 열쇠는 '컨트롤타워 신설’,"27일 금융감독원 전자공시시스템에 따르면, 삼성바이오로직스, 유한양행 등 국내 상위 10대 제약바이오 기업은 GC녹십자를 제외하고 9개사가 모두 올해 1~3분기 누적 매출이 전년동기 대비 증가했다. 상위 20대 기업으로 확대해도 HK이노엔, 제일약품, 일동제약, 한독 정도를 제외하면 모두 1~3분기 누적 매출이..."
2023.11.27.,"[더벨][Financial Index/삼성그룹]삼성ENG 순유출 전환, 물산은 플러스로 돌아...",지난해 영업현금흐름에서 가장 높은 증가율을 기록했던 삼성바이오로직스는 올해도 두 자릿수 증가세를 이어갔다. 지난해 말 9530억원으로 전년(4546억원) 대비 109.6% 증가율을 기록했는데 올해 6월 말에는 8334억원으로 작년 동기(6439억원) 대비 29.4% 늘었다. 삼성바이오로직스가 삼성물산...
2023.11.27.,"바이오 육성은 뒷전…정부 ""추가 세액 공제, 세수 감소 부담"" [Why 바이오]",삼성바이오로직스(207940)는 2032년까지 72만ℓ 규모의 제2바이오캠퍼스를 구축한다. 총 투자 금액은 7조 5000억 원이다. 롯데바이오로직스 역시 2030년까지 36만ℓ의 위탁생산(CMO) 공장 설립에 3조 7000억 원을 투자한다. SK바이오사이언스(302440)는 2025년까지 연구·공정개발(R&PD) 센터 투자금액으로 3257억 원을...
2023.11.27.,"바이오업계, 내년 기술이전·M&A 큰장 열릴까","존림 삼성바이오로직스 사장은 ""연 30조원의 매출을 내는 회사가 되기 위해 CDMO와 바이오시밀러 사업만으로 한계가 있다""라며 ""신약 개발 사업을 위해 국내외 M&A를 검토하고 있다""라고 말했다. 백신 CDMO 경쟁력 확보에 방점을 찍었던 SK바이오사이언스는 기본적인 사세 확장 전략 중 하나로 메신저 리보핵산..."
2023.11.27.,"보스턴 클러스터 벤치마킹, 시흥·송도 바이오 클러스터 시동",우정훈 대표는 “송도는 앵커 기업으로 삼성바이오로직스와 셀트리온이 입주하여 크게 성장하였으나 현재 포화상태로 확산성에 대한 필요성이 크다”면서 “반면 시흥은 이용 가능한 부지가 많이 있으니 두 지역을 연계해 훌륭한 기획으로 R&D 매력을 극대화할 필요가 있다”고 강조했다. 최병호 대표는...
2023.11.27.,"코스피, 상승폭 키우며 2,510선 안착…삼성전자 강보합 행진","이 외 시총 상위 종목 중 삼성바이오로직스(0.99%)와 POSCO홀딩스(0.11%), 셀트리온(1.96%), 카카오(0.59%) 등은 오르고 있다. 반면 삼성전자우(0.52%)와 현대차(0.60%), LG화학(0.58%), NAVER(1.70%), 기아(0.24%), 삼성SDI(0.11%), 포스코퓨처엠(0.49%) 등은 오르막길을 걷고 있다. 같은 시각 코스닥지수는 전..."
2023.11.28.,삼성바이오로직스 7600억 추가 계약…연간 수주 첫 3조 돌파,"삼성바이오로직스가 아시아 소재 제약사와 총 5건의 7600억원 규모의 바이오의약품 위탁생산(CMO) 계약을 체결하면서 연간 누적 수주금액이 처음으로 3조원을 돌파했다. 올해 누적 수주금액이 3조 5000억원에 육박해 2011년 설립이후 역대 최고치를 기록했다. 삼성바이오로직스는 28일 1건의 신규, 4건의..."
2023.11.28.,"삼성바이오로직스, 연간 수주 첫 3조 돌파…""역대 최고""","바이오의약품 위탁개발생산(CDMO) 기업 삼성바이오로직스의 연간 누적 수주금액이 창사 이래 처음으로 3조원을 돌파했다. 삼성바이오로직스는 1건의 신규, 4건의 증액 위탁생산(CMO) 계약을 체결했다고 28일 밝혔다. 고객사(아시아 소재 고객사)의 요청에 따라 회사명과 제품명은 밝히지 않았다. 5건의..."
2023.11.28.,"삼성바이오로직스, 연간 누적 수주금액 첫 3조원 돌파","▲삼성바이오로직스 4공장 삼성바이오로직스가 1건의 신규, 4건의 증액 위탁생산(CMO) 계약을 체결했다고 28일 공시했다. 총 5건의 계약으로 수주 금액은 총 7608억원에 이른다. 다만 고객사의 요청에 따라 회사명과 제품명은 밝히지 않았다. 이로써 삼성바이오로직스는 창사 이래 처음 연간 누적 수주..."
2023.11.28.,"삼성바이오로직스, 연간 누적 수주금액 첫 3조원 돌파","삼성바이오로직스의 연간 위탁생산 수주액이 급증하며 3조 원을 넘어섰다. 삼성바이오로직스는 28일 아시아 소재 제약사와 1건의 신규, 4건의 증액 CMO(위탁생산) 계약을 했다고 밝혔다. 신규 계약과 증액 계약을 통한 수주 금액은 각각 5천888억 원, 1천719억 원이다. 늘어난 전체 수주액이 7천608억 원이다...."
2023.11.28.,"삼성바이오로직스, 연간 누적 수주금액 첫 3조원 돌파","삼성바이오로직스 4공장. 사진=프레스맨DB 삼성바이오로직스가 신규 1건과 증액 위탁생산(CMO) 4건 총 5건의 계약을 체결했다고 28일 공시했다. 이번 계약으로 늘어난 수주 금액은 7608억원으로, 창사 이래 처음 연간 누적 수주 금액이 3조원(3조4867억원)을 넘어섰다. 삼성바이오로직스의 위탁생산 계약은..."
2023.11.28.,"삼성바이오로직스, 연간 누적 수주 첫 3조 돌파...""역대 최고""","7,600억원 규모 위탁생산 계약 체결 탄탄한 신뢰 기반 고성장 지속·상향 바이오의약품 위탁개발생산(CDMO) 기업 삼성바이오로직스의 연간 누적 수주금액이 창사 이래 처음으로 3조원을 돌파했다. 삼성바이오는 28일 아시아 소재 제약사와 1건의 신규, 4건의 증액 위탁생산 계약을 했다. 고객사(아시아..."
2023.11.28.,"삼성바이오로직스, 年 누적 수주금 첫 3조원 돌파...전년比 2배↑","인천시 연수구 송도동 소재의 삼성바이오로직스 4공장 전경. [사진 삼성바이오로직스] 삼성바이오로직스의 연간 누적 수주금액이 첫 3조원을 돌파했다. 삼성바이오로직스가 1건의 신규, 4건의 증액 위탁생산(CMO) 계약을 체결했다고 28일 밝혔다. 총 5건의 계약으로 늘어난 수주 금액은 총 7608억원에..."
2023.11.28.,"삼성바이오, 연간 누적 수주금액 첫 3조원 돌파","삼성바이오로직스가 올해 3조5000억원 가까운 수주실적을 기록해 전년실적의 95%를 초과달성했다고 28일 발표했다. 삼성바이오로직스 4공장. 사진=삼성바이오로직스 삼성바이오로직스는 28일 1건의 신규, 4건의 증액 위탁생산(CMO) 계약을 체결했다고 공시했다. 이번 5건의 계약으로 늘어난 수주금액은..."
2023.11.28.,"삼성바이오로직스, 연간 누적 수주 3조원 돌파…역대 최대","삼성바이오로직스가 총 5건의 위탁생산(CMO) 계약을 체결했다고 28일 공시했다. 구체적으로는 1건의 신규, 4건의 증액 CMO 계약이다. 이번 계약으로 늘어난 삼성바이오로직스의 수주 금액은 총 7608억원에 달한다. 삼성바이오로직스는 창사 이래 처음으로 연간 누적 수주금액 3조원(3조4867억원)을..."
2023.11.29.,"삼성바이오로직스, '공급망 ESG 데이' 개최",지난 28일 인천 송도 본사에서 삼성바이오로직스가 개최한 '공급망 ESG 데이'에서 김동중 삼성바이오로직스 경영지원센터장(CFO ·부사장)이 개회사를 하고 있다. 2023.11.29 [삼성바이오로직스 제공. 재판매 및 DB 금지]
2023.11.29.,"삼성바이오로직스, '공급망 ESG 데이' 개최",삼성바이오로직스는 공급사의 ESG(환경·사회·지배구조) 경영 강화를 독려하기 위해 '공급망 ESG 데이(Supplier ESG Day)'를 개최했다고 29일 밝혔다. 올해 처음으로 열린 이 행사는 지난 28일인천 송도 국제도시 소재의 삼성바이오로직스 본사에서 진행됐다. 이번 행사에는 글로벌 공급사인 머크(Merck)...
2023.11.29.,[바이오게시판] 유한재단 북한 출생 대학생 장학금 수여 등,"▲삼성바이오로직스는 공급사의 ESG 경영 강화를 독려하기 위해 ‘공급망 ESG 데이(Supplier ESG Day)’를 전날 인천 송도 본사에서 개최했다고 29일 밝혔다. 행사에는 글로벌 공급사인 머크(Merck), 싸이티바(Cytiva), 써모 피셔(Thermo Fisher), 싸토리우스 (Satorius) 등 26개 주요 공급사 임원진과 ESG 담당자 총..."
2023.11.29.,[제약+] 삼성바이오로직스 '공급망 ESG 데이' 개최 外,"◆삼성바이오로직스 '공급망 ESG 데이' 개최 삼성바이오로직스가 공급사의 ESG 경영 강화를 독려하기 위해 '공급망 ESG 데이(Supplier ESG Day)'를 개최했다. 행사에는 글로벌 공급사인 머크(Merck), 싸이티바(Cytiva), 써모 피셔(Thermo Fisher), 싸토리우스 (Satorius) 등 26곳의 주요 공급사가 참여했으며, 각 사 임원진..."
2023.11.29.,"삼성바이오로직스, R&D 투자 가장 많이 늘렸다",삼성바이오로직스가 올 들어 10대 제약바이오기업 중 연구개발(R&D) 투자를 가장 많이 늘린 것으로 나타났다. 한미약품과 제일약품도 두 자릿 수 연구개발비 증가율을 기록했다. 29일 데이터뉴스가 금융감독원 전자공시시스템에 공시된 10개 주요 제약바이오기업의 분기보고서를 분석한 결과...
2023.11.29.,"'수주 호조' 삼성바이오로직스, '생산능력' 가치에 발목",삼성바이오로직스의 올해 총 계약규모가 3조원을 돌파했다. 하지만 주가는 지난 2021년 주당 100만원이 넘는 황제주 등극 이후 여전히 하락세에 있다. 상장 당시 '생산 능력'을 가치 기준으로 삼았던 것이 오히려 주가에 발목이 되고 있다는 얘기가 나온다. 삼성바이오로직스는 지난 28일 아시아 소재...
2023.11.29.,[바이오 K-뉴딜] 삼성바이오로직스 3.41% 올라 상승률 상위권,"이들 구성 종목 중 삼성바이오로직스는 전거래일 대비 3.41% 상승해 KRX 바이오 K-뉴딜지수 구성 종목 중 주가상승률 1위를 기록했다. 삼성바이오로직스 뒤를 이어 SK바이오사이언스, 셀트리온헬스케어 종목도 각각 1.78%, 1.68%씩 상승해 상승률 상위권에 이름을 올렸다. 한편..."
2023.11.29.,코스피 외국인 순매수도 상위 10 종목(28일)...삼성전자-삼성바이오로직스-한...,"© 연합뉴스. 28일 코스피 시장에서 외국인은 삼성전자, 삼성바이오로직스, 한미반도체를 집중 매수했다."
2023.11.29.,"인도‧중국, 바이오 CDMO 진출 러시…잠재적 경쟁자 되나?","한국바이오협회 자료를 보면 2020년 기준 전 세계에는 100개 이상의 바이오의약품 CDMO 기업이 있으며, 삼성바이오로직스를 비롯해 스위스 론자(Lonza), 중국 우시바이오로직스(Wuxi Biologics), 미국 캐털란트(catalent) 등이 상위 기업으로 꼽힌다. 국내에서도 CDMO 진출이 활발하다. 셀트리온, 롯데바이오로직스..."
