날짜,제목,내용
2024.02.27.,"삼성, R&D 분야 외국인 경력사원 대거 채용","삼성전자와 삼성디스플레이, 삼성SDI, 삼성전기, 삼성SDS, 삼성바이오로직스, 삼성바이오에피스, 삼성중공업 등이 R&D 분야 외국인 경력사원을 채용한다. 삼성엔지니어링과 삼성물산 건설부문도 기술분야 외국인 경력사원을 채용한다. 국내에서 일할 외국인 경력사원을 뽑는 것은 작년에 이어 이번이 두..."
2024.02.27.,"기관 매도, 코스피 '하락'...삼성물산 · 철강 · 해운주 '뚝'","제약바이오주 중 셀트리온(4.74%), 한미사이언스(5.52%) 등이 올랐고 삼성바이오로직스는 0.37% 하락했다. 시가총액 상위종목 중 하이브는 호실적 발표에도 올해 실적 추정치 하향 속에 7.13% 떨어졌다. 코스피 지수는 전일 대비 22.03포인트(0.83%) 하락한 2625.05를 기록했다. 개인과 외국인이 각각..."
2024.02.27.,"코스피, 기관 던져 2,640선서 안간힘…삼성전자 낙관론 고개 드나","이 외 시총 상위 종목 중 삼성바이오로직스(0.12%)와 POSCO홀딩스(0.12%), 삼성물산(1.90%), 삼성SDI(0.77%), 현대모비스(2.07%), 카카오뱅크(0.50%) 등은 내리막길이다. 반면 현대차(1.05%)와 기아(0.09%), 셀트리온(1.87%), LG화학(0.21%), NAVER(0.30%), 포스코퓨처엠(1.10%), 신한지주(2.06%) 등은 오르고 있다. 같은..."
2024.02.28.,"삼성바이오 노조, 쟁의조정신청 취하…""쟁의보다 대화 우선""",장하나 조현영 기자 = 삼성바이오로직스 상생노동조합(상생노조)이 인천지방노동위원회에 제기한 노동쟁의 조정신청을 지난 22일 취하한 것으로 28일 알려졌다. 앞서 상생노조는 사측과 임금·단체협상을 진행하던 중 임금 인상률 등 쟁점을 두고 이견을 좁히지 못하자 지난 16일 노동쟁의 조정신청서를 내고...
2024.02.28.,사외이사 연봉 가장 높은 곳은 삼성전자,"LG에너지솔루션과 삼성전기, 삼성바이오로직스, 삼성엔지니어링, 한화솔루션, 한화에어로스페이스, 대한항공, 고려아연, 포스코DX 등 13곳은 전년 대비 사외이사 1인당 평균 보수액을 줄인 것으로 파악됐다. 조사 대상 시총 100대 기업 중 사외이사 연봉이 5000만 원 미만인 곳은 코웨이(4200만 원)..."
2024.02.28.,"[데이터 뉴스룸] 제약업체 50곳 1년 새 재고자산은?…삼성바이오로직스, 재고...","◆ 재고자산 증가 금액, '삼성바이오로직스' 3600억 넘게 증가 지난 22년 3분기 대비 작년 동기간에 재고자산 금액이 가장 많이 늘어난 곳은 삼성바이오로직스인 것으로 확인됐다. 이 회사는 지난 22년 3분기 때 1조 2098억 원에서 작년 동기간에는 1조 5699억 원으로 1년 새 3600억 원 이상 재고자산이..."
2024.02.28.,"바이오특화단지 쟁탈전, 전국구 확대",시는 인천에 바이오 '빅4'(삼성바이오로직스·셀트리온·SK바이오사이언스·롯데바이오로직스) 앵커기업이 있기에 경쟁의 선두에 있다며 자신감을 보여 왔다. ▲삼성바이오로직스 3공장 전경. /사진제공=삼성바이오로직스 그러나 이번 산자부 공모에 전국 시·도 절반 정도가 공모에 뛰어들 것으로 보여...
2024.02.28.,"삼성, 주요 계열사 사외이사로 관료 출신 대거 영입","28일 재계에 따르면 삼성 계열사 중 이번 주주총회에서 관료 출신 사외 이사 선임을 추진하는 곳은 삼성전자를 비롯해 삼성바이오로직스, 삼성전기, 삼성SDS, 삼성중공업 등이다. 삼성전자는 신제윤 전 금융위원장을 사외이사 후보로 정했다. 신 전 위원장은 2005년 한미 자유무역협정(FTA) 당시 한국 측 대표로..."
2024.02.28.,"코스피, 외인과 기관 매수에 상승 마감...기아, 현대차 상승 VS LG에너지솔루...","시가총액 상위 10개 종목의 희비는 엇갈렸다. 기아(4.53%), 현대차(3.98%), SK하이닉스(2.73%), POSCO홀딩스(2.46%), NAVER(2%), 삼성전자(0.41%)는 상승 마감했다. 이에 반해 LG에너지솔루션(-0.74%), 삼성바이오로직스(-0.74%), 셀트리온(-0.05%)은 하락 마감했다. 삼성전자우는 보합 마감했다."
2024.02.28.,"[위클리오늘] 주력사업 전망 엇갈려…바이오·반도체 좋고, 철강·조선은",▲삼성바이오로직스 제4공장(사진=삼성전자 제공) 국내 기업들이 바라보는 주력사업의 미래전망이 기업 규모와 업종별로 엇갈리는 것으로 나타났다. 28일 대한상공회의소가 국내 기업 451개사를 대상으로 실시한 '우리 기업의 미래 신사업 현황과 대책 조사' 결과 기업의 61.9%가 ''현재 주력사업의...
2024.02.28.,"전국 시·도, 13조 바이오특화단지 총력전","특히 송도에는 삼성바이오로직스 셀트리온 등 100여 개 글로벌 기업과 연구소 등이 들어서 있다. 강원도는 지난 20년간 바이오산업을 집중 육성했고, 관련 기업이 80여 곳에 이른다. 특히 국내 유일 항체연구소인 스크립스코리아항체연구원, 홍천 국가항체클러스터, 춘천 강소 연구개발 특구 등 바이오산업 기반을..."
2024.02.28.,"저커버그發 AI동맹 기대감에 SK 4.3%, 삼성물산 5.6%↑","배당락일을 맞은 현대차는 3.98% 상승했고, 기아는 4.53% 올랐다. 외국인 매수세가 유입된 삼성물산은 5.63% 상승 마감했다. 반면 LG에너지솔루션(-0.74%), 삼성바이오로직스(-0.74%), LG화학(-0.32%), 카카오(-2.11%) 등은 내렸다. 코스닥지수는 전 거래일보다 9.64포인트(1.13%) 오른 863.39로 장을 마쳤다."
2024.02.28.,국내 제약·바이오 수출 확대 전망…앞에서 끌고 뒤에서 밀고,"같은 날 안덕근 산업통상자원부 장관은 존림 삼성바이오로직스 대표 등이 참석한 '민관합동 수출확대 대책 회의'에서 역대 최대 규모로 수출기업을 지원하며 범정부 협업으로 속도를 내겠다고 말했다. 그는 ""고금리에 어려움을 겪는 수출 중소·중견기업에 대한 유동성 지원을 확대할 것이다""고 약속했다. 이어..."
2024.02.29.,"삼성바이오, 서울대와 손 잡고 바이오 인재 육성 나선다",바이오의약품 CDMO(위탁개발생산) 기업 삼성바이오로직스와 바이오의약품 개발 기업 삼성바이오에피스가 바이오 인재 육성에 나선다. 삼성바이오로직스와 삼성바이오에피스는 서울대학교와 바이오 R&D 분야 인재 양성을 위한 업무협약(MOU)을 체결했다고 29일 밝혔다. 이번 협약을 통해 양사는 서울대 생명과학부...
2024.02.29.,노조는 12% 올려달라는데 사측은 3%…삼성바이오로직스 파업하나,"삼성바이오로직스 노사간의 갈등이 심화되면서 파업 가능성이 부각되고 있다. 29일 제약·바이오 업계에 따르면 삼성바이오로직스 상생노동조합은 이날 인천지방노동위원회에 노동쟁의 조정신청서를 다시 제출했다. 지노위는 노동쟁의 조정 신청을 받으면 사용자 위원과 근로자 위원, 공익위원으로 구성된..."
2024.02.29.,"삼성바이오, 서울대와 바이오 인력 양성 협력","삼성바이오로직스와 삼성바이오에피스가 29일 서울대학교와 바이오 R＆D(연구·개발) 분야 인재 양성을 위한 업무 협약(MOU)을 체결했다. 삼성바이오 측은 서울대 생명과학부 산하에 '바이오 인력 양성 트랙'을 신설했으며, 생명과학부 4학년 재학생 중 우수 장학생을 선발해 바이오 R＆D 분야 석사 인력을 양성할..."
2024.02.29.,"[특징주] 삼성바이오로직스, 3%대↓…6거래일 연속 하락세",삼성바이오로직스가 급락했다. 29일 한국거래소에 따르면 삼성바이오로직스는 이날 오전 10시 42분 기준 전일 대비 2만6000원(3.25%) 하락한 77만5000원에 거래되고 있다. 삼성바이오로직스는 지난 22일부터 6거래일 연속 약세를 보이고 있다. 삼성바이오로직스의 약세는 연기금을 비롯한...
2024.02.29.,"삼성바이오로직스, 글로벌 매출 성장세 지속…전년 대비 유럽 32%·미주 14%↑","삼성바이오로직스의 2023년 지역별 누적 매출은 유럽, 미주, 기타, 한국 순으로 높은 것으로 나타났다.약업닷컴(약업신문)이 삼성바이오로직스의 2023년 4분기 및 누적(12개월) 보고서(연결기준)를 분석한 결과, 삼성바이오로직스 2023년 총 매출은 3조6946억원으로 집계됐다. 이는 전년 대비..."
2024.02.29.,"1위 삼성바이오로직스 주가·2위 신풍제약 주가·3위 셀트리온제약 주가, 2월...",삼성바이오로직스 주가는 2024년 2월 4주차 공개된 랭키파이의 테마별 주식 제약업체 부문 트렌드지수 분석 결과 1위에 올랐다. 랭키파이 테마별 주식 제약업체 부문 트렌드 지수는 2월 3주차 키워드 검색량과 구글트렌드 점수를 지수화한 분석 결과이다. 1위 삼성바이오로직스 주가는 트렌드지수...
2024.02.29.,지난해 삼성바이오로직스 사외이사 평균 보수 8900만원…유한양행은 8400만원,지난해 국내 바이오기업 매출 1위 회사인 삼성바이오로직스는 사외이사 보수를 2021년과 비슷한 수준으로 유지했다. 제약기업 매출 1위 회사인 유한양행은 사외이사 보수를 늘렸다. 29일 기업데이터연구소 CEO스코어(대표 김경준)가 2023년 말 기준 시가총액 100대 기업 중 지난 27일 오후 5시까지...
2024.02.29.,"삼성물산 소액주주 손배소 4년만 시작…""이재용 항소심도 봐야""","서울중앙지법 민사합의30부(정찬우 부장판사)는 29일 A씨 등 삼성물산 소액주주 32명이 삼성물산과 삼성바이오로직스, 이 회장 등을 상대로 낸 손해배상 청구소송의 1차 변론기일을 열었다. 민변 공익변론센터와 참여연대 경제금융센터가 2020년 2월 17일 오후 서울 서초구 서울중앙지방법원 정문 앞에서..."
2024.02.29.,"코스피, 기관 매도에 하락 마감...기아, 현대차 상승 VS 셀트리온, 삼성바이오...","시가총액 상위 10개 종목의 희비는 엇갈렸다. 기아(5.78%), 삼성전자우(3.58%), 현대차(1.01%), 삼성전자(0.27%), LG에너지솔루션(0.25%)은 상승 마감했다. 이에 반해 셀트리온(-5.42%), 삼성바이오로직스(-3.37%), LG화학(-2.48%), POSCO홀딩스(-1.37%), SK하이닉스(-1.14%)는 하락 마감했다."
2024.02.29.,"코스피, 기관 매물에 2,640대로 밀려…외국인 기아·삼성전자·에코프로머티 ...","또한 외국인 순매도 상위 종목은 네이버(1,423억원), 셀트리온(694억원), LG화학(419억원), 카카오(362억원), 삼성생명(228억원), 이수스페셜티케미컬(168억원), 호텔신라(161억원), 한미반도체(157억원), 삼성바이오로직스(154억원), 삼성엔지니어링(132억원), 알테오젠(132억원), 포스코홀딩스..."
2024.03.01.,"삼성바이오-서울대 ""바이오 인재 공동육성""",삼성바이오로직스·삼성바이오에피스가 서울대학교와 바이오 인재 공동육성에 나선다. 삼성바이오로직스와 삼성바이오에피스가 서울대학교와 바이오 R&D분야 인재 양성을 위한 업무협약(MOU)을 체결했다고 1일 밝혔다. 이번 협약을 통해 양 사는 서울대 생명과학부 산하에 '바이오 인력 양성 트랙'을 신설해 우수...
2024.03.01.,"파업 전야…삼성바이오로직스 노조, 지방노동위에 조정 재신청",지난해 영업이익 1조 달성 불구…임금인상률 12% 대 3% 격차 커 지난해 영업이익 1조원을 달성한 삼성바이오로직스가 임금 인상률 등 쟁점을 놓고 노사갈등이 심화되고 있다. 1일 제약·바이오 업계에 따르면 삼성바이오로직스 상생노동조합은 지난 2월29일 인천지방노동위원회에 노동쟁의 조정신청서를 다시...
2024.03.01.,"삼성의 차세대 신약 파트너 인투셀, IPO 청신호","앞서 삼성바이오에피스, 삼성바이오로직스(207940)와 삼성물산이 함께 조성한 삼성 라이프 사이언스 펀드는 인투셀에 대한 지분 투자도 검토한 것으로 알려졌다. 그동안 바이오 시밀러 중심으로 연구개발을 추진해온 삼성바이오에피스가 인투셀과 이 같은 계약을 체결하면서 삼성이 본격적으로 신약 개발에..."
2024.03.01.,"[제약·바이오 주간동향] FDA, 메디톡스 보툴리눔 톡신 허가 거절 外","삼성바이오로직스, 서울대와 바이오 R&D 인재 육성 삼성바이오로직스와 삼성바이오에피스가 서울대학교와 바이오 R&D 분야 인재 양성을 위한 업무협약을 체결했다고 29일 밝혔다. 이번 협약을 통해 서울대 생명과학부 산하에 ‘바이오 인력 양성 트랙’을 신설해 우수 인력을 선제적으로 양성하고..."
2024.03.01.,"식품家 오너 3세, 미래 먹거리 발굴 주력…핵심은 바이오","지난달 7일 삼성바이오로직스와 ADC 개발을 위한 업무협약을 체결하기도 했다. 오리온그룹은 지난 2020년부터 암 진단 키트, 결핵백신 등 관련 기업들과 협력 관계를 맺었다. 이번 레고켐을 인수하면 자회사 오리온바이오로직스 이후 새 기술력을 확보하게 된다. 담서원 오리온그룹 경영지원팀 상무는 현재 그룹..."
2024.03.01.,"'신약 기대감' 바이오주로 다시 몰리는 투심, 성장주 선순환 선봉 서나",대장주인 삼성바이오로직스의 주가흐름이 1월 이후 주춤한 가운데 코스닥 바이오주 중심으로 차별적인 상승세가 나타나고 있다. 2월 한 달 동안 코스닥 주요 바이오종목으로 구성된 코스닥150헬스케어 지수는 16.6% 상승했다. 미국 기준금리 조기인하 기대가 꺾이고 지난해 4분기 실적시즌이 막을 내리는 등...
2024.03.01.,[바이오 TOP 10] HLB 5.43% 올라 업종 내 상승률 상위권,1위 HLB 8만1500원(5.43%)▲2위 SK바이오팜 9만6900원(2.98%)▲3위 한미약품 33만4000원(-1.47%)▲4위 SK바이오사이언스 6만1400원(-1.6%)▲5위 유한양행 6만7400원(-1.89%)▲6위 케어젠 2만3250원(-2.52%)▲7위 한미사이언스 4만1200원(-3.17%)▲8위 삼성바이오로직스 77만4000원(-3.37%)▲9위...
2024.03.01.,"‘나한테 엉덩이 좀 맞자’…여성 언론노동자 4명 중 1명, 직장 내 괴롭힘·성...","“너흰 X대가리”···삼성바이오로직스, 괴롭힘·성희롱 만연했다 최근 20대 직원이 직장 내 괴롭힘으로 목숨을 끊었다는 의혹이 제기된 삼성바이오로직스에서 실제로 괴롭힘과 성희롱이 만연했던 것으로 드러났다. 연장근로 한도 초과·임금체불 등 ... https://www.khan.co.kr/national/labor/article/202401231703001"
2024.03.01.,[삼성그룹] 상승률 상위종목은?...삼성카드 3.02% 상승 '주목',4%)▲10위 제일기획 1만8500원(-0.59%)▲11위 삼성SDI 37만7000원(-1.18%)▲12위 삼성중공업 7900원(-1.5%)▲13위 에스원 5만8100원(-1.53%)▲14위 호텔신라 6만100원(-2.59%)▲15위 삼성바이오로직스 77만4000원(-3.37%)▲16위 삼성엔지니어링 2만4600원(-5.38%)▲17위 삼성생명 9만6900원(-5.83%)
2024.03.02.,"삼성바이오, 서울대와 바이오 인재 육성 위해 '맞손'",삼성바이오로직스와 삼성바이오에피스가 서울대학교와 바이오 연구·개발(R&D) 인재 양성을 위한 업무협약(MOU)을 체결했다고 29일 밝혔다. 이번 협약을 통해 양 사는 서울대 생명과학부 산하에 '바이오 인력 양성 트랙'을 신설해 우수 인력을 선제적으로 양성하고 확보해 나갈 계획이다. 협약식은 서울특별시...
2024.03.02.,"삼성바이오, 서울대와 바이오 R&D 분야 인재 양성 위해 MOU 체결",삼성바이오로직스와 삼성바이오에피스가 서울대학교와 바이오 R&D 분야 인재 양성을 위한 업무협약(MOU)을 체결했다고 29일 밝혔다. 이번 협약을 통해 양 사는 서울대 생명과학부 산하에 '바이오 인력 양성 트랙'을 신설해 우수 인력을 선제적으로 양성하고 확보해 나갈 계획이다. 협약식은 서울특별시 관악구에...
2024.03.02.,"삼성바이오, 서울대와 손잡고 바이오 인재 육성 나서","삼성바이오로직스와 삼성바이오에피스가 서울대학교와 바이오 연구개발(R&D) 분야 인재 양성을 위한 업무협약(MOU)을 체결했다. 왼쪽부터 이규호 삼성바이오로직스 인사센터장, 허원기 서울대학교 학부장, 노성원 삼성바이오에피스 인사팀장이 바이오 우수 인재 양성을 위한 산학협력 협정식에서 기념 촬영을..."
2024.03.02.,[바이오 TOP 10 주간동향] 셀트리온제약 한주간 5.72% 올라 상승률 상위권,1위 셀트리온제약 11만900원(5.72%)▲2위 SK바이오팜 9만6900원(4.64%)▲3위 HLB 8만1500원(3.56%)▲4위 한미약품 33만4000원(0.6%)▲5위 유한양행 6만7400원(0.6%)▲6위 셀트리온 17만9700원(-0.17%)▲7위 한미사이언스 4만1200원(-1.44%)▲8위 SK바이오사이언스 6만1400원(-3.91%)▲9위 삼성바이오로직스...
2024.03.02.,"국힘 청주흥덕 김동원 예비후보, 김학도 공동선대위원장 추대","1호 공약인 '삼성 바이오로직스 유치'는 김학도 전 후보의 공약인 '경제엔진 교제'와도 맥락이 같아 김동원 예비후보의 공약이 체계적으로 가시화될 것으로 보인다. 청주 흥덕 결선투표는 오는 3일까지 당원 20%, 일반 국민 80% 여론조사 방식으로 진행된다. 최종결과는 4일 발표될 예정이다."
2024.03.02.,[기자의 눈] 의기투합 협약식에서 웬 '밥그릇 싸움'?,"셀트리온과 삼성바이오로직스 등이 소재한 인천, 식약처와 질병청이 들어선 충북 등 이미 기반을 갖춘 강력한 후보들이 뛰어든 것이 사실입니다. 반면, 전북은 정읍과 익산에 연구기반은 있지만, 바이오 기업 유치가 아직은 많지 않아 어려운 싸움이 될 수도 있습니다. 하지만 전북은 지난해 이차전지 특화단지..."
2024.03.02.,"인천경제청, 인천스타트업파크 'TRY OUT' 참여 스타트업 모집",민간 실증 프로그램은 △GS칼텍스 △포스코인터내셔널 △한림제약 △셀트리온 △삼성바이오로직스 △태전그룹 △LG사이언스파크 △SSG 랜더스 등 8개 민간 중견·대기업의 수요 기술과 스타트업의 혁신 기술을 연계해 실증을 지원한다. 참여 대상은 공고일 기준 7년 이내의 스타트업 가운데 4차 산업혁명...
2024.03.02.,"김학도 前예비후보, 공동선대위원장으로 추대 ""김동원 후보 지지선언""",김동원 후보의 1호 공약인‘삼성 바이오로직스 유치’는 지역 경제를 활성화 할 수 있는 청주시민들의 염원을 담았다. 또 40% 지역 인재를 채용한다는 조건을 걸어 지역 인재 외부 유출도 막을 수 있다. 이는 김학도 前후보의 공약 ‘경제엔진 교체’와도 맥을 같이하고 중소벤처기업을 잘 아는 전문가인 김...
2024.03.03.,"삼성바이오, 서울대와 손잡고 바이오 인재 육성 나선다","서울대학교에서 열린 삼성바이오-서울대학교, 바이오 우수 인재 양성을 위한 산학협력 협정식에 참석한 (왼쪽부터) 이규호 삼성바이오로직스 인사센터장, 허원기 서울대학교 학부장, 노성원 삼성바이오에피스 인사팀장 등이 협약식을 마친 뒤 기념촬영하고 있다. 사진=삼성바이오로직스 삼성바이오로직스는..."
2024.03.03.,"[사설] 인천, 바이오 클러스터에 사활 걸어야","인천시는 삼성바이오로직스, 셀트리온, SK바이오사이언스, 롯데바이오로직스 등 바이오산업의 빅4를 포함한 앵커기업들을 기반으로 경쟁의 유리한 위치에 서 있다고 평가받고 있다. 송도국제도시, 남동국가산업단지, 영종국제도시 제3유보지를 아우르는 '바이오 트라이앵글' 구상을 통해 이를 더욱 공고히 할..."
2024.03.03.,[삼성그룹 주간동향] 시가총액 1조5008억원 감소...삼성중공업 6.33% 상승 '주...,8%)▲10위 호텔신라 6만100원(-0.99%)▲11위 삼성카드 3만7550원(-1.18%)▲12위 삼성물산 15만6700원(-2.06%)▲13위 삼성SDI 37만7000원(-2.96%)▲14위 삼성화재 29만8000원(-3.4%)▲15위 에스원 5만8100원(-3.81%)▲16위 삼성바이오로직스 77만4000원(-4.91%)▲17위 삼성에스디에스 16만원(-5.27%)
2024.03.03.,"1위 삼성전자·2위 삼성카드·3위 삼성물산, 2월 4주차 그룹사 주식 삼성 부문...","4위 삼성중공업은 15,550포인트, 5위 삼성SDI는 15,026포인트, 6위 삼성증권은 7,487포인트, 7위 삼성전기는 7,375포인트, 8위 삼성바이오로직스는 6,527포인트, 9위 삼성엔지니어링은 5,062포인트, 10위 호텔신라는 4,177포인트이다. 11위는 삼성에스디에스, 12위 에스원, 13위 제일기획, 14위 멀티캠퍼스, 15위..."
2024.03.03.,사라진 황제들…“실적없는 액면분할 등은 모래성”,"3년여 전만 해도 LG생활건강, 엔씨소프트, 삼성바이오로직스, LG화학, 태광산업 등이 황제주 자리를 유지하면서 ‘품절주’ 대접을 받았다. 하지만 최근 몇 년 동안 이어온 고금리·고물가의 여파와 업황 부진 등이 겹치면서 과거 주가의 고점을 회복할 만한 실적 성장도 이뤄내지 못하면서 국내 증시의..."
2024.03.03.,"""송도에서 아파트 나온 게 20년이 넘었다고?""","무엇보다 삼성바이오로직스 제2캠퍼스를 비롯해 롯데바이오로직스, 연세대 국제캠퍼스 2단계, 인하대 오픈이모베이션 캠퍼스 등이 조성될 예정이다. 학업시설과 일자리가 동시에 조성돼 자족기능을 갖추게 될 전망이다. 이러한 분위기다 보니 최근 모델하우스를 개관한 ‘송도자이풍경채그라노블’에..."
2024.03.03.,3월 주총 쏠림현상 여전…28일 하루만 315개사 열려,"유가증권시장과 코스닥시장 상장사 총 2542곳 중 지난해 전자투표제도를 활용한 기업은 804곳(33%)이었다.한편 삼성바이오로직스(15일), 삼성전자(20일), 현대차(21일), LG에너지솔루션(25일)등 시총 상위 주요 기업들이 이달에 주총을 갖는다. 노재영 수습기자 noh@viva100.com3월 정기주주총회 개최 기업 수. (표..."
2024.03.03.,"국힘 청주흥덕 김동원 예비후보, 김학도 공동선대위원장 추대","1호 공약인 '삼성 바이오로직스 유치'는 김학도 전 후보의 공약인 '경제엔진 교제'와도 맥락이 같아 김동원 예비후보의 공약이 체계적으로 가시화될 것으로 보인다. 청주 흥덕 결선투표는 오는 3일까지 당원 20%, 일반 국민 80% 여론조사 방식으로 진행된다. 최종결과는 4일 발표될 예정이다."
2024.03.03.,[포토] 삼바-삼바에피스 인재양성 업무협약,▲ 삼성바이오로직스와 삼성바이오에피스가 서울대학교와 바이오 R&D 분야 인재 양성을 위한 업무협약을 지난달 29일 체결했다. 이번 협약을 통해 두 기업은 서울대 생명과학부 산하 '바이오 인력 양성 트랙'을 신설한다. 이에따라 생명과학부 4학년 재학생 중 우수 장학생을 선발하여 바이오 R&D 분야...
2024.03.04.,삼성바이오로직스 이번엔 노사 간 불화?···임금 협상안 마찰로 노조 파업 ...,삼성바이오로직스가 노사 간 임금 인상률을 마찰을 빗고 있다. 노조 측은 사측이 제시한 협상안에 대해 무게를 두지 않고 전면 파업을 준비한다는 입장이다. 최근 제약·바이오 업계에 따르면 삼성바이오로직스 상생노동조합은 지난달 29일 인천지방노동위원회(지노위)에 노동쟁의 조정신청서를 다시...
2024.03.04.,"롯데바이오로직스, 올해 세자릿수 채용…""전직원 스톡옵션 제도 적용""",롯데바이오로직스가 대규모 채용을 예고한 만큼 삼성바이오로직스와의 ‘인력 쟁탈전’이 가열될 수 있다는 분석도 나온다. 삼성바이오로직스는 롯데바이오로직스가 설립된 2022년부터 롯데로 이직한 직원을 상대로 영업비밀 침해 금지 가처분 신청을 내는 등 견제구를 던져왔다. 롯데바이오로직스로...
2024.03.04.,"[포토]삼성바이오로직스, 납세자의날 '고액납세의 탑' 수상",ⓒ삼성바이오로직스 삼성바이오로직스는 4일 서울 동대문 DDP에서 기획재정부 주최로 열린 '제58회 납세자의 날' 행사에서 '고액납세의 탑(국세 이천억원 탑)'을 수상했다. 이 상은 국가재정에 기여한 모범 납세자에게 대통령 명의로 수여된다. 최상목 부총리 겸 기획재정부 장관과 김동중 삼성바이오로직스...
