날짜,제목,내용
2024.02.13.,"인천 연수구, 1인가구 전력·통신 빅데이터 활용 돌봄서비스","인천시 연수구는 한국전력공사와 함께 홀몸노인과 은둔 청년 등 고위험군 1인 가구 100명을 대상으로 빅데이터 활용 돌봄서비스를 운영한다고 13일 밝혔다. 1인 가구의 전력 사용량, 통화·문자 발신량, 모바일데이터 통신량 등을 분석해 이상 패턴을 감지하고 인공지능(AI) 안부 전화로 대상자 상태를 확인하는..."
2024.02.13.,"‘경질’로 뜻 모은 임원회의 “전력강화위원장은 정해성, 감독은 한국인 선임...","이런 가운데, 이석재 대한축구협회 수석부회장은 ""한국인 감독과 한국인 전력 강화 위원장을 선임하자""라고 깜짝 의견을 밝히기도 했습니다. 이석재 부회장은 뮐러 위원장이 바로 옆에서 지켜보는 가운데 ""이제는 정해성 대회 위원장 같은 국내 분들이 전력 강화 위원장으로 가고 새로운 감독을 한국 사람으로..."
2024.02.13.,"""솔직히 난 사퇴 여론 모르겠다"" 클린스만 감독 '비대면' 화상 회의 참석…15...","아시안컵에 출항한 한국 대표팀 전력은 역대급이었다. 프리미어리그에서 8시즌 연속 두 자릿수 골을 기록했던 '캡틴' 손흥민, 올시즌 부상없이 커리어 하이를 달리는 황희찬, 유럽축구연맹(UEFA) 챔피언스리그 우승 경쟁 팀 바이에른 뮌헨과 파리 생제르맹에서 뛰고 있는 김민재, 이강인 등이 대표팀 주전급..."
2024.02.13.,후쿠시마 핵발전소 폭발은 그들의 책임이었다 _ 도쿄전력,우리나라의 경우 전력사업을 한국전력공사(한전)라는 공기업이 맡는다. 그리고 국가나 지방자치단체가 소유하고 운영하는 공기업의 가장 중요한 목적은 이윤이 아니라 공공의 이익이다. 따라서 한전은 돈을 버는 것에 최우선 가치를 두지 않는다. 반면 민영기업의 가장 중요한 목적은 돈을 버는 것이다. 따라서...
2024.02.13.,"한국전력공사 밀양지사, 밀양시장애인복지관에 후원품","한국전력공사 밀양지사가 설을 맞이해 밀양시장애인복지관에 후원 물품을 전달했다고 12일 밝혔다. 황신규 지사장은 ""온기 가득한 설 명절을 보낼 수 있도록 정성을 담아 준비했다""며 ""지속적인 사회공헌 활동을 통해 나눔 문화 확산에 기여하겠다""고 전했다."
2024.02.13.,"1위 한국전력 주가, 2위 디티앤씨 주가, 3위 태웅 주가… 2월 13일 테마별 주...","테마별 주식 원자력발전 현재 상승률 기준 1위는 한국전력 주가이다. 전일 20,400원 대비 600원 상승해 21,000원이다. 전일대비 등락률은 2.94%이며 거래량은 1,120,702으로 나타났다. 테마별 주식 원자력발전 현재상승률 순위는 2월 13일 11시 11분기준으로 랭키파이 데이터 분석을 통해 집계한..."
2024.02.13.,"한전-고용부, 중대재해법 대비 전력산업계 안전 강화 나서","한국전력(대표이사 사장 김동철)이 고용노동부(고용노동부장관 이정식)와 중대재해처벌법 확대에 따라 안전한 현장 조성을 통한 전력산업 안전문화 확산에 적극 나서고 있다. 한전과 고용부는 최근 15개 전력그룹사 및 전기공사협회, 안전기술원, 전기기술인협회 안전보건관계자 등 30여명이 참여한 가운데..."
2024.02.13.,"한국전력공사 예천지사, 취약계층 아동에 생필품 전달",김학동 예천군수와 오기중 한국전력공사 예천지사장.(자료=예천군) 예천군은 한국전력공사 예천지사 사회봉사단이 지난 7일 예천군청 드림스타트팀을 방문해 관내 취약계층 아동들에게 전달해 달라며 110만 원 상당의 생필품을 전달했다고 밝혔다. 이번 기부는 한국전력공사 예천지사 직원들은 취약계층...
2024.02.14.,"백남길 전기공사공제조합 이사장, 김동철 한국전력 사장 예방","전기공사공제조합은 백남길 이사장이 지난 8일 김동철 한국전력 사장을 예방하고, 중대재해처벌법 확대 시행에 따른 전기공사업계의 우려를 전달했다고 14일 밝혔다. 백 이사장은 한전이 중대재해배상책임공제에 가입한 전기공사 시공업체를 대상으로 인센티브를 부여하는 등 유인책을 마련해줄 것을..."
2024.02.14.,"더 성장할 수 있는, 더 성장해야 할 한국전력 임성진","V리그 남자부를 대표하는 영건은 단연 한국전력 임성진(25)이다. 헌칠한 외모에 매 시즌 성장을 거듭하며 팬들의 사랑을 받고 있다. 서재덕, 신영석 등 베테랑들이 즐비한 한국전력에서 한 자리를 꿰차고 있는 것만으로도 그의 존재감을 짐작할 수 있다. 임성진은 13일까지 ‘도드람 2023~2024 V리그’ 남자부..."
2024.02.14.,"""부산 전력반도체 산업 생태계 조성""… 전문가 한 자리에","주제 발표에서는 방욱 한국전기연구원 반도체연구단장이 'SiC기반 전력반도체 기술 검토 사항'을, 민경진 명지대 반도체공학과 산학협력교수가 '한국 전력반도체의 현황 및 전망'을 소개하고, 김용진 SK하이닉스대학 교수가 '전력반도체 중소업체의 니즈와 제안'에 대한 내용으로 발제했다. 패널 토론에는..."
2024.02.14.,"한국전력공사 밀양지사, 장애인복지관에 후원금",한국전력공사 밀양지사(지사장 황신규)는 밀양시 장애인들을 위해 밀양시장애인복지관(관장 추정숙)에 후원금을 전달했다고 13일 밝혔다. 한전 밀양지사는 지난 2019년도부터 지역 장애인을 위한 사회공헌활동을 펼치고 있다. 황신규 지사장은 “지역주민들이 온기 가득한 하루하루를 보낼 수 있도록 정성을...
2024.02.14.,"한국전력공사 당진지사, 이웃사랑 식품키트 전달","당진신문 | 한국전력공사 당진지사(지사장 노인택)가 지난 6일 당진시복지재단(이사장 왕기림)을 통해 250만원 상당의 이웃사랑 식품키트를 당진 2동(채운동) 소재 경로당 3곳에 전달했다. 이웃사랑 식품키트는 국거리용 소고기, 떡국, 쌀, 과일, 음료 등 총 21품목으로 구성되었으며 한국전력공사 당진지사..."
2024.02.14.,소상공인 전기요금 지원신청 21일 온라인서 시작…최대 20만원,한국전력과 직접 전기사용 계약을 체결한 직접 계약자와 계약을 체결하지 않고 전기를 사용한 뒤 그에 대한 대가를 부담하는 비계약 사용자에 대한 지원 방식은 이원화했다. 직접 계약자는 오는 21일부터 4월 20일까지 두 달간 신청이 가능하다. 한국전력이 직접 계약자의 고지서상 전기요금을 차감하는...
2024.02.14.,"[문답]""월 전기요금 20만원 안 넘는데…이월도 되나요?""","-한국전력과 직접계약을 맺은 1차 사업 지원대상의 경우 고지서상 전기요금을 차감하는 식으로 지원을 받는다. 당월 전기요금이 20만원이 안 되는 경우에는 어떡하냐. ▶대상으로 통보된 후 최초로 발행되는 고지서부터 차감 혜택이 자동으로 적용되는 방식이며, 요금 차감은 20만원 한도 내에서 진행한다...."
2024.02.14.,성범죄 저질러도 '직무 지장 없으면' 복직?...구멍 뚫린 공공기관 징계 규정,"한국전력공사의 계열사인 한전KPS도 2021년 불법촬영 혐의가 인정돼 법원에서 벌금 1000만원을 선고받은 직원에게 정직 3개월의 징계 처분만 내린 사례가 드러났습니다. 감사원이 임직원 100명 이상인 279개 공공기관을 점검한 결과, 절반 정도인 141개 기관이 이런 식으로 당연 퇴직 규정을 느슨하게 운영하고..."
2024.02.14.,"후인정 KB손해보험 감독, 최하위 성적부진 책임지고 사퇴","2016년 은퇴 후 한국전력 코치, 경기대 배구부 코치, 감독을 거쳐 2021년 4월 KB배구단 사령탑에 오른 후인정 감독은 부임 첫 해인 2021~22시즌 정규시즌 2위에 이어 챔피언결정전 진출을 이끌었다. 하지만 2022~23시즌 정규리그 6위로 포스트시즌 진출에 실패한데 이어 올 시즌 4승 23패 승점 18로 최하위에 계속..."
2024.02.15.,전력케이블 화재로 인천 영흥도 정전…19시간 만에 복구(종합),"15일 인천소방본부와 한국전력에 따르면 이날 오전 2시 17분께 인천시 옹진군 영흥면 선재대교 아래에 있는 창고에서 불이 나 1시간 56분 만에 진화됐다. 이 불로 인명 피해는 없었지만, 창고와 선재대교 하부 사이에 설치된 2만2천900볼트(V)짜리 한전 전력케이블이 타 영흥도와 선재도 일대 3천798가구가 모두..."
2024.02.15.,인천 ‘선재대교 하부 화재’ 전력케이블 손상...영흥면 3798가구 정전,인천 옹진군 영흥면 선재대교 하부에 있는 창고에서 발생한 화재로 한국전력 전력케이블이 손상돼 영흥면 3798가구에 정전이 발생했다. 15일 인천소방본부에 따르면 이날 오전 2시 17분쯤 인천시 옹진군 영흥면 어촌체험마을 체험도구 보관창고에서 화재가 발생했다. “선재대교 아래에서 불이 났다”는...
2024.02.15.,한국전력 인재개발원 부지 '매각협상위원회' 제안,"서울 노원갑 예비후보로 활동하고 있는 우원식 국회의원(더불어민주당, 노원을)은 15일 국회 의원회관에서 같은 노원구를 지역구로 둔 김성환 국회의원(더불어민주당, 노원병)과 함께 한국전력 김동철 사장을 면담하고, '한국전력 인재개발원부지 매각협상위원회'를 제안했다. 우 의원이 이날 김동철 사장에게..."
2024.02.15.,"부산대, 전력반도체 산업생태계 조성 워크숍","이어진 주제발표 시간에는 방욱 한국전기연구원 반도체연구단장의 'SIC기반 전력반도체 기술기반'을 시작으로 민경진 명지대 교수가 '한국 전력반도체의 현황 및 전망', 김용진 SK하이닉스 대학교수가 '전력반도체 중소업체의 니즈와 제안' 등을 주제로 깊이 있는 발표가 이어졌다. 방욱 단장은 ""전력반도체는..."
2024.02.15.,[2월 15일 워크넷 채용정보] 주택관리공단·국립암센터·정보통신정책연구원·...,"회사내규 ■ 한국전력공사, 기간제 근로자(대체인력) 모집 재공고 ▷지원자격: 신입 ▷채용기간: 2월 29일까지 ▷전형방법: 서류, 면접 ▷근무지역: 경상북도 ▷근무시간: 오전 8시 30분~오후 5시 30분 ▷임금: 10만원/일 ▷고용형태: 기간제 ▷근무형태: 주 5일 근무 ▷복리후생: 회사내규 ■ (재)..."
2024.02.15.,옹진군 선재대교 화재 영흥면 일대 전력 '셧다운' 살림 마비,"선재대교 화재로 인한 정전으로 영흥도 식당이 운영을 중단한 모습.(사진 독자제공) 당초 한국전력 측은 이날 오후 4시께 전력망을 복구할 것으로 예측했으나 복구는 길어지고 있다. 한편, 비상상황이 길어지자 한국남동발전 영흥본부는 난방과 조리에 어려움을 겪는 주민들을 위해 다목적시설 에너지파크를..."
2024.02.15.,[Q&A]옆 가게랑 나눠 내는데…'전기요금 특별지원' 받을 수 있나요?,한국전력(한전)에서 전기료 고지서를 받아 직접 요금을 내는 '직접 계약' 사업자라면 별도로 서류를 내지 않아도 '특별지원' 신청만 하면 정부에서 선별해 환급금을 지급한답니다. 직접계약 사업자는 오는 21일부터 4월20일까지 신청하면 됩니다. 만약 아파트 상가나 오피스텔 등 공동전기사용 계약을 통해...
2024.02.15.,용인 수지 상현초 삼거리 700m 전신주 지중화,"총예산은 약 22억원으로 한국전력이 50%, 정부가 20%를 지원한다. 나머지 30% 사업예산은 시가 부담한다.지중화 사업 대상지는 수지구 상현동 상현초등학교 삼거리부터 소실봉공원 입구까지 약 700m 구간이다. 이 사업은 오는 12월까지 설계를 완료하고 오는 2025년 착공할 예정이다.그동안 시는 산업통상자원부 등..."
2024.02.16.,"한국전력, 삼성화재에 '3-0' 승리로 '3연패' 끊고 '3위' 복귀",남자 프로배구 한국전력이 3연패 사슬을 끊고 중위권 싸움을 다시 혼전으로 몰아넣었다. 한국전력은 16일 대전충무체육관에서 열린 도드람 2023-2024 V리그 남자부 방문 경기에서 삼성화재를 세트 점수 3-0(25-22 25-20 25-23)으로 완파했다. 3연패에서 탈출한 한국전력은 15승 14패 승점 44를 기록해 5위에서 3위...
2024.02.16.,"정관장 3위 점프, 페퍼 충격의 22연패 늪…男 한국전력, 삼성화재 3-0 완파",사진제공 | 한국배구연맹 대전충무체육관에서 열린 남자부 경기에서는 한국전력이 삼성화재를 3-0(25-22 25-20 25-23)으로 이기고 3연패 사슬을 끊었다. 15승14패(승점 44)를 기록한 한국전력은 5위에서 3위로 점프했다. 삼성화재는 16승13패(승점 42)로 4위에서 5위로 떨어졌다. 한국전력은 타이스가...
2024.02.16.,한국전력 임성진 '간다!',16일 대전충무체육관에서 열린 도드림 23-24 V리그 한국전력과 삼성화재와의 경기에서 한국전력 임성진이 공격을 시도하고 있다.(한국전력 배구단 제공) 2024.2.16/뉴스1
2024.02.16.,"서재덕 18점…3연패 탈출 男배구 한국전력, 단숨에 3위 도약",프로배구 남자부 한국전력이 삼성화재를 꺾고 리그 5위에서 3위로 뛰어올랐다. 한국전력은 16일 오후 대전충무체육관에서 열린 '도드람 2023~2024 V-리그' 남자부 원정 경기 삼성화재전에서 세트 스코어 3-0(25-22 25-20 25-23)으로 완승을 거뒀다. 한국전력은 3연패에서 탈출했다. 15승14패 승점 44점이 된...
2024.02.16.,"'타이스·서재덕·임성진 46점 합작' 한국전력, 3-0으로 삼성화재에 완승…4위...",한국전력이 삼성화재에 완승을 거두며 4위로 올라섰다. 한국전력은 16일 대전 충무체육관에서 열린 도드람 2023-2024 V-리그 남자부 삼성화재와의 원정 경기에서 세트 스코어 3-0(25-22 25-20 25-23)으로 승리했다. 이번 경기로 3연패를 끊어낸 한국전력은 15승 14패(승점 44점)를 기록하며 4위가 됐다. 삼성화재는...
2024.02.16.,"삼성화재만 만나면 펄펄 나는 한국전력, 3연패 탈출&3위 점프 두 마리 토끼 사...","한국전력이 삼성화재에 또 다시 승리를 거두고 천적 관계를 이어갔다. 3연패 수렁에 빠진 한국전력은 올 시즌 삼성화재만 만나면 강세를 보였다. 삼성화재와 4경기에서 3승1패를 기록했다. 삼성화재전 공격 성공률도 55.83%도 상대팀별 공격 성공률 중 가장 높았다. 상대전 리시브 효율(46.22%), 블로킹..."
2024.02.16.,한국전력 하승우 '토스!',16일 대전충무체육관에서 열린 도드림 23-24 V리그 한국전력과 삼성화재와의 경기에서 한국전력 하승우가 토스를 시도하고 있다.(한국전력 배구단 제공) 2024.2.16/뉴스1
2024.02.16.,한국전력 '득점 성공!',16일 대전충무체육관에서 열린 도드림 23-24 V리그 한국전력과 삼성화재와의 경기에서 한국전력 선수들이 득점에 성공한 뒤 기뻐하고 있다.(한국전력 배구단 제공) 2024.2.16/뉴스1
2024.02.16.,한국전력 타이스 '이거야!',16일 대전충무체육관에서 열린 도드림 23-24 V리그 한국전력과 삼성화재와의 경기에서 한국전력 타이스가 환호하고 있다.(한국전력 배구단 제공) 2024.2.16/뉴스1
2024.02.16.,권영민 한국전력 감독 '주먹 불끈',16일 대전충무체육관에서 열린 도드림 23-24 V리그 한국전력과 삼성화재와의 경기에서 권영민 한국전력 감독이 작전을 지시하고 있다.(한국전력 배구단 제공) 2024.2.16/뉴스1
2024.02.17.,"한국전력, 연패 끊고 3위 '껑충'... 봄 배구 포기 못해","한국전력, 삼성화재에 3-0 '셧아웃' 승리 ▲ 프로배구 한국전력 타이스 덜 호스트와 임성진이 16일 삼성화재와의 경기에서 득점을 기뻐하고 있다 ⓒ KOVO 남자 프로배구 한국전력이 봄 배구를 향한 의지를 불태웠다. 한국전력은 16일 대전 충무체육관에서 열린 도드람 2023-2024 V리그 남자부 5라운드 방문..."
2024.02.17.,"'페퍼가 또?' 22연패 수렁, 꼴찌 잡은 정관장 3위로 점프... 한국전력도 삼성...","남자부 수원 한국전력이 2012~2013시즌에 작성한 기록이다. 나아가 통산 최다 연패인 한국전력이 2007~2008, 2008~2009 두 시즌에 걸쳐 기록한 27연패도 페퍼저축은행을 위협하고 있다. 나아가 페퍼저축은행은 2021~2022시즌 창단 이후 정관장에 17전 17패로 단 한 경기도 이기지 못하며 절대열세를 이어갔다...."
2024.02.17.,한전 직원 60%가 MZ세대…김동철 사장 '소통 강화' 나서,한국전력공사가 직원 10명 중 6명이 MZ세대(1982~2003년생)일 정도로 젊어졌다. 지난해 9월 취임한 김동철 사장은 조직 내 세대갈등을 없애고 젊은 직원들의 의견을 적극 청취하기 위해 직접 소통 행보에 나섰다. 17일 한국전력에 따르면 지난 1월 기준 4직급 이하인 직원들의 전체 인원(1만7341명) 중 MZ세대는...
2024.02.17.,"정전·통신두절…섬 전체 마비된 인천 영흥도 ""대책 시급""",17일 인천시 옹진군과 한국전력에 따르면 지난 15일 오전 2시 17분께 옹진군 영흥면 선재대교 아래에 있는 어촌계 소유 창고에서 불이 나 1시간 56분 만에 진화됐다. 이 불로 인명 피해는 없었지만 선재대교 하부에 설치된 한전 전력케이블 50m가량이 불에 타 영흥도와 선재도 일대 3천798가구 전체가 정전되는...
2024.02.17.,'1위 싸움 최고조' 대한항공-우리카드 오늘 미리 보는 챔프전,대한항공이 지난 11일 한국전력을 세트스코어 3-0으로 꺾어 경기가 없던 우리카드를 밀어내며 74일 만에 선두를 탈환했다. 그러자 다음날(12일) 한국전력이 현대캐피탈을 상대로 셧 아웃 승리를 거두고 하루 만에 선두 1위를 되찾았다. 대한항공은 14일 OK금융그룹을 3-1로 물리치고 이틀 만에 선두 자리를...
2024.02.17.,"""스윙 빠르기는 대한민국 최고"" 사령탑 특급 칭찬, '송명근 카드'가 있기에 든...",지난 11일 대한항공이 한국전력에 셧아웃 승리하면서 74일만에 1위 자리를 뺏어갔다. 이후 엎치락뒤치락하고 있다. 하루 뒤인 12일 우리카드가 현대캐피탈을 꺾으면서 하루 만에 선두 1위를 되찾았다. 그러자 대한항공은 14일 OK금융그룹을 3-1로 꺾고 이틀 만에 선두 자리를 되찾아왔다. 우리카드는 외국인...
2024.02.17.,'남자부 역대급 순위 경쟁' 대한항공-우리카드 1위 싸움이 열린다…여자부 현...,대한항공은 지난 11일 열린 한국전력과 5라운드 경기에서 세트 점수 3-0 완승을 거두며 1위로 올라갔다. 74일 만의 1위였다. 하지만 우리카드도 만만치 않다. 1경기 덜 치른 상태로 두 팀의 맞대결이 아니어도 뒤집을 수 있는 격차다. 최근 4연승으로 분위기도 좋다. 그래서 이번 맞대결이 중요하다. 우리카드는...
2024.02.17.,한국기술교육대 2023학년도 학위수여식…1065명 학·석·박사 학위 받아,"한국전력공사 연구원으로 근무하는 이후동씨(31)는 박사과정 재학 중 무려 12건의 연구논문을 SCIE, SCOPUS, KCI급 학술지에 발표했다. 이씨는 “많은 우여곡절과 어려움이 있었지만 노대석 지도교수님과 학과교수님들의 도움으로 영예로운 학위를 받게 됐다”면서 “실사구시 정신을 바탕으로 학교의 위상을..."
2024.02.17.,"지반침하 부곡공단 가스유출..""배관 어그러져""","한편, 지난 2017년 한국전력은 전력구 공사를 시작했으나, 과도한 지하수 유출 원인으로 부곡공단 일부에서 지반침하가 발생됐다. 이후 전력구 공사는 중지됐지만, 부곡공단의 물적 피해 규모는 점차 커지는 상태다. 지반침하로 인해 부곡공단 인근 업체들은 폭발성 물질 사고 위험에 노출돼있는 등..."
2024.02.17.,"""우리카드, 마테이 없어도 할 수 있다는 것 보여주고 있다"" 1위팀 사령탑 경계...",특히 지난 11일 열린 한국전력과 5라운드 경기에서 3-0 완승을 거두며 74일 만에 1위 자리를 탈환했다. 한때 3위까지 처졌던 대한항공은 5라운드 반등하면서 선두 자리를 복귀했다. 이후 엎치락뒤치락하고 있다. 12일 우리카드가 현대캐피탈을 꺾으면서 하루 만에 선두 1위를 되찾았다. 그러자 대한항공은 14일...
2024.02.18.,전기료와 함께 매달 내는 전력기금…올해 첫 3조원 돌파 전망,월 10만 원의 전기요금을 냈다면 이 중 3700원은 한국전력이 아닌 정부가 가져가는 '세금'인 셈이다. 전력기금이 연간 3조원을 넘어서기는 올해가 처음이다. 정부의 위탁으로 전력기금을 운영하는 한전 전력기금사업단에 따르면 전기요금 징수 시 함께 걷는 전력기금은 2016년 처음으로 2조원대에 올라섰고...
2024.02.18.,[사설] 영흥면 정전사태 부른 전력케이블 화재,"불은 창고와 선재대교 하부 사이에 설치된 2만2900V짜리 한국전력공사 전력케이블을 태워 선재도와 영흥도, 두 섬 전체가 순식간에 암흑천지가 됐다. 전력 공급 중단 사태는 한전의 긴급 복구작업 끝에 무려 19시간 30분 만인 같은 날 오후 9시 47분쯤 완전히 복구됐지만 피해가 이만저만 아니었다. 두 섬에..."
2024.02.18.,"'레오 38점' OK금융, KB손보 꺾고 3위 도약·2연패 탈출",이날 승리로 OK금융그룹(16승 13패 승점 47점)은 한국전력(15승 14패 승점 44점)을 끌어내리고 3위로 도약했다. 동시에 2연패 수렁에서 벗어났다. 최하위 KB손해보험(4승 25패 승점 19점)은 또다시 승리와 연을 맺지 못했다. 연패 숫자가 6으로 늘어났다. OK금융그룹 레오가 공격성공률 64.15%로 38점을 쓸어...
2024.02.18.,"IBK기업은행, GS칼텍스 완파하고 봄 배구 희망가…블로킹 11-3(종합)","승점 47(16승 13패)을 기록한 OK금융그룹은 한국전력(15승 14패·승점 44)을 4위로 밀어내고 지난 15일 이후 사흘 만에 3위에 복귀했다. 지난 14일 후인정 감독이 스스로 지휘봉을 반납한 뒤 김학민 대행으로 잔여 시즌을 치르고 있는 KB손보는 7연패 늪에서 벗어나지 못했다. KB손보는 4승 25패, 승점 19에..."
2024.02.18.,'레오 38득점' 남자 배구 OK금융그룹 3위 탈환,승점 47(16승 13패)을 기록한 OK금융그룹은 한국전력(15승 14패·승점 44)을 4위로 밀어내고 지난 15일 이후 사흘 만에 3위에 복귀했습니다. 지난 14일 후인정 감독이 스스로 지휘봉을 반납한 뒤 김학민 대행으로 잔여 시즌을 치르고 있는 KB손보는 7연패 늪에서 벗어나지 못했습니다. KB손보는 4승 25패...
2024.02.18.,"서울시, 공동주택 전기안전 지원…정전사고 예방·에너지 효율 개선","고효율 변압기 교체 지원사업은 한국전력공사의 에너지효율화사업과 연계해 변압기 용량별로 정액 지원한다. 서울시와 한전은 작년 12개 단지의 노후 변압기 18대를 고효율 변압기로 교체하며, 설비 노후화로 인한 정전사고 불안 해소와 에너지 효율 개선을 이뤘다. 저전압계전기(UVR) 이전 설치 지원사업은..."
2024.02.18.,봄배구 경쟁 불 지핀 IBK기업은행…‘감독 부재’ GS칼텍스 완파,의정부 원정에서 KB손해보험을 세트 점수 3-1(25-21 20-25 27-25 25-23)로 물리쳤다. 외국인 공격수 레오나르도 레이바 마르티네스(등록명 레오)가 홀로 38점을 올리며 훨훨 날았다. 승점 47점(16승13패)을 쌓은 OK금융그룹은 한국전력을 끌어내리고 3위로 도약했다. 최하위 KB손해보험은 7연패 늪에 빠졌다. 화성 |
2024.02.18.,이자 감당 어려운 부실기업 부채 비율 11.8%···2년 만에 5%p↑,"전기가스업은 총부채가 323조8000억원, 부실 부채는 116조원이었는데 적자가 심각한 한국전력공사 부채(109조원)가 대부분을 차지했다. 부동산업은 총부채 424조2000억원, 부실 부채 59조1900억원이었다. 최근 주택 거래 감소와 가격 하락으로 임대·중개 수익성이 낮아지고, 저조한 분양 실적에 개발·시행..."
2024.02.18.,연이은 부상 딛고 날아오르는 OK금융그룹 차지환,"승점 3점을 보탠 OK금융그룹은 한국전력을 따돌리고 3위로 올라섰다. 이날도 OK는 에이스인 레오가 38점으로 공격을 이끌었다. 그리고 차지환이 14득점을 올리며 레오를 도왔다. 차지환은 이날 22개의 공격을 시도했고, 14개를 성공시켰다. 범실은 하나, 차단도 하나 밖에 당하지 않았다. 공격성공률은 63.6..."
