날짜,제목,내용
2023.08.29.,광주·전남 상장기업 34곳 중 19곳 '흑자'…전년 대비 매출↑,수조 원의 적자를 기록한 한국전력을 제외하면 매출액뿐만 아니라 영업이익과 순이익이 늘었다. 한국거래소 광주사무소가 29일 발표한 이 지역 12월 결산법인 34곳(코스피 14곳·코스닥 20곳)의 실적에 따르면 전체 매출액은 45조1천704억원으로 전년 동기 대비 26.2%(9조3천832억원) 증가했다....
2023.08.29.,"인제군, 2023 재난대응 안전한국훈련실시","9월 5일 오후 2시 인제체육관에서 진행되는 현장훈련에는 인제소방서, 인제경찰서, 12사단 의무대대, 한국전력공사 인제지사, KT홍천지사, 인제국유림관리소, 한국전기안전공사, 한국가스안전공사, 홍천국토관리사무소, 인제군자율방재단, 인제군 의용소방대 등 11개 유관기관 및 민간단체 150여 명이 참여해..."
2023.08.29.,상반기 광주·전남 상장사 매출액↑ `영업이익·순이익' 적자폭↓,"지역내 실적 비중이 최상위인 한국전력의 적자폭이 축소된 결과로 분석된다. 29일 한국거래소 광주사무소가 발표한 '2023년 상반기 광주전남 12월결산법인실적'에 따르면 12월 결산법인 36사 중 34사(코스피 14사, 코스닥 20사)의 상반기 매출액은 45조1704억원으로 전년 동기(35조7871억원) 대비..."
2023.08.29.,"강경성 산업부 차관,원전 수출일감 통합 설명회 참석","강경성 산업통상자원부 2차관이 29일 서울 서초구 한전아트센터 양지홀에서 열린 원전 수출일감 통합 설명회에 참석,축사를 하고 있다.이날 설명회에는 황주호 한국수력원자력 사장, 이민철 원전수출산업협회 부회장, 이홍주 한국전력공사 부사장을 비롯한 관련 기관 및 국내 원전 기자재·부품기업 대표..."
2023.08.29.,산불 피해 산림 복구 추진…산불 책임 수사 하세월,"강릉시는 전선이 끊어지면서 산불이 난 것으로 보는 만큼, 한국전력에 책임을 물을 수 있다고 보고 수사를 진행하고 있습니다. 하지만 전신주를 덮친 나무가 전기시설에서 5미터 이상 떨어져 심어진 만큼 전기사업법 위반 혐의 적용은 쉽지 않아 보입니다. 강릉시는 다른 증거 확보에 집중한다는 계획이지만..."
2023.08.29.,"한전KDN·광해공단 등 '청년 지원' 강화…""취업 등 뒷받침""","전남도 내 7개 대학 등 광주·전남권 대학과 함께 한전KDN, 한국전력(한전) 등 혁신도시 이전 공공기관·기업 등이 개설한 각 부스에서는 대학 진학 상담 및 모집활동, 공공기관 소개와 인재 채용 상담 등이 펼쳐졌다. 입시 관련 전문가 특강 및 토크콘서트 등도 열렸다. 한전KDN은 채용담당 직원과 광주·전남..."
2023.08.29.,8000억원 규모 원전설비 수출일감 풀린다,산업통상자원부 강경성 2차관이 29일 한국전력공사 아트센터에서 열린 '원전 수출일감 통합 설명회'에 앞서 축사를 하고 있다./사진=산업부 29일 산업통상자원부(이하 산업부)는 윤석열 정부의 원전수출 성과를 원전 중소·중견기업들이 체감하고 일감을 확보할 수 있도록 한국전력공사 아트센터에서...
2023.08.29.,'201조 부채' 한전…62년만에 첫 정치인 출신 사장 임박,"이르면 9월中 한전 사장 인선 마무리 재무개선, 인프라·기술 투자 등 과제 산적 국정과제 '원전 수출 10기 달성' 현안도 사상 최초로 누적 부채 200조원을 돌파한 한국전력이 이르면 내달 중 신임 사장을 맞이한다. 업계에서는 한전 사장 자리에 62년 만에 처음으로 정치인 출신이 유력할 것으로 내다보고..."
2023.08.30.,"[단독][fn마켓워치] 한국전력, 한전기술 보유 지분 최대 5.22% 블록딜 추진",한국전력이 보유중인 한전기술 지분 매각에 나섰다. 30일 투자은행(IB)업계에 따르면 한국전력은 이날 장 종료직후 보유중인 한전기술 지분 100만주(2.61%)에서 최대 200만주(5.22%)에 대한 기관 블록딜 수요예측에 돌입했다. 한 주당 할인율은 이날 종가(7만 2400원) 기준 4.5%에서 최대 6.5%를 적용 한 6만...
2023.08.30.,"한국전력기술, KAIST와 상호 협력체제 구축 협약","[김천=위키트리]=한국전력기술(사장 김성암)은 지난 29일, KAIST(총장 이광형)와 ‘인적자원 역량 강화 및 원자력 기술정보 공유 상호 협력체제 구축을 위한 협약’을 체결했다. 이날 KAIST 본관에서 열린 협약식은 한국전력기술 김성암 사장과 KAIST 이광형 총장 등 양 기관 주요 관계자들이 참석한 가운데..."
2023.08.30.,"한난, 한전과 전력계통 기술교류","한국지역난방공사 동탄지사는 한국전력공사 성남전력지사와 30일 한난 동탄지사에서 전력계통 운영 및 유지보수 관련 협력을 위한 업무협약을 체결했다고 밝혔다. 이번 협약은 두 기관이 보유하고 있는 전력설비(한전의 송변전설비, 한난의 열병합발전설비) 운영 역량과 자원을 적극 활용해 교류함으로써..."
2023.08.30.,"한국전력기술, 열린도서관 개설, 김천지역 어린이 큰 호응","한국전력기술 열린도서관이 김천지역주민과 임직원 자녀를 대상으로 3주간 운영한 여름방학 특강 프로그램이 호평을 받았다. 한국전력기술 열린도서관은 8월 1일부터 3주간 김천지역 어린이와 청소년을 대상으로 그림책 만들기, 요리 활동, 캘리그라피 체험 등 다채로운 특강 프로그램을 개설했다. 5회에 걸쳐..."
2023.08.30.,항저우AG 남자배구 대표팀 확정…한선수·김준우 등 12명 출전,"임 감독은 ""최민호(현대캐피탈), 신영석(한국전력) 등 베테랑 미들 블로커들도 뽑고 싶었으나 부상으로 어쩔 수 없었다""라며 ""김준우는 신장(195㎝)이 작지만 점프력이 좋고 2단 볼 처리 능력이 뛰어나서 선발했다""고 설명했다. 임 감독은 아울러 ""진천 선수촌에선 프로팀과 세 차례 정도 연습경기를 준비하고..."
2023.08.30.,"경기도·한전 등 6개 기관, 지하시설물 안전관리 협의체 구성","경기도는 도내 지하시설물 관계기관인 한국전력공사, 한국수자원공사, 한국가스공사, 한국지역난방공사, 국가철도공단, ㈜KT 등 6개 기관과 ‘경기도 지하시설물 안전관리 협의체’ 구성·운영을 위한 서면 업무협약을 체결했다고 30일 밝혔다. 협약에 따라 경기도와 6개 기관은 지반침하 예방과 지하시설물 관리..."
2023.08.30.,[수도권 주요 뉴스]경기 AI노인말벗 두달새 5900건 상담,"경기도, 6개 기관과 지하 시설물 안전관리 협의체 구성 경기도가 한국전력공사, 한국수자원공사, 한국가스공사, 한국지역난방공사, 국가철도공단, KT 등 6개 기관과 '지하 시설 안전관리 협의체' 구성을 위한 업무협약을 체결했습니다. 협약에 따라 경기도와 6개 기관은 지반 침하 예방과 지하 시설물 관리..."
2023.08.30.,어두운 골목길 밝아진다,"한국전력 충북본부는 한화솔루션㈜, 대한제지㈜, 한국철도기술연구원, 충북경찰청과 2천50만 원 상당의 사회공헌펀드를 활용한 '민·경·공 합동 범죄 예방 환경 조성 사업'을 추진한다고 30일 밝혔다. 범죄 예방 환경 조성을 위한 사회공헌펀드는 한전 충북본부와 지난 4월 '전력기술교류 및 사회공헌펀드..."
2023.08.30.,"농어촌공사, ‘대학생 아침밥 지원사업’ 확대… 10개 기관과 동행","8개 기관(한국농수산식품유통공사, 한국전력공사, 수협은행, 한국도로공사, 농림식품기술기획평가원, 한국공항공사, 건강보험심사평가원)과 2개 대학교(조선대학교, 초당대학교)가 참여해 총 10개 기관이 함께한다. 올해 1학기부터 공사는 전남 나주 혁신도시 이전기관 3곳과 함께 ‘대학생 든든한끼 아침밥’..."
2023.08.31.,"한전, 차기 사장에 김동철 전 의원…임시 이사회서 논의",임소현 이승주 기자 = 한국전력이 차기 사장으로 김동철 전 의원을 임명하기 위한 절차에 본격 착수했다. 31일 업계에 따르면 한전은 김 전 의원을 신임 사장으로 선임하는 공문을 산업통상자원부로부터 공식 접수했다. 한전은 다음달 1일 임시 이사회를 열고 김 전 의원을 신임 사장으로 임명하는 안건을 논의할...
2023.08.31.,"동반위, 한국전력기술과 협력사 대상 ESG 교육 진행",동반성장위원회와 한국전력기술은 30일 협력사 및 지역 중소기업 임직원을 대상으로 '한국전력기술 동반성장 실무자 과정'을 진행했다고 31일 밝혔다. 이번 교육은 한국전력기술의 협력사 및 지역 중소기업 임직원을 대상으로 동반성장과 ESG에 대한 이해도를 높이고 동반성장 문화 조성과 확산을 위해...
2023.08.31.,"김성업 한국전력 영광지사장, 마약 근절 'NO EXIT' 캠페인 동참",김성업 한국전력공사 영광지사장은 31일 마약 근절을 위한 '노 엑시트(NO EXIT)' 캠페인에 동참했다.노 엑시트(NO EXIT)는 마약의 위험성을 환기하고 경각심을 고취하기 위해 경찰청·한국마약퇴치운동본부가 지난 4월부터 추진하고 있는 범국민 캠페인으로 마약에 한번 빠져들면 탈출구(EXIT)가 없다는 의미를...
2023.08.31.,8월 전력수요 역대 최대…한전 3분기 흑자전환 기대감,"(CG)[연합뉴스TV 제공] 전력 판매가 늘면서 한국전력의 3분기 영업실적이 흑자로 돌아설 가능성이 있지만, 누적 기준으로는 막대한 영업손실을 메우는 데 한계가 잇을 것으로 전망된다. 31일 전력거래소에 따르면 전날 기준 8월 월평균 최대전력은 8만2천956MW로 관련 통계가 집계되기 시작한 1993년 이래 역대..."
2023.08.31.,"한전 성남전력지사, 지역난방公 동탄지사와 '기술 교류' 협약",김양상 한국전력공사 경기본부 성남전력지사장(왼쪽에서 세 번째)과 박창규 한국지역난방공사 동탄지사장(왼쪽에서 네 번째)이 지난 30일 열린 '기술교류 협약(MOU)' 체결식에서 기념촬영을 하고 있다. 사진=한국전력공사 경기본부 성남전력지사 한국전력공사 경기본부 성남전력지사는 한국지역난방공사...
2023.08.31.,"[fn마켓워치] 한국전력, 한전기술 보유지분 블록딜 실패","한국전력이 보유중인 한전기술 일부 지분 블록딜(시간 외 대량매매) 매각에 실패했다. 8월 31일 투자은행(IB)업계에 따르면, 전일 한국전력이 보유중인 한전기술 지분 블록딜 수요 예측에 돌입했으나 기관 투자자들의 저조한 참여로 결국 지분 매각에 실패한 것으로 알려졌다. IB업계 한 관계자는 “한..."
2023.08.31.,붕괴 앞둔 우리 전력시스템…에너지 업계 공동 비전 필요하다,"한국의 전력산업이 시스템 붕괴를 앞두고 있다. 전세계를 뒤덮은 에너지 위기 속에 한전의 적자가 수십조원을 기록하고 있으며, 그럼에도 불구하고 한국의 에너지 정책은 여전히 돌파구를 찾지 못하는 실정이다. 과거 우리 산업은 강력한 공기업과 정부가 틀을 만들고, 그곳에서 민간이 어떻게든 틈새를 찾아..."
2023.08.31.,"한국전력기술, 지역민과 소통 프로그램 '성황'","한국전력기술 열린도서관이 여름방학을 맞이해 김천 지역주민과 임직원 자녀를 대상으로 3주간 운영한 여름방학 특강 프로그램이 성황리에 마무리됐다. 열린도서관은 김천시 관내 어린이와 청소년을 대상으로 그림책 만들기, 요리 활동, 캘리그라피 체험 등 다채로운 특강 프로그램을 개설했다. 열린도서관은..."
2023.08.31.,"세이브더칠드런- 한국전력공사 동울산지사, 울산 북구, 동구지역 에너지복지 ...","한국전력공사 동울산지사 박영제 지사장(왼쪽에서 첫 번째), 이화지역아동센터 김미숙 센터장(왼쪽에서 두번째), 세이브더칠드런 동부지역본부 울산아동권리센터 조정현 센터장(왼쪽에서 세 번째), 한국전력공사 동울산지사 김이은 고객지원팀장(오른쪽에서 네 번째)(사진 출처 : 세이브더칠드런 동부지역본부)..."
2023.09.01.,한국전력 신임 사장에 김동철 전 의원…사상 첫 정치인 출신 수장,한국전력공사 새 사장에 김동철 전 국회의원이 선임됐습니다. 한국전력은 오늘(1일) 서울 한전아트센터에서 임시 이사회를 열고 김 전 의원을 사장으로 선임하기 위한 임시 주주총회 개최 안건을 의결했습니다. 주주총회는 약 2주간의 공고 후 열릴 예정입니다. 김 전 의원이 이번 달 중순쯤 한전 사장으로...
2023.09.01.,"한전, 이달 18일 임시주총 열고 김동철 신임 사장 선임",김동철 전 의원이 한국전력 차기 사장으로 선임된다. 1일 한전에 따르면 한전은 오는 18일 임시주주총회를 열고 김 전 의원을 신임 사장으로 선임하는 안건을 논의할 계획이다. 안건이 통과되면 산업통상자원부 장관의 제청을 받아 대통령이 임명하는 것으로 인선은 마무리된다. 앞서 한전은 김 전 의원을 차기...
2023.09.01.,"한국전력 이사회, 김동철 전 의원 사장 선임안 의결",한국전력공사 신임 사장에 김동철 전 국회의원이 선임될 전망입니다. 한국전력은 오늘(1일) 임시 이사회를 열고 김동철 전 의원을 사장으로 선임하기 위한 임시 주주총회 개최 안건을 의결했습니다. 앞서 산업통상자원부는 지난달 31일 김 전 의원을 한전 사장 후보로 단수 추천했습니다. 한전은 2주간 공고를...
2023.09.01.,"SK가스-한전 전력연구원-울산 GPS, ‘신규 가스복합발전소 운영’ 협력 나서","SK가스는 한국전력공사 전력연구원, 액화천연가스(LNG)·액화석유가스(LPG) 듀얼 발전소 울산 GPS(Gas Power Solution)와 함께 ‘신규 가스복합발전소 운영 기술협력’을 위한 업무협약(MOU)을 체결했다고 1일 밝혔다. 이번 체결식은 경기도 판교 SK가스 본사에서 진행됐다. 이 자리엔 백흠정 SK가스..."
2023.09.01.,"지역난방공사·한전, 전력계통 운영·보수 기술교류 맞손","한국지역난방공사 동탄지사는 한국전력공사 성남전력지사와 지난달 30일 한난 동탄지사에서 전력계통 운영 및 유지보수 관련 협력을 위한 업무협약을 체결했다고 1일 밝혔다. 이번 협약은 두 기관이 보유하고 있는 전력설비(한전의 송변전설비, 지역난방공사의 열병합발전설비) 운영 역량과 자원을 적극..."
2023.09.01.,"한국전력기술, 윤리 문화 선도...청렴감사 포럼단 발대식",한국전력기술이 지난 22일 2023년 상반기 청백리 임명식과 청렴감사 포럼단 발대식을 진행했다. 한국전력기술 한국전력기술은 지난 22일 ‘2023년 상반기 청백리 임명식’과 ‘청렴감사 포럼단 발대식’을 개최했다고 1일 밝혔다. ‘청백리’는 청렴·윤리 문화를 선도하는 직원을 선정하여 인센티브를 부여하는...
2023.09.01.,"SK렌터카, 친환경 전기차 활용 제주도 전력 불균형 해소…‘플러스DR’ 사업 ...","이 사업에는 한국전력과 전기차 충전 서비스 전문 기업 대영채비, 국내 전력시장 내 주요 수요관리사업자인 그리드위즈와 함께했다. 빌리카는 SK렌터카 제주지점과 동일한 서비스를 합리적인 요금으로 이용 가능한 세컨드 브랜드로 제주에서만 운영하고 있다. 플러스DR(Demand Response)이란 재생에너지..."
2023.09.01.,"전력거래소, 서울국제전력시장 컨퍼런스 개최","서울국제전력시장 컨퍼런스는 산업통상자원부, 국내외 산·학·연 관계자, 한국전력공사 및 전력그룹사 관계자 등이 참석해 ‘전력계통 안정화를 위한 전력시장 혁신’을 주제로, 전 세계 전력시장의 현재 도전과 향후 발전 방향에 논의했다. 서울국제전력시장 컨퍼런스는 지난 2005년부터 시작돼, 올해로..."
2023.09.01.,"음성군-한국전력공사, 충북혁신도시 '고압송전선로 지중화' 업무협약",［중부매일 서인석 기자］ 음성군(군수 조병옥)은 1일 군수실에서 한국전력공사와 '충북혁신도시 송전선로 지중화 사업' 추진을 위한 업무협약을 체결했다. 이날 협약식에는 조병옥 음성군수와 김영관 한국전력공사 충북본부장이 참석했다. 충북혁신도시 조성 당시 혁신도시 경계에 위치한 송전선로가...
2023.09.01.,"전력거래소, 하반기 일반수소발전시장개설",한국전력거래소 전경 일반수소발전시장 입찰물량이 상반기와 동일한 650GWh 물량으로 하반기에 개설한다. 수소발전입찰시장 관리기관인 전력거래소(이사장 정동희)는 지난달 31일 수소발전입찰시장 위원회를 개최해 2023년 하반기 일반수소발전시장 입찰공고문을 확정하고 하반기 일반수소발전시장을...
2023.09.02.,"SK렌터카, 친환경 전기차로 제주도 전력 수요·공급 불균형 해소","SK렌터카는 ‘한국전력’과 전기차 충전 서비스 전문 기업 ‘대영채비’, 국내 전력시장 내 주요 수요관리사업자인 ‘그리드위즈’와 함께 SK렌터카 제주지점과 빌리카 등 두 곳에 설치된 전기차 충전기와 운영중인 전기차를 활용해 ‘플러스DR’ 사업에 참여한다고 9월 1일 밝혔다. 빌리카는 SK렌터카..."
2023.09.02.,"한국전력기술, 청백리 임명식 및 청렴감사 포럼단 발대식",한국전력기술은 지난달 22일 참석한 가운데 ‘2023년 상반기 청백리 임명식’과 ‘청렴감사 포럼단 발대식’을 개최했다. 한국전력기술의 ‘청백리’는 청렴·윤리 문화를 선도하는 직원을 선정하여 인센티브를 부여하는 제도로 2017년에 신설됐다. 한국전력기술 감사실은 직원들에게 귀감이 되는 직원상을...
2023.09.02.,"한국전력공사, 이달 18일 임시주총 열고 김동철 신임 사장 선임",김동철 전 의원이 한국전력 차기 사장으로 선임된다. 2일 한전에 따르면 한전은 오는 18일 임시주주총회를 열고 김 전 의원을 신임 사장으로 선임하는 안건을 논의할 계획이다. 안건이 통과되면 산업통상자원부 장관의 제청을 받아 대통령이 임명하는 것으로 인선은 마무리된다. 앞서 한전은 김 전 의원을 차기...
2023.09.02.,"음성군-한국전력 충북본부, 충북혁신도시 고압송전선로 지중화 사업 협약",협약식 모습.(제공=음성군청) 충북 음성군(군수 조병옥)은 1일 집무실에서 한국전력공사와 충북혁신도시 송전선로 지중화 사업 추진을 위한 업무협약을 체결했다. 이날 협약식에는 조병옥 음성군수와 김영관 한국전력공사 충북본부장이 참석했다. 충북혁신도시 조성 당시 혁신도시 경계에 위치한...
2023.09.02.,"한국전력·가스공사 등 35개 공공기관, 2027년 부채 743.7조…72조 증가",한국전력공사·한국가스공사 등의 재무구조가 악화하면서 2027년까지 35개 관리대상 공공기관 부채가 72조원 증가하는 것으로 나타났다. 기획재정부는 '2023~2027년 공공기관 중장기재무관리계획'을 '공공기관의 운영에 관한 법률' 및 '국가재정법'에 따라 1일 국회에 제출했다고 밝혔다. 기재부에 따르면...
2023.09.02.,"한국지역난방공사-한전, 전력계통 운영·유지보수 업무협력",한국지역난방공사는 한국전력공사와 전력계통 운영과 유지보수와 관련해 협력키로 했다고 1일 밝혔다. 지역난방공사 동탄지사는 지난달 30일 한전 성남전력지사와 전력계통 운영과 유지보수와 관련 업무협약을 체결했다면서 이같이 말했다. 이번 협약은 두 기관이 보유한 전력설비 운영 역량과 자원을 적극...
2023.09.02.,서울 이촌동 아파트 14시간 넘게 정전…주민 불편,"따르면 서울 용산소방서는 전날(1일) 오후 8시36분쯤 ""인근 변압기가 터졌다""는 신고를 접수했다. 한국전력은 원인 분석 및 복구 작업을 위해 단지 전체 5개 동 250세대의 전기 공급을 끊은 상태라고 밝혔다. 아파트 측과 한전은 단지에서 자체적으로 매설한 고압선에 문제가 생겨 정전된 것으로 파악하고 있다."
2023.09.02.,"'엥 감전당했나?' 밈, 한전 공식 유튜브에…""수치 NO 소통 YES""",'개방형 냉장고 문달기' 정책홍보에 활용…91년생 뉴미디어 직원 아이디어 지난해 10월 직장인 온라인 커뮤니티 '블라인드'에 한국전력공사 소속의 한 직원이 올린 글이 크게 화제가 됐다. 제목은 '한전 다니는 거 숨겨도 나를 좋아해 주는 여자 만나고 싶다'였다. 해당 글에는 '엥 감전당했나…?'라는 댓글이...
2023.09.02.,부천 춘의동 데이터센터 특고압선 지중화… 인근 공장 근로자 반발 예고,이 업체는 최근 데이터센터 건립을 위해 춘의동 65-2번지 공장용지를 매입한 것으로 파악되며 한국전력공사 부천지점에서 해당 용지까지 15만4천V 특고압선 지중화공사를 위해 도로 굴착 심의를 신청해 통과된 것으로 파악됐다. 이런 가운데 특고압선 지중화공사가 진행되는 도로 주변에는 수백명이 근무하는...
2023.09.03.,"유달리 더웠던 8월, 전력 사용량도 최고치 찍었다","사진은 경기도 수원시 영통구 한국전력공사 경기지역본부 전력관리처 계통운영센터에서 관계자들이 전력수급상황을 주시하고 있는 모습. /경인일보DB 지난달 7일 전력 수요가 역대 최고치를 기록하는 등 연이은 폭염으로 전력 사용이 늘어났던 가운데(8월10일자 2면 = '카눈' 북상, 시장·농촌·전력당국..."
2023.09.03.,"세자르호, 태국에 셧아웃 완패…아시아선수권 4강 진출 '빨간불'",지난 6월 튀르키예에서 열린 발리볼네이션스리그(VNL)에서 태국에 셧아웃 패배를 기록했던 한국은 전력 차를 극복하지 못하며 0-3으로 졌다. 앞서 조별리그에서 베트남에 2-3으로 패하면서 1패를 안고 8강 결선리그 E조 경기에 나섰던 한국은 2패(승점 1)가 되면서 상위 두 팀에게 주어지는 4강 진출 티켓...
2023.09.03.,"음성군, 충북혁신도시 고압송전선로 지중화 사업 협약체결",음성군 제공 충북 음성군은 지난 1일 집무실에서 한국전력공사와 충북혁신도시 송전선로 지중화 사업 추진을 위한 업무협약을 체결했다. 이날 협약식에는 조병옥 음성군수와 김영관 한국전력공사 충북본부장이 참석했다. 충북혁신도시 조성 당시 혁신도시 경계에 위치한 송전선로가 지상에 설치돼...
2023.09.03.,SK가스 '가스복합발전소 운영 기술협력',"SK가스는 한국전력공사 전력연구원, LNG·LPG 듀얼 발전소 울산 GP S(Gas Power Solution)와 함께 '신규 가스복합발전소 운영 기술협력'을 위한 업무협약(MOU)을 체결했다고 3일 밝혔다. SK가스 본사에서 진행된 이번 체결식에는 SK가스 백흠정 본부장, 한국전력공사 김태균 본부장, 울산 GPS 조승호..."
2023.09.03.,"두산에너빌리티, 한국중부발전과 초대형 해상풍력 사업 협력","한국중부발전은 2021년부터 한국전력, 한국전력기술, 두산에너빌리티 등과 100MW 규모의 제주한림해상풍력단지 건설을 진행하고 있다. 두산에너빌리티는 이 단지에 5.5MW급 해상풍력 18기를 제작해 설치하는 기자재 공급 계약을 체결한 데 이어 장기유지보수 계약까지 체결했다."
2023.09.03.,"이젠 2인자가 아닌 확실한 1인자···경기·건국대, 전국통일구간마라톤 2연...","‘라이벌’ 한국체대가 지난해에 이어 2년 연속 불참한 가운데, 건국대는 한국전력공사와 치열한 2파전을 벌였다. 경향신문사에서 벽제교로 이어지는 제1 구간(14.4㎞)을 한국전력이 46분27초로 건국대(46분46초)에 19초가 앞섰다. 하지만 벽제교에서 통일로주유소까지의 제2 구간(15.0㎞)은 항저우..."
2023.09.03.,"""한국에너지공대, 국가 에너지 안보 차원에서 설립한 것""","부지 7334㎡에 한국전력을 비롯해 16개 공기업·기관이 둥지를 틀었다. 이들 기업·기관 직원만 해도 7000여 명이다. 한전은 한 해 예산이 나주시의 120여 배에 달하는 60조원이나 된다. ""나주 큰 그림은 '대한민국 에너지수도' 조성"" ""나주혁신도시가 그려가는 큰 그림은 '대한민국 에너지수도' 조성이다. 혁신도시와..."
