날짜,제목,내용
2023.11.23.,"[STOCK] 한국전력, 전기료 인상 수혜 전망… 2.2% 상승",한국전력이 2.2% 상승했다. 이달 전기요금 인상의 효과로 자본 증가가 나타날 것이라는 전망이다. 23일 한국거래소에 따르면 이날 오전 9시48분 한국전력은 전 거래일 대비 400원(2.21%) 오른 1만8540원에 거래되는 중이다. 이날 NH증권은 한국전력에 대해 이달 전기요금 인상과 2024년 시작될 이익...
2023.11.23.,"한전, 대통령 영국 국빈 방문 계기 제2 원전 세일즈 총력",한국전력이 윤석열 대통령의 영국 국빈 방무늘 계기로 신규원전 후보 부지 방문 등 제2 원전 세일즈에 총력을 기울였다. 23일 한전에 따르면 김동철 한전 사장은 18일부터 24일까지 영국을 방문해 신규원전 후보 부지를 직접 확인하고 국빈방문 기간 중 경제사절단으로 참여해 정부·의회와 산업계 고위급...
2023.11.23.,"한국전력기술, 영국 신규원전 건설 추진","한국전력기술은 지난 22일, 런던에서 열린 ‘한-영 비즈니스 포럼’에서 영국 엔지니어링 기업인 Mott MacDonald(모트 맥도날드)사와 ‘영국 신규원전사업 협력을 위한 MOU’를 체결했다고 23일 밝혔다. MOU 체결행사에는 방문규 산업통상자원부 장관과 Kemi Badenoch(케미 베이드녹) 영국 기업 통상부..."
2023.11.23.,"수장도 놀란 1R와 다른 2R, 중위권 경쟁 본격 합류한 한국전력",제공 | 한국배구연맹 제공 | 한국배구연맹 한국전력이 중위권 경쟁에 본격적으로 가세했다. 권영민 감독이 이끄는 한국전력은 2023~2024시즌 초반 고전을 면치 못했다. 1승 5패(승점 3) 최하위로 1라운드를 마쳤다. 2라운드 첫 경기도 패배로 시작했지만 이후 3연승을 내달리고 있다. 지난 14일 OK금융그룹(3-0...
2023.11.23.,"""심야 전력 저장해 낮에 사용""…한전기술 '피크부하 ESS' 가동",한국전력기술이 재사용 배터리를 활용한 에너지 저장장치(ESS) 가동에 들어갔다. 한전기술은 23일 경기 동탄에서 ‘피크부하 저감을 위한 500kW급 ESS’ 준공식을 개최했다고 밝혔다. 피크부하 저감용 ESS는 사용량이 적어 전기요금이 저렴한 심야 시간대의 전력을 배터리에 저장했다가 전력 수요가 많은...
2023.11.23.,"[한경유레카 특징주] 한국전력, 기관계 중심의 매수세 이어져","23일 한국전력이 오전 11시 10분 전일 대비 3.6% 오른 1만8800원에 거래되며 3거래일 연속 상승세를 보이고 있다. 한국전력은 지난주부터 기관계를 중심으로 매수세가 이어지고 있다. NH투자증권은 당일 한국전력에 대해 ""약해지는 규제와 쌓여가는 자본""이라는 제목으로 분석자료를 발표했다. 11월 전기요금..."
2023.11.23.,"한전, '전력인프라 활용 산불탐지 시스템' 적극행정 최우수상 수상",한국전력은 최근 정부 세종청사에서 개최된 '2023년 적극행정 우수사례 경진대회에서 국무총리상(최우수상)을 수상했다고 23일 밝혔다. 이번 대회는 공공 부문 행정의 과감한 혁신과 국익·실용의 국정운영 원칙 구현을 위해 인사혁신처·행정안전부·국무조정실이 공동 주관하는 공공 분야 최고 권위의...
2023.11.23.,나주시민대책위원회 400여명 22일 한국전력공사 본사 앞 성명서 발표,"나주시민대책위원회, 켄텍 총장 해임 건의 철회 및 학교 정상화 촉구 결의대회(사진제공=나주시) 매일일보 = 김용균 기자 | 한국에너지공과대학교(이하 켄텍·KENTECH) 총장 해임 건의 철회와 학교 정상화를 촉구하는 나주시민 결의대회가 지난 22일 한국전력 본사에서 열렸다. 나주시민대책위원회에 참여한..."
2023.11.23.,"[오늘의 주목주] ‘증권가 러브콜' 한국전력 3%대 상승, ISC 7%대 하락",23일 코스피 시가총액 상위 30개 종목 가운데 한국전력 주가가 종가 기준으로 가장 크게 움직였다. 이날 한국전력은 주가가 전날보다 3.36%(610원) 오른 1만8750원에 거래를 마쳤다. 주가는 전날보다 0.50%(90원) 낮은 1만8050원에 출발한 직후 상승전환했다. 오전 11시경까지 상승폭을 완만히 키웠으며 이후...
2023.11.23.,"서부발전, 본사 인력 27% 감축 단행…""전력그룹사 경영위기 극복 동참""","이와 함께 에너지효율화사업부를 신설, 정부의 에너지 수요관리 정책에 적극 부응한다는 계획이다.현재 서부발전은 모기업인 한국전력공사의 경영위기 극복에 동참하기 위해 재정건전화, 임금반납 등 특단의 자구대책을 추진하고 비상경영추진위원회를 통한 비상경영체제를 가동 중이다.서부발전은..."
2023.11.24.,"'타이스 17점' 한국전력, 4연승 질주…KB 손보 10연패",프로배구 남자부 한국전력이 4연승을 내달렸다. 반면 KB손해보험은 10연패 사슬에 묶였다. 한국전력은 24일 의정부체육관에서 열린 '도드람 2023~2024 V-리그' 남자부 KB손해보험과의 경기에서 세트 스코어 3-0(25-21 29-27 25-23)으로 이겼다. 4연승을 달성한 한국전력(5승 6패 승점 15점)은 5위를 유지했다. 4위...
2023.11.24.,"'타이스 17점' 한국전력, 4연승...KB손보는 10연패","프로배구 한국전력이 KB손해보험에 세트 스코어 3대 0 완승을 거두고 4연승을 달렸습니다 타이스가 17점, 임성진이 13점을 올리며 팀 승리를 이끈 한국전력은 2라운드 들어 1패 후 4연승을 질주한 반면, KB손해보험은 개막전 승리 이후 10연패에 빠졌습니다 여자부 경기에서는 아베크롬비가 양 팀 최다인..."
2023.11.24.,"남자배구 한국전력, 4연승 질주... 기업은행 4위 도약",한국전력 타이스(왼쪽)와 신영석. /KOVO 제공 남자 프로배구 한국전력이 4연승을 달리며 중위권 도약을 예고했다. 한국전력은 24일 경기도 의정부체육관에서 열린 2023-2024 도드람 V리그 남자부 방문 경기에서 KB손해보험에 세트 스코어 3-0(25-21 29-27 25-23)으로 완승했다. 1라운드 최하위에 그쳤던...
2023.11.24.,"""풍력 늘어나면 전력가격 하락""…해상풍력 앞선 덴마크 비결은","덴마크의 에너지 정책 이행을 주관하는 정부 기관 에너지청, '덴마크의 한국전력' 에너지넷 핵심 관계자들이 방한해 이뤄진 이날 세션에선 덴마크의 경험 및 한국의 사례 적용 등에 대한 논의가 이뤄졌다. 한국 해상풍력 시장에 진출하려는 개발사, 컨설팅사 등 업계 관계자들이 참석해 약 170석의 관객석을 가득..."
2023.11.24.,"IBK기업은행, 정관장 ‘5연패’ 몰아넣고 2연승…한국전력은 KB손보 꺾고 4연...","남자부에서는 한국전력이 4연승을 내달리면서 KB손해보험을 10연패로 몰아넣었다. 세트스코어 3-0(25-21 29-27 25-23)의 완승이었다. 제공 | 한국배구연맹 한국전력은 타이스 17점을 시작으로 임성진과 신영석이 각각 13, 11점씩으로 힘을 보탰다. 승점을 온전히 챙긴 한국전력은 승점 15(5승6패)로 4위..."
2023.11.24.,[전기요금 인상 딜레마] 한전 반짝 흑자에도 웃지 못하는 中企 속내는,이투데이=김우람 기자 | #한국전력의 1차 공급사에 부품을 납품하는 중소기업 A사는 각종 사고 위험을 대비하는 신형 검침 관련 제품의 도입이 늦어지면서 신제품의 납품이 언제 될지 알 수 없는 상황이다. 한전의 막대한 적자에 따른 예산 문제의 사각지대에 하청업체의 운명이 놓여있다. 23일 본지 취재를...
2023.11.24.,'9연패 탈출' KB손해보험 vs '4연승 도전' 한국전력,"KB손해보험과 한국전력이 2라운드 맞대결을 준비하고 있다. 두 팀은 24일 오후 7시 의정부체육관에서 경기를 시작한다. 홈팀 KB손해보험은 1승 9패 승점 7점으로 최하위고, 원정팀 한국전력은 4승 6패 승점 12점으로 5위다. 이번 시즌 KB손해보험과 한국전력은 시련의 1라운드를 보냈다. 나란히 1승 5패로 KB가 6위..."
2023.11.24.,"한국전력, ‘철탑에 눈(Eye) 달아 산불 예방’","▲사진 : 한국전력 한국전력이 울진지역의 시범운영 이후 500kV HVDC 동해안-신가평 송전선로에 확대 적용할 예정이다. 한국전력 (사장, 김동철)은 지난 20일, 가을철 산불 조심 기간을 맞아 지능형 재해‧환경 모니터링 시스템을 경북 울진지역 송전철탑 2개소에 설치하고 시범운영을 시작하였다고 24일 밝혔다...."
2023.11.24.,[전기요금 인상 딜레마] 안 올리면 한전 하청업체들 고사 올리면 중기 비용 부...,"주요 소비층인 시민들과 기업들은 혜택을 받았지만, 한국전력 1·2차 공급사들은 수난의 시간이었다. 동결의 사각지대에서 매출 하락과 신기술 개발 지연 등을 겪은 것이다. 반면 전기요금을 인상하면 대부분 중소업체는 상당한 부담으로 작용할 것이란 전망이 나온다. 동결이든 인상이든 난제다. 전기요금..."
2023.11.24.,'찌릿찌릿' 정책·수주 소식에 주가 자극받은 전력설비株,"전력망 사업은 한국전력공사(한전)가 독점해 왔는데, 민간에도 문이 열릴 가능성이 생겼다. 업계에 따르면 산업통상자원부는 12월 초 전력망 사업 민간 개방 내용을 담은 '전력계통 혁신대책'을 발표할 예정이다. 한전은 그간 사업 계획을 세우고 주민들과 협의해 송·변전 설비를 건설하는 등 전력망..."
2023.11.25.,"'타이스 17득점' 한국전력, 4연승 질주...'범실 25개' KB손해보험은 10연패 수...",한국전력이 의정부 원정에서 연승을 이어갔다. 권영민 감독이 이끄는 한국전력은 24일 의정부실내체육관에서 열린 도드람 2023~2024 V-리그 남자부 2라운드 KB손해보험과의 원정경기에서 세트스코어 3-0(25-21 29-27 25-23)으로 승리를 거두고 승점 3점을 획득했다. 시즌 성적 5승6패가 된 한국전력(승점 15)은...
2023.11.25.,김동철 한국전력사장 영국 방문…원전수출 총력,한국전력공사는 김동철 사장이 지난 18일부터 24일까지 경제사절단으로 영국을 방문해 원전 수출에 총력을 기울였다고 밝혔다. 한국전력에 따르면 영국 지역주민의 원전 수용성 등을 확인하고 맥테크 에너지 그룹 등과 업무협약(MOU)도 체결했다. 김 사장은 윤석열 대통령의 영국 국빈 방문 기간 중...
2023.11.25.,"한국전력, 정부 주관 ‘적극행정 우수사례 경진대회 국무총리 상’ 수상","▲사진 : 한국전력 한국전력이 디지털 공공서비스 혁신으로 디지털플랫폼정부 구현에 기여한다. 한국전력(사장, 김동철)은 지난 8일, 정부 세종청사에서 개최된 2023년 적극행정 우수사례 경진대회에서 국무총리 상을 수상하였다고 25일 밝혔다. 본 대회는 인사혁신처·행정안전부·국무조정실이 공동 주관하는..."
2023.11.25.,전력기술 '재사용 배터리 에너지저장장치' 설비 준공,한국전력기술이 관련 기관과 협력해 재사용 배터리를 이용한 에너지저장장치(ESS) 설치 준공식을 열었다. 전력기술은 지난 23일 e편한세상 동탄 파크아너스 공사 현장서 '피크부하 저감을 위한 500kW급 재사용 배터리 활용 ESS 실증 설비 구축'을 기념하는 준공식을 거행했다고 밝혔다. 이날...
2023.11.25.,"수소차 충전 대란, 조금이라도 피하고 싶다면…주말 이 시간대는 피해야","한국전력기술 연구진(김민수·전성탁·정태영)은 논문 ‘수소 충전소의 수소 판매량 데이터 분석’을 통해 차종별 충전량과 시간대별·요일별 충전소 방문 횟수 등을 분석했다. 연구진에 따르면 수소승용차의 경우 수소를 1회 충전할 때 평균적으로 연료탱크 용량 중 절반 이상을 채웠다. 즉, 수소 충전량이 50..."
2023.11.25.,"'링컨 18점' 대한항공, 현대캐피탈 3-0 완파…선두 도약","4연패 수렁에 빠진 6위 현대캐피탈(2승 9패 승점 8점)은 5위 한국전력(5승 6패 승점 15점)과의 승점을 좁히지 못했다. 대한항공 링컨이 공격성공률 66.67%로 양 팀 통틀어 최다 득점인 18점을 터트리며 승리를 이끌었다. 김규민, 곽승석, 정한용은 나란히 10점씩 보탰다. 현대캐피탈은 국내 선수들의 지원이..."
2023.11.25.,"한전, ‘임금 체불설’에…“내용 와전된 것”",한국전력 본사. 쿠키뉴스 자료사진 한국전력 임직원 임금 체불 가능성 의혹이 일면서 한전 재무 건전성이 악화되고 있다는 우려가 제기되었지만 한전 측은 와전된 이야기며 실무 검토조차 한 적 없다고 해명했다. 25일 업계에 따르면 며칠 전 직장인 익명 커뮤니티(블라인드)에는 “한전이 공기업 최초로...
2023.11.25.,"한전의 '201조원 부채', 숨긴다고 사라지지 않는다","정권 초부터 한국전력공사(이하 한전)의 전기요금 원가 회수 요구는 정권 내내 묵살되었다. 고용 안정이라는 명분으로 오히려 구형 계량기 검침업체를 한전 자회사로 만들고, 그 직원 5000여명을 정규직화한 사례는 형평성, 디지털혁명, 에너지 전환에도 역행한다. 특히 한전 사례는 일본에서 후쿠시마 원전..."
2023.11.25.,1회 100만원 넘는 온정…경남 적십자사 '기빙클럽' 200호 돌파,"한국전력공사 경남본부, 가수 임영웅 팬클럽 영웅시대 창원경남웅사랑방, BNK경남은행 등도 온정을 더했다. 기부금액은 취약계층·위기가정 지원 등에 사용된다. 박희순 대한적십자사 경남지사 회장은 ""많은 분이 보태준 희망을 취약계층 등에 잘 지원하겠다""고 밝혔다."
2023.11.25.,"11월 넷째 주, 마켓PRO 핫종목·주요 이슈 5분 완벽정리 [위클리 리뷰]","✔'10분기 만에 흑자' 한전, 지금 사도 될까…전문가 ""아직 시기상조"" 한국전력이 10개 분기 만에 영업이익 흑자전환에 성공하면서 향후 주가 전망에 이목이 쏠립니다. 시장에선 그간 대규모 적자에 따른 재무구조 악화 우려 해소로 주가가 반등하지 않겠느냐는 기대감이 나옵니다. 한경 마켓PRO는 24일 한전..."
2023.11.26.,2050 탄소중립 실현하려면…2030년 전력 실질가격 35∼36% 상승,"한국자원경제학회가 한국전력에 제출한 '2050 탄소중립에 따른 전력시장 영향분석' 보고서는 지속가능한 2050 탄소중립을 위해 소비자의 전기요금으로 발전 비용 및 계통 강화 비용을 감당해야 한다며 이같이 밝혔다. 26일 공개된 보고서는 전력수요, 발전원별 발전량 등의 2030 국가온실가스..."
2023.11.26.,"한국전력, 영국 국빈 방문을 계기로 제2 원전 세일즈 총력","▲사진...한국전력 한국전력이 지역사회와의 협력체계를 강화하고 현지 공급망 활용의 극대화를 위한 협약을 체결했다. 한국전력(사장, 김동철) 지난 18일, 영국을 방문하여 국빈 방문 기간 중 경제사절단으로 참여하여 정부·의회 및 산업계 고위급 인사들을 만나 사업 추진방안을 협의하는 등 영국 원전..."
2023.11.26.,"[단독] ‘빚더미’ 공공기관, 3706억 팔았지만…올해 예상빚만 ‘671조’","35개 공공기관 매각내역 입수 코레일 689억 유휴부지 현금화 한전은 문정동 땅 269억에 매각 강원랜드, 애물단지 게임업체 청산 올해 公기관 예상부채 671조 달해 자산매각 통한 재무개선 효과 제한 “구조적 역마진 개선돼야” 지적 한국전력, 한국철도공사 등 빚더미에 오른 공공기관들이 재무구조 개선을..."
2023.11.26.,자금조달 문제로 '급여 체불설'까지 뒤숭숭한 한전…잔인한 겨울 온다,"핵심요약 누적적자 45조 한전, 3분기 반짝 흑자에서 4분기 적자 선회 예상 자금조달 난항에 '급여 체불설'까지…한전 ""근거 없는 낭설"" 투자 여력 없는 한전…송전망 건설 과정에 민간업체 참여 가능성 '200조' 부채로 창사 이래 최대 위기를 맞은 한국전력이 내부에서 자금조달 문제로 '급여 체불설'까지 나오며..."
2023.11.26.,"이민근 안산시장, 사랑의 연탄나눔에 동참","안산에너지나눔봉사단은 한국전기공사협회 안산협의회, 한국LP가스판매협회 안산협의회, 전국보일러설비협회 안산지부, 한국전력공사 안산지사, 한국가스안전공사 경기서부지사, 한국전기안전공사 안산시흥지사, 안산도시개발㈜, ㈜삼천리, 안산시민햇빛발전협동조합, 안산시 에너지정책과 등 10개 기관..."
2023.11.26.,"김포시, '재난안전통신망 단말기' 구매…14개 읍·면·동에 지급","해병대 2사단, 한국전력공사 김포지사, 한국전기안전공사 부천김포지사, 한국가스공사 인천지역본부, 한국가스안전공사, 김포시보건소, 서울국유림관리소, 김포골드라인운영㈜ 등 총 15개 기관이다.구매 예정인 재난안전통신망 단말기는 14개 읍면동 재난담당자에게 지급된다.이를 통해 각 읍·면·동에서..."
2023.11.26.,"한수원, IAEA 인증 원전해체 심화교육 과정 성료","한수원이 11월 24일 한국전력국제원자력대학원대학교에서 '2023년 IAEA 인증 국제 공동 원전해체 심화교육 과정' 수료식을 열었다 한국수력원자력(사장 황주호, 이하 한수원)이 지난 24일 한국전력국제원자력대학원대학교(KINGS)에서 '2023년 IAEA 인증 국제 공동 원전해체 심화교육 과정' 수료식을 열었다...."
2023.11.27.,'수원 남매의 반전' KOVO 판도 뒤집는 한국전력·현대건설,프로배구에서 경기도 수원시를 연고로 두고 있는 남녀부 한국전력과 현대건설이 1라운드 부진을 완벽히 씻어내고 있다. 두 팀은 2라운드에서 나란히 4승 1패를 기록하며 2라운드 순위 2위를 기록 중이다. 남자부 한국전력은 2라운드에서 그야말로 반전을 쓰고 있다. 시즌 초반까지만 해도 우승 후보로...
2023.11.27.,"한국전력기술, 원전 생태계 복원 및 경쟁력 강화 세미나 성료","""향후 SMR 상용화, 설계용역 필요 없는 시대 대비해야"" ""탈원전으로 깨진 원전 산업 균형, 점검 기회로 삼아야"" 한국전력기술 감사실과 감사자문위원회는 정부의 에너지 정책과 원전 생태계 복원 및 경쟁력 강화 세미나를 성황리에 마쳤다고 27일 밝혔다.지난 22일 김천 본사 1층 국제세미나실에서 진행된 이날..."
2023.11.27.,2050년 탄소중립 실현 위해선 2030년 전력 실질가격 35∼36% 오른다,"한국자원경제학회가 한국전력에 제출한 ‘2050 탄소중립에 따른 전력시장 영향분석’ 보고서에 따르면 2050 탄소중립을 위해서 소비자의 전기요금으로 발전 비용 및 계통 강화 비용을 감당해야 한다. 26일 공개된 보고서는 전력수요, 발전원별 발전량 등의 2030 국가온실가스 감축목표(NDC)상..."
2023.11.27.,"이종호 과기 장관 ""SW는 디지털 신산업 기초 체력…글로벌 진출 지원사격""","대한민국 소프트웨어 기술대상은 한국전력공사와 HL만도가, 한국 IT 아키텍처 공모전 대상은 LS ELECTRIC 채대석 상무가 과기정통부장관상을 수상했다. 이종호 과기정통부 장관은 ""그동안 디지털 신산업의 기초 체력인 소프트웨어 산업의 발전을 위해서 정부와 산업계가 함께 노력한 덕분에 우리의 소프트웨어..."
2023.11.27.,"경기도, '긴급복지 핫라인' 홍보에 버스·택시 2만7천대 활용",앞서 도는 긴급복지 사업과 관련해 ▲ 종교계 ▲경기도약사회 ▲ 공인중개사협회 ▲ 소상공인연합회 ▲ 국민건강보험공단 ▲ 사회복지 기관·단체 ▲ 한국전력공사 ▲ 도시가스 기업 ▲ 신용회복위원회 ▲ 경기도교육청 등과 협약을 체결해 위기도민을 발굴·제보하는 사업을 추진하고 있다. 김능식 도...
2023.11.27.,"과기정통부, 김동욱·배경훈에 'SW 산업 발전 유공' 은탑산업훈장","대한민국 소프트웨어 기술대상은 한국전력공사(015760)와 HL만도가, 한국 IT 아키텍처 공모전 대상은 LS ELECTRIC 채대석 상무가 과기정통부 장관상을 받았다. 이날 행사에서는 이를 포함한 총 50점에 관한 시상이 이뤄졌다. 이종호 과기정통부 장관은 ""소프트웨어 산업이 디지털 심화시대의 핵심 원동력이 될..."
2023.11.27.,◇내일의 경기(28일),◆28일(화) △프로축구= 아시아연맹 챔피언스리그 조별리그 G조 인천-요코하마(19시·인천전용구장) △프로농구= kt-LG(수원kt아레나) 소노-정관장(고양소노아레나·이상 19시) △프로배구= 한국전력-삼성화재(수원체육관) 정관장-페퍼저축은행(대전충무체육관·이상 19시) △수영= 2024 경영 국가대표 선발전...
2023.11.27.,코트라·한전KDN 등 산업부 9개 기관 '우수 혁신사례' 표창,"이번 행사에서는 데이터 기반의 업무 혁신을 이룬 대한무역투자진흥공사(코트라)와 한국수력원자력, 한국로봇산업진흥원, 한국전력공사, 한국디자인진흥원 등 9곳의 담당자가 산업부 장관 표창을 받았다. 이날 우수사례 발표에서 코트라는 디지털 마케팅을 활용한 신무역모델과 디지털 무역 종합지원센터..."
2023.11.27.,‘역대급 실적’에…삼성보다 기부금 더 낸 현대차그룹 [재계 TALK TALK],"현대차·기아 뒤를 이어 하나은행(536억원), HMM(248억원), 한국전력공사(219억원), 쌍용C&E(206억원), SK에너지(152억원) 등 순으로 전년 대비 기부금 지원 규모를 많이 늘렸다. 올해 기부금을 가장 많이 줄인 곳은 교보생명이다. 누적 기부금은 16억원으로 전년 동기(455억원) 대비 96.5% 급감했다. 기부금이..."
2023.11.28.,"프로배구 한국전력, 3위 삼성화재까지 꺾었다…파죽의 5연승",여자부 정관장은 최하위 페퍼저축은행 누르고 5연패 탈출 올 시즌 초반 최하위권을 맴돌던 남자 프로배구 한국전력이 3위 삼성화재마저 무너뜨리며 파죽의 5연승을 내달렸다. 한국전력은 28일 경기 수원체육관에서 열린 도드람 2023-2024 V리그 남자부 홈 경기에서 삼성화재에 세트 점수 3-1(14-25 25-23 25-22...
2023.11.28.,"한국전력, 짜릿한 승리","28일 수원 실내체육관에서 열린 도드람 23-24 V리그 한국전력과 삼성화재 경기, 3대1로 삼성화재를 꺾은 한전 선수들이 기뻐하고 있다. (사진=한국전력 배구단 제공) 2023.11.28. photo@newsis.com *재판매 및 DB 금지 공감언론 뉴시스가 독자 여러분의 소중한 제보를 기다립니다. 뉴스 가치나 화제성이..."
2023.11.28.,"'1승5패→5승1패' 돌풍의 한국전력, 삼성화재 제압하고 5연승 질주 (종합)",한국전력이 삼성화재를 꺾고 파죽의 5연승을 내달렸다. 여자부에서는 정관장이 5연패에서 탈출하며 2라운드 전패 위기에서 벗어났다. 페퍼저축은행은 정관장전 14연패 수렁에 빠졌다. 한국전력은 28일 수원체육관에서 열린 도드람 2023~2024 V-리그 남자부 2라운드 삼성화재와의 홈경기에서 세트스코어 3-1...
2023.11.28.,"임성진·타이스 제 몫 한국전력, 삼성화재에 역전승",남자프로배구 한국전력이 연승을 5경기째로 늘렸다. 한국전력은 28일 수원체육관에서 삼성화재를 상대로 2023-24시즌 도드람 V리그 삼성화재와 홈 경기를 치렀다. 한국전력은 안방에서 짜릿한 역전승을 거뒀다. 삼성화재에 세트 스코어 3-1(14-25 25-23 25-22 25-20)로 이겼다. 한국전력은 5연승으로 내달렸고 6승...
2023.11.28.,[사진]한국전력 5연승,28일 오후 수원체육관에서 열린 도드람 2023-2024 V리그 남자부 한국전력과 삼성화재의 경기에서 한국전력이 삼성화재에 세트스코어 3대1 승리를 거뒀다. 한국전력은 5연승 질주. 한국전력 권영민 감독과 선수들이 승리에 기뻐하고 있다. 2023.11.28 / jpnews.osen.co.kr
2023.11.28.,"[포토] 타이스, 한국전력의 승리다!","28일 수원체육관에서 열린 V리그 남자부 한국전력과 삼성화재의 경기, 한국전력 타이스가 경기를 승리로 이끄는 마지막 포인트를 성공하며 환호하고 있다. 수원=/2023.11.28"
2023.11.28.,한국전력 파죽의 5연승...여자부 정관장은 5연패 탈출,올 시즌 초반 최하위권을 맴돌던 남자 프로배구 한국전력이 3위 삼성화재마저 무너뜨리고 파죽의 5연승을 달렸습니다. 한국전력은 경기 수원체육관에서 열린 V리그 홈경기에서 삼성화재에 세트 점수 3대 1로 승리했습니다. 5연승을 내달린 한국전력은 승점 18점을 기록하며 3위 삼성화재를 승점 1점 차이로...
