날짜,제목,내용
2023.09.28.,"美 원조로 큰 제일제당, 삼성을 일으키다 [+영상]",現 삼성 모태 제일제당의 시작 1951년 삼성물산을 세워 무역업으로 어느 정도 자본을 축적한 고(故) 호암 이병철 회장도 이내 제조업 진출을 고민했다. 그는 회고록 ‘호암자전’에 “국민들이 매일 사용하는 제품을 수입에만 의존하면 국가 경제 자립과 경제발전을 가져올 수 없다. 제조업을 통한 국내...
2023.09.28.,"삼성물산 빈폴, '태도를 입는다'…FW(가을·겨울) 시즌 브랜드 캠페인 진행",삼성물산 패션부문의 트래디셔널 캐주얼 브랜드 빈폴(BEANPOLE)은 지난해 '제대로 입다' 캠페인에 이어 이번에는 '태도를 입는다'를 슬로건으로 한 FW(가을·겨울) 시즌 브랜드 캠페인을 진행한다고 27일 밝혔다. 삼성물산에 따르면 빈폴은 '타임리스 캐주얼웨어(Timeless Casualwear)'의 브랜드 정체성을 공고히 하고...
2023.09.28.,삼성·LG 추석 맞이 경기 살리기 동참,"물품대금 조기 지급에는 삼성전자, 삼성디스플레이, 삼성전기, 삼성SDI, 삼성SDS, 삼성바이오로직스, 삼성바이오에피스, 삼성물산, 삼성엔지니어링, 제일기획, 삼성웰스토리 등 11개 관계사가 참여했다. 이어 삼성은 국내 내수경기 활성화를 돕기 위해 임직원 대상 ‘추석 맞이 장터’를 열고 △관계사..."
2023.09.28.,[삼성그룹] 시가총액 1조6820억원 감소...삼성엔지니어링 2.37% 상승 '주목',1위 삼성엔지니어링 3만250원(2.37%)▲2위 호텔신라 8만4700원(1.68%)▲3위 삼성전기 13만7400원(1.18%)▲4위 멀티캠퍼스 3만1650원(0.96%)▲5위 삼성FN리츠 5020원(0.6%)▲6위 삼성중공업 7840원(0.38%)▲7위 삼성바이오로직스 68만1000원(0.15%)▲8위 삼성물산 10만7600원(-0.19%)▲9위 삼성에스디에스...
2023.09.28.,캐시닥 타임스프레드 용돈퀴즈 정답 9월 28일,'패션 스타일로그' 컨셉으로 개편한 삼성물산 패션몰 SSF샵 스타일 커뮤니티 diver에 내 스타일을 공유하면 현금처럼 사용하는 퍼플코인을 일 최대 OOOO코인 즉시 적립 가능! 퍼플코인으로 쇼핑도 즐기고 내 스타일도 업그레이드하세요!' 정답은 '2000'이다. 돈버는 영어퀴즈 메모리워드 용돈퀴즈...
2023.09.28.,"[특집] 추석맞이 'ESG 경영 실천' 기업들 ""풍성한 한가위 맞이하세요""","물품대금 조기 지급에는 삼성전자, 삼성디스플레이, 삼성전기, 삼성SDI, 삼성SDS, 삼성바이오로직스, 삼성바이오에피스, 삼성물산, 삼성엔지니어링, 제일기획, 삼성웰스토리 등 11개 관계사가 참여하며 회사별로 애초 지급일에 비해 최대 10일 앞당겨 지급할 예정이다. 삼성전자와 삼성디스플레이는 협력회사의..."
2023.09.28.,한가위 연휴?…재계 총수들 ‘바쁘다 바빠’,그동안 삼성물산·제일모직 부당 합병 및 삼성바이오로직스 부정회계 의혹과 관련한 재판 일정으로 긴 해외 일정을 소화하지 못했지만 이번에는 부산엑스포 유치에 천군만마가 돼 줄 것으로 보인다. 추석연휴로 재판이 휴정기에 돌입해 지난 23일부터 10월13일까지 최대 20일의 여유가 생겼다. 최태원 SK그룹...
2023.09.28.,‘자이’ 이미지 회복 ‘깜깜’…신사업에 기대?,GS건설은 1구역 사업 초기 단계부터 수주에 힘써왔지만 삼성물산이 본격적인 경쟁에 뛰어들면서 결과는 안갯속이다. 막상 노량진1구역 공사 수주에 성공해도 안심할 상황은 아니다. 원자잿값 인상 여파로 제값의 공사비를 받지 못할 경우 수익을 남기기 어렵기 때문이다. 최근 시공사 선정에 나섰던 서울...
2023.09.29.,"“함께 해요”…삼성·LG, 조기 대금 지급으로 한가위 ‘온정’","이번 납품 대금 조기 지급은 삼성전자, 삼성디스플레이, 삼성전기, 삼성SDI, 삼성SDS, 삼성바이오로직스, 삼성바이오에피스, 삼성물산, 삼성엔지니어링, 제일기획, 삼성웰스토리 등 11개 관계사가 동참한다. 삼성은 국내 내수 경기 활성화를 위해 임직원을 대상으로 ‘추석 맞이 장터’도 연다. 관계사..."
2023.09.29.,'쉴 틈 어딨나' 추석에도 삼성·SK·현대차·LG 총수는 '업무 중',"이 회장은 삼성물산 불법 합병 의혹으로 재판을 받고 있어 운신에 제약이 있었다. 지난해의 경우 멕시코, 파나마, 캐나다, 영국 등을 찾아 시장 동향을 살피고 현지 마케팅 전략 등을 논의했다. 올해 삼성전자의 상황을 썩 좋지 않다. 주력인 반도체 사업은 올 연말까지 고전할 것으로 예상된다. 가전, TV..."
2023.09.29.,[코스피] 외국인 순매수 TOP5 삼성전자·현대차·기아·SK텔레콤·셀트리온,"그밖에 외국인 순매수 상위는 KT 99억원규모, KB금융 76억원규모, 삼성물산 60억원규모, 포스코인터내셔널 48억원규모, 두산밥켓 45억원규모 순으로 나타났다. 한국거래소에 따르면 27일 코스피는 전 거래일 대비 2.10p(0.09%) 오른 2465.07에 거래를 마쳤다. 외국인은 273억원어치를 매도했다. 최근..."
2023.09.29.,[보험사 이모저모] 삼성금융이 꺼낸 상생금융 20년,"이재용 삼성전자 회장을 비롯해 홍원학 삼성화재 사장, 정해린 삼성물산 리조트부문 사장, 백수현 삼성전자 커뮤니케이션팀장 사장, 김완표 삼성글로벌리서치 사장, 최영무 삼성사회공헌업무 사장 등 삼성 사장단이 대거 출동한 이 날 홍 전 관장은 시각장애 피아니스트 김예지 국민의힘 의원을 비롯한..."
2023.09.29.,"건설현장 안전사고, 올해 상반기에만 3217건 발생","SK에코플랜트는 사망자 5명, 부상자 688명으로 2위였고, 삼성물산은 사망자 5명, 부상자 516명으로 그 뒤를 이었다. 이 밖에도 DL이앤씨(사망 8명·부상 493명), DL건설(사망 5명·부상 477명), 신세계건설(사망 1명·부상 432명), 현대건설(사망 15명·부상 401명), 현대엔지니어링(사망 7명·부상 373명)..."
2023.09.29.,"추석 연휴 층간소음, 이렇게 해결하세요","삼성물산은 고중량 바닥패널과 스프링을 활용해 층간소음 관련 인증 1등급을 지난해 10월 획득했다. 모듈을 사전 제작해 현장에서 제작하는 '모듈러 방식'으로 균일한 차단 성능을 확보할 수 있었다. 한국건설생활환경시험연구원에 의뢰해 측정한 결과, 중량충격음 29dB와 경량충격음 21dB을 기록했다...."
2023.09.29.,'찐부자 패션'이 유행이라는데…조용한 럭셔리가 뭐야?,"[르메르 23FW 컬렉션 (제공=삼성물산)] 삼성물산의 올드머니룩 대표 주자는 수입 브랜드 '르메르'와 국내 브랜드 '르베이지'가 꼽힙니다. 르메르는 ‘일상을 위한 옷을 만든다’는 철학으로 절제되고 은은한 디자인이지만 동서양의 문화가 조화된 독특한 감성, 뛰어난 소재, 오묘한 컬러가 조화롭습니다. 코튼..."
2023.09.29.,아파트 브랜드 성장성 조사 톱2에 ‘래미안·한화포레나’ 선정,국내 아파트 브랜드 중 향후 성장이 기대되는 브랜드 1위와 2위에 삼성물산의 ‘래미안’과 한화 건설부문의 ‘포레나’가 선정됐다. 부동산R114는 매트릭스리서치와 지난 1일부터 14일까지 전국 소비자 3690명을 대상으로 ‘아파트 브랜드 이미지’를 설문조사한 결과를 29일 발표했다. 이 조사는 브랜드별로...
2023.09.29.,래미안·자이·푸르지오…아파트 브랜드 무슨 뜻일까,국내 아파트 브랜드 중 대표적인 것은 삼성물산 '래미안'이다. 래미안은 2000년부터 삼성물산 아파트에 적용됐는데 △최고의 기술로 꿈이 실현되는 앞선 미래의 공간 래(來) △미래가 살아 숨쉬는 아름다운 주거 공간 미(美) △최고의 안전성과 최상의 보안을 약속하는 편안한 생활 공간 안(安)을 합친...
2023.09.29.,"이마트·홈플러스·롯데마트·코스트코 휴무일, 9월 29일(금) '추석' 대형마트...",홈플러스는 1997년 9월 삼성물산에서 홈플러스 1호점인 대구점을 열었다. 홈플러스는 최초의 매장을 대구광역시에 개점하는 등 주로 영남권에 매장을 개설했다. 설립 초기 수도권에 많은 매장을 출점한 이마트와 중복을 피해 영남권에서 우세를 점했다. 2000년대 중반 수도권 지역으로 영업지점을...
2023.09.30.,"경제사상가 이건희 별세 3年, 김인 前 삼성SDS 사장 증언 ㊤ [+영상]","김 전 사장은 1974년 삼성물산에 입사해 창업 회장인 호암 이병철 회장 시절 비서실 인사팀에서 근무하다 프랑크푸르트 법인 주재원으로 일한다. 이건희 회장이 회장으로 취임한 뒤인 1989년 귀국해 비서실 종합연수원 교육총괄, 비서실 인사팀장을 거쳐 삼성SDI 독일법인장 영업본부장, 서울신라호텔 총지배인..."
2023.09.30.,삼성맨 '이돈태'...롯데 디자인 전략 수립한다,"특히 삼성물산의 대표 브랜드 래미안이 그의 손길을 거쳤다. 그는 2006년부터 2012년까지 삼성물산의 주택건설 디자인 고문으로 활동하며, 래미안 주거공간 디자인에 참여했다. 이후 2018년 말부터 현재까지 삼성디자인교육원(SADI)원장으로 디자이너 양성에 앞장섰다. 업계에서도 이 사장은 디자인 경영에..."
2023.09.30.,"""1가구당 3.6억 돌려드려요""…여의도 시공사 수주전 '치열'","각각 GS건설과 삼성물산, 삼성물산과 롯데건설이 시공사 선정에 강한 의지를 나타내고 있어 치열한 수주전이 벌어질 것으로 관측된다. 여의도·노량진·과천에서 고급화 경쟁 27일 정비업계에 따르면 여의도 한양아파트와 송파 가락프라자아파트의 시공사 선정 총회가 다음달 29일 열릴 예정이다. 서울시..."
2023.09.30.,부산 재개발 대어 '시민공원 2-1구역' 수주 경쟁 치열,공사비 문제 기존 계약 해지…포스코이앤씨·삼성물산 등 경쟁 재개발 사업비가 1조가 넘는 부산시민공원 촉진 2-1구역의 시공사 선정을 앞두고 건설사들의 물밑 경쟁이 치열하다. 30일 건설업계 등에 따르면 부산시민공원 촉진 2-1구역 재개발 사업 조합이 지난 7월 말 마련한 현장 설명회에 총 8개 건설사가...
2023.09.30.,우크라 재건사업 뛰어든 '팀 코리아'[해외로 눈돌리는 K건설]③,"원팀코리아는 ▲정부(국토부, 해양수산부) ▲공공기업(LH, 수자원공사, 코레일, 한국공항공사, KIND, 한국환경산업기술원) ▲민간기업(삼성물산, 현대건설, HD현대건설기계, 현대로템, 네이버, 유신, 한화솔루션, 한화건설, KT, CJ대한통운, 포스코 인터내셔널) ▲협회(해외건설협회) 등 총 18곳으로 구성됐다. 원..."
2023.09.30.,"브랜드 홍보·소통 '일석이조'…건설사, 갤러리 운영 확대","삼성물산 건설부문도 서울 송파구에 자사 주택 브랜드 이름을 딴 ‘래미안갤러리’를 운영 중이다. 래미안갤러리는 오는 11월 5일까지 올해 3번째 시즌 전시인 ‘The High Light’를 진행한다. 삼성물산 래미안갤러리는 올 봄 ‘플라워 샤워’, 여름 ‘스마일 컬러팝’을 주제로 시즌 전시를 개최하는 등 매..."
2023.09.30.,추석 9/30(토) 이마트·홈플러스·롯데마트·코스트코 휴무·영업시간은?,홈플러스는 1997년 9월 삼성물산에서 홈플러스 1호점인 대구점을 열었다. 1999년 5월 삼성물산의 유통부문과 영국의 세계적 유통업체인 테스코가 합작회사로 삼성테스코를 설립했다. 2000년 8월 최초의 합작 1호점인 안산점을 열었다. 2001년 7월 홈플러스 PB/상품권을 출시했다. 2001년 10월 국내 유통업계...
2023.09.30.,캐시닥 타임스프레드 용돈퀴즈 정답 9월 30일,'패션 스타일로그' 컨셉으로 개편한 삼성물산 패션몰 SSF샵 스타일 커뮤니티 diver에 내 스타일을 공유하면 현금처럼 사용하는 퍼플코인을 일 최대 OOOO코인 즉시 적립 가능! 퍼플코인으로 쇼핑도 즐기고 내 스타일도 업그레이드하세요!' 정답은 '2000'이다. 돈버는 영어퀴즈 메모리워드 용돈퀴즈...
2023.09.30.,"이마트·홈플러스·롯데마트·코스트코 휴무일, 9월 30일(토) 대형마트 영업하...",홈플러스는 1997년 9월 삼성물산에서 홈플러스 1호점인 대구점을 열었다. 홈플러스는 최초의 매장을 대구광역시에 개점하는 등 주로 영남권에 매장을 개설했다. 설립 초기 수도권에 많은 매장을 출점한 이마트와 중복을 피해 영남권에서 우세를 점했다. 2000년대 중반 수도권 지역으로 영업지점을...
2023.09.30.,에스와이 주가 룰루랄라~...모듈러주택 장점 시장서 주목,"덕신하우징, 한신공영, 자연과환경, GS건설, 아이윈플러스, 금강공업, 삼성물산POSCO홀딩스, 코오롱글로벌, 범양건영 등도 매수 입질이 이어지고 있다. 모듈러주택은 공장에서 미리 제작된 주택으로, 현장에서 조립하여 완성된다. 현장에서 짓는 주택보다 공사기간이 짧다. 에스와이는 조립식 샌드위치패널..."
2023.10.01.,[삼성그룹] 9월 한달 시총 4조7700억원 증가...제일기획 월간 상승률 선두,1위 제일기획 2만50원(6.37%)▲2위 삼성화재 26만500원(5.68%)▲3위 삼성생명 7만300원(3.99%)▲4위 삼성물산 10만7600원(2.77%)▲5위 삼성전자 6만8400원(2.24%)▲6위 삼성카드 3만450원(1.67%)▲7위 삼성전기 13만7400원(1.48%)▲8위 에스원 5만6600원(1.43%)▲9위 삼성FN리츠 5020원(-1.18%)▲10위...
2023.10.01.,[기고] 합병가액 산정방식 변경에 대한 논의,"이정환 변호사 [사진=화우] 2022.11.18 peoplekim@newspim.com 일견 합리적으로 보이는 이러한 규정은 2015년 제일모직과 삼성물산의 합병 사례에서 크게 이슈가 되었다. 당시 제일모직과 삼성물산은 위 자본시장법 시행령 규정을 근거로 제일모직 보통주식을 159,294원, 삼성물산 보통주식을 55,767원으로 보고..."
2023.10.01.,"킨텍스 제3전시장 발주 가시화, '6천억' 공사에 대형 건설사 총출동 전망","킨텍스 제1전시장은 삼성물산이, 제2전시장은 현대건설이 시공을 맡았다. 현재 시공능력평가 1·2위 건설사가 한국 대표 전시장을 지은 셈이다. 제1전시장은 삼성물산과 현대건설이 컨소시엄을 이뤘다. 제2전시장은 현대건설이 삼성물산을 이기고 수주에 성공해 건립했다. 건설업계는 주요 건설사들이..."
2023.10.01.,"국내 종합상사, 해외 친환경 사업에 집중",삼성물산 상사부문은 태양광 사업에 집중하고 있다. 삼성물산 상사부문의 미국 신재생에너지법인 삼성 C&T 리뉴어블스는 14일 미국 남부 텍사스주 3GW 규모 태양광·ESS(에너지저장장치) 프로젝트 매각 및 개발 서비스 계약을 체결했다. 3GW는 미국 기준 약 60만 가구가 연간 사용할 수 있는 발전 용량으로...
2023.10.01.,[코스피] 주간 외국인 순매수 TOP5 삼성전자·기아·포스코인터내셔널·SK텔레...,"그밖에 외국인 순매수 상위는 현대차 223억규모, KT 201억규모, HD한국조선해양 175억규모, 삼성물산 153억규모, STX 114억규모 순으로 나타났다. 한국거래소에 따르면 27일 코스피는 전 거래일 대비 2.10p(0.09%) 오른 2465.07에 거래를 마쳤다. 외국인은 273억원어치를 매도했다. 기관은 이날 798억원의..."
2023.10.01.,"""티내지 않는 럭셔리"" MZ도 반한 '올드머니룩' 뭐길래","삼성물산 패션부문이 운영하는 컨템포러리 브랜드 구호(KUHO)는 가을·겨울 시즌 대표 상품으로 '캐시미어 아이콘 코트'를 출시하기도 했다. 컬러는 올드머니룩을 대표하는 클래식한 블랙과 그레이를 비롯해 브라운, 카멜, 베이지 등으로 출시됐다. 모든 상품은 이태리 콜롬보사(社)의 고품질 캐시미어 100..."
2023.10.01.,"건설업계, 불황 속에도 상생 강화···동반성장 '청신호'",이번에 최우수 기업에 이름 올린 건설사는 △삼성물산 건설부문 △삼성엔지니어링 △자이씨앤에이 △포스코이앤씨 △한화 건설부문 △현대건설 △현대엔지니어링 △DL이앤씨 △GS건설 △SK에코플랜트 △효성중공업 등이다. 특히 SK에코플랜트(7년)를 비롯해 △현대엔지니어링(6년) △현대건설(5년)...
2023.10.01.,추석연휴 마무리...천가구 넘는 대단지 몰려온다,이 밖에도 삼성물산 컨소시엄은 11월 중 수원시 권선6구역 재개발을 통해 '매교역 팰루시드'를 분양할 예정이다. 총 2178가구 규모로 1234가구가 일반분양된다. 지방권 주요 단지로는 우미건설이 10월 울산광역시 '다운2지구'의 첫 민간분양 아파트로 선보이는 '울산 다운2지구 우미린 더 시그니처'가...
2023.10.01.,"이마트·홈플러스·롯데마트·코스트코 휴무일, 10월 1일(일) 대형마트 영업하...",홈플러스는 1997년 9월 삼성물산에서 홈플러스 1호점인 대구점을 열었다. 홈플러스는 최초의 매장을 대구광역시에 개점하는 등 주로 영남권에 매장을 개설했다. 설립 초기 수도권에 많은 매장을 출점한 이마트와 중복을 피해 영남권에서 우세를 점했다. 2000년대 중반 수도권 지역으로 영업지점을...
2023.10.01.,우리집은 ‘포스코향’ 난다…고급 아파트 향기 전쟁,"단지의 가치를 높일 수 있다는 판단에 하이엔드 브랜드를 찾는 조합원들도 늘어나고 있다. 예로 노량진1구역 재개발 조합은 지난달 열린 시공사 선정 현장설명회에서 입찰 조건 ‘하이엔드 브랜드 적용’을 내걸었다. 이날 설명회에는 GS건설과 현대건설, 삼성물산 등 7개 건설사가 참석했다."
2023.10.02.,"삼성 이재용 회장, 추석 명절에 사우디·이스라엘·이집트 현장 경영",이재용 삼성전자 회장이 1일 사우디아라비아 서북부 타북주에서 삼성물산이 참여하는 ‘네옴’ 신도시의 지하 터널 공사 현장을 점검하고 있다. 이 회장은 추석 연휴인 지난달 28일부터 이날까지 사우디와 이스라엘·이집트를 찾아 현지 사업장에서 근무 중인 임직원들을 격려하고 사업 확대 방안을...
2023.10.02.,"이재용 “중동, 삼성의 미래”···추석연휴 중동 3개국 방문","삼성전자는 이 회장이 지난 1일(현지시간) 사우디 서북부 타북주에서 삼성물산이 참여하는 친환경 스마트시티 네옴(NEOM) 산악터널 공사 현장을 점검했다고 2일 밝혔다. 네옴은 사우디가 구축하는 미래형 신도시로, 삼성물산은 네옴의 핵심 교통·물류 수단인 지하 철도 공사에 참여하고 있다. 삼성이 맡은 터널..."
2023.10.02.,[포토] 삼성 이재용 회장 (@중동),(사진=삼성전자)이재용 삼성전자 회장이 1일(현지시간) 사우디아라비아 서북부 타북주(州)에서 삼성물산이 참여하는 '네옴(NEOM)' 신도시의 지하 터널 공사 현장을 점검하고 있다.이재용 삼성전자 회장이 1일(현지시간) 사우디아라비아 서북부 타북주(州) '네옴(NEOM)' 신도시 건설 현장에 헬기로 도착해...
2023.10.02.,이재용 삼성회장 9월 보유 상장주식 12.8조원…작년말보다 10% 늘어,"이재용 회장은 삼성전자의 보통주와 우선주, 삼성물산, 삼성생명, 삼성에스디에스(삼성SDS), 삼성엔지니어링, 삼성화재의 주식을 소유하고 있다. 이재용 회장의 주식은 고(故) 이건희 회장으로부터 상속받은 물량이 상당수를 차지하고 있다. 이 회장이 보유한 주식 가운데 삼성전자 보통주가 1조2761억원..."
2023.10.02.,"[포토] 이재용 삼성전자 회장, 사우디 '네옴' 공사 현장 방문",이재용 삼성전자 회장이 1일(현지시간) 사우디아라비아 서북부 타북주에서 삼성물산이 참여하는 '네옴(NEOM)' 신도시의 지하 터널 공사 현장을 점검하고 있다. (제공: 삼성전자)
2023.10.02.,"[기획] 삼성·셀트리온·SK바사, 글로벌시장 정조준","또, 제품 포트폴리오 확장을 위해 지난 4월 삼성물산과 함께 조성한 '삼성 라이프 사이언스 펀드'를 통해 스위스 바이오기업인 '아라리스 바이오텍'에 투자했다. 삼성바이오로직스 자회사인 삼성바이오에피스는 바이오시밀러 사업을 영위하고 있다. 현재 항체치료제, 항암제, 면역질환치료제 등 6~7개..."
2023.10.02.,"10년째 해외서 명절 보내는 이재용 회장, ‘네옴시티’ 등 중동 3개국서 현장...","삼성물산 네옴 공사현장 찾아 임직원 격려 “중동은 미래 먹거리와 혁신 기회 가득한 보고(寶庫)” 이재용 삼성전자 회장이 올해 추석 명절 연휴에도 사우디, 이스라엘, 이집트를 방문해 삼성의 글로벌 사업장 최전선에서 근무하는 임직원을 격려하는 등 현장 경영 행보를 이어갔다. 이재용 회장은 지난..."
2023.10.02.,"10년째 명절 '현장 경영' 나선 이재용...""중동은 미래 먹거리 보고""",이재용 삼성전자 회장이 1일(현지시간) 사우디아라비아 서북부 타북주(州)에서 삼성물산이 참여하는 '네옴(NEOM)' 신도시의 지하 터널 공사 현장을 점검하고 있다. 이 회장은 추석 연휴인 지난 달 28일부터 이날까지 사우디와 이스라엘·이집트를 찾아 현지 사업장에서 근무 중인 임직원들을 격려하고 사업 확대...
2023.10.02.,"이재용 회장, 명절 현장 경영…사우디 등 중동 3개국 방문","이 회장은 1일(현지시간) 사우디 서북부 타북주에서 삼성물산이 참여하고 있는 친환경 스마트시티 '네옴(NEOM)' 산악터널 공사 현장을 점검했다. 작년 회장 취임 직후 아랍에미리트(UAE) 바라카 원전 건설 현장을 점검한 데 이어, 1년 만에 다시 중동 지역을 찾아 현지 사업을 살펴본 것이다. 스마트시티 '네옴'은..."
2023.10.03.,삼성 콘트롤타워 부활할까…지배구조 '촉각'[이재용 취임 1주년③],"이후 삼성전자(사업지원TF), 삼성생명(금융경쟁력제고TF), 삼성물산(EPC경쟁력강화TF) 등 3개사가 각각 태스크포스(TF)를 만들어 계열사들을 관리하고 있다. 이 TF 체제 출범으로 삼성은 계열사별 자율경영을 통한 권한과 책임 조율이 가능했다. 하지만 TF가 과거 미래전략실처럼 강한 실행력이 있는 조직이 아니기..."
2023.10.03.,"삼성물산, 건설로봇 확대에 495억원 출자","신기사 펀드 활용, 150억에 로보콘 인수…내달 6일 출자금 납입 삼성물산 건설부문이 건설현장 내 로봇의 활용범위를 넓히기 위해 적극적인 행보를 보이고 있다. 최근에는 로봇관련 스타트업을 인수하고 삼성벤처투자를 통해 로봇사업 관련 신기술사업투자조합에 출자도 단행했다. 삼성그룹 전반에서..."
2023.10.03.,"삼성, 해외 新사업 발굴 현장 행보","이 회장은 지난 1일 사우디 서북부 타북주에서 삼성물산이 참여하는 친환경 스마트시티 '네옴(NEOM)' 산악터널 공사 현장을 점검했다. 스마트시티 '네옴'은 사우디의 대규모 국가 개혁 프로젝트 '비전 2030' 일환으로 구축 중인 미래형 신도시로, 삼성물산은 '네옴'의 핵심 교통·물류 수단인 지하철도 공사에..."
2023.10.03.,"‘삼성전자’ 4분기 스퍼트… 추석 잊은 이재용, 반등 고삐 죄나",1일 사우디아라비아에선 헬기를 타고 삼성물산이 참여하고 있는 스마트시티 '네옴' 산악터널 공사 현장을 찾았다. 임직원들을 격려하고 경영진들과 비즈니스 확대 방안을 강구했다. 스마트시티를 표방하는 네옴엔 삼성의 첨단 IT·반도체 비즈니스 기회가 많을 것이란 관측이 나온다.매 명절마다 이 회장의...
2023.10.03.,"삼성 셀트리온도 뛰어든 블루오션, 항체약물접합체(ADC)시장 국내 유망주는","라이프 사이언스 펀드는 삼성바이오로직스와 삼성바이오에피스, 삼성물산이 출자한 펀드로 에임드바이오 이전 해외 기업에만 투자해왔다는 점에서 의미가 크다. 에임드바이오는 뇌종양의 일종인 '교모세포종'과 방광암에 대한 ADC 신약 후보물질 'AMB302'의 전임상 단계를 마치고 임상1상을 준비하고 있다...."
2023.10.03.,"""래미안 초코크림빵, 먹어봤어요?""",대형사 3곳(삼성물산 건설부문·SK에코플랜트·코오롱글로벌) 컨소시엄은 올 하반기 경기 수원 권선구 세류동 일원 '매교역 펠루시드' 분양을 앞두고 소비자와의 선제적인 소통을 위해 사전 홍보관 '웰컴라운지' 문을 열었다. 이 웰컴라운지는 매교역 펠루시드의 장점과 궁금한 점에 대해 공유하는 설문조사...
