날짜,제목,내용
2023.12.19.,"삼성물산, 부산시민공원 촉진 2-1구역 입찰 서류 누락…입찰 무효되나?","공사비 1조 원 규모 시공사 선정에 삼성물산-포스코이앤씨 경쟁 부산시민공원 촉진 2-1구역의 시공사 최종 선정을 앞둔 가운데 삼성물산이 입찰 서류 일부를 누락한 것으로 알려져 논란이 되고 있다. 해당 사업은 공사비만 1조 원 규모의 대형 사업으로, 지난 10월과 11월 2차례 유찰 뒤 마지막 입찰에..."
2023.12.19.,"""건설회사 브랜드평판 1위 현대건설, 2위 삼성물산, 3위 대우건설""","국내 건설회사 브랜드평판 '2023년 12월 빅데이터 분석'결과, 1위 현대건설 2위 삼성물산 3위 대우건설 순으로 분석됐다.​ 한국기업평판연구소는 19일, 2023년 11월 19일부터 2023년 12월 19일까지 건설회사 브랜드 30개의 빅데이터 22,612,978개를 분석해 소비자들의 브랜드 참여와 소통량과..."
2023.12.19.,"""준감위 2기, 삼성에 필요한 존재로…준법문화 체질화 성과""",한편 외국계 행동주의 펀드가 삼성물산(028260)을 상대로 주주환원 문제를 제기한 문제에 대해선 “아직 전달받지 못했다. 검토할 시간이 없었다”며 “필요한 부분이 있다면 의견을 전달하거나 권고할 것”이라고 말했다. 미국 행동주의 헤지펀드인 화이트박스 어드바이저스는 삼성그룹의 실질적 지주사...
2023.12.19.,해외 브랜드 성장 무섭네···삼성물산 패션 '나홀로 성장',"해외 상품 전문 이소란 부사장 선임 편집숍 등 브랜드 발굴 및 육성 인정 佛 '자크뮈스' 전년比 매출 170%↑ 전체 비중 30% 차지하며 매출 견인 삼성물산 패션부문이 해외 브랜드 사업 강화의 의지를 나타냈다. MZ세대가 선호하는 신규 수입 브랜드, 즉 '신(新)명품'의 선전에 실적 한파를 견딘 회사는 인사 조치를..."
2023.12.19.,"12/18 외국인 순매수 상위 종목 기술력, '고평가' HLB·삼성물산","삼성물산의 기술투자지수는 632.3, 기술력점수(TSS)는 380.1, 기업가치추정은 다소 고평가로 나타났다. 지난 15일 코스피 시장 외국인 순매수 상위 TOP10은 SK하이닉스, 삼성전자, 현대차, 기아, 두산로보틱스, NAVER, POSCO홀딩스, 포스코퓨처엠, 카카오, SK이노베이션 등 순으로 이름을 올렸다. 또 코스닥 시장..."
2023.12.19.,"삼성 500억, 현대차 350억…재계 이웃돕기 온정(종합)","삼성전자, 삼성디스플레이, 삼성SDI, 삼성전기, 삼성SDS, 삼성생명, 삼성화재, 삼성카드, 삼성증권, 삼성물산, 삼성엔지니어링, 제일기획, 에스원 등 23개 관계사가 참여해 연말 이웃사랑성금을 마련했다. 삼성은 우리 사회의 어려운 이웃과 함께 나누기 위해 사회복지공동모금회에 1999년부터 25년간..."
2023.12.19.,"오세철 사장의 첫 수주전... '부산 촉진2-1' 놓고, 삼성물산 VS 포스코이앤씨","철저한 선별수주 외친 삼성물산 부산 촉진2-1' 재개발 놓고 이례적 경쟁전 상대는 올해 돌풍의 주인공 '포스코이앤씨' 삼성물산, 신반포15·반포3주구 이후 첫 경쟁전 [시장경제=정규호 기자] 삼성물산 건설부문 오세철 사장. 사진=삼성물산 공사비만 1조원가 넘는 '부산 촉진2-1' 재개발을 놓고, 메이저..."
2023.12.19.,"[인터뷰] 英 팰리서 CIO ""삼성물산 지배구조 개편, 이재용도 이득""","'삼성물산 행동주의' 제임스 스미스 팰리서캐피탈 CIO 인터뷰 ""삼성물산, 내재가치 53조인데 시총 20조…할인율 63%"" ""신사업 투자 집중하고 비핵심 사업부 매각 검토 필요"" ""경영진 책임성 강화 위해 단일대표 체제로 개편해야"" ""지주사 전환 충분히 가능…회사와 건설적 대화 지속"" (서울=연합인포맥스) 김학성..."
2023.12.20.,"삼성물산, ‘부산시민공원 촉진2-1구역’ 입찰 무효되나",공사비 1조원 규모로 부산의 대표적 재개발 사업장인 ‘시민공원 주변 재정비촉진지구 촉진2-1구역’ 도시환경정비사업조합(촉진 2-1구역) 시공사 선정전에 뛰어든 삼성물산이 전자 입찰 과정에서 제출서류를 무더기로 빠뜨린 채 접수를 마쳐 논란이 일고 있다. 20일 촉진 2-1구역 조합 측에 따르면 최근 시공자...
2023.12.20.,"美 헤지펀드, 삼성물산 상대 KT&G 소송 전례 따를까 [넘버스]","미국 헤지펀드 화이트박스 어드바이저(Whitebox Advisors LLC)가 삼성물산을 상대로 KT&G와 동일한 전략을 택해 주주행동주의에 나설지 주목된다. 화이트박스는 올해 초 KT&G 상대로 주주행동주의를 전개하며 여러 건의 소송을 제기했다. 올해 2월 KT&G는 화이트박스, 플래시라이트 캐피탈 파트너스(Flashlight..."
2023.12.20.,"부락종합복지관, 삼성물산 가전제품 후원 받아","부락종합사회복지관(관장 정일준 바르톨로메오 신부)은 12월 4일 삼성물산(주)으로부터 가전제품을 전달받았다. 이날 삼성물산 관계자들은 부락종합복지관을 방문, 정일준 신부에게 평택 반도체 현장에서 작업 기간 중 현장 직원들이 숙소에서 사용했던 가전제품을 전달했다. 이날 받은 가전제품은 냉장고 17대..."
2023.12.20.,"삼성물산, '그린암모니아 사업' 위해 글로벌 기업들과 '맞손'",투데이코리아=진민석 기자 | 삼성물산이 다국적 기업과 맞손 잡고 오만의 그린암모니아 프로젝트에 참여해 친환경 시장 입지 공략에 나선다. 삼성물산 건설부문(이하 삼성물산)은 지난 13일 일본 마루베니와 오만 국영 에너지회사(OQ) 등 글로벌 다국적 기업들과 손잡고 컨소시엄을 구성해 오만 내 연간 100만t...
2023.12.20.,[건설회사 브랜드평판] 1위 현대건설·2위 삼성물산·3위 대우건설,"현대건설 로고 국내 건설회사 브랜드평판 2023년 12월 빅데이터 분석결과, 1위 현대건설 2위 삼성물산 3위 대우건설 순으로 분석됐다.​ 한국기업평판연구소는 2023년 11월 19일부터 2023년 12월 19일까지 건설회사 브랜드 30개의 빅데이터 22,612,978개를 분석하여 소비자들의 브랜드 참여와 소통량과..."
2023.12.20.,"2024년 패션 키워드 'WINDUP'... 삼성물산패션 ""올해 트렌드는 BREAKPOINT""","포쓰저널 반지수 기자 2024년 패션시장 키워드 WINDUP /삼성물산패션 삼성물산패션이 내년 패션 키워드로 'WINDUP(마무리짓기)'을 제시했다. 올해 이슈는 'BREAKPOINT(중단점)'로 정리했다. 20일 임지연 삼성패션연구소장은 ""경기불황이 장기화 조짐을 보이며 불안한 성장을 지속해온 패션..."
2023.12.20.,"②-삼성패션연구소, 2023년 패션 10대 이슈?!",일찍이 신명품 브랜드를 중심으로 체질 개선 작업을 진행한 삼성물산 패션부문은 올해 ‘자크뮈스(Jacquemus)’ ‘스튜디오 니콜슨(Studio Nicholson)’ ‘가니(Ganni)’ 등 3대 신명품 확대에 주력하며 포트폴리오를 강화했다. 한섬은 ‘가브리엘라허스트(Gabriela Hearst)’ ‘베로니카비어드(Veronica Beard)...
2023.12.20.,"반포3주구, 삼성물산 신용보강에 2000억 추가 조달",부지의 사업성과 더불어 시공사인 삼성물산의 높은 신용도가 받쳐준 결과다. 19일 정비업계에 따르면 반포3주구 재건축 조합은 KB증권으로부터 2000억원의 자금을 조달했다. 이를 위해 KB증권은 PF대출채권을 유동화회사인 뉴스타반포3제일차유동화전문회사에 맡기고 ABS(유동화사채)를 발행해 자금을...
2023.12.20.,국민연금 기금운용에 드러난 '지는 물산&뜨는 모직' 공감대,뉴시스 더피알=한민철 기자 ｜ 삼성 측은 삼설물산과 제일모직의 합병 명분을 '당시 삼성물산의 사업 및 실적 부진과 이로 인한 주가 하락 상황에 대해 제일모직과의 사업 시너지를 통한 타개'로 들었다. 당시 국민연금의 두 회사 지분 보유 상황을 보면 삼성물산의 부진과 제일모직의 상승세라는 상황에...
2023.12.20.,"[모닝픽] 삼성물산, 베트남 년짝 4 화력발전소 발전기 공식 설치","◇삼성물산, 베트남 년짝 4 화력발전소 발전기 공식 설치 삼성물산은 19일(현지시간) 베트남 동나이성 년짝(Nhon Trach) 지역에 위치한 년짝 4 화력발전소에 발전기를 공식적으로 설치했다고 밝혔다. 이 프로젝트는 베트남 정부가 추진하는 중요한 국가 프로젝트로, 총 투자액이 14억 달러에 달한다...."
2023.12.21.,"삼성물산 패션, 겨울 시즌 스타일과 보온성 갖춘 '방한템' 제안",삼성물산(028260) 패션부문은 21일 추운 날씨에도 개성을 살리고 힙한 감성을 더할 수 있는 패션 아이템으로 보온성과 스타일을 동시에 갖춘 방한 액세서리를 제안했다. 올겨울은 평년보다 따뜻하다가도 갑자기 추워지는 이상 기온 현상이 훨씬 두드러질 것이라는 전망이 나온다. 이에 겨울 시즌 필수 아이템으로...
2023.12.21.,"이재용과 나란히 사장됐던 삼성家 이부진, '부회장' 타이틀 언제 달까 [유미의...","그러면서 ""삼성그룹이 2015년 7월 삼성물산과 제일모직을 합병하며 삼성물산을 사실상 지주회사로 한 지배구조를 만들면서 이재용 회장을 중심으로 한 경영 승계 구도가 확고해졌다""며 ""이부진 사장이 그간 부회장 승진을 하지 않는 것도 오빠인 이재용 회장과 같은 직급이 되면 부담스러운 측면이..."
2023.12.21.,삼성물산·LF·나이키·폴로 등 할인 정보 '패션넷'에서 제공,"산업부·한국섬유산업연합회·한국패션산업협회, 할인 정보 안내 서비스 삼성물산·이랜드월드·LF·형지에스콰이어 등 45개 국내 패션기업(매출 1000억 원 이상 패션기업·국내 대표 제화 브랜드)과 나이키·폴로 랄프로렌 등 10개 해외 패션기업의 할인 정보가 22일부터 섬유·패션 종합 정보 플랫폼 패션넷..."
2023.12.21.,[kfe 人 ceo] '60세 룰' 깬 오세철 삼성물산 사장,사진=삼성물산 한국금융경제신문=오아름 기자 | 오세철 삼성물산 건설부문(삼성물산) 사장이 '60세 룰(세대교체를 위해 60세 이상 임원은 2선으로 물러난다)'을 깨고 두번째 임기를 수행하게 된다. 업계는 오 사장 임기 동안 달성한 호실적이 이번 연임 성공에 긍정적 요인으로 작용했다고 분석했다. 오...
2023.12.21.,"이준서 삼성물산 패션부문장, 올해도 실적 기록 깬다","적자를 냈던 사업부문을 맡아 한 해만에 1000억 원 이상의 영업이익을 올린 이준서 삼성물산 패션부문장이 지난해에 이어 올해도 최대 매출을 써낼지 주목된다. 21일 데이터뉴스가 금융감독원 전자공시시스템에 공시된 삼성물산의 분기보고서를 분석한 결과, 이 회사의 패션부문은 올해 1~3분기 1조5058억..."
2023.12.21.,사우디 네옴시티 '더라인' 추가 발주 나온다…삼성물산·현대건설·대우건설 ...,이미 해당 사업에 참여하고 있는 삼성물산과 현대건설을 비롯해 대우건설 등 우리 건설사가 큰 관심을 보이고 있다. 21일 중동 건설전문지 미드(MEED) 및 관련 업계에 따르면 네옴은 올해 말 더라인 프로젝트와 관련해 12개 공사 패키지의 입찰을 순차적으로 실시할 예정이다. 이번에 나오는 패키지로는...
2023.12.21.,"검찰 vs 삼성, 엇갈리는 주장…확인된 '타임라인'은 이렇다","문 : 국민연금은 2015년 6월 11일 삼성물산과 본건 합병에 대해 미팅했죠. 답 : 네. 문 : 국민연금 리서치팀의 신○○ 차장 알고 계시죠? 답 : 네, 알고 있습니다. 문 : 신○○ 차장이 삼성물산 IR팀의 이□□ 과장에게 전화해 '책임투자팀에서 삼성물산 담당자들을 만나고 싶어 한다'면서 미팅 어레인지를 하는 6월..."
2023.12.21.,"[시황] 국내증시, 양도세 완화에도 하락…삼성전자 2년 만에 '75층' 진입",이 외에도 △기아(0.42%) △셀트리온(0.75%) △삼성물산(0.16%) 등이 강세를 보였다. 상승세를 이어가던 △에코프로머티(-2.98%) △두산로보틱스(-2.22%)는 주춤했다. 코스닥 지수는 기관의 매도세가 몰리면서 3거래일 만에 하락 마감했다. 21일 코스닥은 전 거래일 대비 0.41%(3.54포인트) 내린 859....
2023.12.21.,"코스피, '대주주 양도세' 완화에도 하락 마감…외국인 삼성전자·포스코DX·알...","(51억원), 삼성물산(50억원), 위메이드(49억원), 대한항공(47억원), 카카오(44억원), 나노신소재(43억원) 등이다.또한 외국인 순매도 상위 종목은 두산로보틱스(413억원), 삼성SDI(349억원), 에코프로(300억원), SK하이닉스(292억원), 한화솔루션(147억원), LG에너지솔루션(135억원), 포스코홀딩스(127억원)..."
2023.12.22.,"삼성물산 패션, 겨울 시즌 스타일·보온성 갖춘 '방한템' 제안",삼성물산 패션부문은 추운 날씨에도 개성을 살리고 힙한 감성을 더할 수 있는 패션 아이템으로 보온성과 스타일을 동시에 갖춘 방한 액세서리를 제안한다고 22일 밝혔다. 올겨울은 평년보다 따뜻하다가도 갑자기 추워지는 이상 기온 현상이 훨씬 두드러질 것이라는 전망이 나온다. 이처럼 급작스러운 기후...
2023.12.22.,"삼성물산 컨소, 수원 '매교역 팰루시드' 모델하우스 개관[집슐랭]","삼성물산 건설부문·SK에코플랜트·코오롱글로벌 컨소시엄은 경기 수원시 권선구에 '매교역 팰루시드' 모델하우스를 열었다고 22일 밝혔다. 수원시 권선 113-6구역을 재개발해 짓는 매교역 팰루시드는 지하 2층~지상 최고 15층, 32개동, 총 2178가구로 조성된다. 이 중 일반분양 물량은..."
2023.12.22.,행동주의 펀드 '공습'…삼성 지배구조 정점 겨눴다,미국계 사모펀드인데 2015년 삼성물산과 제일모직 합병 때 반대하면서 주주총회에서 더 많은 표를 확보하기 위해 삼성 측과 치열한 위임장 확보 대결을 벌인 바 있다. 삼성은 합병 전 삼성물산의 최대주주였던 국민연금의 찬성을 등에 업고 승리했지만 다른 한편으로는 고통의 서막이었다. 추후 특검 수사...
2023.12.22.,[영상] 네옴시티 추가 발주…삼성물산·현대건설·대우건설 ‘물망’,"최근 주요 국내외 건설사를 대상으로 진행한 사업 설명회에서 우리 건설사 가운데서는 삼성물산과 현대건설, 대우건설 등이 이 자리에 참석해 관심을 보였습니다. 자세한 내용은 더구루 홈페이지에서 만나보실 수 있습니다. ◇ 더구루 인사이트 영상보기 ◇ 상세 기사 사우디 네옴시티 '더라인' 추가 발주..."
2023.12.22.,"[특징주] 삼성전자, 반도체 기대감에 주가 나흘째 상승…52주 신고가 행진","삼성생명의 최대주주는 삼성물산으로 지분 19.34%를 갖고 있다. 삼성물산의 최대주주는 이재용 회장으로 보통주 지분 18.10%를 소유하고 있다. 국민연금공단은 올해 3분기까지 삼성전자 주식 1034만여주를 매각해 지분을 낮췄다. 삼성전자는 외국인의 비중이 53.9%, 소액주주 비중이 67%에 달한다. 김대성..."
2023.12.22.,"'사법리스크' 삼성전자, ESG지수 제외…고민 깊어진 연기금투자풀",이재용 삼성전자 회장은 지난달 17일 최대 주주였던 제일모직과 삼성물산이 합병하는 과정에서 합병 비율 왜곡과 삼성바이오로직스 회계장부 조작이 있었다는 혐의로 검찰에서 징역 5년과 벌금 5억원을 구형받았다. 내년 26일 1심 선고가 나올 예정이다. ESG등급으로만 따지면 한국ESG기준원은 올해...
2023.12.22.,"[더벨]삼성물산이 찜한 '메디히어', 미국 플립 추진",그동안 삼성물산이 처음 투자한 디지털 헬스케어 기업으로 주목받았다. 국내 원격의료 규제가 쉽사리 풀리지 않고 있는 가운데 미국 사업 성과가 가시화 되자 내린 결정으로 보인다. 21일 벤처캐피탈(VC) 업계에 따르면 메디히어는 미국으로 플립을 진행 중이다. 플립은 국내 스타트업이 해외로 본사를...
2023.12.22.,"삼성전자, 외국인·기관은 1조 원어치 사고 개인은 1조 팔았다","2~10위는 기아, 포스코DX, HLB, 에코프로비엠, 알테오젠, 한진칼, 삼성물산, 삼성바이오로직스, LG에너지솔루션이었다. 외국인의 순매도 상위 10개 종목은 SK하이닉스(924억 원), POSCO홀딩스(612억 원), 두산로보틱스(501억 원), NAVER(478억 원), KB금융(373억 원), 삼성SDI(336억 원), 포스코인터내셔널..."
2023.12.22.,"총수 부재 시 삼성·SK·현대차·LG, '플랜B' 있을까",또 이부진 사장은 삼성전자 지분 0.82%에 실질적인 지주사인 삼성물산 지분도 6.23%로 이재용 회장 다음으로 많이 보유하고 있다. 재계 관계자는 “과거에 삼성의 오너가들은 예기치 못한 돌발 상황에 대비해 같은 비행기를 타지 않는다는 속설이 있을 정도로 플랜B를 염두에 둔 행보를 보인 바 있다”고...
2023.12.23.,"컨소시엄 단지 인기 속… 삼성물산 컨소시엄, '매교역 팰루시드' 선보여","이 단지는 삼성물산 건설부문, SK에코플랜트, 코오롱글로벌이 경기 수원 권선113-6구역을 재개발해 지하 2층~지상 최고 15층, 32개동, 총 2,178가구로 들어서며 이 중 1,234가구를 일반에 분양한다. 매교역 팰루시드는 여러 수요층의 기호에 맞춰 소형부터 대형까지 다양한 타입의 단위세대로 구성된다...."
2023.12.23.,[코스피 주간동향] 외국인 순매수 상위권 종목…삼성전자·기아·한진칼 등,"한진칼의 이번 주 거래대금 순매수는 314억6782만1000원, 거래량 순매수는 45만2528주다. 뒤이어 삼성물산과 삼성바이오로직스 거래대금(거래량) 순매수는 각각 263억3152만9700원(20만5457주), 260억8299만6000원(3만6561주)으로 나타났다."
2023.12.23.,떴다 하면 주가 '上上'…행동주의는 개미의 영웅? 성적표 보니,22일 삼성물산은 전 거래일보다 700원(0.55%) 내린 12만7600원으로 거래를 마쳤다. 일부 차익실현 매물이 출회되며 주가가 하락했으나 최근까지 행동주의 펀드들의 타겟이 되면서 주가가 상승했다. 지난 14일엔 13만5000원까지 올라가며 52주 신고가를 찍었다. 삼성물산에 행동주의를 펼치는 곳은 글로벌...
2023.12.23.,[삼성그룹] 시가총액 6조2240억원 증가...삼성엔지니어링 2.72% 상승 '주목',4%)▲9위 삼성카드 3만2350원(0.15%)▲10위 삼성생명 7만1500원(0%)▲11위 삼성SDI 45만500원(-0.11%)▲12위 삼성중공업 7500원(-0.27%)▲13위 삼성증권 4만400원(-0.37%)▲14위 에스원 6만1700원(-0.48%)▲15위 삼성물산 12만7600원(-0.55%)▲16위 삼성화재 25만5500원(-0.58%)▲17위 호텔신라 6만4700원(-0.77%)
2023.12.23.,"미국, 자국 청정수소 생산 지원 기준 발표…정부 ""韓기업 진출 본격화""",삼성물산 건설부문이 경북 김천에 지을 예정인 태양광발전 연계 청정수소 생산기지 조감도. (사진=삼성물산 건설부문) 23일 산업통상자원부에 따르면 미국 재무부·국세청은 22일(현지시간) IRA 청정수소 생산 세액공제 잠정 가이던스를 발표했다. 미국 정부·의회는 지난해 8월 청정에너지에 대한 대규모...
2023.12.23.,'매교역팰루시드' 등 1만590가구 분양예정[분양캘린더],"삼성물산·SK에코플랜트·코오롱글로벌 컨소시엄은 경기 수원시 세류동 일원에서 주택재개발을 통해 '매교역팰루시드'를 분양한다. 지하 2층~지상 최고 15층, 32개동, 총 2178가구 중 전용면적 48~101㎡, 1234가구를 일반분양한다. 지하철 수인분당선 매교역 역세권이며, KTX·GTX-C(예정)·지하철 1호선이..."
2023.12.23.,"월패드에 소음알람 뜨고, 신공법 연구도…‘층간소음 줄이기 경쟁’ 격화","[이승식/삼성물산 층간소음연구소 부소장 : ""기둥, 보, 슬래브로 이뤄진 라멘식 세대고요. (실제로 그렇게 지어놓은 공간인거죠?) 실제로 그렇게 지어놨고요. 라멘식 세대에서의 층간소음 특성, 효과를 알아보기 위해서…""] 소음을 줄이는 확실한 방법은 바닥 콘크리트 슬래브를 두껍게 하는 거지만 그만큼 비용이..."
2023.12.23.,"롯데건설, 11월 '사회공헌' 관심도 1위…포스코이앤씨·SK에코플랜트 순","정보량 순으로 ▲롯데건설 ▲포스코이앤씨 ▲SK에코플랜트 ▲HDC현대산업개발▲대우건설 ▲한화 건설부문 ▲GS건설 ▲DL이앤씨 ▲삼성물산 건설부문 ▲현대건설 ▲현대엔지니어링 ▲호반건설 등이다. DL이앤씨, SK에코플랜트, GS건설과 같이 사명에 알파벳이 들어가는 경우 각각 ‘디엘이앤씨’..."
2023.12.23.,올해 마지막 분양시장…다음주 전국 8551가구 청약 접수,"단지가 들어서는 평택 브레인시티는 첨단산업단지를 비롯해 대학과 대규모 주거시설, 상업시설 등이 갖춰질 전망이다.같은 날 삼성물산은 경기 수원시 권선구 세류동 일원에 건립되는 '매교역 팰루시드'의 1순위 청약 접수를 받는다. 지하 2층~지상 15층 32개 동, 총 2178가구 중 전용면적 48~101..."
2023.12.23.,대단지 아파트 5년간 2.6억 원 오를 때 소규모 단지는 1.8억 원에 그쳐,"경기도 수원에서는 삼성물산 건설부문이 SK에코플랜트, 코오롱글로벌과 컨소시엄을 맺고 총 2178가구 규모의 ‘매교역 팰루시드’를 연내 분양한다. 이 중 1234가구를 일반에 분양하는 이 단지는 지하철 수인분당선 매교역세권에 위치하며 GTX-C노선이 개통 예정인 수원역과 1정거장 거리로 이용이..."
2023.12.24.,[2023 서초동 명장면]①재판서 '울컥' 이재용 삼성 회장·'만세' 이용수 할머...,안정적인 경영권 승계를 위해 삼성물산과 제일모직의 합병에 부당하게 관여한 혐의 등으로 2020년 기소된 이 회장은 총 106차례 재판을 받았다. 지난해 10월 27일 회장으로 취임한 당일에도 그는 취임행사 대신 서울중앙지법에 모습을 드러냈다. 이 회장의 1심 선고 결과는 내년 1월 26일 나올 예정이다. [서울...
2023.12.24.,"[분양레이다] 삼성물산 컨소시엄, '매교역 팰루시드'...'역세권' 2000여 가구...",경기 수원 매교역 일대 구도심에 약 2000여 가구 대단지가 들어섭니다. 교통·교육·상권 등 다양한 생활 인프라를 갖춘 것이 특징입니다. 전형섭 기자가 현장 취재했습니다. [기자] 경기 수원 권선구 세류동 일대에 새롭게 들어서는 아파트의 견본주택 현장. 방문객들이 단지 모형도를 살펴보고 세대 내부...
2023.12.24.,[코스피] 외국인 순매수 TOP5 삼성전자·HMM·삼성바이오로직스·한진칼·KT,"이밖에 외국인 순매수 상위는 삼성물산 68억원규모, DB하이텍 67억원규모, 한올바이오파마 45억원규모, 카카오 39억원규모, SK이노베이션 38억원규모 순으로 높게 나타났다. 한국거래소에 따르면 코스피는 전 거래일 대비 0.51포인트(0.02%) 내린 2599.51에 장을 마감했다. 투자자별로 개인과..."
2023.12.24.,"건설사들 인도네시아 수도 이전 사업 수주 준비, 대선 결과는 사업 추진 변수","<행정중심복합도시건설청 인도네시아 공공사업주택부 신수도 인프라태스크포스> 인도네시아 신수도사업의 진행 상황을 삼성물산 건설부문과 현대건설, 대우건설이 주시하고 있다. 삼성물산과 대우건설은 인도네시아 수도 이전 뒤 진행될 6개 위성도시사업 수주를 위한 군불을 때고 있다. 다만 내년 현지..."
2023.12.24.,[2023 건설 결산] 국내 침체로 해외로 시선을 돌리다,"◆'굴지 1위' 해외사업 선망 영업익 창출…'업계 맏형'도 해외에 주력 삼성물산 건설부문(이하 삼성물산)은 여타 다른 건설사와는 달리 경기 침체에도 불구, 높은 영업이익을 바탕으로 선방하는 데 성공했다. 실제 2022년 매출과 영업이익에 있어 각각 전년대비 32.8%, 248.6% 증가한 삼성물산은 올 3분기..."
2023.12.24.,[삼성그룹 주간동향] 한주간 시총 16조8350억 증가...삼성엔지니어링 주간 상...,31%)▲10위 삼성SDI 45만500원(-0.44%)▲11위 삼성증권 4만400원(-0.49%)▲12위 삼성FN리츠 5000원(-0.99%)▲13위 삼성물산 12만7600원(-1.31%)▲14위 삼성전기 15만1300원(-1.37%)▲15위 삼성화재 25만5500원(-1.73%)▲16위 호텔신라 6만4700원(-1.97%)▲17위 삼성중공업 7500원(-5.78%)
