날짜,제목,내용
2023.06.01.,"“아모레퍼시픽, 중국·면세 부진”...하나證, 목표가 하향 [오늘, 이 종목]","20만원서 17만원으로 대폭 낮춰 하나증권은 1일 아모레퍼시픽에 대해 “국내 리오프닝 효과를 기대하지만 중국과 면세 관련 매출이 부진할 것”이라고 평가하며, 투자의견은 ‘매수’ 유지, 목표주가는 기존 20만원에서 17만원으로 하향했다. 하나증권은 2023년 아모레퍼시픽의 매출을 전년 동기 대비 3..."
2023.06.01.,"아모레퍼시픽 바이탈뷰티, ‘메타그린 슬림업 X 마이멜로디’ 에디션 출시",아모레퍼시픽의 이너뷰티 브랜드 '바이탈뷰티'가 60일분 구성의 '메타그린 슬림업 X 마이멜로디' 두 번째 에디션을 선보인다고 1일 밝혔다. 이번 에디션은 장기간 섭취를 원하는 고객들의 의견을 반영해 기존 컬래버레이션 제품의 2배 용량인 60일분 구성으로 출시한다. 지난달 판매했던 핑크색 패키지의...
2023.06.01.,"""아모레G, 中 비중이 직접적이지 않아 리스크가 낮다""","하나증권은 1일 아모레G에 대해 대형사 중 내수 비중이 가장 높아 방한 관광객 유입에 따른 실적 개선 효과가 가장 유의미할 것으로 기대하며, 아모레퍼시픽 그룹의 비중국 확대 전략 측면에도 이니스프리/에뛰드/에스쁘아 등의 중저가 브랜드가 핵심이 될 것으로 판단한다. 또한 중국 비중이 직접적이지..."
2023.06.01.,"'아모레 장녀' 서민정, 재단에 이니스프리 지분 '수증'…왜?",서경배 아모레퍼시픽그룹 회장의 장녀인 서민정 아모레퍼시픽 럭셔리브랜드 디비전 AP팀 담당이 최근 아버지가 운영하고 있는 재단에 이니스프리 주식을 수증하면서 그 이유에 관심이 쏠린다. 1일 금융감독원 전자공시시스템에 따르면 서 담당은 이날 이니스프리 주식 4만4450주(18.18%) 가운데 2만3222주(9.5%)를...
2023.06.01.,"외국인 투자자, 8일만에 아모레·LG생건 '매수'","그동안 하락으로 아모레퍼시픽은 10만 원대 이하로, LG생활건강은 50만 원대 이하로 내려갈 위험수준까지 다다랐지만 오늘 반등으로 아모레퍼시픽은 104,900원으로, LG생활건강은 536,000원으로 각각 거래를 마쳤다. 특히 아모레퍼시픽과 LG생활건강에 대해 기관투자자와 외국인 투자자들은 비슷한 투자..."
2023.06.01.,"외국인 투자자, 아모레·LG생건 주식 던졌다!",이들은 그동안 아모레퍼시픽과 LG생활건강 등 대형 종목에 대한 투자 비중을 낮추고 OEM과 중견 종목에 투자하고 있는 것으로 분석됐다. OEM 종목의 경우 한국콜마가 국내 증권사 애널리스트를 영입하면서 외국인 투자자를 대상으로 적극적인 홍보활동을 전개하고 있지만 증가률이...
2023.06.01.,"아모스, 일본 헤어 디자이너 교류 파티 공개","HBD 한일 디자이너 교류 행사 공식 후원 지난 5월 30일, 아모레 본사 5층에서 개최 관계자 150여명 참석, 글로벌 진출 계획 발표 [시장경제=최지흥 기자] 아모스프로페셔널이 5월 30일 아모레퍼시픽 세계본사 5층 아모레가든에서 진행된 한일 헤어 디자이너 교류 파티 'HBD; Happy Bridges Day' 행사 현장을 6월 1일..."
2023.06.01.,‘미술시장과 창작’…제9회 미술사학대회 3일 개최,"한국미술사학회는 3일 오전 10시 반부터 서울 용산구 아모레퍼시픽미술관 대강당에서 제9회 미술사학대회 ‘미술시장과 창작’을 개최한다고 밝혔다. 이번 학술대회는 서양미술사학회, 한국미술사교육학회, 한국미술이론학회가 공동으로 주최하고 한국연구재단과 아모레퍼시픽미술관 후원으로 열린다. 이번..."
2023.06.01.,"'찍고 바르고' 뷰티주…ODM·중소형사 주가만 '훨훨', 왜?","이 기간 아모레퍼시픽과 LG생활건강이 각각 15%, 13.3% 하락한 것과 대비된다. 증권업계는 대형사의 높은 중국 시장 의존도를 지적했다. 한중관계 악화와 중국인들의 자국 제품 선호도 심화가 대형사의 실적 부진이라는 결과를 낳았다는 평가다. 아모레퍼시픽은 LG생활건강의 1분기 영업이익은 전년 동기..."
2023.06.01.,"[패션·뷰티 투데이]효성티앤씨 폐어망 섬유, 아웃도어 의류로 재탄생 外","◇바이탈뷰티, ‘메타그린 슬림업 X 마이멜로디’ 두 번째 에디션 출시 아모레퍼시픽 이너뷰티 브랜드 ‘바이탈뷰티’가 60일분 구성의 ‘메타그린 슬림업 X 마이멜로디’ 두 번째 에디션을 선보인다. 5월 1일 출시한 ‘메타그린 슬림업 X 마이멜로디’ 첫 번째 에디션은 출시와 동시에 올리브영 전체..."
2023.06.02.,"아모레퍼시픽 스킨유, 샤워젤·스크럽 신제품 선봬",아모레퍼시픽 바디 케어 브랜드 스킨유(SKIN U)가 샤워젤과 스크럽 신제품을 출시하고 브랜드 모델 신세경과 광고 캠페인을 전개한다고 2일 밝혔다. 이번에 선보이는 스킨유 샤워젤 2종(선셋 오랑쥬·오드 플로럴)은 고밀도 크림 향수 거품으로 24시간 잔향을 느끼게 해주는 기존 스킨유의 장점은 그대로...
2023.06.02.,[브리핑] 아모레퍼시픽·애경산업·LF·이랜드,"포쓰저널 서영길 기자 /아모레퍼시픽 ◇ 아모레퍼시픽 스킨유, 샤워젤·스크럽 신제품 출시 아모레퍼시픽은 바디케어 브랜드 스킨유가 샤워젤과 스크럽 신제품을 출시하고 브랜드 모델 신세경과 광고 캠페인을 전개한다고 2일 밝혔다. 스킨유 샤워젤 2종(선셋 오랑쥬·오드 플로럴)은 고밀도 크림 향수..."
2023.06.02.,[주간#신상태그] 아모레퍼시픽·레고그룹·롯데호텔 외,이번 주 뷰티·패션 및 유통·호텔업계 소식. 에뛰드에서 순정 시카 카밍 앰플 에센스를 새롭게 출시한다. '순정 시카 카밍 앰플 에센스'는 예민해진 피부를 촉촉하고 순하게 진정시켜주는 저자극 비건 포뮬러로 수분과 진정 집중 케어하는 앰플 에센스이다. 손상 피부 집중 진정에 도움을 주는 Advanced Cica™는...
2023.06.02.,아모레퍼시픽이 평가한 이니스프리 가치는 2860억,아모레퍼시픽그룹과 서경배과학재단이 이니스프리의 기업가치를 2860억원으로 책정했다. 이니스프리는 서민정 아모레퍼시픽 럭셔리브랜드 디비전 AP팀 담당이 지난 1일 보유하던 회사 지분 2만3222주를 서경배과학재단에 매각했다고 2일 공시했다. 전체 지분의 9.5% 규모다. 서민정 담당은 서경배...
2023.06.02.,"[패션·뷰티 투데이] 아모레 스킨유, 신세경 앞세워 신제품 선봬 外","◇스킨유, 신제품 출시하고 모델 신세경과 캠페인 전개 아모레퍼시픽은 자사 바디 케어 브랜드 스킨유(SKIN U)가 이노센트 라인의 샤워젤과 스크럽 신제품을 출시하고 브랜드 모델 신세경과 광고 캠페인을 전개한다고 밝혔다. 이번에 선보이는 스킨유 샤워젤 2종(선셋 오랑쥬, 오드 플로럴)은 여름에..."
2023.06.02.,화장품 대장주 교체 위기? 'OEM·중견주 주도',최근 화장품 투자자들은 기존의 아모레퍼시픽이나 LG생활건강 등 대장주에 대한 관심이 낮아진 반면 OEM이나 중견 종목에 집중하는 경향이 나타나고 있다. 지난해까지만 해도 아모레퍼시픽이나 LG생활건강이 투자자들의 관심을 집중시키고 전반적인 주가 상승과 하락에 높은 영향력을 행사했다. 그러나...
2023.06.02.,"LG생활건강, 창사 이래 첫 희망퇴직 실시","지난해 LG생활건강 매출은 7조5168억원으로 전년 대비 4.6% 증가했지만, 같은 기간 영업이익은 1조2896억원에서 7111억원으로 44.8% 감소했다. 앞서 코로나 여파로 실적 부진을 겪은 아모레퍼시픽(090430)도 2020년 창사 이래 처음으로 근속 만 15년 차 임직원을 대상으로 희망퇴직을 실시했다."
2023.06.02.,“여름은 노출의 계절” 다이어트 기능식품 판매 70% 폭증,그 중에서도 인기가 많은 슬리밍 제품을 살펴보면 아모레퍼시픽에서 만든 체중관리용 건강기능식품인 바이탈 뷰티 메타그린 슬림업과 ‘신봉선 다이어트’로 잘 알려진 건기식인 콜레올로지 등을 꼽을 수 있다. 식사 후 체지방 관리를 위해 먹는 제품인 메타그린 슬림업의 경우 1초에 3정씩 팔린다는 말이...
2023.06.02.,"[A 유통가 소식] 유니클로, 일주일간 '유니클로 여름 감사제' 진행 外","사진=아모레퍼시픽 ◇스킨유, 모델 신세경과 캠페인 전개=아모레퍼시픽 바디 케어 브랜드 스킨유(SKIN U)가 이노센트 라인의 샤워젤과 스크럽 신제품을 출시하고 브랜드 모델 신세경과 광고 캠페인을 전개한다. 이번에 선보이는 스킨유 샤워젤 2종(선셋 오랑쥬, 오드 플로럴)은 여름에 어울리는 시트러스..."
2023.06.02.,"스킨유, 샤워젤·스크럽 신제품 선봬…스킨푸드, 캐릭터 머핀앤너츠와 협업 패...","스킨유 모델 신세경과 신제품 ⓒ사진 제공=아모레퍼시픽 스킨유, 신제품 출시하고 신세경과 캠페인 전개 아모레퍼시픽 바디 케어 브랜드 스킨유(SKIN U)는 샤워젤과 스크럽 신제품을 출시하고 브랜드 모델 신세경과 광고 캠페인을 전개한다고 2일 밝혔다. 이번에 선보이는 스킨유 샤워젤 2종(선셋 오랑쥬, 오드..."
2023.06.03.,[브리프] 아모레퍼시픽 LG생활건강 이랜드 LF 무신사,"■ 아모레퍼시픽, '메타그린 슬림업 X 마이멜로디' 두 번째 에디션 출처=아모레퍼시픽 아모레퍼시픽 대표 이너뷰티 브랜드 바이탈뷰티가 60일분 구성의 '메타그린 슬림업 X 마이멜로디' 두 번째 에디션을 선보인다. 지난 5월 1일 출시한 '메타그린 슬림업 X 마이멜로디' 첫 번째 에디션은 출시와 동시에..."
2023.06.03.,"[Daily Pick유통] 삼립, 11번가, 아모레퍼시픽, 풀무원, 위메프 外","아모레퍼시픽 스킨유, '샤워젤', '스크럽' 아모레퍼시픽의 바디 케어 브랜드 스킨유가 이노센트 라인의 샤워젤과 스크럽 신제품을 출시한다. 사진=아모레퍼시픽 아모레퍼시픽의 바디 케어 브랜드 스킨유가 이노센트 라인의 샤워젤과 스크럽 신제품을 출시한다. 스킨유 샤워젤 2종 '선셋 오랑쥬', '오드 플로럴..."
2023.06.03.,[코스피 공매도 잔고비중 TOP5] 롯데관광개발·후성·두산퓨얼셀·OCI홀딩스·...,"지난달 31일 기준 코스피시장에서 공매도 잔고 비중이 높은 5개 종목은 롯데관광개발, 후성, 두산퓨얼셀, OCI홀딩스, 아모레퍼시픽 등으로 나타났다. 한국거래소에 따르면 지난달 31일 기준 공매도 잔고비중은 롯데관광개발 9.48%, 후성 5.65%, 두산퓨얼셀 5.18%, OCI홀딩스 4.69%, 아모레퍼시픽 4.28..."
2023.06.03.,[#유통365] AI가 골라준 아모레 '맞춤형 화장품',아모레퍼시픽 용산 본사에 설치된 톤워크 부스. / 사진=한다원 기자 아모레퍼시픽이 맞춤형 메이크업 전문 브랜드 '톤워크(TONEWORK)'를 출시했다. 인공지능(AI) 기술을 기반으로 각자 피부 색상에 최적화된 베이스 메이크업 제품을 총 600가지 옵션으로 만나볼 수 있다. 보통 한국 사람들은 본인의 호수를 '21호...
2023.06.03.,"미래에셋증권, 6월 첫째주 SK바이오팜 등 55종목 매수 추천","아모레퍼시픽(090430) 1분기 매출액 9137억원(YoY -22%), 영업이익 644억원(YoY -59%). 면세와 중국, 주요 채널이 YoY -50% 내외 대폭 축소. 투자 포인트 : 2분기 이익 하향이 불가피하나 매출 기준 개선은 긍정적. 목표주가 16만원과 투자의견 매수 신규 개시. F&F(383220) 1분기 매출액 4974억원(YoY +14%), 영업이익..."
2023.06.03.,[신상NEWS] 풀무원녹즙 ‘핏러브 엑스투’…간편하게 건강 챙긴다,"농심은 기능성 저분자콜라겐펩타이드NS의 1일 권장량을 섭취할 수 있는 ‘라이필 탱탱 콜라겐 젤리스틱’를 내놓았고, 아모레퍼시픽의 바이탈뷰티는 체지방 관리를 위한 ‘메타그린 슬림업 X 마이멜로디’의 두 번째 에디션을 선보였다. ■ 풀무원녹즙, 융복합 건강기능식품 ‘핏러브 엑스투’ 출시..."
2023.06.03.,"오퀴즈 '아토베리어', 오후 1시 정답은?","이넷뉴스 = 오퀴즈가 아모레퍼시픽의 '에스트라 아토베리어' 관련 퀴즈를 3일 오후14시 출제해 관심이 커지고 있다. 퀴즈는 ""피부 ㅈㅂ을 강화하는""이다. 'ㅈㅂ'이 초성힌트다. 정답은 '장벽'이다. 한편, 지난 2일 아모레퍼시픽 프리미엄 바디 케어 브랜드 스킨유(SKIN U)는 이노센트 라인의 샤워젤과 스크럽..."
2023.06.03.,"[분석] 화장품사 1분기 평균 매출총이익 361억, 전년비 3.4%↓","이어 2위 아모레퍼시픽그룹(7016억원), 3위 한국콜마(1168억원), 4위 에이피알(907억원), 5위 애경산업(731억원) 순이었다.6~10위에는 코스맥스(555억원), 휴젤(501억원), 에이블씨엔씨(383억원), 클리오(373억원), 클래시스(302억원)가 각각 올랐다.△ 매출총이익율 상위 10대 기업매출총이익률면에서는..."
2023.06.03.,"옷 사러 가니 서점, 책 사러 가니 와인…재미난 ‘팝업’ 세계 [ESC]","문구 전문 오롤리데이 같은 작은 브랜드들이 성공적으로 팝업 스토어를 여는 것을 보고 동서식품이나 아모레퍼시픽, 엘지생활건강, 농심, 삼양식품, 롯데제과, 삼성물산 등 큰 기업들도 본격적으로 팝업 스토어를 구상하게 되었습니다. 유행을 선도하는 권한을 큰 브랜드가 독점할 수 없게 된 것은 팝업..."
2023.06.03.,"코스피, 기관 순매수도 상위 10종목(2일)...카카오-한화솔루션-POSCO홀딩스","▲ 2일 코스피 시장에서 기관은 카카오, 한화솔루션, POSCO홀딩스, SK이노베이션을 집중 매수했다.© 연합뉴스. 2일 코스피 시장에서 기관은 카카오, 한화솔루션, POSCO홀딩스, SK이노베이션을 집중 매수했다. 반면, 아모레퍼시픽, 한미반도체, LG생활건강을 집중 매도했다."
2023.06.04.,"[주간 투자자 동향] 외국인, 반도체 투톱 1조3000억 싹쓸이","4위 아모레퍼시픽 -449억원(-42만주), 5위 기아 -400억원(-47만주), 6위 엔씨소프트 -341억원(-11만주), 7위 OCI -326억원(-24만주), 8위 KT -293억원(-94만주), 9위 NAVER -282억원(-14만주), 10위 한미반도체 -245억원(-93만주), 11위 LG생활건강 -240억원(-4만주), 12위 S-Oil -181억원(-25만주), 13위..."
2023.06.04.,"스킨유, 비타민C 포함한 싱그러운 향취 샤워젤 2종 출시","아모레퍼시픽 프리미엄 바디 케어 브랜드 스킨유(SKIN U)가 이노센트 라인의 샤워젤과 스크럽 신제품을 출시하고 브랜드 모델 신세경과 광고 캠페인을 전개한다. 이번에 선보이는 스킨유 샤워젤 2종(선셋 오랑쥬, 오드 플로럴)은 여름에 어울리는 시트러스, 플로럴 계열의 향취로 패키지 또한 깔끔한 백색으로..."
2023.06.04.,‘하루 4000개씩 팔려’…헤라 ‘블랙 쿠션’ 1천만개 판매 눈앞,"5월까지 890만개 판매…하루 4천개씩 팔려 업황 어려운데도 올 1분기 두자릿수 성장 ‘올드하다’ 이미지 벗고 MZ세대 브랜드로 아모레퍼시픽의 뷰티 브랜드 ‘헤라’가 효자 브랜드로 자리매김한 가운데, 그 중에서도 특히 2030 여성들에게 압도적 지지를 받고 있는 일명 제니 쿠션인 ‘블랙 쿠션’이 곧..."
2023.06.04.,"“내가 더 벌었어”…디밀 vs 레페리, 뷰티 MCN 1위 두고 갑론을박","후발주자인 디밀은 ‘오늘의 하늘’, ‘우린’, ‘제제’ 등이 소속돼있고 현대홈쇼핑과 아모레퍼시픽그룹으로부터 150억원 규모의 투자를 받았다. 결국 이번 사안의 핵심은 잠정매출액을 확정매출액처럼 광고할 경우 표시광고법 위반에 해당하는지 여부다. 이에 대해 윤주경 의원실이..."
2023.06.04.,'회장님'들의 숨바꼭질,서경배 아모레퍼시픽 회장의 장녀인 서민정 럭셔리브랜드 디비전 AP팀 담당은 272억원 규모의 이니스프리 지분 2만 3222주(9.5%)를 서경배과학재단에 1일자로 기부했다. 서 회장이 지난 2016년 9월 사재 3000억원을 출연해 설립한 이 재단은 생명과학 분야의 한국인 신진과학자를 선정해 연구비를 장기적으로...
2023.06.04.,5월 국내 증시 개인 순매수 상위종목 10개 수익률 -10.58%…기관·외인은 양호,"이외에도 에코프로(4284억 원), LG화학(2702억 원), LG생활건강(1658억 원), 엔씨소프트(1615억 원), 두산에너빌리티(1378억 원), 아모레퍼시픽(1010억 원), 한화솔루션(1008억 원), 이마트(782억 원), KT&G(781억 원) 순으로 많이 순매수했다. 해당 종목들은 모두 5월 한 달간 하락했다. 특히 에코프로(-22.88..."
2023.06.04.,"[분석] 화장품사 1분기 평균 영업익 60억, 전년비 15.2%↓",2위는 아모레퍼시픽그룹인데 영업이익 규모는 816억원으로 집계됐다. 전년동기에 비해 52.3% 감소했다.3위는 영업이익 232억원으로 흑자전환한 에이피알이다. 4위는 클래시스가 차지했다. 이 회사의 영업이익은 199억원으로 전년대비 19.1% 증가했다. 5위인 휴젤은 전년대비 24.9% 감소한 185억원의...
2023.06.04.,RE100 건너뛰고 '기후클럽 기여' 가능할까,"국내에서는 2020년 에스케이(SK) 계열사 6곳이 처음으로 가입했고, 현재 네이버, 삼성전자, 아모레퍼시픽 등 27곳이 참여하고 있습니다. 한국 정부와 재계가 추진하는 CF100이 RE100과 다른 점은 재생에너지 외에 원자력발전, 수소연료전지, 탄소포집활용(CCS) 등도 '무탄소 전원'으로 인정하겠다는..."
2023.06.05.,"아모레퍼시픽 라네즈, 해양 보전 활동 3개국서 진행","아모레퍼시픽의 라네즈가 WWF(세계자연기금)와 해양 보전을 위한 글로벌 파트너십을 맺었다고 5일 밝혔다. 이번 파트너십을 통해 라네즈는 한국, 중국, 태국 3개국에서 해안 보전 활동을 진행하게 된다. 라네즈는 지난 10년간, 글로벌 물 부족 국가의 식수 개선 사업과 지속 가능한 물 자원 보호를 위해 다양한..."
2023.06.05.,"아모레퍼시픽 라네즈, 세계자연기금 손잡고 해양 보전 나선다","아모레퍼시픽은 화장품 브랜드 라네즈가 세계자연기금(WWF)과 해양 보전을 위한 파트너십을 맺었다고 5일 밝혔다. 이번 파트너십을 통해 라네즈는 한국과 중국, 태국 등 3개국에서 해양 보전 활동을 진행한다. 한국에서는 충남 태안 국립공원 청포대 해안 쓰레기 수거 작업을 이어가고 있으며, 오는 22일에는..."
2023.06.05.,[브리핑] 아모레퍼시픽·LF·이랜드,"포쓰저널 서영길 기자 아모레퍼시픽 직원들이 지난해 태안 청포대 해안 플로깅 후 기념사진을 촬영하고 있다./사진=아모레퍼시픽 ◇ 아모레퍼시픽 라네즈, 세계자연기금과 해양 보전 활동 아모레퍼시픽은 화장품 브랜드 라네즈가 세계자연기금(WWF)과 해양 보전을 위한 파트너십을 맺었다고 5일 밝혔다...."
2023.06.05.,"아모레퍼시픽, 대한모발학회 심포지엄 개최","아모레퍼시픽은 5월 28일 일요일 서초구 더케이호텔 서울에서 열린 대 한모발학회 학술대회에서 심포지엄을 개최했다. 해당 행사에서 아모레퍼시픽은 그동안 이어온 여성 탈모 연구 성과와 제품 개발 사례를 발표하고, 국내외 전문가들과 심도 깊은 논의를 진행했다. 이번 심포지엄은 ‘Hair Loss in..."
2023.06.05.,[AT 유통 소식] 아모레퍼시픽·인터파크쇼핑·쿠팡·한화호텔앤드리조트,"5일 유통업계에 따르면 아모레퍼시픽의 글로벌 브랜드 라네즈가 WWF(세계자연기금)와 해양 보전을 위한 글로벌 파트너십을 체결했다. KGC인삼공사의 뷰티 브랜드 동인비는 ‘1899 워터리 오일 에센스’를 출시, 인터파크쇼핑은 환경의 날을 맞아 ‘녹색소비주간’을 운영한다. 쿠팡은 6월을 시작으로 가전..."
2023.06.05.,아모레퍼시픽미술관 현대미술 소장품 특별전 불안·공포·막연 등 현시대 작가...,"아모레퍼시픽미술관 소장품 특별전 'APMA, CHAPTER FOUR – FROM THE APMA COLLECTION'. 사진은 바바라 크루거의 작품 '무제(영원히)'. 사진/손원태기자 아모레퍼시픽미술관이 오랫동안 보관했던 초콜릿 상자를 꺼내놓았다. 소장품 특별전인 'APMA, CHAPTER FOUR – FROM THE APMA COLLECTION'가 지난달 25일 열린 것이다. 전시는..."
2023.06.05.,"K-뷰티, 중국 대신 북미 대안될까…캐나다 판로 확대 박차",아모레퍼시픽그룹의 설화수는 홀트 렌프류에 이미 입점해 있다. 코트라에 따르면 작년 캐나다의 대(對) 한국 화장품 수입 규모는 전년 대비 20.9% 증가한 6259만 달러(약 609억 원)를 기록했다. 한국은 캐나다 전체 화장품 수입 시장에서 미국과 프랑스에 이은 3위다. 아시아 국가 사이에선 단연 시장점유율 1위다....
2023.06.05.,"뷰티업계, '환경의 날' 맞아 친환경 경영 강화…제품성분·재활용 패키지",생태계 보호를 위한 유해성분 배제 비레디 블루 수분 선크림(아모레퍼시픽) 아모레퍼시픽의 남성 토탈 스타일링 브랜드 '비레디(B.READY)'가 출시한 '블루 수분 선크림'은 해양 생태계 및 산호초 보호를 위해 유해성분을 배제한 리프 프렌들리(Reef Friendly) 제품이다. 선크림을 포함한 블루 비건 라인은...
2023.06.05.,OEM 종목 투자가 뜨겁다! '코스메카 이어 코스맥스',"아모레퍼시픽과 LG생활건강의 주가는 하락세에서 상승세로 전환하지 못하면서 답답한 흐름이다. 특히 아모레퍼시픽은 10만원대, LG생활건강은 50만원대 유지여부를 놓고 치열한 공방전이 진행되고 있어 관심이 높다. 아모레퍼시픽은 5월 31일 104,500원으로 10만원대 이하로 내려갈..."
2023.06.06.,"아모레퍼시픽, 한·중·태국 해안 보전 활동 추진","아모레퍼시픽 브랜드 라네즈는 WWF(세계자연기금)와 해양 보전을 위한 글로벌 파트너십을 체결했다고 5일 밝혔다. 이번 파트너십을 통해 라네즈는 한국, 중국, 태국 3개국에서 해안 보전 활동을 진행하게 된다. 라네즈는 지난 10년간, 글로벌 물 부족 국가의 식수 개선 사업과 지속가능한 물 자원 보호를 위해..."
2023.06.06.,"""직접 눈으로 확인""... 국내 화장품 기업, 글로벌 초청 행사 눈길",사진=1.아모레퍼시픽 2.더마펌 3.티르티르 국내 화장품 기업들이 해외 석학들과 바이어 등을 대상으로 직접 기술력을 소개하는 자리를 확대하며 글로벌 시장 공략에 적극적으로 나서 관심을 모은다. 최근 다양한 심포지엄 개최를 통해 글로벌 시장에 기술력을 소개하고 있는 아모레퍼시픽은 지난...
2023.06.06.,"아모레 에스쁘아·미샤 어퓨, 日큐텐 자외선차단제 순위 휩쓸어","에스쁘아 기능성·어퓨 라인업 호평 4월 판매 데이터 바탕으로 랭킹 발표 아모레퍼시픽 에스쁘아와 미샤 어퓨가 일본에서 제품력을 인정받았다. 에스쁘아와 어퓨에서 출시한 자외선 차단제의 기능성, 다채로운 제품 등이 높이 평가받았다. 6일 업계에 따르면 에스쁘아 워터 스플래시 선크림 세라마이드..."
2023.06.06.,"""中화장품에 밀렸다""…'설화수'에 열광했던 중국인들의 변심","韓 화장품 수출은 마이너스 지속...""하반기 이후 中 시장 회복"" 반면 우리나라 대표 수출 화장품인 LG생활건강의 '후'나 아모레퍼시픽의 '설화수'는 코로나19(COVID-19)와 한한령(한류금지령) 이후 중국에서 큰 반향을 일으키지 못하고 있는 상황이다. 산업통상자원부에 따르면 5월 한국 화장품 수출액은 전년..."
2023.06.06.,"“1980년대, 생각보다 촌스럽지 않네요”…유행화장전 [가보니]",추천된 화장품은 당시 아모레퍼시픽이 만들어 인기가 높았던 제품들이었다. 면세점에 들렀다가 전시회를 소개받고 방문했다는 관람객 한모 씨는 “원래 화장에 관심이 많은데 전시회에서 당시 제품이나 의상을 보니 감회가 새롭다”며 “요즘 Y2K(밀레니엄 버그)가 다시 뜨고 있는데 그 이전에 유행했던...
2023.06.06.,얼어붙은 소비 녹일 ‘P.T.S.D’ [스페셜리포트],"신라면세점은 아모레퍼시픽과 함께 ‘그 시절, 우리가 사랑했던 유행 화장’ 전시를 진행하고 있다. 1980년대를 재현한 공간에서 당시의 스타일링을 활용한 화장대, 옷장, 응접실 등으로 공간을 구성했다. 불황형 소비 심리 노린 ‘사기 사이트’ 극성 “미끼 상품·환불 거부 조심하세요” 최근 ‘초저가’..."
