날짜,제목,내용
2023.08.07.,[브리프] 아모레퍼시픽 LF 애경 형지 무신사,"■에스트라, 민감성 피부 슬로에이징 '리제덤365 모공탄력 캡슐세럼 출시 리제덤365 모공탄력 캡슐세럼ㅣ아모레퍼시픽 아모레퍼시픽의 메디 뷰티 브랜드 에스트라(AESTURA)가 '리제덤365 모공탄력 캡슐세럼'을 출시한다. 민감성 피부를 위한 독자 성분 '더마 타이트닝 배리어 캡슐TM'을 함유해 피부 장벽과 모공..."
2023.08.07.,"아모레퍼시픽그룹, 잼버리 현장에 선크림 4만개 긴급 지원",아모레퍼시픽그룹은 2023 새만금 세계스카우트 잼버리 조직 위원회에 선크림 4만 개를 긴급 지원했다고 7일 밝혔다. 아모레퍼시픽 CSR 비전 로고.[사진=아모레퍼시픽그룹] 아모레퍼시픽그룹은 주말 사이 긴급 물류 대응을 통해 세계스카우트 잼버리 현장에 직접 4만 개의 선크림을 지원했다. 제공된 선크림은...
2023.08.07.,[기업 소식] 아모레퍼시픽그룹·코웨이·SPC그룹 外,"아모레퍼시픽그룹, 잼버리 현장에 선크림 4만 개 긴급 지원 아모레퍼시픽그룹이 2023 새만금 세계스카우트 잼버리 조직 위원회에 선크림 4만 개를 긴급 지원했다고 밝혔다. 아모레퍼시픽그룹은 주말 사이 긴급 물류 대응을 통해 세계스카우트 잼버리 현장에 직접 4만 개의 선크림을 지원했다. 제공된..."
2023.08.07.,아모레 장녀 서민정 돌연 휴직…승계 이상기류說 확산 [재계 TALK TALK],"서경배 아모레퍼시픽그룹 회장의 장녀 서민정 씨가 최근 휴직에 들어간 것과 관련, 그룹 후계 구도를 둘러싼 여러 해석이 나온다. 금융감독원 전자공시와 금융투자업계에 따르면, 서민정 씨는 현재 지주사 아모레퍼시픽그룹(아모레G) 지분 2.7%, 이니스프리 지분 8.7% 정도를 보유하고 있다. 서 씨의 휴직과..."
2023.08.07.,"현해탄 건넌 K뷰티 열풍, 일본에서 '살길' 찾은 아모레퍼시픽, LG생건","아모레퍼시픽은 이니스프리·라네즈·에뛰드·에스쁘아 전면에 내세웠으며, LG생활건강은 차앤박(CNP)을 필두로 일본 시장에 진출했다. K뷰티 열풍은 성과로 이어졌다. 아모레피시픽의 올해 2분기 일본 매출은 전년 대비 30% 이상 성장했으며, LG생활건강의 일본 매출 비중은 전체 매출의 5%까지 올라왔다. 한..."
2023.08.07.,[오늘의 장바구니] 신세계그룹·아모레퍼시픽·BYC 외,아모레퍼시픽의 메디 뷰티 브랜드 에스트라(AESTURA)가 '리제덤365 모공탄력 캡슐세럼'을 출시한다. 민감성 피부를 위한 독자 성분 '더마 타이트닝 배리어 캡슐TM'을 함유해 피부 장벽과 모공 탄력을 동시에 개선할 수 있도록 도와준다. 에스트라는 민감성 피부일수록 잦은 피부 손상과 산화 스트레스에 노출돼...
2023.08.07.,이니스프리 주식 기부한 아모레 서민정...컨설팅 업계 “지주사 중심 경영 효...,"아모레퍼시픽그룹(아모레G)의 장녀 서민정씨가 비상장사 이니스프리의 주식을 서경배과학재단에 기부하고, 이 주식을 다시 이니스프리가 되사면서 업계의 관심이 쏠리고 있다. 최근 서민정씨가 예상치 못했던 휴직을 하고 아모레퍼시픽그룹의 차녀인 서호정씨의 지분이 늘어난 것까지 맞물려 승계구도..."
2023.08.07.,아모레·LG생건 'K뷰티' 큰형님은 주춤…中企는 훨훨,아모레퍼시픽과 LG생활건강의 2분기 실적이 시장 컨센서스(전망치)를 하회했다. 중국 시장 부진의 영향이다. 두 회사 모두 중국 시장 의존도를 낮추려 수년째 노력 중이지만 여전히 중국 매출 비중은 전체의 10% 이상을 차지하고 있다. 반면 중소 뷰티 브랜드는 역대급 실적을 기록했다. 해외에서 먼저...
2023.08.07.,잼버리 지원 팔 걷은 기업들…삼성·다이소·아모레 등 '총력지원',"아모레퍼시픽그룹은 주말 사이 긴급 물류 대응을 통해 세계스카우트 잼버리 현장에 직접 4만 개의 선크림을 지원했다. 제공된 선크림은 뜨거운 햇빛에 장시간 활동 중인 현장 참가자들에게 전달될 예정이다. 이마트는 대회 현장에 생수 총 70만병을 지원하기로 하고 지난 4일과 5일 각각 약 8만병, 10만병을 우선..."
2023.08.08.,"아모레퍼시픽 에스트라, '리제덤365 모공탄력 캡슐세럼' 출시","아모레퍼시픽의 메디 뷰티 브랜드 에스트라(AESTURA)는 8일, '리제덤365 모공탄력 캡슐세럼'을 출시한다고 밝혔다. 사측에 따르면 이 제품은 민감성 피부를 위한 독자 성분 '더마 타이트닝 배리어 캡슐TM'을 함유해 피부 장벽과 모공 탄력을 동시에 개선할 수 있도록 도와준다. 에스트라 측은 ""민감성 피부일수록..."
2023.08.08.,"아모레·코스맥스 등 화장품 업계, 잼버리 현장에 긴급 지원","협회는 연일 계속되는 폭염으로 어려움을 겪고 있는 잼버리 현장에 아모레퍼시픽과 코스맥스 등 회원사가 물품을 지난 5일 지원했다고 밝혔다. 아모레퍼시픽은 선크림 4만개, 코스맥스는 선스프레이 등 1만9000개를 전달했다. 한국콜마에서도 추가로 지원할 예정이다. 화장품 업계가 제공한 물품은 야외 활동등..."
2023.08.08.,잼버리 조기철수···유통기업들 예의주시,세계스카우트연맹은 잼버리 대원 전원을 전라북도 부안군 새만금 잼버리 야영장에서 조기 철수를 결정함에 따라 후원에 나섰던 이마트·홈플러스·아모레퍼시픽그룹·아워홈·하림·동아쏘시오그룹 등 주요 유통기업들이 상황을 예의주시하고 있다. 야영장을 떠난 대원들은 서울·인천 수도권으로 숙소를 옮겨...
2023.08.08.,"[오후의 쟁점] 신고가 속출, 중소형 화장품 아모레퍼시픽도 드디어?","출연> 윤여민 휴먼자산운용 이사 김도형 MTN W 어드바이저 ▶쟁점#1 : 화장품 ""중국 없어도 제일 잘 나가~"" 화장품주 탑픽 : 아이패밀리에스씨 ▶쟁점#2 : 반도체 ""아직 끝나지 않은 겨울, 해결의 열쇠는?"" 반도체주 탑픽 : 한미반도체 - 매수가 47,000~48,000원 / 목표가 55,000원 / 손절가 42,000원..."
2023.08.08.,화장품 빅2 '탈중국'에 희비...신시장 개척 박차,"우먼타임스 = 곽은영 기자 K-뷰티 시장의 양대 산맥으로 불리는 아모레퍼시픽과 LG생활건강이 해외 매출 실적에 희비가 엇갈리고 있다. 아모레퍼시픽은 북미, 유럽, 중동 등 비중국 시장에서의 매출 증가와 수익성이 개선된 반면, LG생활건강은 중국시장에서의 판매량 감소와 면세 매출 부진으로 실적이..."
2023.08.08.,[백블] 재고 4만개 탈탈... 아모레 서경배 '잼버리 지원' 막전막후,"사진=연합뉴스 아모레퍼시픽 등 국내 대표 화장품 기업이 2023 세계스카우트 잼버리 측에 자외선 차단제 4만5,000개 전달한 것으로 8일 알려졌다. 특히 이 과정에서 서경배 아모레퍼시픽 회장은 계열사 재고를 모두 긁어모아 1시간 만에 4만 여개 제품을 현장에 공급한 것으로 알려져 주목받고 있다. 사실 화장품..."
2023.08.08.,[대기업집단 브랜드평판] 1위 삼성·2위 현대자동차·3위 LG,"2023년 8월 대기업집단 브랜드평판 30위 순위는 삼성, 현대자동차, LG, SK, 농협, 한화, 롯데, 쿠팡, 신세계, KT, GS, 포스코, CJ, 두산, 네이버, 미래에셋, 카카오, 현대중공업, 동원, 현대백화점, 한국투자금융, 한진, 코오롱, KT & G, 대우건설, 넥슨, 이랜드, 하이트진로, 아모레퍼시픽, 영풍..."
2023.08.08.,한강요트에 YG댄스까지…잼버리에 체험·관광 싹 풀었다,"합정동 와이지엑스(YGX) 본사에서는 케이팝 댄스 수업을 들을 수 있고, 용산구 아모레퍼시픽 본사에서는 케이뷰티 시설을 탐방할 수 있다. 공예수업과 롤(LOL)파크 투어도 마련됐다. 서울시청 체험 프로그램도 한시적으로 운영을 확대해 1800여 명의 대원에게 관광콘텐츠를 제공한다. 서울에 체류하는 잼버리..."
2023.08.08.,외국인 관광객들 '설화수' '후' 배우고 맞춤형 메이크업 받는다,"이번 달(8월)은 10일 아모레퍼시픽 브랜드 '설화수' 수업이 남아 있다. 지금은 영어로만 수업을 진행하지만 앞으로 국가별 선호 브랜드를 나누고, 해당 나라의 언어로 수업을 진행하며 서비스를 세분화한다는 계획이다. 8일부터는 전문가에게 메이크업을 받을 수 있는 'K뷰티 살롱'도 운영한다. 본점의 '정샘물'과..."
2023.08.09.,"아모레퍼시픽그룹, 잼버리 참가자에 용산 본사 개방한다",아모레퍼시픽그룹이 2023 새만금 세계스카우트 잼버리(잼버리) 참가자들에게 용산 아모레퍼시픽 본사와 오산 뷰티파크 투어 프로그램을 제공한다고 9일 밝혔다. 아모레퍼시픽그룹은 태풍 카눈으로 조기 퇴영을 결정한 잼버리 멕시코 대표단 200여 명을 위해 오산 아모레 뷰티파크를 개방했다. 뷰티파크 내의...
2023.08.09.,"[단독] '서경배 공간 애착' 아모레퍼시픽, 북촌한옥마을 부동산 156억 원 매입",아모레퍼시픽이 서울 북촌한옥마을에 있는 부동산을 대거 매입하고 있다. 2018년 일대 한옥과 양옥을 매입해 회사 주력 브랜드 체험판매장으로 재탄생시킨 아모레퍼시픽은 2020년 9월에 이어 올해 6월 인접 부동산을 추가로 사들였다. 아모레퍼시픽 북촌 거점 확장에는 ‘전통의 현대화’​를 강조하는...
2023.08.09.,"‘탈중국 시급’ LG생건·아모레, 주가 반등 멀었다","원조 K뷰티 2강으로 꼽히는 LG생활건강과 아모레퍼시픽 주가 부진이 장기화되고 있다. 2년 전부터 하락세가 시작된 주가가 좀처럼 회복되지 않는 상황이다. 중소형 업체들이 선전하며 K뷰티 위상은 갈수록 높아지고 있지만, 과거 황제주로 주목받은 원조 업체들은 수혜에서 벗어난 모양새다...."
2023.08.09.,"아모레퍼시픽그룹, 잼버리 참가자에게 기업 탐방 프그램 제공","아모레퍼시픽그룹이 2023 새만금 세계스카우트 잼버리(이하 잼버리) 참가자들에게 용산 아모레퍼시픽 본사와 오산 뷰티파크 투어 프로그램을 제공한다고 전했다. 아모레퍼시픽그룹은 9일, 태풍 카눈으로 조기 퇴영을 결정한 잼버리 멕시코 대표단 200여 명을 위해 오산 아모레 뷰티파크를 개방했다. 뷰티파크..."
2023.08.09.,"K뷰티 빅2 아모레·LG생건, 하반기 승부처는 ‘글로벌’","국내 화장품 ‘빅2’ 아모레퍼시픽과 LG생활건강이 올 상반기에 이어 하반기에도 글로벌 사업 확장에 속도를 낸다. 특히 두 회사 모두 올 상반기 해외 시장에서 가시적인 성과를 거둔 만큼 미국, 유럽, 동남아시아 등 비중국 지역 공략에 드라이브를 걸어 성장세를 이어 나갈 전망이다. 9일 업계에 따르면..."
2023.08.09.,'잼버리 대회를 살려라' 신세계·롯데·현대백도 지원 동참,"아모레퍼시픽그룹은 잼버리 참가자들에게 용산 아모레퍼시픽 본사와 오산 뷰티파크 투어 프로그램을 제공한다. 아모레퍼시픽그룹은 태풍 카눈으로 조기 퇴영을 결정한 잼버리 멕시코 대표단 200여명을 위해 오산 아모레 뷰티파크를 개방했다. 뷰티파크 내 아모레 팩토리, 원료식물원, 아카이브 투어와..."
2023.08.09.,"분주해진 '잼버리 손님맞이'…기업들 ""즐겁고 유익하게""","▲ 마케도니아 스카우트 대원이 9일 오후 SK텔레콤 미래기술체험관 티움(T.um)을 방문, 미래 세상에 대한 가상 체험을 즐기는 모습 [SK텔레콤 제공] 9일 관련업계에 따르면 삼성과 현대차, SK, LG, 롯데, 포스코, 코오롱, 아모레퍼시픽 등 주요 기업들은 모두 세계 각국에서 온 스카우트 대원들을 손님으로 맞았다...."
2023.08.09.,취지는 좋았지만.. 유통가 '잼버리 후원' 논란 가중,"아모레퍼시픽그룹은 잼버리 참가자들에게 용산 아모레퍼시픽 본사와 오산 뷰티파크 투어 프로그램을 제공한다. 잼버리 멕시코 대표단 200여명을 위해 오산 아모레 뷰티파크를 개방했다. 뷰티파크 내의 아모레 팩토리, 원료식물원, 아카이브 투어와 기념품을 제공하고 아모레퍼시픽의 제품 생산 철학과..."
2023.08.09.,"""숙소부터 견학 프로그램까지"" 잼버리 참가자들에 손 내민 주요 기업들","아모레퍼시픽그룹도 잼버리 참가자들에게 용산 아모레퍼시픽 본사와 오산 뷰티파크 투어 프로그램을 제공한다. 아모레퍼시픽그룹은 9일 태풍 카눈으로 조기 퇴영을 결정한 잼버리 멕시코 대표단 200여 명을 위해 오산 아모레 뷰티파크를 개방했다. 뷰티파크 내 아모레 팩토리, 원료식물원, 아카이브 투어와..."
2023.08.09.,"연수원 내주고, 롯데월드 개방도…잼버리 돕는 기업들",롯데는 10일 롯데월드 어브벤처에 대원들을 초청하기로 했다. 또 서울 고척 스카이돔에서 열리는 롯데자이언츠와 키움히어로즈 야구 경기도 관람할 수 있도록 지원한다. 아모레퍼시픽그룹은 서울 용산 본사를 개방하고 경기 오산 뷰티파크 투어 프로그램도 제공하기로 했다.
2023.08.10.,"아모레퍼시픽 '비레디', 나이스웨더와 손잡고 한정판 제품 출시",아모레퍼시픽의 남성 토탈 스타일링 브랜드 '비레디'가 '나이스웨더'와 함께 한정판 제품을 출시하고 팝업스토어를 운영한다고 10일 밝혔다. 나이스웨더는 편의점을 재해석한 신개념 편집숍이다. 협업 기간 두 브랜드의 아이덴티티(정체성)를 담은 한정판 제품들이 출시된다. 비레디 대표 제품인 '블루 쿠션'과...
2023.08.10.,"아모레퍼시픽, 코스알엑스 잔여 지분 인수 검토… “올해 안 결론 낼 것”","아모레, 2021년 단일 규모 최대인 1800억 투자 2024~2025년 걸쳐 잔여지분 매수 ‘콜옵션’ 보장받아 아모레퍼시픽이 글로벌 스킨케어 브랜드 코스알엑스(COSRX)의 잔여 지분 인수와 관련해 올해 안으로 결론을 낼 방침인 것으로 확인됐다. 앞서 아모레퍼시픽은 코스알엑스에 투자하면서 잔여 지분을 추가..."
2023.08.10.,잼버리 참가자들에게 '기업 탐방 프로그램' 제공하는 아모레퍼시픽그룹,"= 아모레퍼시픽그룹이 2023 새만금 세계스카우트 잼버리(이하 잼버리) 참가자들에게 용산 아모레퍼시픽 본사와 오산 뷰티파크 투어 프로그램을 제공한다.아모레퍼시픽그룹은 9일, 태풍 카눈으로 조기 퇴영을 결정한 잼버리 멕시코 대표단 200여 명을 위해 오산 아모레 뷰티파크를 개방했다. 뷰티파크 내의..."
2023.08.10.,"아모레퍼시픽, 주가 강세…중국인 단체여행 비자 발급에 눈길",아모레퍼시픽 주가가 시간외 매매에서 급등했다. 10일 한국거래소에 따르면 전일 시간외 매매에서 아모레퍼시픽 주가는 종가보다 1.32% 오른 12만2700원에 거래를 마쳤다. 아모레퍼시픽의 시간외 거래량은 731주이다. 이는 중국인 한국 단체여행이 이번주 중으로 해제될 것으로 정부와 관광업계가 사실상...
2023.08.10.,"""유커가 돌아온다"" 中, 한국 단체 관광 허용 임박…화장품 업계 ""환영""","LG생활건강(051900), 아모레퍼시픽(090430), 애경산업(018250) 등 국내 화장품 제조 업체들의 경우 기존 '제로'(0)에 가까웠던 면세 매출 회복에 대한 기대감을 나타내고 있다. 아모레퍼시픽 관계자는 ""관광객 증가는 당연히 호재""라며 ""중국 고객뿐만 아니라 많은 외국인 고객들이 한국을 찾고 있어서 다양한 주요..."
2023.08.10.,中 훈풍?...LG생활건강 · 아모레퍼시픽 · 애경산업 '장중 껑충',"10일 증시에서 LG생활건강, 아모레퍼시픽, 애경산업 등 화장품주들의 주가가 장중 급등세를 기록 중이다. 중국 정부가 한국행 단체관광을 허용할 가능성에 대한 기대감 속에 이 같은 흐름이 나타나고 있다. 한국거래소에 따르면 오전 9시 31분 현재 LG생활건강은 전일 대비 11.60% 뛰어오른 49만500원에 거래..."
2023.08.10.,[위기는 기회다] 아모레퍼시픽의 '리브랜딩'... 중국 리스크 극복 묘수될까,"[편집자 주(註)] 아모레퍼시픽이 리브랜딩을 통해 영광을 재현할 수 있을지 관심을 모은다. 사진은 '북촌 설화수의 집' 전경.[사진=아모레퍼시픽] 중국 시장에서의 압도적 성적으로 대한민국 황제주로 불렸던 '영광의 시기'는 끝났다. 중국의 더딘 리오프닝도 문제지만, 그 와중에도 아모레퍼시픽 등 한국..."
2023.08.10.,아모레·LG생건 '비참' VS 코스메카·코스맥스 '유쾌',"아모레퍼시픽과 LG생활건강 등 브랜드사들의 2분기 매출과 영업실적이 부진한 반면 OEM사들은 큰 폭으로 성장했다. 최근 아모레퍼시픽은 2분기 매출은 전년 동기 대비 매출은 0.4% 증가했으며 영업이익은 흑자 전환했다고 LG생활건강은 2분기 매출은 전년 동기 대비 3.0%, 영업이익 27.1% 각각 감소했다고..."
2023.08.10.,"호텔신라 8%, 아모레퍼시픽 7% 급등...중국관련주, 중국 단체허용 소식에 일제...","호텔신라 8%, 아모레퍼시픽 7% 급등...중국관련주, 중국 단체허용 소식에 일제히 급등"
2023.08.11.,"코스알엑스 잔여지분 인수 나선 아모레퍼시픽, M&A로 돌파구 찾나",아모레퍼시픽(090430)이 코스알엑스(COSRX)의 잔여 지분을 추가 인수할 것으로 전해진다. 최근 실적 부진을 겪고 있는 아모레퍼시픽은 고공성장 중인 코스알엑스를 추가 인수해 경쟁력을 강화하려는 셈법이다. 그 사이 높아진 코스알엑스의 몸값이 콜옵션 행사 여부를 가름할 요인으로 떠오른다. 11일...
2023.08.11.,"""中 단체관광 허용…호텔신라·아모레퍼시픽·LG생건에 주목""-KB","중국인 단체관광이 6년 만에 재개되며 호텔신라, 아모레퍼시픽, LG생활건강, 클리오가 혜택을 받을 것이란 분석이 나왔다. 정해진 일정대로 움직이고, 연령대가 높은 것을 감안하면 면세점, 화장품 업종이 수혜를 볼 것이란 전망에서다. 화장품 제조자개발생산(ODM) 업체도 간접적인 수혜주로 꼽혔다. 박신애..."
2023.08.11.,"""6년 만의 유커 귀환"" 뷰티업계 볕 드나…유커 맞이 '분주'",국내 뷰티기업 '빅3'(LG생활건강·아모레퍼시픽그룹·애경산업)는 코로나19로 수년간 실적 부진을 이어왔다. 올해 2분기 성적표만 봐도 3사 중 애경산업(018250)만 유일하게 웃었다. LG생활건강(051900)과 아모레퍼시픽그룹(002790)은 중국 관광객이 급감한 이후 특히 면세 매출에서 부진한 모습을 보이고 있다. 두...
2023.08.11.,"아모레퍼시픽 비레디, 나이스웨더와 협업…‘팝업 스토어’ 선봬","(사진=아모레퍼시픽) 아모레퍼시픽의 브랜드 ‘비레디’가 ‘나이스웨더’와 함께 한정판 제품을 출시하고 팝업 스토어를 운영한다고 11일 밝혔다. 나이스웨더는 편의점을 재해석한 신개념 편집숍으로, 문화 콘텐츠와 일상 소비재를 감각적으로 담은 것이 특징이다. 비레디는 대표 제품인 ‘블루 쿠션’과..."
2023.08.11.,중국 단체 관광 허용 희소식에 화장품株 연이틀 ‘好好’,"11일 LG생활건강 13%, 아모레퍼시픽 7%씩 올라 한국화장품 등 중소형 화장품주는 상한가 기록 중국 정부가 그동안 금지했던 한국행 단체 여행을 허용할 것이라는 전망이 나오면서 투자 자금이 화장품株로 몰리고 있다. 10일 중국 문화여유부(문화관광부)는 한국·미국·일본 등 세계 78개국에 대한 자국민의..."
2023.08.11.,"中서 꺾였다는 K-뷰티, '단체관광 재개' 덕 볼까",한국행 중국인 단체관광이 재개되면서 LG생활건강과 아모레퍼시픽의 면세 매출 회복 가능성도 조심스레 점쳐진다. 지난 10일 중국 문화여유부는 한국을 포함한 세계 78개국에 대한 자국민의 해외 단체관광을 허용한다고 밝혔다. 2017년 3월 사드(THAAD·고고도미사일방어체계) 배치에 대한 보복 이후 6년 5개월여...
2023.08.11.,[N-Stock] 아모레퍼시픽 LG생활건강 한국화장품 다음주 주도하나...중국발 소...,중국 정부가 한국행 단체 여행을 허용할 것이라는 전망이 나오자 LG생활건강 아모레퍼시픽 한국화장품 같은 코스메틱 관련주들도 덩달아 강세국면이다. 10일 중국 문화여유부는 한국·미국·일본 등 세계 78개국에 대한 자 국민의 단체 여행을 허용한다고 발표했다. 대형주들이 보합에 머무르며 숨고르기를 할 때...
2023.08.11.,"""다시 뛰는 K뷰티"" 아모레·콜마·코스맥스 2분기 '훨훨'","이날 행사에는 이상목 아모레퍼시픽그룹 대표, 조윤수 지니더바틀 대표, 뷰티 크리에이터 이사배를 비롯한 업계 관계자들이 참석했다. (사진=연합뉴스) 한국콜마(161890)는 지난 2분기 연결 영업이익이 557억원을 기록해 전년 동기 대비 65.48% 증가했다고 11일 공시했다. 같은 기간 매출액과 순이익은 5997억원..."
2023.08.11.,엇갈린 희비...2분기 K뷰티 승자는?,"주요 시장인 중국에서 선전한 아모레퍼시픽과 애경산업은 웃었지만 LG생활건강은 다소 아쉬운 성적표를 받아들었다. 11일 업계에 따르면 LG생활건강은 2분기 매출이 전년 동기 대비 3% 감소한 1조8077억원, 영업이익은 27.1% 줄어든 1578억원을 기록했다. LG생활건강의 사업 부문은 크게 화장품(Beauty), 생활용품..."
2023.08.11.,"""큰 손 돌아온다"" 中 단체관광 재개에 K-뷰티 '기대감'",LG생활건강과 아모레퍼시픽은 서둘러 중국어 리플렛을 재정비하고 관련 프로모션을 계획하는 등 준비에 들어갔다. 다만 이같은 변화가 하반기 실적 회복에 얼마나 영향을 줄지는 예측하기 어렵다는 의견도 나온다. 그간 중국 정부와의 관계가 썩 좋지 않았던 데다 단체관광객의 방한이 6년5개월만에...
2023.08.12.,"""돌아온 '유커'에 새 테마주 뜬다""…화장품·면세·카지노株 누가 웃을까",아모레퍼시픽(090430) 주가 역시 2021년 5월 말 30만원까지 상승했으나 현재 13만원대를 기록 중이다. 중국의 단체관광 코스에는 면세점 방문이 필수 코스인 만큼 면세가 주도 업종이 될 거란 목소리도 있다. 면세점 업계가 올해 수익성 위주 사업 전략을 펼치며 영업실적 개선에 적극적으로 나서고 있던...
2023.08.12.,"잼버리 대원 最多 수용 경기도 시·군…""전 세계에 지역 알린 호기""","특히, 롯데, 아모레퍼시픽그룹 등 오산시 관내 기업들의 협업도 빛을 발했다. 롯데는 지난 9일부터 롯데인재개발원 오산캠퍼스를 대원들의 숙소로 제공했으며, 대원들을 실내 놀이동산인 롯데월드 어드벤처로 초청했다. 아모레퍼시픽도 멕시코 대표단에게 오산 아모레 뷰티파크를 개방하고 원료식물원..."
2023.08.12.,[유커가 온다③] 중국만 보다 또 발등 찍힐라…다른 나라로 눈 돌린 기업들,"'탈(脫) 중국'에 주력하면서 아모레퍼시픽과 LG생활건강 모두 올해 2분기 미국과 유럽 등 화장품 본고장에서 성장세가 두드러집니다. ▶ 스탠딩 : 유승오 / 기자 - ""국내 화장품 업계는 한자 표기나 표현을 내세웠던 이전과 달리, 최근에는 영문 표기를 강조하고 있습니다."" 중소 업체들 역시 미국에서 20% 넘게..."
2023.08.12.,[다음주 증시전망] 中유커 귀환에도 美물가가 문제…또 박스권,10일 중국 정부가 6년 만에 한국행 단체 여행의 빗장을 푼다는 소식에 호텔신라(008770)·현대백화점(069960)·신세계(004170)·롯데쇼핑(023530)·에이블씨엔씨(078520)·아모레퍼시픽(090430)·LG생활건강(051900)·코스맥스(192820)·한국콜마(161890) 등 관련주들은 그 직후부터 급등세를 보였다. 원달러 환율이 1300원을...
2023.08.12.,"""한국 업체엔 큰 기회"" 기대감 폭발…560억 '잭팟' 터졌다","LG생활건강과 아모레퍼시픽은 지난 2분기에도 증권가 예상에 못 미친 성적을 내놨다. 중국 화장품 시장 회복이 더뎌 국내 면세 산업의 부진이 이어진 결과다. 전문가 사이에서는 향후 미국, 일본, 유럽 등 비중국 지역의 중요도가 한층 커질 것이란 관측이 나온다. 통상 하반기 미국 최대 쇼핑 행사인..."
