날짜,제목,내용
2023.10.11.,"아모레퍼시픽 에스트라, 일본 론칭 기념 팝업 연다…열도 공략 강화",오는 24일까지 아토코스메 오사카서 진행 내년 베트남·태국 등 아세안 진출 목표 아모레퍼시픽의 메디 뷰티 브랜드 '에스트라'가 일본 시장 공략에 고삐를 죈다. 일본 최대 뷰티 전문 플랫폼이자 멀티 브랜드 숍인 '아토코스메'(@COSME)에 제품을 입점한 데 이어 플래그십 스토어를 연다. 피부 진단 서비스·제품...
2023.10.11.,"3분기 시총 290조↑…삼성전자, 77조 늘었다",여기에 ▲한국가스공사(93→133위) ▲현대로템(94→103위) ▲에스디바이오센서(95→190위) ▲팬오션(96→113위) ▲GS리테일(97→118위) ▲한국금융지주(98→105위) ▲아모레퍼시픽그룹(99→116위) ▲씨에스윈드(100→129위) 종목 등도 최근 9개월 새 시총 100위권 밖으로 밀려났다. 시총 상위...
2023.10.12.,"아모레퍼시픽공감재단, ‘청년 마음 캠퍼스’ 성료","(사진=아모레퍼시픽) 아모레퍼시픽공감재단이 Look at ME ‘청년 마음 캠퍼스’를 개최했다. 12일 아모레퍼시픽에 따르면, 지난 4~5일 열린 Look at ME ‘청년 마음 캠퍼스’에서 동덕여대와 서울여대 학생 1000여 명이 참가한 가운데, 아모레퍼시픽공감재단과 동덕여자대학교 인권센터, 서울여자대학교 학생상담센터..."
2023.10.12.,LG·아모레도 뛰어든 맞춤형 뷰티 DNA 맞춤 화장품서 타투 프린트까지,"최근 아모레퍼시픽, 코스맥스 등 뷰티 업계는 ‘초개인화’트렌드에 따라 인공지능(AI), 빅데이터 등의 첨단 기술을 활용해 개인의 취향, 피부 특성, 선호도를 고려한 개인 맞춤형 화장품 시장에 주목하고 있다. 식품의약품안전처에 따르면, 글로벌 맞춤형 화장품 시장은 2020년 7억5300만달러에서 올해..."
2023.10.12.,[기업 소식] 포커스미디어·GS리테일·직방 外,"아모레퍼시픽공감재단, '청년 마음 캠퍼스' 성료 아모레퍼시픽공감재단이 동덕여자대학교와 서울여자대학교 학생들의 마음 건강 증진을 위한 Look at ME '청년 마음 캠퍼스'를 개최했다. 지난 10월 4일과 5일에 각각 진행한 '청년 마음 캠퍼스'는 동덕여대와 서울여대 학생 1000여 명이 참가한 가운데..."
2023.10.12.,'궈차오'에 中서 고전 중인 뷰티업계...대응 방안은?,"중국 시장 상황에 대해 국내 대표 기업인 아모레퍼시픽과 LG생활건강은 ""아직까지 유의미한 변화는 없다""는 입장이다. 12일 뷰티업계에 따르면 지난해 국내 화장품 수출액의 45.9% 정도가 중국이 차지했지만 올해 8월 까지 12%p 급락해 33.9%까지 떨어졌다. 지난 8월 국내 화장품 수입 증가율은 전년대비 미국(72..."
2023.10.12.,"아모레, 日서 라네즈 '립 슬리핑 마스크' 컬렉션 선론칭…열도 공략 강화",내달 로프트·플라자·큐텐 등에 입점 기존 라인업과 차별화…소비자 관심↑ 아모레퍼시픽 라네즈가 일본 시장 공략에 고삐를 죈다. 일본 버라이어티숍·드럭스토어에 라네즈 간판 제품인 '립 슬리핑 마스크'를 입점해 온오프라인 공략을 보다 강화에 나섰다. 립 슬리핑 마스크는 라네즈의 글로벌 베스트셀링...
2023.10.12.,[대기업집단 브랜드평판] 1위 삼성·2위 현대자동차·3위 LG,"2023년 10월 대기업집단 브랜드평판 30위 순위는 삼성, 현대자동차, LG, 한화, 쿠팡, SK, 롯데, 네이버, 농협, 현대산업개발, 두산, 카카오, 현대백화점, 미래에셋, 포스코, 동원, GS, 신세계, CJ, KT, DB, 한진, 코오롱, 한국투자금융, 현대중공업, 아모레퍼시픽, 대우건설, 대림, 넥슨, 효성 순으로..."
2023.10.12.,'쇼핑 대신 맛집' 中 관광객 돌변에…유커 관련주 '급락',"아모레퍼시픽이 지난 1개월 사이 11.39% 떨어졌고, LG생활건강도 6.17% 하락했다. 중국 관광객에 의한 호황을 전망하며 급등했던 카지노 관련주들도 기대가 꺼지자 급락하고 있다. 파라다이스, GKL은 같은 기간 각각 11.8%, 10.74% 떨어졌다. 카지노·호텔 등을 포함한 복합 리조트를 운영하는 롯데관광개발도 21.65..."
2023.10.12.,아우딘퓨쳐스 주가 상승 뚜렷...중국인 관광객 유입 효과 기대,"미우너상사, 아모레퍼시픽, CSA코스믹, 웨스트라이즈, 동구바이오제약, 바른손, 한국주철관, 슈피겐코리아, YG PLUS, 오상자이엘, CJ제일제당, 코웽, 바이오스마트, 아모레G, 아이큐어, 이엔코퍼레이션, 엘앤씨바이오, 씨앤씨인터내셔널, 네이처셀, 신세계인터내셔날, 연우, 코스맥스, 오가닉티코스메틱..."
2023.10.13.,"아모레퍼시픽 마몽드, 앰버서더 '윈터'와 리브랜딩 캠페인","아모레퍼시픽 브랜드 마몽드가 브랜딩 캠페인을 전개한다. <아모레퍼시픽> 아모레퍼시픽 브랜드 마몽드가 브랜딩 캠페인을 전개한다고 13일 밝혔다. 그룹 에스파 윈터를 브랜드 앰버서더로 발탁하고, 새로운 디자인과 강력해진 효능으로 돌아온 '포어 슈링커 바쿠치올 크림'을 선보인다. 마몽드는 브랜드..."
2023.10.13.,"K뷰티 투톱 '아모레·LG생건', 일제히 '입술'에 집중…왜?","국내 뷰티업계 '투톱' 아모레퍼시픽과 LG생활건강이 모두 입술에 집중하는 모양새다. 13일 뷰티업계에 따르면 아모레퍼시픽은 북미 시장을 중심으로 '립 슬리핑 마스크' 라인업을 확대하고 있으며, LG생활건강은 최근 새로운 형태 립케어 신제품 '립세린'을 출시했다. 아모레퍼시픽 라네즈의 '립 슬리핑 마스크..."
2023.10.13.,[브리핑] 아모레퍼시픽·애경산업,"포쓰저널 반지수 기자 /아모레퍼시픽 ◇마몽드, 앰버서더 '윈터'와 리브랜딩 캠페인… '포어 슈링커 바쿠치올 크림' 출시 아모레퍼시픽은 마몽드가 브랜딩 캠페인을 전개한다고 13일 밝혔다. 그룹 에스파(aespa) 윈터를 브랜드 앰버서더로 발탁하고 새로운 디자인과 강력해진 효능으로 돌아온 '포어 슈링커..."
2023.10.13.,[AT 유통 소식] LF·아모레퍼시픽·이랜드·유한킴벌리·루이비통,"아모레퍼시픽의 브랜드 ‘마몽드’는 그룹 에스파 윈터를 브랜드 앰버서더로 발탁하고, ‘포어 슈링커 바쿠치올 크림’을 선보이는 등 브랜드 캠페인을 전개한다. 이랜드가 운영하는 SPA 브랜드 스파오는 23 FW ‘파자마 페스타’를 16일부터 29일까지 진행한다. 유한킴벌리는 첨단 티슈 신설비의 준공을..."
2023.10.13.,"“해외 명품 다 이겼다” 아모레퍼시픽 헤라, 파운데이션 평판 1위","한국정경신문 박진희 기­자 pre-jini@hanmail.net 아모레퍼시픽의 헤라 파운데이션의 소비자 평판이 에스티로더, 크리스찬디올 등 해외 명품들을 압도적으로 앞섰다. 13일 한국기업평판연구소에 따르면 파운데이션 브랜드평판 2023년 10월 빅데이터 분석결과 1위 헤라 파운데이션, 2위 에스티로더 파운데이션..."
2023.10.13.,"‘脫중국’ 아모레, 이제 화색 돌까…판로 확대 효과 ‘솔솔’","中 의존도 낮추고 亞·북미·유럽 시장 개척 북미·유럽 매출비중 올해 10%, 내년 15% “非중국 영업이익 2년 내 중국 넘어설 것” 면세점과 중국 시장의 부진으로 실적 약세를 보이는 아모레퍼시픽이 3분기 이후에는 반등을 기록할 것으로 보인다. 올해초부터 중국 의존도를 줄이고 지역 다변화와 브랜드..."
2023.10.13.,[뷰티명품의 배신]②국산은 관리 꼼꼼한데…처벌 못 하는 이유,"▷관련기사:[뷰티명품의 배신]①화려한 매장 속 철 지난 테스터들(10월11일) 이와 대조적으로 국내 브랜드인 아모레퍼시픽의 헤라와 LG생활건강의 후 매장에서는 테스터에 사용기한을 넘긴 경우가 발견되지 않았고, 각 테스터에는 개봉일까지 기재돼 있었다. 가장 큰 이유는 화장품 브랜드들을 관리하는 주체의..."
2023.10.13.,중국 단체관광객 방한 효과는?...메디앙스 주가 미소짓나,"한편 지난달 빅데이터 분석 화장품 상장기업 브랜드평판 1위는 아모레퍼시픽이다. 순위는 다음과 같다. 아모레퍼시픽, LG생활건강, 한국콜마, 현대바이오, 클리오, 코스맥스, 한국화장품, 토니모리, 코리아나, 아모레G, 애경산업, 코스나인, 한국화장품제조, 스킨앤스킨, 라파스, 브이티, 올리패스..."
2023.10.13.,"[데이터로 보는 증시]SK이노베이션·SK하이닉스, 기관·외국인 코스피 순매수...","외국인은 SK하이닉스(773억원)를 비롯해 기아(222억원), 하나금융지주(086790)(123억원), 한올바이오파마(009420)(111억원), 삼성생명(032830)(106억원), 삼성전기(009150)(90억원), 아모레퍼시픽(090430)( 78억원), 우리금융지주(75억원), 한미반도체(74억원), SK텔레콤(70억원)등을 순매수한 반면..."
2023.10.14.,코스메카코리아 주가 부활 청신호...기관 20거래일 쓸어 담는다,"미우너상사, 아모레퍼시픽, CSA코스믹, 웨스트라이즈, 동구바이오제약, 바른손, 한국주철관, 슈피겐코리아, YG PLUS, 오상자이엘, CJ제일제당 등도 급등락 하고 있다. 넥스트아이 주가는 0.99% 하락 400원에 거래되고 있다. 이외에 코웽, 바이오스마트, 아모레G, 아이큐어, 이엔코퍼레이션, 엘앤씨바이오..."
2023.10.14.,명동 ‘유커’ 북적이는데···中 소비주는 ‘눈물’ 왜?,아모레퍼시픽 역시 9월 고점 대비 9% 떨어졌다. 파라다이스와 GKL도 9월 고점 대비 10% 안팎 떨어졌다. 유커 수혜주로 기대를 모았던 중국 소비 관련주의 부진은 중국 경기 침체에 따른 소비 심리 위축과 무관치 않다는 분석이 나온다. 중국의 부동산발(發) 경기 침체로 중국인의 소비 여력이 줄어들어 국내 내수...
2023.10.14.,[오늘의 주요일정]사회(10월14일 토요일),"▲오전 8시 용산시민회의, 한강로동 아모레퍼시픽 서편 인도, 용산어린이정원 폐쇄 촉구 집회 ▲오전 10시 서울동자동주민대책위, 본동 래미안트윈파크 건너편 인도, 공공주택지구 계획 철회 촉구 집회 ▲오전 10시 호국불교승가회, 광화문역 5번출구, 호국불교정신선양계도 법회 ▲낮 12시 빈곤사회연대..."
2023.10.14.,[오늘의 주요 사회 일정] 사회(10월14일 토요일),"▲오전 8시 용산시민회의, 한강로동 아모레퍼시픽 서편 인도, 용산어린이정원 폐쇄 촉구 집회 ▲오전 10시 서울동자동주민대책위, 본동 래미안트윈파크 건너편 인도, 공공주택지구 계획 철회 촉구 집회 ▲오전 10시 호국불교승가회, 광화문역 5번출구, 호국불교정신선양계도 법회 ▲낮 12시 빈곤사회연대..."
2023.10.14.,[코스피] 외국인 순매수 TOP5 SK하이닉스·기아·하나금융지주·한올바이오파...,"그밖에 외국인 순매수 상위는 삼성생명 105억원규모, 삼성전기 90억원규모, 아모레퍼시픽 78억원규모, 우리금융지주 74억원규모, 한미반도체 73억원규모 순으로 높게 나타났다. 13일 코스피는 전 거래일(2479.82) 대비 23.67포인트(0.95%) 하락한 2456.15에 마감했다. 이날 외국인은 1612억원..."
2023.10.15.,"한국소비자원, 시각장애인 일상에 안전을 확보한다","소비자원은 지난해 ㈜LG생활건강, 애경산업㈜, 헨켈홈케어코리아(유), 로레알코리아, 한국피앤지판매(유), 유한킴벌리㈜, 라이온코리아㈜, ㈜아모레퍼시픽 등 기업과 함께 생활가정용품 식별을 돕는 점자 태그를 제작했다. 올해는 지원 품목과 수량을 전년보다 1.6배 확대한 8종 세트 6천530개를 보급한다. 참여..."
2023.10.15.,"일본이 만든 이 악마 캐릭터, 'MZ판 뽀로로' 됐다","올해에만 이디야커피, 던킨, 배스킨라빈스, 유한킴벌리, 아모레퍼시픽, 세븐일레븐, 골프 브랜드 왁 등이 산리오 캐릭터를 활용한 상품을 내놨다. 신한카드가 지난 3월 산리오 캐릭터를 입힌 신용카드는 출시 한 달만에 10만장 이상이 발급되기도 했다. 롯데하이마트도 갤럭시Z플립5에 산리오 캐릭터인..."
2023.10.15.,"외국인투자자, 10월 삼성전자 '팔고' SK하이닉스 '샀다'","반면 이 기간 외국인은 SK하이닉스(3425억원), 기아(1170억원), KT(377억원), 한미반도체(365억원), 금양(344억원), 아모레퍼시픽(279억원), 한국항공우주(255억원), 한화에어로스페이스(246억원), 하나금융지주(245억원), 포스코인터내셔널(236억원) 등을 순매수 했다. 외국인의 매도세는 금리 상승과 수출..."
2023.10.15.,"Z세대 공략하는 마몽드, 에스파 윈터 앰버서더로 발탁",15일 아모레퍼시픽에 따르면 마몽드는 에스파 윈터의 솔직하고 자신감 있는 태도로 주체적인 삶을 살아가는 모습이 마몽드 브랜드 스토리와 부합한다고 판단해 앰버서더로 발탁했다. 윈터와 함께한 캠페인 영상 및 다양한 콘텐츠는 마몽드 공식 소셜 미디어 계정을 통해 확인할 수 있다. 마몽드는 브랜드...
2023.10.15.,[오늘의 주요일정]사회(10월15일 일요일),"[서울=뉴시스] ▲오전 8시 용산시민회의, 한강로동 아모레퍼시픽 서편 인도, 용산어린이정원 폐쇄 촉구 집회 ▲오전 8시 평강제일교회 前 목사 등, 오류동 평강성서유물박물관 앞, 교회질서 회복 집회 ▲오후 1시 前 경기의사협회장, 세종대로 교보빌딩 앞 인도, 민주주의 회복 기원 집회 ▲오후 1시30분..."
2023.10.15.,[오늘의 주요 사회 일정] 사회(10월15일 일요일),"▲오전 8시 용산시민회의, 한강로동 아모레퍼시픽 서편 인도, 용산어린이정원 폐쇄 촉구 집회 ▲오전 8시 평강제일교회 前 목사 등, 오류동 평강성서유물박물관 앞, 교회질서 회복 집회 ▲오후 1시 前 경기의사협회장, 세종대로 교보빌딩 앞 인도, 민주주의 회복 기원 집회 ▲오후 1시30분 동물권단체 케어..."
2023.10.16.,"아모레퍼시픽 구딸, '북촌 조향사의 집' 팝업 스토어 진행",아모레퍼시픽이 수입·판매하는 파리 1세대 니치 향수 브랜드 구딸(GOUTAL)이 다음 달 30일까지 '북촌 조향사의 집'에서 브랜드 팝업 스토어를 운영한다고 16일 밝혔다. 이번 팝업 스토어는 '향기로 기억되는 삶의 순간'이라는 콘셉트로 40여년의 브랜드 역사와 정체성을 경험할 수 있는 공간으로 선보인다. 1981년...
2023.10.16.,[브리핑] 아모레퍼시픽·애경산업,포쓰저널 반지수 기자 브랜드 팝업 스토어 전경 /아모레퍼시픽 ◇ 아모레퍼시픽 구딸 팝업 스토어 아모레퍼시픽이 수입·판매하는 파리 1세대 니치 향수 브랜드 구딸(GOUTAL)이 11월 30일까지 '북촌 조향사의 집'에서 브랜드 팝업 스토어를 운영한다고 16일 밝혔다. 이번 팝업 스토어는 '향기로 기억되는 삶의...
2023.10.16.,"아모레퍼시픽공감재단, 동덕·서울여대서 청년 마음 캠퍼스 성료","아모레퍼시픽공감재단은 대학생들의 마음 건강 증진을 위한 '룩엣미(Look at ME) 청년 마음 캠퍼스'를 개최했다. 16일 아모레퍼시픽공감재단에 따르면, 이번 청년 마음 캠퍼스는 동덕여대와 서울여대 학생 1000여명이 참가한 가운데 무사히 치러졌다. 아모레퍼시픽공감재단과 동덕여자대학교 인권센터..."
2023.10.16.,"화장품 황제주 무기력...잇츠한불, 천원대 위기","화장품 황제주인 아모레퍼시픽과 LG생활건강의 주가가 9월 18일부터 계속 하락하고 있다. 따라서 9월15일부터 오늘(10월16일)까지 아모레퍼시픽은 18,300원, LG생활건강은 56,000원이 각각 하락했다. 특히 오늘 아모레퍼시픽의 주가는 110,200원으로 거래를 마쳐 이번 주에 반등을 하지 못하면 10만 원대..."
2023.10.16.,신용등급 ‘A’ 기업도 이자 7% 낼 판…현금 마련 ‘초비상’,아모레퍼시픽은 9월 11일 241억원 규모 아모레퍼시픽 진천공장 용지를 동원F&B에 매각한다고 밝혔다. 이 또한 재무건전성 강화가 주된 목적이다. 쌍용씨앤이는 지난 7월 자회사인 쌍용레미콘에 임대한 2050억원 규모 토지를 매각한다고 발표했다. 쌍용씨앤이 측은 재무 구조 개선과 사업 구조 개편을 위한 자산...
2023.10.16.,"유니클로, 히트텍 무료체험 이벤트 外 무신사·구딸·W컨셉 [유통단신]","아모레퍼시픽이 수입·판매하는 파리 1세대 니치 향수 브랜드 구딸(GOUTAL)이 팝업스토어를 운영한다. W컨셉은 31일까지 겨울옷을 미리 장만하는 고객 수요를 잡기 위해 ‘프리쇼’기획전을 지난해보다 일주일 앞당겨 선보인다. 유니클로, 무료체험 히트텍 3만장 쏜다 유니클로(UNIQLO)가 자사 대표 기능성..."
2023.10.16.,[르포] 면세점에 지갑 닫은 유커… 화장품 대신 '이것' 담는다,"호텔신라·아모레퍼시픽 10%대↓… 오리온·농심은 방긋 유커의 귀환에도 면세점, 화장품 등 전통 수혜주는 부진한 성적을 나타내고 있는 반면 제과·식품 기업의 주가는 상승세를 기록 중이다. 대표적으로 오리온은 지난 13일 유가증권시장에서 12만7700원에 거래를 마쳤다. 한 달 전(12만2500원)과 비교해 4.2..."
2023.10.16.,"[데이터로 보는 증시]SK하이닉스·기아, 기관·외국인 코스피 순매수 1위(10월...","(91억원), 아모레퍼시픽(83억원), 두산에너빌리티(034020)(75억원), 삼성전기(75억원), 포스코퓨처엠(70억원), S-Oil(62억원), LG이노텍(57억원), 한화오션(042660)(52억원), POSCO홀딩스(48억원)등을 순매도했다. 외국인 순매수 상위종목은 기아(000270)(163억원)를 비롯해 영풍제지(006740)(89억원)..."
2023.10.16.,[리걸타임즈 특집] Leading Lawyers 2023=Corporate and M&A,▲서울대 법학전문대학원 졸업 ▲제1회 변호사시험 합격 ◇이석현 변호사/케이씨엘=아모레퍼시픽그룹이 (주)퍼시픽패키지의 지분 60% 및 경영권을 프랑스의 포장재 기업 오타종(Autajon)에게 매각하는 거래와 (주)아모레퍼시픽이 미국 럭셔리 클린 뷰티 브랜드 '타타 하퍼'(TATA HARPER)를 운영하는 Tata's...
2023.10.17.,"LG화학, 아모레퍼시픽과 친환경 패키지 개발 협약",LG화학 NCCPO사업부장 양선민 전무(오른쪽)와 아모레퍼시픽 SCM 유닛장 강명구 전무가 지난 16일 서울 용산 아모레퍼시픽 본사에서 친환경 패키지 개발 및 공급을 위한 업무 협약(MOU)을 체결 후 기념 촬영하고 있다. 2023.10.17 [LG화학 제공. 재판매 및 DB 금지]
2023.10.17.,"아모레퍼시픽, LG화학과 친환경 패키지 개발 업무협약",아모레퍼시픽(090430)과 LG화학(051910)은 17일 전날 서울시 용산구 아모레퍼시픽 본사에서 '지속가능한 친환경 패키지 소재 개발 및 공급을 위한 업무협약(MOU)'을 체결했다고 밝혔다. 이번 협약을 통해 아모레퍼시픽은 화장품과 생활용품 포장재 제조 과정에 재활용 플라스틱 사용을 늘리고 환경 영향을...
2023.10.17.,"LG화학, 아모레퍼시픽과 친환경 패키지 개발 협약","LG화학이 아모레퍼시픽과 손잡고 화장품 용기와 포장재의 친환경 전환에 나선다. LG화학은 16일 서울 용산구 아모레퍼시픽 본사에서 아모레퍼시픽과 업무협약을 맺고 친환경 패키지 개발 및 공급을 위한 업무 협약을 체결했다고 밝혔다. LG화학이 재활용, 열분해유, 바이오 기반의 플라스틱 원료를 공급하면..."
2023.10.17.,"""50년 축적 학술 성과 나눈다"" 아모레퍼시픽재단, '물의 자리, 돌 풀 바람' 전...","아모레퍼시픽재단이 설립 50주년을 기념해 '물의 자리, 돌 풀 바람' 전시를 11월 5일까지 아모레부산에서 진행한다고 17일 밝혔다. 재단은 아모레퍼시픽 창업자 장원 서성환 선대회장의 뜻에 따라 1973년 설립돼 올해 50주년을 맞았다. 학술재단으로서 '아름다움'이라는 화두를 역사·문화적 맥락 안에서 지속하고..."
2023.10.17.,"LG화학, 아모레퍼시픽에 친환경 플라스틱 공급","LG화학이 아모레퍼시픽과 손잡고 화장품 용기와 포장재의 친환경 전환에 나선다. LG화학은 지난 16일 서울 용산 아모레퍼시픽 본사에서 아모레퍼시픽과 친환경 패키지 개발 및 공급을 위한 업무 협약을 체결했다고 17일 밝혔다. 협약에 따라 LG화학은 재활용, 열분해유, 바이오 기반의 플라스틱 원료를..."
2023.10.17.,"LG화학-아모레퍼시픽, 친환경 화장품 용기·포장재 개발 협력",친환경 패키지 개발에 나선 LG화학과 아모레퍼시픽 [사진: LG화학] LG화학이 아모레퍼시픽과 손잡고 화장품 용기와 포장재의 친환경 전환에 나선다. LG화학은 16일 용산 아모레퍼시픽 본사에서 아모레퍼시픽과 업무협약을 맺고 친환경 패키지 개발 및 공급을 위한 업무 협약을 체결했다고 17일 밝혔다. 이번...
2023.10.17.,"LG화학, 아모레퍼시픽과 친환경 화장품 용기 만든다",16일 서울 용산구 아모레퍼시픽 본사에서 '지속가능한 친환경 패키지 개발 MOU 체결식'이 열린 가운데 LG화학 NCCPO사업부장 양선민 전무(오른쪽)와 아모레퍼시픽 SCM 유닛장 강명구 전무가 기념촬영을 하고 있다. (사진=LG화학) LG화학이 아모레퍼시픽과 손잡고 화장품 용기와 포장재의 친환경 전환에 나선다....
2023.10.17.,"아모레퍼시픽, LG화학과 친환경 패키지 소재 개발 협력 강화",아모레퍼시픽과 LG화학이 친환경 패키지 소재의 개발과 지속 가능한 제품 생산을 위한 업무협약(MOU)을 체결했다고 17일 밝혔다. 협약에는 ▷탄소 저감 플라스틱 소재 및 신제품 개발 ▷플라스틱 재활용 협업 모델 구축 ▷소비자 친화적 친환경 제품 개발 ▷친환경 원료 적용 제품 확대 등 지속가능경영 목표...
2023.10.17.,"LG화학, 아모레퍼시픽과 맞손…화장품 용기·포장재 친환경 전환 나서","LG화학이 아모레퍼시픽과 손잡고 화장품 용기와 포장재의 친환경 전환에 나선다. LG화학은 지난 16일, 용산 아모레퍼시픽 본사에서 아모레퍼시픽과 업무협약을 맺고 친환경 패키지 개발 및 공급을 위한 업무 협약을 체결했다고 17일 밝혔다. LG화학이 재활용, 열분해유, 바이오 기반의 플라스틱 원료를..."
2023.10.18.,"아모레퍼시픽 아이오페, '레티놀 엑스퍼트 링클 코렉터' 업그레이드 출시",아모레퍼시픽 아이오페가 주름과 모공 고민 개선에 집중한 '레티놀 엑스퍼트 링클 코렉터' 0.1%와 0.3%를 업그레이드해 출시한다. 아이오페 레티놀 엑스퍼트는 30년 가까이 레티놀과 레티노이드를 연구해 온 아이오페의 전문성이 집약된 제품 라인이다. 기존 레티놀 엑스퍼트가 눈가와 팔자 주름에 집중했다면...
2023.10.18.,실적 악화에 승계 잡음까지...깊어지는 서경배 아모레퍼시픽 회장의 시름,생존을 위해 포스트 중국 시장을 찾고 있는 아모레퍼시픽이 차기 리더십 부재 논란까지 겹쳐 '암울한 시기'를 벗어나지 못하고 있다. 팬데믹 이후 좀처럼 중국발 타격을 벗어나지 못하는 상황에서 새로운 진지를 구축한 북미 시장에 전력투구해도 모자라지만 최근 서경배 회장의 두 딸을 두고 승계 구도...
2023.10.18.,"아모레퍼시픽-LG화학, 친환경 패키지 개발 업무협약",16일 '지속가능한 친환경 패키지 개발 MOU 체결식'에 참가한 아모레퍼시픽 SCM유닛장 강명구 전무(왼쪽)와 LG화학 NCC/PO사업부장 양선민 전무. (사진=아모레퍼시픽) 아모레퍼시픽과 LG화학은 '지속가능한 친환경 패키지 소재 개발 및 공급을 위한 업무협약(MOU)'을 체결했다고 17일 밝혔다. 이번 협약을 통해...
2023.10.18.,"[산업 이모저모] 화장품 용기 친환경 세대, LG화학이 아모레퍼시픽과 함께 연...","LG화학이 아모레퍼시픽과 손잡고 화장품 용기와 포장재의 친환경 전환에 나선다. LG화학은 16일, 용산 아모레퍼시픽 본사에서 아모레퍼시픽과 업무협약을 맺고 친환경 패키지 개발 및 공급을 위한 업무 협약을 체결했다고 17일 밝혔다. LG화학이 재활용, 열분해유, 바이오 기반의 플라스틱 원료를..."
