날짜,제목,내용
2024.03.27.,"'아모레, 사회·LG생건, 환경'...ESG 경영 강화","아모레퍼시픽과 LG생활건강이 매출 악화 등에도 불구하고 꾸준하게 ESG경영활동을 지속하고 있다. 아모레퍼시픽은 화장품사라는 특징을 살려 청각장애 및 지적장애 청년들에게 메이크업 테라피를, LG생활건강은 화장품과 무관한 생물 다양성 보존을 위한 활동을 2년째 실시하고 있다. 최근 아모레퍼시픽은..."
2024.03.27.,장애 청년 마음 테라피...발달장애 오케스트라 연주회,"포쓰저널 반지수 기자 /사진=아모레퍼시픽 ◇ 아모레퍼시픽공감재단, 청년 마음 테라피 in 서울애화학교 진행 아모레퍼시픽공감재단은 26일 서울애화학교에서 장애 청년의 삶을 건강하고 아름답게 온전히 누릴 수 있도록 지원하는 'Look at ME 청년 마음 테라피'(이하 '청년 마음 테라피')를 진행했다고 27일..."
2024.03.28.,[브리프] 아모레퍼시픽 LG생활건강 애경 블랙야크 무신사,"■아모레퍼시픽공감재단, '청년 마음 테라피 in 서울애화학교' 진행 'Look at ME 청년 마음 테라피' 진행 /아모레퍼시픽 아모레퍼시픽공감재단은 지난 26일, 서울애화학교에서 장애 청년의 삶을 건강하고 아름답게 온전히 누릴 수 있도록 지원하는 'Look at ME 청년 마음 테라피'(이하 '청년 마음 테라피')를..."
2024.03.28.,"""아모레퍼시픽, 2분기부터는 성장 전환할 설화수""","한화투자증권은 28일 아모레퍼시픽에 대해 1분기 실적은 시장 기대치에 부합할 것이라고 전했다. 한유정 한화투자증권 연구원은 ""아모레퍼시픽의 1분기 연결 매출액은 전년 동기대비 5.7% 늘어난 9661억원, 영업이익은 15.9% 줄어든 542억원으로 종전 추정 영업이익 469억원은 상회하나 컨센서스 영업이익..."
2024.03.28.,"아모레퍼시픽, 올해 영업이익 증가율 급증…코스알엑스 주목","한화투자증권이 올해 연결 편입 예정인 코스알엑스 성장률 30% 초과 달성을 예상하며 아모레퍼시픽(090430)의 투자의견 매수와 목표주가 16만원을 유지했다. 한유정 한화투자증권 연구원은 28일 보고서를 통해 ""기대치에 부합할 1분기""라며 ""상반기 중국 부진에 대한 실망감은 충분히 선반영돼 앞으로..."
2024.03.28.,"서울부터 구례까지, 피어나는 꽃들 [여행의 기분]",아모레퍼시픽 원료식물원 (경기 오산시 가장산업단지) 아모레 뷰티파크는 예약자 대상으로 투어를 진행합니다. 연말까지 ‘아모레퍼시픽 서성환 100년 | 1924-2024’라는 기획 전시가 열리네요. 관람 예약은 아모레퍼시픽 팩토리투어 홈페이지에서 사전 예약할 수 있으며 관람비는 무료입니다. 1. 서울의...
2024.03.28.,"아모레퍼시픽공감재단, 서울애화학교서 '청년 마음 테라피'","아모레퍼시픽공감재단이 지난 26일 서울 강북구 미아동(솔매로52길) 서울애화학교에서 '룩 앳 미(Look at ME) 청년 마음 테라피'로 학생들의 심리 안정을 도와줬다. 27일 아모레퍼시픽에 따르면, 서울애화학교는 청각·지적 장애 특수 교육기관이다. 아모레퍼시픽공감재단은 지난해부터 청년 마음 테라피(치료)를..."
2024.03.28.,"현대차증권 “아모레퍼시픽, 미국 비중 확대 모멘텀 유효..매수 유지”",한국정경신문 우용하 기­자 wooyh1053@naver.com [한국정경신문=우용하 기자] 현대차증권은 아모레퍼시픽에 대해 라네즈와 이니스프리의 미국 성과가 가시화에 따른 성장 가능성이 유효하다고 판단하며 투자 의견 매수와 목표주가 18만원을 유지했다.하희지 현대차증권 연구원은 28일 보고서에서 “북미...
2024.03.28.,"현대바이오, 3월 4주차 업종별 주식 화장품 부문 트렌드지수 순위 1위…LG생활...","아모레퍼시픽은 7,649포인트로 전주보다 275포인트 하락해 3위를 차지했다. 4위 마녀공장은 5,980포인트, 5위 토니모리는 2,620포인트, 6위 클리오는 2,558포인트, 7위 코스맥스는 2,448포인트, 8위 한국콜마는 2,300포인트, 9위 브이티는 2,292포인트, 10위 올리패스는 2,098포인트이다. 11위는 디와이디..."
2024.03.28.,K뷰티 ‘태풍의 눈’ 한국콜마·코스맥스…경영진 연봉도 선두권으로,"코로나19를 기점으로 ‘K뷰티’의 큰형님 격인 아모레퍼시픽, LG생활건강이 수년째 부진의 늪에 빠진 사이 이들 ODM·OEM사들이 급성장한 영향으로 풀이된다. 28일 금융감독원 전자공시시스템에 따르면 윤동한 한국콜마 회장의 장남 윤상현 부회장은 지난해 보수로 약 30억원을 수령한 것으로 집계됐다...."
2024.03.28.,"[재무리뷰] K-화장품 '지각변동'…대형 지고, 중소형 뜨고","전통 강자인 아모레퍼시픽‧LG생활건강‧애경산업 3사가 화장품 부문에서의 실적 부진을 면치 못한 반면, 편집샵인 CJ올리브영과 ODM‧OEM을 전문으로 하는 한국콜마‧코스맥스 등은 역대급 실적을 써냈다. 사실상 K-화장품의 트렌드가 중국이라는 큰손을 잃은 대신 진출국이 다양해지고, 고가..."
2024.03.28.,"이니스프리, 실적 감소에 배당 축소…믿을 건 ‘온라인·해외’",지난해 실적이 감소한 아모레퍼시픽그룹 자회사인 이니스프리가 배당을 대폭 축소했다. 또 2022년에는 중간배당과 결산배당을 모두 했으나 2023년에는 결산배당만 진행했다. 이니스프리는 로드숍을 지속적으로 줄이면서 온라인과 해외 사업에 역량을 집중하며 흑자 유지에 힘쓰고 있다. 28일...
2024.03.29.,"우송정보대, 준오아카데미 및 아모레퍼시픽 견학",28일 우송정보대학 뷰티디자인학부 헤어디자인 전공 학생들이 '준오 아카데미와 아모레퍼시픽 본사'를 방문해 현장 견학 및 체험활동을 진행했다. 사진=우송정보대 제공 우송정보대학 뷰티디자인학부 헤어디자인 전공 신입생 76명과 준오헤어 취업을 앞둔 37명의 학생들은 28일 '준오 아카데미와 아모레퍼시픽...
2024.03.29.,[주간#신상태그] 아모레퍼시픽·BYC·파라다이스시티 외,"아모레퍼시픽 독자 기술인 '피그먼트 미립화 공정'을 통해 기존보다 곱고 세밀해진 미세 파우더 입자에, 새로 고안된 스트레처블 레이어(Stretchable layer) 기술을 접목시켜 기존보다 훨씬 유연해진 제형을 탄생시켰다. 이러한 제형이 피부에 초밀착되면서 얇고 가볍게 발리고, 주름에 끼임이나 들뜸 없이..."
2024.03.29.,"아모레퍼시픽 주가 주춤…""앞으로가 더 중요""","아모레퍼시픽 주가가 하락했다. 29일 거래소에 따르면 전 거래일 0.90% 내린 12만1200원에 거래를 마쳤다. 1분기 연결 매출액은 9661억원, 영업이익은 542억원으로 종전 추정 영업이익 469억원은 상회하나 컨센서스 영업이익 540억원에는 부합할 것이라고 한화투자증권이 내다봤다. 포트폴리오, 재고..."
2024.03.29.,"아모레퍼시픽, 중국 부진 실망감 ""이미 반영""","아모레퍼시픽이 성장은 코스알엑스를 포함한 북미·EMEA에서, 손익 개선은 중국에서 주도하며 올해 영업이익 증가율은 248%에 달할 것이라고 전망됐다. 한유정 한화투자증권 연구원은 ""2024년 1분기 아모레퍼시픽의 영업이익은 542억 원으로 컨센서스에 부합할 것""이라고 전망했다. 이어 ""1~2월 강한 반등으로..."
2024.03.29.,가락시장 흔드는 거대 자본의 마수…정작 농민은 '빈손',"중앙청과 서영배 회장은 아모레퍼시픽(구 태평양)의 창업주인 서성환 회장의 장남으로 아모레퍼시픽 서경배 회장의 친형이다. 서영배 회장은 건설과 금속, 학원 사업을 물려받아 부동산 개발‧건설 업체인 태평양개발과 과일 수탁판매업체인 중앙청과를 경영하고 있다. 서 회장은 지난해 해외 계좌에..."
2024.03.29.,"톱모델 클로이 오, 헤라 광고 찍었다","29일 소속사 케이플러스에 따르면 클로이 오는 아모레퍼시픽 메이크업 브랜드 헤라 광고를 촬영했다. 클로이 오는 자신의 인스타그램에 광고 컷 및 촬영 현장을 공개하기도 했다. 클로이 오는 베이비 페이스에 쌍꺼풀 없는 눈매, 깊은 눈빛의 도회적 아름다움이 돋보인다. 흔하지 않으면서 시선을 사로잡는..."
2024.03.29.,"㈜뷰스컴퍼니, 뷰티 마케팅 10년의 노하우를 담은 MCN 브랜드 '비라운드' 출범","㈜뷰스컴퍼니는 지난 10년 동안 다양한 뷰티 회사(올리브영, 아모레퍼시픽, LG생활건강, 유니레버 등)와 협업한 광고대행사로 최근 뷰스컴퍼니만의 차별화된 서비스를 선보이기 위해 MCN 브랜드를 출범했다고 29일 밝혔다. 비라운드 로고. 사진=뷰스컴퍼니 ㈜뷰스컴퍼니는 지난 10년 동안 다양한 뷰티 회사..."
2024.03.29.,토니모리 주가 휘파람... 향후 실적호전 지속 '청신호',"미우너상사, 아모레퍼시픽, CSA코스믹, 웨스트라이즈, 동구바이오제약, 바른손, 한국주철관, 슈피겐코리아, YG PLUS, 오상자이엘, CJ제일제당, 코웽, 바이오스마트, 아모레G, 아이큐어 등도 시장 상황에 따라 크게 출렁 거렸다. 넥스트아이는 1.85% 올라 386원에 거래를 마감했다. 이외에 이엔코퍼레이션..."
2024.03.29.,"LG생활건강 아픈 손가락, 미국 종속기업 ‘에이본’ 심폐소생 가능할까",화장품업계 한 관계자는 “LG생활건강이나 아모레퍼시픽 같은 대기업에게 미국 시장은 특히 중요하다. 다른 나라들과 시장 규모 차이가 너무 크기 때문에 미국이나 중국을 못 뚫으면 성장이 어려운데 중국에서 힘을 못 쓰고 있기 때문”이라고 말했다. 화장품업계 다른 관계자 또한 “요새는 다들 중국...
2024.03.30.,"라네즈, 日서 '바슬마' 알린다…테스트베드 역할 톡톡",바운시 슬리핑 마스크 샘플 증정 다음달 20일 일본 공식 론칭 예정 아모레퍼시픽 라네즈가 일본 드럭스토어 운영기업 마츠모토 키요시와 협업해 바운시 슬리핑 마스크(이하 바슬마) 현지 시장 진출을 본격화한다. 다음달 일본 론칭에 앞서 소비자 반응도 확인하는 테스트베드로 삼는다는 계획이다. 28일 업계에...
2024.03.30.,"아모스 라뉴얼 샴푸, 'iF 디자인 어워드' 본상 수상",한편 아모스프로페셔널은 아모레퍼시픽 계열사로 헤어 프로페셔널 시장에서 뷰티 전문가를 위해 최적화된 헤어케어 솔루션을 제공하며 성장해 왔다. 지난해 리브랜딩을 통해 새로운 디자인과 라인업으로 헤어 디자이너의 전문성을 높이며 그들만의 프로다움을 지원하겠다고 밝힌 바 있다.
2024.03.30.,"'황사·미세먼지' 시즌 피부 케어 전략은…뷰티업계, 신상품 출시 봇물",◇메이크업·미세 모공 클렌징…각질 관리 효과도 아모레퍼시픽(090430) 스킨케어 브랜드 아이오페는 저자극 클렌저로 '바이오 컨디셔닝' 클렌징 라인 2종을 출시했다. 이번 신규 클렌징 라인은 아이오페의 스테디셀러인 '바이오 컨디셔닝 에센스'의 항산화 성분인 바이오-리독스 알파™를 담았다. 1차 세안제...
2024.03.30.,쿠팡 바짝 쫓는 알리…'1000원 한우' 초저가 무기의 비결 [중국산 대공습 현장...,"알리는 생활용품 입점사로 아모레퍼시픽, LG생활건강, 애경, 유한킴벌리 등을 판매자로 확보한 데 이어 식품업계에서는 쿠팡과 갈등을 빚고 거래를 중단 중인 CJ제일제당까지 들였다. 삼성전자도 케이베뉴에 브랜드 페이지를 연 상태다. 리는 최근 기업간거래(B2B) 전용몰 한국어 웹사이트를 구축하며 B2B..."
2024.03.30.,"[데이터 뉴스룸] 석화業 30곳, 작년 영업이익 전년比 반토막…SK이노베이션·...","특히 한화솔루션을 비롯해 S-Oil, 금호석유화학 아모레퍼시픽 등 10곳은 영업이익 감소율이 50%를 넘어선 것으로 조사됐다. 반면 SK이노베이션과 HDC현대EP는 최근 1년 새 영업이익이 100% 넘게 증가해 희비가 크게 엇갈렸다. 이 같은 내용은 본지가 '국내 석화 업체 30곳의 2022년 대비 2023년..."
2024.03.30.,"""AI시대, K이커머스 혁신 비즈니스 모델 제시"" 이재석 카페24 대표 [이주의 유...","LG생활건강은 '오휘'와 '숨', '글린트' 등 12개 브랜드의 D2C 쇼핑몰을 카페24를 통해 구축했고, 이른바 '먹태깡 대란'을 일으켰던 농심은 D2C 쇼핑몰 '농심몰'을, 아모레퍼시픽의 두피 케어 브랜드 '라보에이치', 이랜드월드 '후아유', SK텔레콤CST1 '티원샵' 등이 있다. 최근에는 국내 프로야구 구단인..."
2024.03.30.,[참관기] UI·UX 트렌드 한자리에... 2024 웹 트렌드 컨퍼런스 어땠나,이날 장후원 그로브 이사는 브랜드 이노베이션 대상을 수상한 아모레 퍼시픽 톤워크 프로젝트를 기반으로 케이스 스터디를 공유했다. 이날 장 이사가 거듭 강조한 것은 ‘서비스 디자인’이었다. 실제로 장 이사는 이번 발표에서 얼핏 보면 서로 비슷하지만 결정적인 차이점이 존재하는 서비스 디자인에...
2024.03.30.,"코스맥스, 韓·中법인 대표 상호교체…K뷰티 재도약 나선다","코스맥스차이나를 이끌 심상배 부회장은 1980년 태평양으로 입사해 아모레퍼시픽에서 사업지원담당 전무, 생산·R&D 부문 대표이사, 대표이사 사장을 거쳐 2020년 코스맥스그룹에 합류했다. 이듬해인 2021년 코스맥스 대표에 선임되며 경영지원, 마케팅, 생산, 연구 등을 총괄하고 있다. 심 부회장은 화장품..."
2024.03.30.,오파스넷 주가 훨훨... 향후 수익선 개선 '모락모락',"주요 매출처로는 SK그룹 계열사와 삼성전자, 한국거래소, 국민은행, 넥슨, 아모레퍼시픽, 두산 등 국내 주요 대기업을 포함한다. 전 거래일 재택근무 스마트워크 관련주인 폴라리스오피스 제이씨현시스템 에스넷 효성ITX 더존비즈온 소프트캠프 폴라리스오피스 링네트 소프트캠프 NHN 휴네시온..."
2024.03.31.,"""설화수 사느니…"" 코로나 끝나자 중국인들 돌변한 이유 [중국산 대공습 현장...",반면 우리나라 대표 수출 화장품 업체인 LG생활건강의 '후'나 아모레퍼시픽 '설화수'는 지난해에 이어 올해도 주요 순위권에 들지 못했다. 매출이 크게 줄어 광군제 실적도 선뜻 공개하지 못할 정도였다. 최대 시장인 중국에서의 부진이 이어지자 실적에도 빨간불이 들어오기 시작했다. 아모레퍼시픽그룹은...
2024.03.31.,"아모레퍼시픽, 이니스프리 '지구의 달' 한정판 출시...자원 선순환 실천",아모레퍼시픽의 고효능 자연주의 브랜드 이니스프리가 4월 지구의 달을 기념한 제품을 선보인다. 이니스프리가 오는 4월 1일 지구의 달 한정판 '그린티 씨드 히알루론산 세럼 대용량'을 출시한다고 31일 밝혔다. 이번 지구의 달 한정판은 공병 수거를 통해 모아진 유리 용기를 일부 재활용해 만들어졌다. 전체...
2024.03.31.,"아모레퍼시픽, 에뛰드 '베어 엣지 슬림 브로우'...신규 색상 선봬",아모레퍼시픽의 글로벌 메이크업 브랜드 '에뛰드'가 아이브로우 펜슬 '베어 엣지 슬림 브로우'를 재단장했다고 31일 밝혔다. 이번 재단장을 통해 에뛰드는 새로운 색상을 총 5종 출시한다. 특히 이 가운데 '마일드 토프'는 눈썹 숱이 부족하거나 메이크업 기술이 부족한 사람도 편하게 사용할 수 있는 부드럽고...
2024.03.31.,"아모레 라네즈, 미국 LA서 팝업….'바슬마' 집중 홍보",바운시 슬리핑 마스크 등 체험 기회 제공 다음달 공식 출시 앞두고 글로벌 마케팅 아모레퍼시픽이 미국 캘리포니아주 LA에 라네즈 팝업스토어를 열고 고객몰이에 나섰다. 라네즈 신제품 '바운시 슬리핑 마스크(이하 바슬마)' 글로벌 홍보에 박차를 가하고 있다. 31일 업계에 따르면 아모레퍼시픽은 다음달...
2024.03.31.,"[교육소식]우송정보대 헤어디자인전공, 준오아카데미 견학 등","우송정보대는 뷰티디자인학부 헤어디자인전공 신입생 76명과 준오헤어 취업을 앞둔 37명이 준오아카데미와 아모레퍼시픽 본사를 방문, 현장 견학 및 체험활동을 했다고 31일 밝혔다. 참가 학생들은 국내외 우수 헤어 디자이너가 양성되고 있는 준오아카데미 교육 현장에서 기술 특강과 시설을 체험했다. 또..."
2024.03.31.,"[Why&Next]쫓는자, 쫓기는자…쿠팡 vs 알리 '머니 게임' 노림수는?","현재 알리의 케이베뉴에는 삼성전자의 온라인 공식 파트너사를 비롯해 LG생활건강, 아모레퍼시픽, 애경, 농심, 롯데칠성음료, 한국 P&G 등이 입점했다. 알리가 공격적인 투자로 몸집을 불리면 '반(反)쿠팡 연대' 구심점이 될 것이라는 전망도 나온다. 입점사에게 낮은 수수료를, 고객에게는 초저가 판매와 무료..."
2024.03.31.,‘팜유 세미나’ 방송으로 주목받는 팜유 …대세는 ‘팜유 프리’ [식탐],"가장 높은 점수는 ‘아모레퍼시픽’의 14.5점이다. 팜유 인증의 사용은 점차 증가하는 추세다. ‘RSPO’ 인증 팜유를 사용한다고 답한 기업은 지난 2020년 59%에서 2021년 69%로 늘었다. 다만 WWF는 지금 같은 속도로는 지구 환경을 지킬 수 없다고 본다. 지속가능한 팜유협의회 조사 결과, 지난 2021년 전 세계..."
2024.03.31.,"애경산업, 김상준 대표체제 ‘글로벌 판’ 키운다","경쟁사인 아모레퍼시픽·LG생활건강 실적과 비교하면 차이가 더욱 두드러진다. 지난해 애경산업의 영업이익이 두 자릿수 상승률을 기록한 반면에, 이들 두 업체는 영업이익이 전년 대비 반토막 나는 등 어닝 쇼크 수준의 성적을 냈다. 희비가 교차된 지점은 화장품 사업이다. 애경산업 매출 비중은..."
2024.04.01.,"아모레퍼시픽 헤라, 제니와 6년 연속 모델 재계약","아모레퍼시픽의 뷰티 브랜드 헤라가 제니와 6년 연속 모델 재계약을 체결했다. 헤라는 서울 문화를 기반으로 독창적인 아름다움을 전 세계에 확산하고 있으며, 동시대의 가장 당당하고 주체적인 브랜드의 페르소나를 대변할 수 있는 모델을 고용하고 있다. 2019년 초 글로벌 아이콘 제니를 신규 모델로 발탁해..."
2024.04.01.,"아모레퍼시픽 바이탈뷰티, '슈퍼콜라겐 리프트샷' 출시",아모레퍼시픽의 이너뷰티 브랜드 바이탈뷰티는 슈퍼콜라겐 라인의 신제품 ‘슈퍼콜라겐 리프트샷’을 출시한다고 1일 밝혔다. 슈퍼콜라겐 리프트샷은 5가지 타입의 콜라겐이 한 포에 담긴 고밀도 액상형 전신 콜라겐 제품이다. 흡수율이 일반 콜라겐 대비 9.4배 빠른 아모레퍼시픽의...
2024.04.01.,"""중국 매출 생각보다 괜찮네""…LG생건-아모레, 주가 살아나나",중국 내수 침체 우려로 연초 부진했던 LG생활건강과 아모레퍼시픽 주가가 최근 반등하고 있다. 중국 내 실적이 예상 대비 선방할 것이라는 분석이 나오면서다. 증권가에서는 실적 부진이 길었던 만큼 단기 실적 개선으로도 주가가 더 오를 것이란 분석을 내놓고 있다. 1일 오후 3시 LG생활건강은 7.37...
2024.04.01.,“중국인 관광객 어서오고”...부진하던 ‘이 종목’ 훨훨 나는 이유,아모레퍼시픽 6%대 올라 LG생건 5개월만에 40만원 한동안 주춤하던 ‘K-뷰티’ 업황 회복 기대감에 화장품 관련주들이 일제히 강세를 나타내고 있다. 중국 관련 수요가 회복 조짐을 보이면서 관련주들의 주가를 견인한 모양새다. 1일 한국거래소에 따르면 이날 화장품 대장주로 꼽히는 아모레퍼시픽은 전...
2024.04.01.,중국發 봄바람 부나…LG생건·아모레퍼시픽 6% '껑충'[핫종목],LG생활건강(051900)과 아모레퍼시픽(090430) 등 화장품 대형주 주가가 6% 이상 동반 상승했다. 중국 경기가 회복되고 국내 화장품 업계의 중국 실적이 우려 대비 선방했다는 평가가 나오면서다. 1일 한국거래소에 따르면 LG생활건강은 전 거래일 대비 2만 5000원(6.58%) 상승한 40만 5000원에 거래를 마쳤다....
2024.04.01.,[브리프] 아모레퍼시픽 LG생활건강 애경 블랙야크 무신사,"■바이탈뷰티, 전신 초밀착 '슈퍼콜라겐 리프트샷' 출시 슈퍼콜라겐 리프트샷 /아모레퍼시픽 이너뷰티 브랜드 바이탈뷰티가 슈퍼콜라겐 라인의 신제품 '슈퍼콜라겐 리프트샷'을 출시한다. 슈퍼콜라겐 리프트샷은 5가지 타입의 콜라겐이 한 포에 담긴 고밀도 액상형 전신 콜라겐 제품이다. 슈퍼콜라겐..."
2024.04.01.,"하나證, ""아모레퍼시픽, 미주매출 고성장 등 영향 수익 개선 '전망'...목표가...","▲ 아모레퍼시픽 CI © 아모레퍼시픽 아모레퍼시픽의 미주 매출의 고성장 지속과 우려 대비 선방한 중국 매출 등에 힘입어 매출이 성장세를 나타낼 것이라는 전망이 나왔다. 하나증권 박은정 연구원은 아모레퍼시픽의 1분기 실적이 연결 매출 9500억원(전년동기대비 4% 증가), 영업이익 527억원(전년동기대비..."
2024.04.01.,SPC 던킨 롯데호텔 아모레퍼시픽 外(유통﻿家 이모저모),슈퍼콜라겐 리프트샷=아모레퍼시픽(대표이사 서경배 김승환)의 바이탈뷰티가 슈퍼콜라겐 라인의 신제품 '슈퍼콜라겐 리프트샷'을 출시한다. 슈퍼콜라겐 리프트샷은 5가지 타입의 콜라겐이 한 포에 담긴 고밀도 액상형 전신 콜라겐 제품이다. 피부 전문 기업인 아모레퍼시픽이 피부과 전문의와 원료...
2024.04.01.,"(종합) 캐시닥/타임스프레드/지니어트, 1일 오후 6시 10분 현재 '아모레퍼시픽...","금융건강 앱 '캐시닥'과 유사한 '타임스프레드', '지니어트'에서 1일 오후 6시 10분 현재 출제되고 있는 '아모레퍼시픽 BEST 라인업' 관련 문제의 정답 캐시닥 타임스프레드 용돈퀴즈. 사진=캐시닥 ◆금융건강 앱 '캐시닥'과 유사한 '타임스프레드', '지니어트'에서 1일 오후 6시 10분 현재 출제되고 있는..."
2024.04.01.,"하나증권 ""K뷰티 인기 속 화장품 수출 확대, LG생활건강 아모레퍼시픽 주목""","<연합뉴스> 관련 종목으로는 LG생활건강과 아모레퍼시픽, 브이티, 코스맥스, 씨앤씨인터내셔널, 클리오, 한국콜마, 아이패밀리에스씨 등을 제시했다. 화장품 수출은 올해 들어 중국 외 지역에서 크게 늘고 있다. 전날 한국무역협회는 올해 1~2월 화장품 수출 규모가 1년 전보다 36.2% 증가한 15억1500만 달러(2조407억..."
2024.04.02.,"설화수, 지속가능보고서 단독 발간…아모레퍼시픽 브랜드 중 최초","아모레퍼시픽(090430) 브랜드 중에서 단독으로 지속가능보고서를 선보인 것은 설화수가 처음이다. 설화수는 다양한 최초, 최고의 기록을 쌓아 온 대한민국 대표 뷰티 브랜드다. 설화수는 여성의 생애주기를 기반으로 피부 고민의 근본적인 해결책을 제시하며 예술과 문화를 아우르는 아름다움의 가치를..."
2024.04.02.,"아모레퍼시픽, 설화수 '지속가능보고서'...브랜드 단독 발표",/아모레퍼시픽. 아모레퍼시픽의 '설화수'가 설화수만의 지속가능한 아름다움을 알리며 브랜드 가치 제고에 나섰다. 아모레퍼시픽은 글로벌 럭셔리 스킨케어 브랜드 설화수가 2023년 지속가능보고서를 발간했다고 2일 밝혔다. 아모레퍼시픽 브랜드 중에서 단독으로 지속가능보고서를 발표한 것은 설화수가...
2024.04.02.,"아모레퍼시픽 한율X이슬로 작가, 어린쑥 한정판 출시",아모레퍼시픽 클린뷰티 브랜드 한율이 작가 '이슬로'와 협업해 어린쑥 한정판 제품을 출시한다. 한율은 독보적인 페인팅 스타일로 MZ세대 사이에서 각광받고 있는 일러스트레이터 작가 이슬로와의 이색적 만남을 통해 어린쑥 라인을 특별하게 선보인다. 라인의 대표 제품인 '어린쑥 수분진정 크림'은 출시 이후...
2024.04.02.,"아모레퍼시픽 바이탈뷰티, ‘슈퍼콜라겐 리프트샷’ 출시","사진=아모레퍼시픽. 아모레퍼시픽 바이탈뷰티가 슈퍼콜라겐 라인의 신제품 ‘슈퍼콜라겐 리프트샷’을 출시한다고 2일 밝혔다. 슈퍼콜라겐 리프트샷은 5가지 타입의 콜라겐이 한 포에 담긴 액상형 전신 콜라겐 제품으로, 아모레몰과 네이버 브랜드 스토어, 주요 온라인 채널을 포함한 올리브영 등에서 구매..."
